,user_id,user_name,user_rating,user_text,restaurant_name,restaurant_rating,restaurant_price,restaurant_type
81,eThWs-hck1shvVYuW-ppIg,Geoffrey C.,2.0 star rating,"The wife had this bookmarked since she works in Hoboken and had always wanted to try. With two kids in tow, we were in need of something warm to drink and maybe a little something to satisfy a sweet tooth craving. Place is really quaint, cozy and inviting, with people of all ages and walks of life communing. There is adequate seating on the ground floor, with additional seating upstairs if the kids get loud. Check. We ordered a couple of hot chocolates, figuring these had to be good given the cafe's namesake. Fail. I'm not sure what happened, but the first sip produced such a bitter taste in my mouth, literally. I gave it a second swig, thinking maybe it was just the foam. Still bitter. I don't mind my dark chocolate to be a little strong, this was just a combination of bitter and lack of flavor, if that makes sense. I threw it out after that second swig, too worried to go back and ask for another one because one of the kids was in pre meltdown mode. On the recommendation of one of the workers, I also tried a chocolate short bread pastry. She told me it was chewy, which I don't mind. But this thing could've cracked one of my teeth, it was that rock hard and inedible. Fail again.Place gets two stars because the macaroons were good and we were digging the ambiance.",Choc O Pain,4.0 star rating,$$,"Bakeries,, Coffee, &, Tea,, French"
82,OkhRUOyyZ5g23nRn6WqvaQ,Leslie M.,4.0 star rating,Rustic little shop with upstairs seating at large communal tables. Selection is great and the pastries are heavenly. Great place for a pastry and coffee in Hoboken. I am pleasantly surprised and thanks for the warmest hospitality too. Great croissants & warm staff.,Choc O Pain,4.0 star rating,$$,"Bakeries,, Coffee, &, Tea,, French"
83,-g_6eem3hYRigRsTil1IKA,Darshan S.,4.0 star rating,"Great ambience, this place has a lofted room perfect to study and/or hang out with a group of friends. Pastries are on point and the coffee is great as well",Choc O Pain,4.0 star rating,$$,"Bakeries,, Coffee, &, Tea,, French"
84,N9gE4o_FnxHTY2nLQsiFsw,Pearl S.,4.0 star rating,"Perfect atmosphere for getting work done. Pleasant staff and variety of pastries. There is a cute room upstairs for children to play, which doubles as a great workspace when it is quiet.",Choc O Pain,4.0 star rating,$$,"Bakeries,, Coffee, &, Tea,, French"
85,WArcnb66oO5af1TXf01JsA,Kris S.,5.0 star rating,All of the baked goods at this place are phenomenal if you have ever been to France this place is like stepping into a bakery in Paris..,Choc O Pain,4.0 star rating,$$,"Bakeries,, Coffee, &, Tea,, French"
86,kvpz1_lyn6U0EQhAbnhJ6A,Omana M.,5.0 star rating,The best croissants! I love the chocolate almond croissants. I also occasionally grab a dozen croissants for the office and everyone loves it. They also often have groupons so it's a decent deal!,Choc O Pain,4.0 star rating,$$,"Bakeries,, Coffee, &, Tea,, French"
87,Jvp9ULSCExfvpkJzdGerHw,R W.,5.0 star rating,"Best iced latte in town! Also great pastries and if you catch them at the right time, you can snag a free sample!",Choc O Pain,4.0 star rating,$$,"Bakeries,, Coffee, &, Tea,, French"
88,KMrDaRYsOoAYU7R-rGgIIw,Cindi W.,5.0 star rating,Absolutely delicious with top notch service makes their expensive pricing worth it. Their biggest problem is they can't keep their melt-in-your-mouth bakery items (patisserie items if I'm being more accurate with my language) in stock.,Choc O Pain,4.0 star rating,$$,"Bakeries,, Coffee, &, Tea,, French"
89,mrRtO_rAjgoMgriy3VdlLA,Miao X.,4.0 star rating,Chewy Petit Kouign! All flavors come out delicious! Would definitely come here again.,Choc O Pain,4.0 star rating,$$,"Bakeries,, Coffee, &, Tea,, French"
90,0WzT84TJm-3uPMO3OKYS8g,Sasha G.,5.0 star rating,"Bonjour Choc O Pain! OUI! OUI! Finally tried this place my lover constantly raves about. YOU SURE I haven't taken you to Choc O Pain?!? I'M SURE. YOU SURE? CHOC O PAIN?I'm sure.........And so we end up here. My intention is to get an iced Americano and nothing more but even with a glass case half full of pastries on a Sunday afternoon holding on for dear life,  the pastries were enticing. And since my lover is on a not-so-secret mission to make me fat despite my love of fitness, he probed me to get the gluten-free chocolate cake. Um OK, OK. Maybe it didn't take much probing. I kept looking at it salivating. HELL YES I want chocolate cake. Anyway, the Americano was great. Good espresso. I think they serve one of my fave coffee brands (Colombe). However I didn't like the ice they use.. It's tiny and melts awfully quick. The cake was rich but not overwhelming or overly filling. Just right & light. Delish! Ambiance is relaxing. The french music playing in the background (Is that French Pandora?!) and the ample seating makes this place a lovely idea cafe to sit and have a great chat with a friend or a lover- your choice! Definitely a good place for coffee. Iced Americano: $2.70.",Choc O Pain,4.0 star rating,$$,"Bakeries,, Coffee, &, Tea,, French"
91,mjoPd2xa8BCsKus5bnca0A,Gabriela L.,4.0 star rating,"There's a reason Yelp considers me a regular, and it's because even when I can make a pretty damn good espresso in my own house, I'd sometimes rather take a quick walk to Choc O Pain. I love their lattes and espresso drinks. They aren't too strong and taste really rich and velvety. I've had one of their specialty quiches and it was savory and delicious. The macaroons are yummy too! My favorite are the salted caramel and vanilla. Soon, I will be back for one of their sandwiches because the bread looks to die for. If you're into croissants, they are a must! Buttery, flaky and could also be sweet depending on which you get. The servers are all super nice, which makes it that much more of a pleasurable experience. There is even a room upstairs for private parties and events!",Choc O Pain,4.0 star rating,$$,"Bakeries,, Coffee, &, Tea,, French"
92,AI1rYT1Hu-sIvKxGL0jW_A,Emily J.,3.0 star rating,"I'm a newbie to the Hoboken area and was looking for a cafe to meet a friend. We found this gem on Yelp and decided to give it a try.Notes:  1. I ordered a Hot Chocolate and a Croissant.  2. I received a chocolate pastry and a bitter Hot Chocolate. I'm guessing the cashier didn't hear me because she was preoccupied talking to other guests - probably a regular.   3. I wish they had warned me that he hot chocolate was BITTER otherwise I wouldn't have ordered it.   4. Loved the ambiance and free wifi.  I'm not too sure if I'll come back. I liked the pastry it was flaky and soft, a nice surprise. I thought it would be hard and chewy.",Choc O Pain,4.0 star rating,$$,"Bakeries,, Coffee, &, Tea,, French"
93,fQwn3Nons1HNUpLGf0Woig,Mari K.,5.0 star rating,"Great little place with yummy coffee, macarons, and fun snacks!",Choc O Pain,4.0 star rating,$$,"Bakeries,, Coffee, &, Tea,, French"
94,-4I7yEgKzQSx7q-8KdkpoQ,Gabrielle P.,5.0 star rating,Came in for a quick coffee after a few of my friends and I had gotten manicures across the street. It's a super cute French bakery.Coffee was great and so were their macaroons! Seating is limited which may be a problem if you have a group greater than 3 people. Would definitely come back.,Choc O Pain,4.0 star rating,$$,"Bakeries,, Coffee, &, Tea,, French"
95,ls2-0A7OQQMPdhEHjCopEw,Nicole S.,4.0 star rating,"Great coffee shop and it's near my apartment, great-great! Very clean and cute coffee shop. They have free WiFi so it's definitely a nice spot to study or read while you enjoy a cup of coffee and a pastry. I was only in the mood for cappuccino so I didn't get a chance to try their food yet. I will be back because I'm dying to taste some of their pastries!",Choc O Pain,4.0 star rating,$$,"Bakeries,, Coffee, &, Tea,, French"
96,SCxinVl4v25xeI23M8GdsQ,David W.,5.0 star rating,"I've known about this great gem of a place since it opened and have loved it from the beginning, but I've recently rediscovered it (I live on the other side of town) and had forgotten just how good it is. Brother, it's that good.Nothing in the area comes close to its bread. It has that super hard crust that you just never find in Jersey. Absolutely the best. The pastries and croissant are completely delicious. The almond and almond/chocolate croissant in particular - wholly moly!The place is quiet and relaxing and I just can't say enough good things about it. It's definitely worth me getting an Uber for.",Choc O Pain,4.0 star rating,$$,"Bakeries,, Coffee, &, Tea,, French"
97,WTK20gSsRnQ-kEx0CKzBXw,George C.,3.0 star rating,"A decent pain au chocolat, but far from worth returning.",Choc O Pain,4.0 star rating,$$,"Bakeries,, Coffee, &, Tea,, French"
98,wgclybWhBVzy1awIROqSFA,Lu M.,2.0 star rating,"$6.74 for a slice of quiche. Waited 5 minutes for it to be heated up. Its still ICE COLD. The surface isn't even lukewarm. Called back and asked if she just forgot to turn on the oven and she said ""uhhhhhhhhhhhh yeah maybe"".Maybe she is high. I wish I was too so I could enjoy my cold ass quiche a little more. They weren't busy at all (1 other guest waiting for a drink).",Choc O Pain,4.0 star rating,$$,"Bakeries,, Coffee, &, Tea,, French"
99,9WZ4Y8Yq7ztTaMyPxqn_uA,Jennifer B.,5.0 star rating,Choc o pain is probably one of my most favorite things about Hoboken. I literally go at least twice a week. I buy all of my bread from choc o pain and love to go and sit out side while sipping coffe and eating a delectable crescent! Highly recommend!,Choc O Pain,4.0 star rating,$$,"Bakeries,, Coffee, &, Tea,, French"
100,xXZ1OFNRZ_adYrdtMbeHwg,Pietro R.,1.0 star rating,Manhattan prices without Manhattan food or service. Head to Washington & 4th's Old German Bakery to taste the difference.,Choc O Pain,4.0 star rating,$$,"Bakeries,, Coffee, &, Tea,, French"
101,qLxBMYnpx4IdtMZD12RnFQ,Jo S.,5.0 star rating,My favourite coffee shop. Great service. Nice atmosphere. Awesome desert and coffee. Never purchased their sandwiches so can't comment on those. I recommend getting their points card if you plan to visit frequently.,Choc O Pain,4.0 star rating,$$,"Bakeries,, Coffee, &, Tea,, French"
102,6Z1nKW5mlDydXULyS7mKSg,Kim D.,5.0 star rating,"I think I'm in love with this place! I was looking for a place I could study, and decided to venture to Hoboken! 1) amazing place to study! Relatively spacious, free wifi, clean restroom, and unlike many other places, they don't mind if you stay there for a couple of hours to study! What more can you ask for?2) I've read other reviews concerning their customer service.. And I must say my experience here has been quite pleasant. Especially the gentlemen working there. Gave me many recommendations, and even asked if I need water while I was studying! 3) prices here are just a little expensive, but I think it's worth it for the quality of the food/the experience you get here. Just for a sense of how much things are... These are just approximate valuesChocolate croissant ~$3Small coffee ~$2Quiche ~$6 Check out upstairs, and try their chocolate croissant!",Choc O Pain,4.0 star rating,$$,"Bakeries,, Coffee, &, Tea,, French"
103,xCClp4GvwDMHKJK8mb5ujA,Aimee S.,5.0 star rating,"Amazing!  Chocolate almond croissant, macaroons, amazing apple muffins. Everything was on point.",Choc O Pain,4.0 star rating,$$,"Bakeries,, Coffee, &, Tea,, French"
104,kfjwjDbiHwIoM-knQHKtZQ,Laura B.,5.0 star rating,"My favorite bakery in Hoboken, and perhaps all of NYC. Fresh bread, and their pastries are delicious. My favorites are choc o pain and petit queen.",Choc O Pain,4.0 star rating,$$,"Bakeries,, Coffee, &, Tea,, French"
105,7lrcRul9ikv7pO2QKO9Ryw,Andy M.,5.0 star rating,Great place. Customer service and food deserves 5 stars.  I work right around the corner at daniels and close up for 3 min so that i can hurry up and pick up some of my favorite pastries and other freshly baked food.,Choc O Pain,4.0 star rating,$$,"Bakeries,, Coffee, &, Tea,, French"
106,eI9aihcFqDiwG5BzF4lzTA,Patty G.,5.0 star rating,"While visiting family in NJ we stayed at the W and Choc O Pain was very close by! Close enough for my husband and I to eat breakfast here 3 out of the 5 days we were in Hoboken. It was amazing. The customer service is spot on and the ambiance is amazing. I loved the open view into the kitchen.Several times I had the quiche. Yum. Their ham and cheese croissants though were probably my favorite!!! So delicious. The cappuccino's were very good. Overall, my favorite little spot in Hoboken for breakfast and coffee. Very close to the Path also which is convenient.",Choc O Pain,4.0 star rating,$$,"Bakeries,, Coffee, &, Tea,, French"
107,v1tXMHbGsT6jbKRsKacgLA,Jessica G.,4.0 star rating,"I LOVE THIS PLACE, but hate the tons of screaming babies and toddlers that fill it.It would normally get 5 stars, but the ambiance is just plain horrible sometimes. It makes me and my fiancé doubt if we want kids.  But we want lots and lots of croissants. The plain croissants are to die for and the chocolate croissants may be even better.  Excellent coffee and awesome sandwiches and breads.  I have never been disappointed with their food and visit a few times a week.  Always bring some carbs home for the family when I visit.",Choc O Pain,4.0 star rating,$$,"Bakeries,, Coffee, &, Tea,, French"
108,sffJ0ej3HcrQ3wTwiMvT3A,Hongting W.,5.0 star rating,My favorites are chocolate croissant and kouigan! Love how everything is made fresh daily. Staff are friendly. If you ever want recommendations just ask and they will be more than happy to help. Haven't tried their coffee yet but heard it's of the best in town. Gotta try it next time,Choc O Pain,4.0 star rating,$$,"Bakeries,, Coffee, &, Tea,, French"
109,7joE5pWDA8GQDikf_4MExw,Christine S.,5.0 star rating,"Such a cozy, free spirit place. Staff members are sweet and patient with requests. Background music and decor of the cafe definitely brings an authentic French feel. Had a pastry with raspberry and another with maple and both were equally delicious. Plan on visiting again",Choc O Pain,4.0 star rating,$$,"Bakeries,, Coffee, &, Tea,, French"
110,Ralo7wlSbCF5IM3Z46y8PA,Yeraldine S.,4.0 star rating,"The place is really really nice. When you walk in, there are plenty of tables to sit at and enjoy your coffee/latte with a tasty pastry. The workers are friendly and helpful. I wasn't thrilled about my soy latte though but I will have to return to try other drinks. It had a burn taste to it but their croissant with chocolate in it made up for it. I went to the upstairs room which looks like a cozy apartment with couches and comfy seats. It's adorable. I do plan on returning to experience more of what this Hoboken cafe has to offer.",Choc O Pain,4.0 star rating,$$,"Bakeries,, Coffee, &, Tea,, French"
111,wDQpAORlHNC8HFbLJo4uDQ,Wenjing Y.,5.0 star rating,Check out the second floor! Really cute and comfortable. It has a lot of toys for kids to play with. It might be hard to get a seat though. Pastries and the light bites are really good.,Choc O Pain,4.0 star rating,$$,"Bakeries,, Coffee, &, Tea,, French"
112,c6aStNnKnhSIYxB3a7VCZg,Yibei C.,5.0 star rating,I always go for a tea and work there for the entire afternoon. Nice people and ambience!,Choc O Pain,4.0 star rating,$$,"Bakeries,, Coffee, &, Tea,, French"
113,tXjL9YHa9xYswAq5Nqrmlg,Lucy R.,3.0 star rating,"I'm a regular at Choc O Pain, when I first discovered this spot I was obsessed, you can't deny their pastries and coffee. I will say the service has started to disappoint me over the past few months. Order a latte and they give you the wrong drink, my ham and cheese croissant is cold in the middle- always!, snotty baristas for some comical reason and it's starting to make me want to turn to a different cafe. Overall- great food but the service for a chic ""French cafe"" is enough to make the food start to taste a little dry and tasteless.",Choc O Pain,4.0 star rating,$$,"Bakeries,, Coffee, &, Tea,, French"
114,rMcX1XA4qn33lqBbMF6r3A,Lisa Y.,5.0 star rating,"This is an adorable cafe with beautiful little French pastries, fresh baked breads, sandwiches, and coffee. If you need a place to work, there are little tables to the side (hopefully you're not easily distracted, as the cafe tends to get fairly busy). There is also a spacious upstairs area with couches and tables - a perfect place for parents and little children, or for work if it's not too busy. The latte was delicious and went perfectly with the chocolate heaven cake (which was indeed heavenly). The cake is flourless and has a rich, melt in your mouth consistency. SO GOOD!!One tip: don't risk coming if you're in a rush. There's often a lengthy line and not enough staff to keep up so drink and food orders can take some time.",Choc O Pain,4.0 star rating,$$,"Bakeries,, Coffee, &, Tea,, French"
115,kw_unRenFD-ModrsLLL2_g,Victoria C.,4.0 star rating,"This is a cute little cafe/bakery. I haven't actually spent much time actually in the place as I've just taken stuff to go, but their baked goods are delishhh. The atmosphere is kind of cute/quiet/quaint. They have a small outdoor seating area - never sat out there, but I always see people there for breakfast when I pass by every morning.They have almond croissants that are to die for, but I'm biased because I love croissants of any kind. They also have macarons - you can buy a pack of them and mix and match different flavors :)",Choc O Pain,4.0 star rating,$$,"Bakeries,, Coffee, &, Tea,, French"
116,94V-snVUg2Gd-OPd7rcZEg,Laila D.,4.0 star rating,"This is a solid bakery with excellent bread and pastries, and consistently excellent.  The food is on the expensive side but the quality is great.  It is a nice place to meet a friend and chat. There is an upstairs space but somehow I have never ventured upstairs. The coffee is strong and good, but I go here mostly for the baguettes and pastries which are authentically French.  I appreciate they also make seasonal desserts such as Gallette des Rois. And where else can you find sweet chestnut paste in a tube for your homemade crepes?",Choc O Pain,4.0 star rating,$$,"Bakeries,, Coffee, &, Tea,, French"
117,Oh0cY1NpGtqYvJpg4wC6WQ,Josie C.,5.0 star rating,Best crossant you can get on this side of the river. chocolate pecan babka was unforgetable. They makes really good quality french pastry.,Choc O Pain,4.0 star rating,$$,"Bakeries,, Coffee, &, Tea,, French"
118,fvYT9mVkkMBV7lz7ScPi3g,Elaine H.,5.0 star rating,"Always have a hard time locating some coffee store having good yet not too sweet macarons, so finding choc would truly be a remarkable experience. I guess the sweet level also carried to its drinks, hence I was more than happy to enjoy a healthy cup of latte. The best part about it was definitely the location, as it was sitting quietly yet not lonely at the corner. So strongly suggest sitting outside to enjoy the beautiful sunshine. Gonna come back and try its bakery sometime later!",Choc O Pain,4.0 star rating,$$,"Bakeries,, Coffee, &, Tea,, French"
119,KOygMqXCqAmCmktxYXyL1g,Scott H.,4.0 star rating,"Viva Choc O Pain!  I've only been here a few times so far, mainly because I live on the other end of town.  If I lived closer I'd be here all the time, for sure.  Why?  Because of the great food, coffee and atmosphere.To date I've only tried the espresso-based drinks, not the iced or regular coffee.  Cappucinos and lattes are some of the best in town:  rich and delicious espresso served under a thick, velvety layer of microfoamed milk.  The large is quite large - gotta be 20 oz., maybe more - and if you order in, drinks are served in beautiful china mugs.  Which is fitting, because the atmosphere inside is so pleasing, characterful and genteel.  They've managed to make the shop look like it's been around for 100 years (in a good way), which is a nice trick considering it's so new.  For eats, I've only sampled the choc o pain (yeah, it was so good that I just kept getting the same thing on repeat visits, couldn't help myself), but based on what my eyes and other reviews tell me, there are lots of other things I'd like to try.Bonus points for the large onsite kitchen / bakery, which ensures everything is absolutely fresh.Holding things at four stars for now solely because there are so many items I haven't tried, but I wouldn't be surprised if, after further review, this place vaults up to a full five.  I'm looking forward to doing the necessary research ;-)",Choc O Pain,4.0 star rating,$$,"Bakeries,, Coffee, &, Tea,, French"
120,CVRV6yZUlIEqMWVk-D3GUQ,Danielle R.,4.0 star rating,"Delicious bakery selection of breakfast and lunch items. The staff members were all very friendly and helpful in assisting me. I got a black iced tea and the quiche Lorraine. It was so outstanding! Just fluffy, light, flavorful, and practically melted in my mouth. I wish they had pour over coffee options and more iced tea options, other than just black and green. But it was a great place to go and get some work done. Highly recommend!",Choc O Pain,4.0 star rating,$$,"Bakeries,, Coffee, &, Tea,, French"
121,GC7ow6LnrCuJBqiiRbYdkg,Lauren S.,5.0 star rating,"Five stars. Yes. Five. Count 'em.I do not believe a restaurant has to be a ""fine dining"" establishment to earn a five-star rating. I just believe that they have to have a strong objective and succeed at meeting it. And what this coffee shop/bakery does, it does well. The second you walk in, you are transported from Jersey to Paris. It's not ""Hey, this place is trying to be like a French bakery!"" It's more like, ""Wait, how did I get to Paris? What's going on? Did I Apparate here?"" My friend, who studied abroad in Paris for a semester, immediately began freaking out. Everything from the writing on the walls to the cute little baguette sandwiches just oozes with authenticity. But it's not just the aesthetics that rock. Cripes. For lunch, I picked one of the simplest things: the egg sandwich with spinach and ricotta on 6-grain sandwich bread. It sounded slightly dull, but the other sandwich options contained massive quantities of bread that I knew would over-fill me. However, I got the surprise of my life from my humble sandwich; it was incredibly flavorful. The bread was astounding (so nutty and fresh), and fillings were perfectly seasoned to enhance the flavors of the ingredients, which sounds odd considering neither eggs, ricotta, NOR spinach are naturally that flavorful. And the coffee. Hands down one of the best soy lattes I've ever had. I ended up ordering a second one, which is not something I typically do. I also tried the apple tart, and yeah, it was obviously fantastic. I mean, duh.",Choc O Pain,4.0 star rating,$$,"Bakeries,, Coffee, &, Tea,, French"
122,XutdlmLZ8NUbWzkiDtyxwQ,Kitty S.,5.0 star rating,I've tried different kinds of croissant and they were awesome! Sandwiches were healthy and great. coffee/espresso was also great!!,Choc O Pain,4.0 star rating,$$,"Bakeries,, Coffee, &, Tea,, French"
123,6v5zKln3LnnKcyfBcXBSAA,Lauren K.,4.0 star rating,"I live about a block from this place and finally decided to stop in on a random Saturday morning. I was feeling adventurous so I just asked what their specialties were and grabbed a few of each. I have to say, everything was absolutely delicious. I couldn't even tell you what I ate but I would get it all again. Fantastic! My only complaint is that it is a bit pricey. But definitely good to indulge.",Choc O Pain,4.0 star rating,$$,"Bakeries,, Coffee, &, Tea,, French"
124,4RWvbHylmDB3ey-l_7iBkg,Tanvi P.,5.0 star rating,"Love the baguette it has a lil bit of sour taste which I totally love, the chocolate croissants, rasberry kougin was crispy from outside and latte or coffee is amazing too.",Choc O Pain,4.0 star rating,$$,"Bakeries,, Coffee, &, Tea,, French"
125,G_nO0WC-PwY2LA4O8GPsww,Robert B.,5.0 star rating,"This place is great! The coffee is delicious and the pastries are amazing! Do not leave without getting a croissant... Also Michelle, one of the employees was super friendly : )",Choc O Pain,4.0 star rating,$$,"Bakeries,, Coffee, &, Tea,, French"
126,HkwZbx1EisPAvlAwQk1Qmw,Ling L.,4.0 star rating,"I love coming here and discussing life and life-related things with my significant other. I rave not just about the quaint ambiance, friendly staff, or the delicious chocolate almond croissant, but recently I had my first experience with the ham and cheese croissant and holy moly was that an experience worth opening Yelp and writing about. The only opportunity for improvement I can think of is the coffee. I usually order the latte, and I find that it lacks the aroma and texture that I crave.",Choc O Pain,4.0 star rating,$$,"Bakeries,, Coffee, &, Tea,, French"
127,SO0BB2y6n7ABl8hva2YzJw,Ciara G.,3.0 star rating,"First, they serve La Colombe espresso which impressed me much. I've had a few pastries (croissant and brioche) and they were just ok. Though their lemon curd tart topped with berries was heavenly.A group of 5 of us went in for lunch and it was a bit hectic when it came to all of us ordering and paying. A bowl of soup, berry tart, brioche, and iced americano set me back right under $20. That's a little expensive if you ask me. I'll probably stop by every now and then just for a coffee.",Choc O Pain,4.0 star rating,$$,"Bakeries,, Coffee, &, Tea,, French"
