,user_id,user_name,user_rating,user_text,restaurant_name,restaurant_rating,restaurant_price,restaurant_type
38,SuL8mod1Doke7DOSdCzoCQ,Kat G.,5.0 star rating,"Went there last night for an early dinner and was greeted by a very sweet hostess.  Since it was our first visit, she told us they had an area upstairs for events/parties and live music after 7. Our server (forgot his name) was very attentive and suggested the sampler appetizer which was great.  Food came out rather quickly. It was hot, fresh, and really tasty.  I'm Cuban and this is definitely real Cuban food.  From start to finish it was a great experience. Not only was the food good but the service was great. Great food,  prices,  and service!",Conga Cafe,4.5 star rating,$$,"Bars,, Latin, American"
39,zH-bjTnPKDxYnnTrOaOLLg,Alfred S.,5.0 star rating,"Conga had phenomenal food. The service was top notch, great atmosphere, and very friendly, capable staff. We recommend Conga to all who enjoy an overall great dining experience.",Conga Cafe,4.5 star rating,$$,"Bars,, Latin, American"
40,8lOCLOZk6jGpoiubWaw8Kw,Dawn P.,5.0 star rating,"Simply put, this place is AWESOME. I was told about Conga Cafe through work, so when I was going out to dinner to meet friends with my fiancé, this place is the first I thought of; and I am so glad I did! The hostesses, the bartender, and the servers are all top notch. Warm and friendly all across the board. They make you feel so welcomed. The drinks were so good, and at a reasonable price.   (I recommend the coconut mojito and margarita on the rocks.) the food... AMAZING! We got the beef empanadas as an app, and churrasco, Cuban sandwich, and seafood in a creole sauce as our entrees. SO SO GOOD! The owner was there and came over to see how our meal was, which was a really nice touch. This place is a diamond in the ruff and I would recommend it to anyone. Give it a try, you will not regret it.",Conga Cafe,4.5 star rating,$$,"Bars,, Latin, American"
41,s6SEU3KuuY48b1mtbxyLNw,Wen M.,5.0 star rating,"Beautiful decor, exotic food with an exquisite drink! Let me start off by saying how attentive and genuinely friendly everyone we came in contact with, the waiters, hostess, managers! My husband and I were indecisive if we wanted to wait or sit at the bar for drinks or dine in while we waited for another couple to meet us for dinner. They have a small wait area and while we waited our friends cancelled on us so we decided we'll just hit the bar. The hostess gladly escorted us to the bar. Not bad! Normally restaurants would give you the sly eye and have you fetch your own bar seat. Perfect, we sat at the bar and ordered two drinks, coconut mojito and CHA CHA CHA... both were YUMMMMY... Coconut mojito is a DESSERT IN GLASS!! Food: we ordered a steak quesadilla and my husband ordered garlic chicken with rice and red beans... (sorry the pics may not do it any justice but trust and believe it was delicious) the chicken as was the steak were both incredibly tender and flavorful. So very pleased to have dined at this lovely establishment. Before our visit to be quite honest I was a bit skeptical of the reviews, rarely do you see such impeccable ratings. So glad we took the drive out, they truly deserve such great FIVE STAR ratings!! Ps... they have valet parking!!!",Conga Cafe,4.5 star rating,$$,"Bars,, Latin, American"
42,L46GYZtFyZKeQnQM_bGZzw,Meg C.,1.0 star rating,Food is never consistent.... last 2 times Iv been there the food flat out sucked!!! It was terrible! Restaurants need to be consistent with the food. Almost all there food is pre heated you can Taste it right away not fresh! Turned off by conga won't be going Back! Thanx but no thank!,Conga Cafe,4.5 star rating,$$,"Bars,, Latin, American"
43,ornb1UYCzFd2u9Y_ldGvPA,Nicole R.,5.0 star rating,"Union City aka ""Little Havana"" has finally added another Cuban gem to its town.  What makes this location a hit is where it is located.  Downtown UC (if familiar with the area) does not offer a lot of good quality restaurants especially in the Cuban food department.  Conga Cafe decided to open where it was needed most.Let's start with the decor which gives off such a classy feel as you walk up the steps.  Upon our arrival, we were greeted by a pleasant hostess who seated us into the main dining area.  I didn't have the chance to go for a tour but did peak around and notice the Cuban accents and wide open area.  It screams ""Havana"" when you really take in the bright colors and lighting.  For an appetizer we ordered the empanadas.  They were all really good.  I was a little surprised by how tiny they were in comparison to other places I have been to.  It was definitely a perfect order for 2-3 people.  Any more you would need another order.  I came to Conga Cafe for lunch so I have yet to try their dinner menu.  I ordered a chicken sandwich for $5.95.  The toppings included are lettuce, tomatoes, and onions.  They do not fail to leave out any important component of this really good sandwich de pollo. The fresh Cuban bread is the best part! What makes this sandwich as a standout compared to others was the bread and flavor of the chicken.  I tasted the mojo seasoning they used after every bite and was in a happy food place.  The sandwich doesn't come out pressed like a panini which is a plus because it allows you to enjoy the bread itself.I am so happy that Conga Cafe opened because it adds more to the list of local Cuban restaurants we have in the area.  This will certainly not be my last time eating here and I look forward to coming for dinner and many evenings to try out their sangria.",Conga Cafe,4.5 star rating,$$,"Bars,, Latin, American"
44,UP1FTD0bpaIneaqZizyxsw,Melissa K.,5.0 star rating,"I really enjoyed this new spot. It was so modern inside. The day I went there was a party on the second floor, and while the music seemed a little too loud, the food made up for it. I had the chicken in garlic sauce that was delicious! The beans were flavorful and the tostones so good! Staff was very nice and drinks were on point. I hope they keep up the serve and the quality of the food. The only bad thing is the valet parking. It's a small lot so unless you street park, you gotta use the valet.",Conga Cafe,4.5 star rating,$$,"Bars,, Latin, American"
45,hIukLe6RVqphMMJSeZwEDA,Joseph A.,4.0 star rating,Not at all bad. The place is new and extremely clean. It has a fun inviting and attractive environment with a very friendly staff.I only popped in for drinks and a sandwich w/ a friend so I can't speak extensively about the food. I wish the Cuban sandwich was not so dry and overcooked but that can be easily fixed.I would absolutely try it again when in the area.,Conga Cafe,4.5 star rating,$$,"Bars,, Latin, American"
46,f3I_gGbmL0QyeAY-x9e2uw,Miguel P.,5.0 star rating,"I live two blocks from the restaurant and it has been a blessing since they opened. The town of Union City was missing the idea of a restaurant that embraces the culture but also feel ""upscale"". This is a great place to bring your family and friends; for dinner or a drink at that bar. The decor feels vintage, warm, but also comfortable. The music choice flows with the environment. Parking is simple, valet or self park. The food is amazing; the breaded chicken and the churrasco have been the best I've had. The menu is simply simple. Union City now has it's own version of an amazing restaurant like Weehawken has Chart House or Ruth Chris.",Conga Cafe,4.5 star rating,$$,"Bars,, Latin, American"
47,0w6BH9X88w8nQQMQrRZL0g,Janelle K.,5.0 star rating,"Came here for the first time and got the cuban sandwich and it was amazing! As was everything else from the service, the food, decor! Loved it! Will definitely be back!!",Conga Cafe,4.5 star rating,$$,"Bars,, Latin, American"
48,UD3Mg0MUN766bVcGbwW24g,Josue R.,5.0 star rating,"Amazing place , excellent customer service and excellent food and drinks. I love coming here",Conga Cafe,4.5 star rating,$$,"Bars,, Latin, American"
49,RzeSOI7njN3zGvgSeyV6lg,Alba C.,5.0 star rating,"I came here a few times when they opened and fell in love. The decor is so unexpected that you feel like you're in a completely different area of town. Drinks (especially the coconut mojito) were amazing and the food was just awesome. You go up to the party room and now you're transported yet again to a completely different place! Very classy, super spacious, 3 bathrooms and it still smells like it's new!  I booked a surprise birthday party for my husband and we had the party just yesterday. Prices are very reasonable, and the manager was super helpful. From setup and decorating ideas to food choices, I was helped all along the way. And the party itself exceeded all of my expectations! Empanadas, croquettes, chorizo and papa rellena for appetizers-- everyone LOVED them.  Main dishes: salmon in lemon butter sauce, chicken in mushroom sauce and masitas de puerco (every time I come to this place they are ALWAYS juicy, and they delivered again!). Maduros, moros and yuca.  Dessert: flan and tres leches. All throughout the party, our glasses were never empty, everyone enjoyed their sangria and specialty drinks, and all of the servers were super nice. I highly recommend this place for a night out with your significant other or friends, and a definitely recommend it for parties! Oh and another important word: PARKING!!! There is so much parking and valet on weekends.",Conga Cafe,4.5 star rating,$$,"Bars,, Latin, American"
50,fzu5w5qhB5wqxUu-jPX0sw,Ted B.,5.0 star rating,Just had a great experience here.   A very fun atmosphere with great food.  The chef knocked the ball out of the park with the pollo con champinones They've also got a lot of other things.  Service was very friendly and they have a ton of parking and valet parking.  I'll be back to try other dishes for sure,Conga Cafe,4.5 star rating,$$,"Bars,, Latin, American"
51,-64btjwUIVNu9JPvLvUgXQ,Lina A.,5.0 star rating,"Great food, great drinks, great prices! Came here Sunday afternoon for lunch. Big plus, they offer free parking! The decor is very nice.. The main back wall has a row of 3D little houses.. CUTE! Our server came over, he was very friendly and we put in our drink order. Sangria was pretty good.. we ordered a couple of apps, and 1 entree. Apps - were Shrimp & Chorizo very delicious, and then we had the pastelon.. the pastelon was actually cold when we got it, but our server quickly apologized and they brought us out a new one.. EXCELLENT!!Our main course was Lechon, with moro, yuca, and maduros - very juicy lechon! The owner Lenny then came over and also apologized for the pastelon, and offered us a couple of shots on the house!! what gets better than shots! :) He was very nice and offered to give us a tour of their 2nd floor which is used for parties.. He told us about the entertainment, on the week-ends.. Will be back for that.. the 2nd floor was beautiful! Very nice decor, great menu options, great for parties up to 150 people.. I highly recommend Conga Cafe and I definitely look forward to coming back soon.",Conga Cafe,4.5 star rating,$$,"Bars,, Latin, American"
52,cFymTKtiI--xi7CMyIQP3w,Patricia Viviana B.,4.0 star rating,"My friend & I were looking for a place to have some drinks, listen to music & for it to be nearby. So we came here & weren't completely disappointed. Free valet parking was great! The complimentary free bread with guaya cream was delicious. The DJ was very good except that the music got too too loud...like if it were for a club location instead of a lounge/restaurant type of venue . My friend & I had a hard time listening to each other other towards the end of the night. Then I was disappointed at the sangria pitcher..waay too small for a pitcher... it shouldn't be called that...it was an en extra large glass...& $12 each! Compared to other restaurants...it wasn't the same. This place has potential & very little competition around the area but it needs to get up to par to the others if it wants to attract customers..",Conga Cafe,4.5 star rating,$$,"Bars,, Latin, American"
53,Ipu3G9LMtNcWte8xi-BRzQ,T G.,5.0 star rating,Amazing Cuban place loved the ambience food was good and drinks were yummy...we came on a Friday was nice to dine and then dance a little to some Spanish music. The staff was very nice and attentive. I will recommend and will definitely come back.,Conga Cafe,4.5 star rating,$$,"Bars,, Latin, American"
54,JqWJ4FRZRxIc89sIU9ntCg,Jovannka L.,5.0 star rating,Amazing food great great service Latin fusion Gourmet to say the least I order the beef milanesas and to say delicious is an under statement My husband had chicken milanesa napolitano and he was more than impressed For appetizer we had empanadas and for dessert he had flan and we can't even choose a favorite because everything was outstanding Is definitely going to be our to go restaurant first on our list Our hats off for an excellent place in Union City.,Conga Cafe,4.5 star rating,$$,"Bars,, Latin, American"
55,iG265oMqvI9Y7pH3uV4H2Q,Daniel P.,2.0 star rating,Food was not bad. My girlfriend had a churrasco it was very tasty but came out cold. My dish was tasty as well but my yuca portion was literally one piece. Waited 30 min to place appetizer order. Than another 30 min to place entree order. We had a party of 7 had to ask for bread after 30 min of sitting. Once we got bread the pieces were counted. Not enough bread for all of us. Service was non existent. Waitress was overwhelmed. Place was very busy making plenty of money. The establishment can certainly afford to hire more staff. Waited 45 min for dessert. Was not going to complain about anything  but the dessert was the final strike. Went to the owner and told her I was waiting 30 min for my dessert and then had to wait another 15 min afterwards for dessert. No apology given about poor service. This is my first time posting a bad review about a business. We eat out all the time have had good and bad experiences have never posted a bad review. Food was not bad. Service was the worst I've ever had. Gratuity was already included in bill. Was not completely servers fault. Management was poor and not aware of situation. Once again food was not the issue. Will not be returning again.,Conga Cafe,4.5 star rating,$$,"Bars,, Latin, American"
56,QGuorUopOcMnyjRDvPe6jQ,Dennis Q.,5.0 star rating,"OH MY!!!  the food is delicious, the presentation was great, and Valentina is an AMAZING hostess!  enjoy the feast!",Conga Cafe,4.5 star rating,$$,"Bars,, Latin, American"
57,eDPNPjKDmWO2-PEdKXU4uw,Tate S.,5.0 star rating,"Had an amazing dinner at Conga Cafe! Between the food and service, this is my new favorite spot. Our waitress Pamela was very helpful when it came to explaining the dishes. We haven't had much Cuban, so it was great that she could guide us through the menu! We took her suggestions and couldn't be happier. Really great space, with an amazing and friendly staff :) So happy to have found this place, we cannot wait to return!!",Conga Cafe,4.5 star rating,$$,"Bars,, Latin, American"
58,QzHS3Lw393UZqvYTZ7Vh0w,Dulce L.,2.0 star rating,"The noise in this place is unbearable. I stayed because i was starving and working in the area.  I ordered the breaded steak, white rice black beans and avocado salad.  The waiter forgot to put my order in. I waited one hour and a half for my food.  Breaded steak was hard. Black beans were just ok.. Tres leche dessert was good so i gave them 2 star for the dessert.  I write my reviews on my experience when visiting an establishment. I do this for my fellow yelpers.  I like to get the truth and not a lie written by an acquaintance of the establishment, when i am going to  experience a restaurant for the first time. I had a friend of your business insult me in a personal message on this site.  No, i am not dumb as your friend called me.  I just write the exact truth as to what i experienced.",Conga Cafe,4.5 star rating,$$,"Bars,, Latin, American"
59,yryi-98YMHLWPvNPETW-RA,Terence S.,5.0 star rating,"Great food and great prices !Servers always checking on us.I've eaten here allot I work in the area & never had a bad meal.All the apps I've had were delicious, Shrimp dinner is my go to and the fish sandwich is great for lunch.Great spot to have dinner, drinks then dance it off.Extra star given for Beautiful Cuban women who always makes sure I'm well taken care of.",Conga Cafe,4.5 star rating,$$,"Bars,, Latin, American"
60,y140DHpakBY_Pg5n8_ci4A,Laz A.,4.0 star rating,"Love the atmosphere, Lenny and his Wife are very inviting and friendly as well as the employees. The food was great. Lots of parking and great drinks and live music. I recommend this place to anyone whether you're going with family, friends or on a date!",Conga Cafe,4.5 star rating,$$,"Bars,, Latin, American"
61,ruzkORtPL0EbvqK-_UnYMw,Maria M.,2.0 star rating,"So we went here for my sisters birthday and i was very disappointed with the service. We can start off that it took and waitress 20 minutes to come and greet us and ask for our drink orders and that was only because i stood up to the hostess and asked her if we were going to get service, to which she apologized and took our orders herself.we didn't order many apps but the ones we did order were really good. i got the guacamole with plantain chips and we also ordered the papas rellenas.the entrees were something else though. The meat was not very well seasoned very bland and the beans were flavorless and bland as well. The ropa vieja we ordered was absolutely disgusting. Not an once of flavor,not peppers, no onions, no garlic, no cilantro.. nothing... it was shredded beef with tomato paste... I mean drenched in tomato paste which took any flavor the beef might have had... it was like taste tomato soup with bits of meat.My party was also no refilled on their drinks throughout the night. It was really nasty food...",Conga Cafe,4.5 star rating,$$,"Bars,, Latin, American"
62,c_91hgYavQViNoOI9WmDQQ,Monica T.,5.0 star rating,Best bartender ever.... great service... so clean and nice place... i loved my mojito...,Conga Cafe,4.5 star rating,$$,"Bars,, Latin, American"
63,ZcvbnE9ANuq6BhqzQmh-qQ,Nidza G.,5.0 star rating,"Wow!!! I would recommend this place the service was great, our server Andrea is awesome super sweet young woman she is very personable and very efficient. The food OMG delicious. I went there a few weeks ago just for drinks and dancing I had the best time. I'm glad I went back for dinner. I loved the look and feel of the restaurant the bartenders were awesome as well. I would definitely go back.",Conga Cafe,4.5 star rating,$$,"Bars,, Latin, American"
64,O5BUtS92A02W9-rH-S-p1g,Melissa R.,4.0 star rating,Upon arriving we were greeted by the hostess who was very friendly and sweet and seated us immediately. After finally deciding what we wanted to order we were greeted by our waiter Joel who had the best attitude very positive happy and friendly. We ordered the empanadas for our apps and love them! So yummy! I ordered the arepa con queso y ropa vieja with a side or Moro rice. I loved that arepa! The dice was ok and the ropa vieja was pretty good. I would definitely come back here.,Conga Cafe,4.5 star rating,$$,"Bars,, Latin, American"
65,6-8znaZwUcFrq-YwXLqugA,Luis B.,3.0 star rating,Spacious Restaurant. top floor for events. Plenty of parking. The staff is nice and speedy. Food is typical for the area. I came here for lunch but I will go back to check out the night scene and try out the drinks. I recommend this place for large parties.,Conga Cafe,4.5 star rating,$$,"Bars,, Latin, American"
66,c7e2rtfZ2ReEphxGPAMh8g,Cara Z.,5.0 star rating,"Love this place.  The service is more attentive than anywhere in Hudson County, but without being pushy.  They clearly take pride in the success of this business. I appreciated their enthusiasm and helpfulness. Food was very tasty.  My group shared so I got to try - Guacamole with marequillas (sp? It's basically long plantain chips). Guac was perfect.  Just the right amount of acidity and chunky but with a smoothness.   - Flan was creamy with a light sweetness.  Not as sweet as Dominican flans (I prefer less sweet).  Wish it had a touch more of the syrup. Also, it was a bit more thick than flans I'm used to.  - Piccadillo was very tasty. Not overly salted (like a lot of Spanish places that serve this dish)  - Rice - shiny and delicious- Black beans - good texture but no outstanding flavor or defining feature.  Parking - they recently started renting the lot across the street so now they have 2 lots for free parking.   I had read a review here that they have valet parking but the staff said they do it sometimes on the weekends and when they do, it's free of charge. Would definitely come back here.   The pastelon looked fantastic but I didn't get to try it.",Conga Cafe,4.5 star rating,$$,"Bars,, Latin, American"
67,SIqHWciOvxLcJ50f8zddGA,Karen Z.,5.0 star rating,"Union City's newest Cuban wonder, I was skeptical at first but I was pleasantly surprised. The service is phenomenal and the food is wonderful. The decor is perfect for the setting!",Conga Cafe,4.5 star rating,$$,"Bars,, Latin, American"
68,f0KKT2hrkz_3023-9bhJng,John Paul G.,1.0 star rating,Just ordered takeout from here. Food was SUPER SALTY. Ordered lechón asado and bistec de palomilla. Nothing spectacular. Bistec was ok. Lechón was salty. Really salty. Got Moros with both dishes and Moros seemed oily.Prices on their website are different than what I was charged. Ended up paying a few dollars more (which was higher than I wanted to pay in the first place) for oversalted food.In short I will not go back to this place. Should have stuck to the mediocre places on Bergenline. At least I wouldn't have overpaid.,Conga Cafe,4.5 star rating,$$,"Bars,, Latin, American"
69,4xzsnQosB7JdB3Y-XSpxKA,Dan F.,5.0 star rating,"Union City is known for its Cuban food, but Conga Cafe is really the first of its kind around here. It's a brand new place, much bigger than other restaurants in the area, and with a better atmosphere, and it serves alcohol! Great mojitos! Being able to park in their parking lot is also so clutch. Street parking is next to impossible around there! With all this you would expect high prices but when I looked at the menu I was shocked that it is so cheap! I got the Cuban sandwich again because it's my go-to for lunch but my girlfriend got the breaded steak (la milanesa de mima) which was also so good. Typing this in already getting hungry again. I'll be back!",Conga Cafe,4.5 star rating,$$,"Bars,, Latin, American"
70,vUhauZ77NeplN7hMl1RnrQ,Susell S.,5.0 star rating,Best Cuban food in Union City!!!!!!  Lenny the owner is very hospitable i highly recommend this restaurant.,Conga Cafe,4.5 star rating,$$,"Bars,, Latin, American"
71,NB5XWP-Lnp5Mcl_gwi3UzQ,Sandy D.,3.0 star rating,New spot in Union City...my brother told me about the restaurant. The food was good and mojito drinks taste well. I would like my mojito to be a bit stronger. The inside of the restaurant is very nice. The location used be another restaurant I used to go to as a child. It was nice to see the new updates. We all enjoy our food.,Conga Cafe,4.5 star rating,$$,"Bars,, Latin, American"
72,W4bbz3TqHSm6THaEMsdENw,Elrei D.,5.0 star rating,"Outstanding, highest rating possible. There has to be a best restaurant in the area, this is it.   I rarely write long reviews, but this place was fantastic.  From beginning to end, let's start;Parking - more than ample, about a dozen right in front of the restaurant.  Another 30-40 spots immediately across the street, and I was told there was even more parking around the bend.  Entrance - very inviting, the staff and greeter were very amiable.  Atmosphere - Music was at a perfect level and it was Cuban themed, just as you would suspect.  I can only assume that it went back as far as the 1940's, but I can assure you it played all the way to present day.  Very good mix.  The décor was superb.  The street scene in the main dining area is actually 3D.  It was Saturday, early evening, so I did not know how much better the night would be.Drinks and Appetizers - My wife raved about the Mojitos, and they were very good.  I ended getting one of my own.  The Appetizer menu was very generous.  I settled on the pastelon (a favorite of mine since childhood) and it was spot on authentic.  My wife could not resist on trying the garlic shrimp and loved it.  Meal - The plates were plenty big.  My daughter is very critical of Ropa Vieja, on this day she said in no uncertain terms ""This is the best Ropa Vieja I've ever had"".  Enough said about that.  I had to try the Masitas de Puerco (sautéed pork chunks, again a favorite since childhood).  It was authentic beyond words.  I had always had it with white rice, I decided to go with the moro this time and it a good choice.  My wife went with Milanesa de mima,, I grabbed a mouthful just to test, it was great as well.  Halfway through the meal, the crowd started picking up, and alas live music from the part of the restaurant I did not explore.  A good solid crowd dancing the night away, singing to the music.  A happy scene.  The music was great as well.Dessert - This is where we should have slowed down, but we decided to plow ahead.  My wife went for the Flan de mama beba.  She said it was as good or better than any she has had in the past.  High praise.  I wanted to be strong, but the menu hit my weakspot, Tres Leche.  Very good, I lived in Miami and had become used to the quality of  this dish as made by the Cubans.  It was better than many of the places in Miami.  Like I started off saying, this place is max-review all the way.  Now that my work brings me into the area, I will try a lunch every now and again.  I am sure it will be good.",Conga Cafe,4.5 star rating,$$,"Bars,, Latin, American"
