,user_id,user_name,user_rating,user_text,restaurant_name,restaurant_rating,restaurant_price,restaurant_type
73,yw3QPVV4RNqNKn8Lc5Xv-w,Stephen V.,5.0 star rating,"We have been anxiously waiting the opening of Conga Cafe and it was worth the wait.  It was our Christmas ""go-out"" to dinner and oh boy, we will make up a holiday every week, just to go back.The menu is extensive - just try and pic one of the appetizers - just try.  We went with Guacamole which was wonderful.  We weren't  sure what the entree portion sizes were, so thought we would take it slow.   The entree portions were neither too small or too large - just right by our estimation.  All entrees look delisious - our breaded steak and lechon asado excellent.  Bringing to the desert, i had given up eating flan because i found it always to be custardy and ""eggy"", our waitress told me try this one - you will not beleive it.  So we got the flan and the tres leches cake and were fighting back and forth as to who was going to finish which dessert.Please do yourself a favor and place yourself into the hands of the wonderful staff at Conga Cafe and enjoy the ride.Stephen and Mario",Conga Cafe,4.5 star rating,$$,"Bars,, Latin, American"
74,iEaUtoTP4wO4Ku6AHi1b_g,Jess S.,5.0 star rating,"Wow, I don't even know where to start with this review, but If i could give them more stars I would.I planned a going away party for my son Aa'ron and  I couldn't have chosen a better place for the celebration.When I initially inquired via email, I received a prompt response from Rebecca. I went in one day to speak to Hugo, but instead I ran into a lovely lady named Raquel. Raquel was beyond phenomenal in helping me plan my event. She walked me through everything step by step and even made accommodations for those who were vegetarian.The day of the event the party room was set up prior to my arrival, so all I had to do was come in and place the cake and candy on the table. I was so impressed by the venue and the staff. I felt like family at this place because they did everything in their power to make sure things went well. Every guest enjoyed the food and fell in love with the venue, so much that we are planning another event here in the future. I hate that I don't know the names of the waiters because they deserve so much credit for the parts they played. I can't wait to come back....A million thank you's to all of you who made Aaron's day special",Conga Cafe,4.5 star rating,$$,"Bars,, Latin, American"
75,xFEmtk9TfE2LSUVRloVl8Q,Yvonne V.,5.0 star rating,"Staying in Jersey while visiting New York to save. The family and I returned home late and we were starving. Thankfully our hotel had this listed as a delivery service. We were unsure they'd been bring the order due to how late it was, but they came and the food was absolutely delicious! And in a very short amount of time! Thank you for saving us Congacafe!",Conga Cafe,4.5 star rating,$$,"Bars,, Latin, American"
76,Q8puAYS0n7ftWDtPbXeWew,FRANK B.,4.0 star rating,"Pro: first ,valet parking,interior design very nice.Three dining areas.We sat were the dj played ,by the bar.Menu pricing for wasn't to bad.Food was really good and favorable.Once ordered came very quickly.Staff very friendly.Cons: service very slow.It appeared there was only one waiter for our dining area.Apparently ,this is a common complaint.My wife has gone several times with her girlfriends .Same issue,very slow service.Its a shame that a nice place like this could be so much better , due to their service.In fairness to the waiter,he was not rude,but very friendly ,when he was there.Go enjoy the food, music... just be patient.",Conga Cafe,4.5 star rating,$$,"Bars,, Latin, American"
77,PpoInmo0lG3GXVihDoeh0A,Victor Q.,5.0 star rating,Excellent!!!! Modern but very well decorated Cuban themed restaurant.  Perfect for a dinner date or a casual lunch.   The service was quick and friendly!The empanadas for appetizer were not greasy and cooked just right.  The ropa vieja was amazing and the black beans were very good.  For desert the homemade flan was creamy and just perfect. The portions were just right.  This is definitely my first choice for Cuban food in the area!,Conga Cafe,4.5 star rating,$$,"Bars,, Latin, American"
78,tzsbTezmUIDSAYmwZ410cQ,Q J.,5.0 star rating,"Atmosphere is cozy and modern. Staff is friendly and accommodating.  And the food TASTE AMAZING! Flavorful, authentic with high end quality. Not to mention reasonably priced! I enjoyed date night with myself. So glad I live close so I can visit often!",Conga Cafe,4.5 star rating,$$,"Bars,, Latin, American"
79,eQuCPA6LKw8RwKK4UUoKmg,Evelyn S.,5.0 star rating,"This place is fabulous! The food is just delicious and the service is great, we met the owner and he was very kind and showed us the upstairs part and the bar in the back. It is such a cozy place to enjoy their affordable and yummy food.",Conga Cafe,4.5 star rating,$$,"Bars,, Latin, American"
80,AQvkT_lfskBkMmbYUScdcw,Eddy R.,5.0 star rating,"What an awesome new spot. Just saw that they recently opened this place and decided to give it a try. Me and my gf started off with some cocktails, a coconut mojito and guajira ( a bourbon mule), they were both amazing. For dinner decided to have pan seared salmon and my gf had a lechon asado. Both were cooked perfectly. They both came with sides but decided to order an additional side, a fair warning the additional sides are very small (only negative thing), suggest ordering two. But food was delicious. Afterwards had a couple of desserts. A tres leches and chocolate cake to be exact, wasn't so crazy about the chocolate cake but tres leches was good. And the service was absolutely amazing, they made you feel very welcomed with a very friendly staff. Highly recommend this place to anyone, great Cuban restaurant.",Conga Cafe,4.5 star rating,$$,"Bars,, Latin, American"
81,gmuqqJAc6jA_5iKl55oehw,Cindy A.,5.0 star rating,First time coming here and it exceeded my expectations. The food was delicious and the service was great. Enjoyable atmosphere definitely will be coming again.,Conga Cafe,4.5 star rating,$$,"Bars,, Latin, American"
82,L6jnoxDu-saoL4Q9GhT1Og,O G.,1.0 star rating,"We went to Conga Cafe in Union City tonight for the first time and I must say that I rarely write a review, but felt I had to this time.  The restaurant: nice, with valet parking, which is always a plus.  So we get seated where I guess is considered the main seating area.  There were two separate parties consisting of approximately 20 people in each party, with unruly kids running around with balloons around us, ( at that point we should've left), but my husband wanted to give them a try.  I asked to be moved to their other room which is smaller and away from the parties and was told that all the tables were reserved for 7:00 and 8:00 pm reservations, this was at 5:10pm.Drinks and food:  first a small basket of the thinnest slices of bread with the worst butter-marmalade was placed on our table, then, we ordered a small red sangria which had a bit of red wine with lots of club soda, the worst I ever had.  Now, seeing what was going on, of course I asked if the kitchen was backed up.  Our waitress, (by the way very nice young lady), checked with the kitchen and was able to tell us if we ordered right away we wouldn't have to wait long.  Without even looking at the menu I ordered the first thing that came to mind.  We both had breaded chicken steak (a la Milanesa) with tostones.  The breaded chicken although a little thin was tasty and the tostones were great!  Now my personal experience, As a former West New Yorker, I recognized the manager from town and Memorial H. S. Avelino.  His father was the owner of St. Barbara Restaurant, (best breaded steaks I ever had).  As a manager, he was quit rude as he never lifted his head to greet the customers (in this instance us), when we walked in or left. There were three other families that were seated in the main dinning room like us that walked out, something we should have also done.  He never walked to our table or any table not related to the party for that sake to ask if everything was ok.  My opinion:  as long as this guy keeps in head in his turtle shell, I don't see much business.  What should have been a relaxing dinner after a long day of worked turned out to be a dump.",Conga Cafe,4.5 star rating,$$,"Bars,, Latin, American"
83,R4s5mOeGSRQUD3uOKbjjgQ,Argelys M.,5.0 star rating,"I am so excited to have this type of restaurant as part of my community. I grew up in this area and had yet to have a cuban place that was exceptionally well in food and service. Amazing staff, service, and great food! I came with my parents and kids and they staff understand the urgency of accommodating out table based on our needs with the kids. Ambiance was fantastic (even for a mom of a toddler) as they have a DJ that also lets you karaoke from time to time. My daughter didn't not want to leave because of the birthday chants and music provided to the celebratory guests. Lastly, I ordered a churrasco which was utter perfection but my mom ordered the BBQ ribs with the guava sauce that was to die for! Definitely coming back for MORE!",Conga Cafe,4.5 star rating,$$,"Bars,, Latin, American"
84,UhIVQV42GfuMBzVG3S7Erw,John D.,5.0 star rating,"Today I had the honor to eat at this fine restaurant. The food was absolutely delicious from the amazing Drinks to the delicious Tapas, you will be extremely satisfied.  The minute I got there, I was nicely greeted. The waiter Andy was truly serviceful and a true gentle to all myself but most important my female friends. The owner was very friendly and made sure we were enjoying ourselves. As a group we were able to see the upstairs party lounge and looked extremely classy. Planning our Welcome back party here for sure. Lastly,  I highly recommend this place.....go visit you wont regret it.",Conga Cafe,4.5 star rating,$$,"Bars,, Latin, American"
85,tk4-JqZpO2sWeEMOaeFcnA,Laura G.,4.0 star rating,"My first visit, so went for the classics...  Cubano sandwich was good but desperately needed more pickles :).  Tostones were delicious!  Service excellent and good was piping hot.",Conga Cafe,4.5 star rating,$$,"Bars,, Latin, American"
86,LifSWdVJf0JmY-6KOYB9fg,Kat K.,1.0 star rating,"I've driven by this place on my way home from work everyday and stopped in with my family for dinner, unfortunately it will be the last time I stop here.Service was horrible, we got served spoiled cranberry juice which the bartender insisted was fine (without trying it) until he co-worker tasted our drink and confirmed it with cold and hard bread. We waited about 15 mins for water to get poured in our glasses, another 20 mins for an appetizer....bartender never apologized for spoiled drink, the lady playing music was having a loud conversation on the phone on how she was losing clients and would sporadically loudly ""check her mic""Never again....",Conga Cafe,4.5 star rating,$$,"Bars,, Latin, American"
87,8Ord0vYCkiLUFhAr4-r0Bw,Gabriela B.,4.0 star rating,service was great...food was good....i personally loved the chicken chunks for starters,Conga Cafe,4.5 star rating,$$,"Bars,, Latin, American"
88,3CkSyXz-cUK_K1O9Obuhkw,Kostas P.,5.0 star rating,"We came here while visiting the area and we didn't regret it! The place doesn't seem to have a lot to offer while you walk by it but it is a true latin/cuban culinary experience! Everything we tried was great and fresh. The service was great and guess what; they don't try to get you our of there before you have taken your last bite. I.e., you have to ask for the check if you want to leave :) the place has also great ambiance and it is good for any occasion really.",Conga Cafe,4.5 star rating,$$,"Bars,, Latin, American"
89,6uljjm06HVSOr6lgRsaH7Q,Mario A.,5.0 star rating,"Love this place, good service, not too greasy and excellent. The owner was really nice and so was every waiter that we encounter. There's free parking on site and did I said the food was very good?? Yes it is!!!!",Conga Cafe,4.5 star rating,$$,"Bars,, Latin, American"
90,s6dpxoeTAM6gNECnc67-dg,Bianca S.,5.0 star rating,"HIGHLY RECOMMEND!I have lived in Union City for over 25 years and have never found a place in the area that's worth sitting at to enjoy a meal/night out, until now! It was always ordering takeout or having to pay for an overpriced dining experience in Hoboken, but now (FINALLY) there is something worth going to nearby! This place is just awesome in every possible way. From the greeters/waiters/bartenders to the decorations, music, food options, and drinks, I'm in love! I've gone about 7 times in the last 2 months and have recommended so many co-workers and neighbors to it and they all agree! The employees are so catering and it's super affordable! The portions are very generous and I always have leftovers for the following day, so you definitely get even more of your money's worth. They even have a parking lot so you don't have to worry about finding parking, making it so much more convenient and enjoyable to go out to eat here. Overall, I think it's an amazing addition to Union City and I can only hope others follow these owners in creating such a beautiful, delicious, and affordable restaurant in Union City!Pictured is a picture of the Guava Sangria and Mama's Beba Flan",Conga Cafe,4.5 star rating,$$,"Bars,, Latin, American"
91,oc3atvR-eDaDpYy9g3zvTQ,Nathy L.,5.0 star rating,"Great appetizers, food and drinks! Maduros wrapped in bacon and shrimp in garlic sauce were delicious.  The churrasco with rice and black beans were also very good.  Love the feel and look of this place and the service was exceptional.  Our waiter Raul was awesome and several people that came by to make sure everything was ok (owners and even the hostess) were extremely nice.  Lastly, the cigar box as a holder for the check was an excellent touch.  My family loved it and we look forward to eating here again!",Conga Cafe,4.5 star rating,$$,"Bars,, Latin, American"
92,O7dRG3SvPnHl_2XKmHltaA,Kim L.,5.0 star rating,"I got delivery from here and the food was amazing. I ordered the pastelon, the lechon asado, and the steak quesadilla. Pastelon was SO GOOD i highly recommend it to everyone. Lechon was juicy with huge portion size and came with arroz moro yucca and maduros none of which were dry at all which is great for delivery. I loved this place and would definitely order from here again!",Conga Cafe,4.5 star rating,$$,"Bars,, Latin, American"
93,WrUBmHWmxmeAoJW4KBCEkQ,Jannyl E.,1.0 star rating,"I drive past here everyday to work, and I've heard a few good comments about the food and the environment . We decided to celebrate my FIRST Mother's Day here . What. A HUGE mistake !!! We made a reservation for 4 pm for 9 people . We were sitted by 4:15 , it's now 6:19 we placed our dinner orders at 5:20 because the waiter didn't want to take our orders before because he was busy . Granted he said he had 3 other big tables . The waiter is walking in circles doing NOTHING . Still sitting here they said it would be another 20 minutes for food .. I would have walked out but I'm with my parents and family and do NOT want to ruin this evening even more .",Conga Cafe,4.5 star rating,$$,"Bars,, Latin, American"
94,nTl7kOB1Pz3iv0y7sRb93A,Michelle G.,4.0 star rating,"Great food, servers are great! Great portion..live close by so no need for me to take my car yet good with parking. Will def go back with the family",Conga Cafe,4.5 star rating,$$,"Bars,, Latin, American"
95,VAesXhOjYrqBnkuIZwzswQ,Vicky L.,5.0 star rating,"Love this spot!  I had no idea the place existed until one of my business friends took me here. I think this was the old Ricky's Frontier Steak House but they transformed it into a trendy , modern Cuban restaurant with two floors. I like the set up and flow of the place and I know on weekends they have the live music playing. Since discovering the spot, I've been here a couple of times. Great service and the owner and his wife are super down to earth.",Conga Cafe,4.5 star rating,$$,"Bars,, Latin, American"
96,aaUhXqCUT0tcUH7nTxB71g,Alexeis B.,5.0 star rating,"First visit and Certainly not the last one. Excellent restaurant, excellent work by ownership. Abundance of parking, internally beautiful decoration. The food was unmatchable, delicious, incomparable. A member of staff by the name of Raul was VERY professional, taking care of our table with class and efficiency. The menu has a lot of choices and the dishes are affordable. The food is outstanding and not expensive at all. I highly recommend this restaurant.",Conga Cafe,4.5 star rating,$$,"Bars,, Latin, American"
97,6uiYSze9sghCPbCVy_NTIg,Adria A.,5.0 star rating,"Went to Conga last Friday night and I have to say this is the best Cuban food I've had in a while. The skirt steak was tasty and tender, cooked to perfection.  But what I was most impressed with was their guava and cheese empanada.  OMG!! If you come here you NEED TO have those. The ambiance was also on point.  The place is clean, the music is just loud ""enough"" where you heard it but you can also have a conversation.  The staff was very friendly, and the hostess came around several times to make sure everything was to our liking. I will be going back.",Conga Cafe,4.5 star rating,$$,"Bars,, Latin, American"
98,pABsrlETpWq44uoq7gB2_g,Angelica L.,5.0 star rating,Came here again for my Mother In Laws 70th Birthday. This place is awesome!!! We were a group of 20 people. They sat us down right away and had someone taking our drink and appetizer order very quickly.   Our food was served quickly also. The waiters kept refilling our drinks. The service was amazing.,Conga Cafe,4.5 star rating,$$,"Bars,, Latin, American"
99,vzH1d3bLOY_gqT0mb8YuAQ,Doris S.,5.0 star rating,"Wonderful.  Great ambiance,  amazing food.   I had the jefe fish sandwich and loved every bite.   Gotta wean myself of these coconut mojitos.... slowly.....",Conga Cafe,4.5 star rating,$$,"Bars,, Latin, American"
