,user_id,user_name,user_rating,user_text,restaurant_name,restaurant_rating,restaurant_price,restaurant_type
65,B-U7fN__cwJ45wbtihaHhQ,Fae S.,5.0 star rating,"This place has been on my list of restaurants I've been meaning to try. Finally had the chance to stop by tonight. I had such a great experience. The restaurant itself was small, but well maintained and clean. The staff was welcoming and very helpful. We came maybe an hour before their closing time, but they happily and properly served us. It was my first time and the man at the register was very friendly and knowledgeable. I was unsure of what to order, but he gave us an informative description on the menu which helped me narrow it down. I ended up trying the Yak and my boyfriend had the Kangaroo. Once our orders were placed, our food came out fresh and was quickly made. Along with my yak burger, I added guac on top, which was also very tasty. On the side, we shared a large order of truffle fries, which was more than enough.  The place itself isn't too pricey for what you're paying, which is always a plus for your pocket. Overall, the food and staff were excellent! Definitely recommend stepping out of your comfort zone and trying the different types of burgers they offer. No complaints here and I will definitely be coming back soon! They also deliver to locals, but I recommend stopping by and trying the food for yourself!",Dark Side of the Moo Cafe,4.5 star rating,$$,"Burgers,, Cafes,, American, (Traditional)"
66,HMNSgqckcRsorAcMP0RThw,Myiesha W.,2.0 star rating,"Tried it three times.  Early evening on week day, late night on week day and once on sunday.  Disappointed.  Sometimes there was no salt and pepper on the patty or fries, patty warm but pulled pork cold, entire burger cold, fries soggy.  I wanted to love this place.  Maybe it's better when you sit down there to eat.  I've picked up twice and delivered once.  Giving two stars because staff is nice.  Sorry",Dark Side of the Moo Cafe,4.5 star rating,$$,"Burgers,, Cafes,, American, (Traditional)"
67,75oF_oV9ZL0F4xllOmt4Cg,Michelle G.,5.0 star rating,"Finally had lunch here and it was great!  Very friendly service, lamb burger delicious, and truffle fries were made just right. They even have beef pattys for the dog in your life. The inside is small but very clean and nicely decorated.I will definitely go back to try the other options on the menu.",Dark Side of the Moo Cafe,4.5 star rating,$$,"Burgers,, Cafes,, American, (Traditional)"
68,tbpNfiKonbGyTc4muVWcUQ,Omar M.,3.0 star rating,"A welcome and ambitious addition to the area. Probably a little over priced and they packed my to go order of fried foods in a closed container, which represents the pinnacle of stupidity (no one wants soggy fries.)",Dark Side of the Moo Cafe,4.5 star rating,$$,"Burgers,, Cafes,, American, (Traditional)"
69,QwHc7pNMWOSDDS90yTc_yw,Morgan H.,5.0 star rating,"Went here with my mother about a month ago. Delicious food with a passionate chef. He answered all our questions about the unique meat selection they have and gave suggestions as to what we may enjoy. The gentleman behind the counter clearly took pride in his work and it showed. The food was delicious, arrived quick and the service was terrific.",Dark Side of the Moo Cafe,4.5 star rating,$$,"Burgers,, Cafes,, American, (Traditional)"
70,EnyKabVppxepXHQn7dEQog,Mark R.,5.0 star rating,"Still five stars. The tacos are delicious and so is the bison burger. Had them last night for dinner. Also, try the bacon jam. Sounds weird but was quite tasty...Have fun...",Dark Side of the Moo Cafe,4.5 star rating,$$,"Burgers,, Cafes,, American, (Traditional)"
71,wqKgm0Db92Hgd5aMdy55_A,Patricia L.,1.0 star rating,Ordered delivery. Burger with truffle fries. Asked for lettuce and tomato on the side- Didn't get it. Ordered coke slaw. It was disgusting. The burger was in 3 pieces and didn't cover the little bun. Furs were mushy and everything was ice cold after an hour and ten minute wait. Waste of $22. Yuk,Dark Side of the Moo Cafe,4.5 star rating,$$,"Burgers,, Cafes,, American, (Traditional)"
72,e5BWzwTC9GfelpcIrzIpRQ,Yan M.,2.0 star rating,"Came here Christmas eve cuz it was one of the few things open in the neighborhood. Grabbed the a guac-zilla burger, roast beef sandwich, cajun fries and a side of mac and cheese. We got everything to go so I am not sure if some of it would have tasted better if we ate there.The guac-zilla burger was bland, messy, guac was more like chunks of avocado.The cajun fries were under-cooked, not much seasoning on there either, couldn't even tell they were cajun fries.The mac and cheese has definitely been sitting there for quite some time, the macaroni was falling apart. I expect my mac and cheese to be on the salty side from the cheese but this mac and cheese was sweet. Maybe some people like that but I was not a fan. Overall, big disappointment considering they have amazing reviews from both their food truck and brick and mortar location. Maybe they were just having an off day with the food since it was Christmas eve.",Dark Side of the Moo Cafe,4.5 star rating,$$,"Burgers,, Cafes,, American, (Traditional)"
73,r6pTFn7tKCOTY3rhUBeQxw,Manny M.,4.0 star rating,"Loved this place... We're from the NYC area, so we felt right at home and will return when we're back in town...",Dark Side of the Moo Cafe,4.5 star rating,$$,"Burgers,, Cafes,, American, (Traditional)"
74,K3MH-omNlXXXmqCEW-TmCA,Kassey M.,5.0 star rating,"Don't let the looks or the size of this place fool you. They're  really good with their meat. To be honest I came in with pretty high expectations, but oh my they surpassed whatever expectation I had and made the 40 minute drive I made totally worth it.kangaroo is bombbison is bombjust try all of the exotics so goodthe owners are  super nice and the service is quick. definitely come here",Dark Side of the Moo Cafe,4.5 star rating,$$,"Burgers,, Cafes,, American, (Traditional)"
75,0SoCAE9rCTKOi0da_vs48Q,ashley S.,5.0 star rating,"I've ordered take out from here twice now and it's consistently great! I stick to the double burger most of the time, because if you can't do basics you can't do exotic. Their 'basic' double is great - I'm looking forward to trying more of their exotic burger. When I went in to pick up my order the other week, they chef and owner (?) were so nice! The order was ready to go and we chatted about various root-beer options haha. Had I know the restaurant was so cute I would have eaten in. Now I just need them to open an outpost over in Bergen Hill :)",Dark Side of the Moo Cafe,4.5 star rating,$$,"Burgers,, Cafes,, American, (Traditional)"
76,B8SYKlgwqWg0NteuBI_HpQ,Aman K.,5.0 star rating,We are so glad we found the Dark side. Our food was so delicious. Delivery was fast. We ordered the double BBQ bacon cheeseburger with grass fed beef and it was tasty. The only thing I will change for next time is for the lettuce to be on the side because the heat wilted it during delivery. And the bun was a little soggy. We also had the vegan burger and it was flavorful. We will definitely be ordering from here again soon.,Dark Side of the Moo Cafe,4.5 star rating,$$,"Burgers,, Cafes,, American, (Traditional)"
77,z_l551yMolKenwFmY5jDTA,Kash K.,5.0 star rating,"Burgers are delicious! We made our way here from Downtown JC and it was totally worth the trip. Will definitely be coming back to try the rest of the menu, especially the exotic meats. Just a heads up, seating is a little limited inside (6 barstools and one table with seating for 7-8), so this spot is more suited for a quick bite or grab n' go.",Dark Side of the Moo Cafe,4.5 star rating,$$,"Burgers,, Cafes,, American, (Traditional)"
78,OhmG9jBV5hbUXYW3LIgd2w,Rebecca C.,5.0 star rating,"At the farmers market 2 weeks ago, it was customer appreciation day so that meant this cute little food truck was giving out free sample plates. The owner was quietly outed by a customer that he's planning to open his own restaurant very, very soon which I'm not super excited about.We were given a few options verbally (no menu) and I chose the hamburger slider and potato salad while my hubby got the pulled chicken and potato salad. The BBQ was homemade as he poured it from a reused Worcestershire container -- at least it tasted so. And everything was juicy and delicious! Some of the best BBQ food I've eaten in a decade!",Dark Side of the Moo Cafe,4.5 star rating,$$,"Burgers,, Cafes,, American, (Traditional)"
79,calybEDYdCqPCZE6aN26YA,Thomas S.,5.0 star rating,I came here for lunch.  I had the Yak Burger and alligator empanadas.  Mmmmm delicious.  The yak burger was not greasy like conventional meat and had a great taste to it.  Please also include their home made bacon.  Looking forward to going next time.,Dark Side of the Moo Cafe,4.5 star rating,$$,"Burgers,, Cafes,, American, (Traditional)"
80,lnmBl3uUzJRTHkZrtiM-BA,Vanessa T.,5.0 star rating,"Ask for the fries extra crispy. They are so good. Had the yak burger, it was nice and lean.    Small but cozy and love the outside art.",Dark Side of the Moo Cafe,4.5 star rating,$$,"Burgers,, Cafes,, American, (Traditional)"
81,QV5FDcNNcMpdqzDi9Y4GGQ,Sead E.,5.0 star rating,"If you eat meat you have try this place out, cannot believe I haven't been here sooner! But they do have vegetarian and vegan options along with the widest variety of meat you can imagine from a burger joint.",Dark Side of the Moo Cafe,4.5 star rating,$$,"Burgers,, Cafes,, American, (Traditional)"
82,z72pa1Y3aXHl_oxd1HferQ,Ashley W.,5.0 star rating,"I love this small shop! I came here with a few friends and we all got different things so we could try out the different exotic meats. We tried the camel, kanga, beef, and bison burgers, and gator sausage. They all tasted good, but my favorite was the gator sausage. We had fries and mac & cheese, and it's BYOB so feel free to bring your own brews. The owner is really nice guy too and has some cool decorations around the shop, feel free to chat it up with him.",Dark Side of the Moo Cafe,4.5 star rating,$$,"Burgers,, Cafes,, American, (Traditional)"
83,YqPcR84d7s7XnWc2Ps1Cow,Tony K.,2.0 star rating,"Their exotic burgers are ok but over priced, and they take a long time to make. Usually I wait 10-15 minutes for a burger. Kind of unacceptable. The seating isn't the best - just awkward chairs and an uneven bar.",Dark Side of the Moo Cafe,4.5 star rating,$$,"Burgers,, Cafes,, American, (Traditional)"
84,PpV_6TcobmNSDaB6rIi6Nw,JT C.,2.0 star rating,"First time ordering with them and was uber excited...however, when we drove home (7 blocks away), food was cold - Mac-n-cheese  missing and Cole slaw- yuck (too vinegary).  Yak burgers were on small side! Husband felt deli roll they were served on overpowered the meat/condiments.  Havana was good but lacking roast pork.  Truffle fries were okay but cold / seems that they were fried earlier in the day.  Wish them the best of luck and hope they can work the kinks out. Concept is creative and much needed in the area.  I'll keep an eye on them and hope to return ... One day.  Although, please note, our tastebuds were developed in the NYC scene.",Dark Side of the Moo Cafe,4.5 star rating,$$,"Burgers,, Cafes,, American, (Traditional)"
85,SVdUbdnnkViGlwaIXBchDA,Priya R.,5.0 star rating,"This place is a hidden gem!  We had duck tacos, kangaroo sausage, wild boar tacos and a camel slider. Everything we got was delicious!  The waitstaff was very knowledgeable and very friendly. You have to come try this place, you won't be sorry!",Dark Side of the Moo Cafe,4.5 star rating,$$,"Burgers,, Cafes,, American, (Traditional)"
86,sfYlqsWLSfH5LIbfMbtUhA,Sean R.,5.0 star rating,"I've been ordering from this place for about 3 months now, and never once have I been dissapointed. I've tried the elk and yak burgers, the wings and the gator sausage, and all have been excellent. The service has also always been great, the staff are friendly and go out of their way to make sure you get a great experience.",Dark Side of the Moo Cafe,4.5 star rating,$$,"Burgers,, Cafes,, American, (Traditional)"
87,aE50NPSvg9ThR_8Kktr2tw,Ayana A.,5.0 star rating,"We are so excited to have this burger spot in our neighborhood. The variety of menu choices is great and the prices are fair. The food is cooked well and the recipes are flavorful. I think that this place has gotten better within the short time they have been here in the storefront. The crew working in this shop is friendly and inviting. I hope one day they make milk shakes :) But until then, they serve Boanana pudding and it's unbelievably good!",Dark Side of the Moo Cafe,4.5 star rating,$$,"Burgers,, Cafes,, American, (Traditional)"
88,kMzCYlpAvVzZPCOJmrZqIw,Gerald Y.,1.0 star rating,"Ordered Online at and they delivered the wrong items completely, not they don't want bring correct items. I ordered a burger they sent me a black bean and corn item. Then the phone number don't work to correct order, had to go to Yelp Eat and they offer me 2 bucks off another order from a different restaurant. Text from online chat "" I will refund you the full amount of this order Gerald! I apologize for the inconvenience. The owner himself sends his apologies. They are extremely busy and will not be able to redeliver the correct items. I do apologize "" Don't order from here.",Dark Side of the Moo Cafe,4.5 star rating,$$,"Burgers,, Cafes,, American, (Traditional)"
89,ohaKZ_3CH30qbvkBahrfGw,Rene R.,5.0 star rating,"Great food, great prices, great staff. Even if you're vegan you can find something to eat here, which is saying a lot about a place that sells exotic meats as it's primary business. I love this place.",Dark Side of the Moo Cafe,4.5 star rating,$$,"Burgers,, Cafes,, American, (Traditional)"
90,wHCKwGO0dKlu3LuaPzirvA,Daniel L.,5.0 star rating,"Amazing cafe.  Love the ambiance.  Great staff.  Went with Tyrone's recommendation on the yak burger, cajun style fries, and fig & goat cheese salad.  Great taste & perfectly cooked.  Amazingly, I did not give have that terribly greasy feeling afterwards.  My new go-to place in the heights!",Dark Side of the Moo Cafe,4.5 star rating,$$,"Burgers,, Cafes,, American, (Traditional)"
91,6j4OJ3nJJxDOXXru7aRbGw,CaroLyn L.,5.0 star rating,After a long hot market day that was FANTASTIC! We decided to grab some grub so we're here @themoofoodtruck #restaurant in #theheights and I'm seriously in love with their #indianspiceblackbeanburger!!! It's been almost two weeks that I haven't touched meat and I'm thrilled I have this option here! #amazing oh and the #truffle fries are so good!!!! Can't wait to try their watermelon salad!!!,Dark Side of the Moo Cafe,4.5 star rating,$$,"Burgers,, Cafes,, American, (Traditional)"
92,lekYXUiVTyqy0SC_0GLYNQ,Robert M.,5.0 star rating,"I love this place and the service has always been friendly, prompt and efficient. I wouldn't normally review, but I just read Franco B.'s review and your response. GOOD FOR YOU! Franco B. Find something better to do with your time!",Dark Side of the Moo Cafe,4.5 star rating,$$,"Burgers,, Cafes,, American, (Traditional)"
93,3bg_zLPEQml1feMYEZc1YQ,Nick C.,4.0 star rating,"Paid a visit to Dark Side of the Moo by the Grove St. PATH station in JC yesterday afternoon to try some of the exotic meats. I opted for a camel burger and a kangaroo sausage. I wish the meats came in forms other than a burger or sausage, like a steak or something. I would like to taste pure exotic animal. Anyway, the camel burger was delicious, juicy, and very lean. I preferred the kangaroo sausage, which was spicy and full of flavor.I was slightly disappointed though, because I expected an extremely exotic flavor. The camel didn't taste any different than beef. I would've guessed it was a beef burger. The kangaroo had a notably different taste than common meats, which is why I preferred it. For those of you worried about the taste of strange animals, don't be.  I expected, and wanted any sort of gamey flavor.Can't discredit Tyrone though. The food was tasty and cheap, just not tasty in the way I was hoping.",Dark Side of the Moo Cafe,4.5 star rating,$$,"Burgers,, Cafes,, American, (Traditional)"
94,m_J19ZftmRc0vFsmj9ti5g,Justin D.,5.0 star rating,Great local spot with regular burgers and also some more exotic ones if you wanna try something new. I plan on trying every burger on the menu at some point. The ones I've had so for did not disappoint and were delicious. I usually get the double burger cause one isn't enough to satisfy my hunger. Also like the fact that the owner fires back at Dumb Internet trolls who complain about everything,Dark Side of the Moo Cafe,4.5 star rating,$$,"Burgers,, Cafes,, American, (Traditional)"
95,Bm-tZT0a2rROMKOAKS16EQ,Brent C.,1.0 star rating,"Maybe the restaurant is good but the food truck was disgusting, cold and hard pulled pork sandwich that was painful to finish. I hate when somebody messes up my lunch and that's exactly what this truck did",Dark Side of the Moo Cafe,4.5 star rating,$$,"Burgers,, Cafes,, American, (Traditional)"
96,sRZlfWk5cBuZFPDGADtyiQ,Ben J.,3.0 star rating,The portions were small and they didn't deliver the condiments I requested. The burger tasted really good though,Dark Side of the Moo Cafe,4.5 star rating,$$,"Burgers,, Cafes,, American, (Traditional)"
97,nzel808OLB1XhBOACCxMxA,Mona E.,4.0 star rating,One of my favorite places to eat in the heights. They have exotic meats and everything has amazing flavor. The only bad thing are the prices-- the burgers are upwards of $9.00 and that would be okay normally but the issue is that it doesn't come with fries. Otherwise the ambiance is great and you get some one on one service.,Dark Side of the Moo Cafe,4.5 star rating,$$,"Burgers,, Cafes,, American, (Traditional)"
98,x_BiH0xe3F7r5xoqG-9Mvw,Heather V.,3.0 star rating,"Visited Dark Side of the Moo during an organized food truck festival so the line was LONG - which was a sign that it was good. HOWEVER, we waited for more than a half hour intending to order a beef burger, but only by the time we reached the front of the line did they make us aware that the only option available was buffalo. I know it was super busy, so its understandable they ran out of product, but they should have posted a sign and let the customers know. (And perhaps they should have charged for the price of beef instead of the price of buffalo - due to the inconvenience). The truck still deserves three stars because the four hourseman of the aporkalypse was a great burger - and I would return again to try their tasty-sounding variety of burgers.",Dark Side of the Moo Cafe,4.5 star rating,$$,"Burgers,, Cafes,, American, (Traditional)"
99,R6FckC3gh0oNT3O-dEomrQ,Luisa G.,5.0 star rating,"OMG!!!! I am so happy that the Dark Side of the Moo has finally open up a brick and mortar spot. Every JC food festival, I only looked forward to seeing their truck. Now, I don't have to wait for a festival, I can simply visit their cafe in the Heights. LOVE it, their burger, without a doubt, the best in Jersey City... this comes from someone who has eaten a $20 burger from one of Daniel Boulud's restaurants. Not only is the regular burger delicious (think seasoned meat, melted cheese, and delicious moo sauce on nice potato bun), but they also have several exotic meats for those who are more adventurous. I encourage everyone to visit this place, because its a gem that makes Jersey City what it is.",Dark Side of the Moo Cafe,4.5 star rating,$$,"Burgers,, Cafes,, American, (Traditional)"
100,Ip9mAO-CbwBkDz8y3ldqEw,Eric M.,2.0 star rating,"Honestly, I got a little grossed out thinking I was eating a kangaroo, and the third-rate bun didn't help either. The fries were awesome, so there's that. The chef was a bit intense. All in all, it was a bit gross.",Dark Side of the Moo Cafe,4.5 star rating,$$,"Burgers,, Cafes,, American, (Traditional)"
101,dl4ENy4Bk6-lCu59A8vxbg,Bloss C.,5.0 star rating,"Very excited to see some more dining options recently in the Heights!  Dark Side of the Moo Cafe is from the same British food truck that has been at the Riverview farmers market most weeks for the last year or two, so you are probably already familiar with the food.  The truck was very burger focused with an emphasis on exotic meats (alligator, ect) but plenty of more familiar options as well (beef, bison).  The cafe keeps the focus on burgers, but has a few well thought out additions to the truck's menu, such as a pear gorgonzola salad,  breakfast sandwiches and omelettes, french fries (cajun or truffle), and tacos.  On my first visit I was pleased with my egg sandwich and truffle fries, and will update my review when I get to try the veggie burger.  A quick look at the menu shows a lot of options for add-ons to your burger which I'm excited to try.  The cafe space is a bit on the cozy side with about two tables and some counter seating.",Dark Side of the Moo Cafe,4.5 star rating,$$,"Burgers,, Cafes,, American, (Traditional)"
102,7IqQ2RDR0fTmb4jmJpjraQ,Mor C.,5.0 star rating,"I unfortunately just moved in about a block away from here which is only unfortunate for my waist line. I remember getting food from these guys in front of the Ale House in Hoboken and was so excited realizing they're right down the street. I went there the other day with a friend and got 2 Kango burgers that were awesome. We got some extra moo sauce on the side which was incredible. The food here is awesome and you can tell the owner has a lot of pride (the good kind) in what he does. Definitely worth a try AT LEAST once so you can see it'll be your favorite guilty delight. Sometimes the order can be more then the online suggested time but when you get in, you see why. The only thing I'd change is to agree to put a basket on a zip line directly to my apartment but other then that great food, great place, great employees.",Dark Side of the Moo Cafe,4.5 star rating,$$,"Burgers,, Cafes,, American, (Traditional)"
103,sUXSQqR_q4A7p1yIg4mfRA,Allison R.,1.0 star rating,"Surprised with all of these five star reviews given the quality of my delivery food tonight, but maybe you have to eat their food in person to get a decent meal.Our delivery time was quoted at 30-45 min, didn't arrive until about an hour and a half later. (I had to call delivery.com to even get someone from the restaurant to pick up the phone)Food arrived cold and completely soggy, and to add to it my taco wasn't even made correctly. I asked for no pico or lettuce and it was covered in it.  The taco was so soggy that it fell apart in my hands as I tried to pick it up to eat it. Fries were soggy, bland and unappetizing and went right in the trash.  The flavor of the chili is decent, but my tiny portion of it had a huge bone in it that I could've cracked a tooth on.I don't recommend ordering take out from here and I will not be ordering from here again.",Dark Side of the Moo Cafe,4.5 star rating,$$,"Burgers,, Cafes,, American, (Traditional)"
104,baLl26-ExBJjBxg4AJh1dw,Jazmin G.,5.0 star rating,"I am so happy I finally got to try out Dark Side of the Moo this past Sunday. I was with 4 others and we ordered our food to go. It's a small, 2 table seating  with an eat in bartop. But of course, the t star rating is because the food is crazy good.A friend had the Donald burger, a special made of a duck, asian coleslaw, and more. He raved about it.Another had the Mike Bison - a yak burger. He finished it so fast and recommends it.My brother had the Southern Comforts burger, a cheeseburger with mac&cheese, pulled pork, coleslaw, and bbq sauce. Let me tell you, it sounds delicious and he wouldn't stop talking about it.My husband got the Chipotle cheeseburger with Pico de gallo, jalapeños, and chipotle mayo. He didn't even let me try it he was so enthused.As for myself, I had the Guac-zilla burger. Guac is always a good addition and the Wasabi mayo was a great kick.I can't wait to go back and try the Gator sausage, gumbo, and if I'm feeling adventurous the kangaroo.",Dark Side of the Moo Cafe,4.5 star rating,$$,"Burgers,, Cafes,, American, (Traditional)"
105,OLuar_HGSTvZdkAOYVJcHQ,David C.,4.0 star rating,I had the Yak burger with BLT - hella good. Throw in the Big Mac sauce and you're sure to smile. Possible trademark infringement? Yes but that edginess may make the burger more delicious.,Dark Side of the Moo Cafe,4.5 star rating,$$,"Burgers,, Cafes,, American, (Traditional)"
106,WTA8uLFMHuVsN21qrYbOAA,Danny B.,5.0 star rating,"I tried this truck at the Winter Blast festival last year for the SuperBowl Block party in Secacus and the name definitely caught my eye because it was so unique. The menu was definitely even more unique! Kangaroo, alligator, elk and many more options that you usually can't find anywhere else. I had the kangaroo sausage and it was delicious and had a nice spicy kick to it!Can't wait to go to another festival and see these Aussies there again!",Dark Side of the Moo Cafe,4.5 star rating,$$,"Burgers,, Cafes,, American, (Traditional)"
107,bFdIVnDNo1Y7Rl3UJhw9Sg,Tor G.,4.0 star rating,"I love the burgers,  but kind of hate the fries. I've tried them a few times now,  and every time,  they come out soggy and oily and don't hold up well.  What's up guys? Seems like an essential thing to nail! A delicious burger without a delicious fry? That's not gonna fly.edit 2017: the fries have been vastly improved! thanks for making them better! my review is up to 4 stars now! thanks!",Dark Side of the Moo Cafe,4.5 star rating,$$,"Burgers,, Cafes,, American, (Traditional)"
