,user_id,user_name,user_rating,user_text,restaurant_name,restaurant_rating,restaurant_price,restaurant_type
30,FZEI6QysMFjij5GxUTL46w,Steve A.,5.0 star rating,"Update: Now that I've been to their brick and mortar location, I can add that fifth star. I visited for their 2nd anniversary and slapped together kangaroo and elk burgers. The kangaroo was medium-well and definitely roo - somewhat dry and deserty, unmistakably Australia. The elk was medium-rare, juicy, gamey, full of life. The toppings are basic - American cheese, lettuce, tomato, pickle - because this is all about the meat, so why lose that in a sea of gourmet toppings? I also had the Ninja Turtle soup, my first time eating turtle in many a year, and it was much better than I remember. Fries are decently good, medium thickness and not overcooked, but not particularly flavorful (must be the choice of oil). I suppose I will summarize as 4.5 stars, but I'm definitely rounding up for the friendly service and unique offerings.",Dark Side of the Moo Cafe,4.5 star rating,$$,"Burgers,, Cafes,, American, (Traditional)"
31,Ogp4RYtB6uMXgWqnJpWJGQ,Gab R.,5.0 star rating,"The bacon egg and cheese sandwich is worth it!! Cheese was melted, eggs were cooked perfect and the bacon was delicious!! Love this place!",Dark Side of the Moo Cafe,4.5 star rating,$$,"Burgers,, Cafes,, American, (Traditional)"
32,lYKdznv9Ccfchz30v5xsQQ,Joseph G.,5.0 star rating,"Went into Dark Side of the Moo last Wednesday night with my best friend with an open mind of trying something different. I got there a little early and was promptly asked if I was ready to order, but told them I would wait for my friend. I also asked if I could use a phone charger being that I was below 5% and the cook was glad to lend me one they had being the counter.He ordered the Kangaroo burger and I ordered the Camel burger. We both thought they were cooked to perfection and tasted delicious. We both ordered single burgers not realizing how small they would be so, if you go in there with an appetite make sure to order a double. On the side of my burger I got an order of the truffle fries which were also very good. After finishing up our burgers and the fries we were still hungry and decided to split an order of the Wild Boar tacos. We ordered 2 each and they were also very good. The soy ginger glaze on the taco was the highlight of the taco by far.All in all it was a great experience at this restaurant, the staff, food were great and even had a small, quiet dining room which is rare in Jersey City. It is pricey but it is also an exotic meat emporium so it's to be expected. Will definitely be back soon to try some of the other burgers and get some more tacos!",Dark Side of the Moo Cafe,4.5 star rating,$$,"Burgers,, Cafes,, American, (Traditional)"
33,BJYbR2h0r0H0OPSlweRJpQ,Carlos S.,3.0 star rating,"If you're not looking carefully you will miss the Dark Side of The Moo. Parking is not easy so good luck with that. Before I walked in, I thought it would be a normal size seating area, I was wrong. There is a bar with two seats and two small tables. I guess this is a grab your food and go place.The menu is interesting. Try something new. I was a bit afraid to. We went with the   traditional Wings and a side of peach-habanero sauce, Cajun fries, and we split BBQ bacon cheese burger. The wings were ok for me nothing to write home about. I had better Cajun fries and the small burger  I know i would make it better.My son saw that they had Camel Empanadas and was willing to try it. He loved all the food. For me it was ok.The price was a little pricy for my taste. The staff was friendly and polite.",Dark Side of the Moo Cafe,4.5 star rating,$$,"Burgers,, Cafes,, American, (Traditional)"
34,vFttdH4-8kcItQ83j7yJqQ,Reginald B.,5.0 star rating,"Love their burgers! The choices for the meat range from the regular beef to different game meats such as bison, camel, ostrich, yak, kangaroo, wild boar, and more that I cannot remember. The burger is very meaty and I actually prefer it double stacked. The burger comes with lettuce, tomatoes, pickles, onions, cheese, and their special moo sauce. I normally want my burgers plain with cheese only but here, I get it with everything as it just works well all together. They also serve specials which varies. I recommend trying them if they're still available for that day. I think I have tried every game meat they offer at least once. I liked them all so far. I just need to eat here more often though to taste and determine the difference of each meat offered. The problem here on the weekends is parking. It's street parking only and since it is in a residential area and it's friggin Jersey shitty, I mean, city,  parking can be hell. Tyrone, buy that small lot beside you for parking! They do have food trucks (which how it all started) roaming but I don't really check social media all that often to get updates where they will be.",Dark Side of the Moo Cafe,4.5 star rating,$$,"Burgers,, Cafes,, American, (Traditional)"
35,MjSBhbc4xGME9pD8cSqFmw,Ed R.,4.0 star rating,"Went to the food truck and although they serve elk, alligator, ostrich, and even camel I stayed safe and had the chicken sandwich.  The chicken was breaded nicely and the ""moo"" sauce was very tasty. If in the area I would definitely try this truck again and next time maybe I'll try one of the exotic menu items.",Dark Side of the Moo Cafe,4.5 star rating,$$,"Burgers,, Cafes,, American, (Traditional)"
36,wT_iYftd8O3DqbMwa8oe-w,Marianne C.,5.0 star rating,"Food truck review: I booked the Dark Side of the Moo food truck for my husband's 30th birthday this past weekend and I cannot say enough good things about it! First off, Tyrone answered my emails quickly and completely. He even helped me brainstorm ideas for serving different containers of craft beer (and that wasn't even part his job!). At the party, he came early and offered to serve early, and was very accommodating when I asked for one last burger before he left! Him and his employee were both absolutely pleasant the from start to finish. Second, the food was, as one party attendee said ""HEAVENLY"". People came up to me raving about EVERY SINGLE ITEM on the menu! The bison burger, the truffle fries, the bacon burger, the mac and cheese, I mean EVERYTHING people raved about. I was especially happy to have the veggie bean burger since I am vegan (which was also amazing). I cannot wait to tell my company to use his food truck this year for our annual BBQ. If you book this food truck, you will not regret it!!!",Dark Side of the Moo Cafe,4.5 star rating,$$,"Burgers,, Cafes,, American, (Traditional)"
37,uXcWzqiINoGqh98SXS3_xw,Wurtle T.,5.0 star rating,"Their burgers are the bomb! Tried them first at a festival food truck. Had the regular (beef) and exotic burgers such as kangaroo, ostrich, elk, bison, and camel. Everything was good. Then we decided to try them again at their cafe location at jersey city. Parking sucks though. We had to walk a few blocks since there's no parking slot close by. Anyways, my bf and I ordered the kangaroo burger (double patty), truffle fries, wild boar empanada, and baonana pudding and it tasted phenomenal. Definitely worth the drive and hassle with parking. Prices are reasonable and the owner is very friendly too. Keep watch of their specials. Yum yum in my tum tum!",Dark Side of the Moo Cafe,4.5 star rating,$$,"Burgers,, Cafes,, American, (Traditional)"
38,FkzIhkcxB-mlCEOMKCZsuA,Abby M.,4.0 star rating,"I absolutely love Dark Side of the Moo. Every time I'm in JC I have to stop in here. The staff have always been friendly and the owner always gives suggestions for new things to try. The food is a little pricey, as I paid $18 for a burger, fries and drink. Other than that it's perfect. Definitely try the bread pudding too - it's addicting.",Dark Side of the Moo Cafe,4.5 star rating,$$,"Burgers,, Cafes,, American, (Traditional)"
39,dugA_rKOfCPu4Wdj5Rtt7g,Ashleigh O.,4.0 star rating,"I have only ordered delivery, but I'd love to stop by.Their truffle fries are amazing. I'm an obvious glutton because the large heaping I've ordered twice now is never enough. The establishment will happily skip the cheese on these, by the way.The indian-spiced burger is also fantastic. If they offered a vegan cheese with it I'd be even happier, but, really, you'll hardly miss it.",Dark Side of the Moo Cafe,4.5 star rating,$$,"Burgers,, Cafes,, American, (Traditional)"
40,dEYYFV2uWpp5RUxZDRapBA,Nina M.,4.0 star rating,"I had a date take me here  for lunch one day when I was in the area. They are a burger joint  with a lot of interesting meat selections. You ordered the special of the day which was brisket and a camel burger. I am typically not a fan of strange meats and was talked into trying it. To my surprise it wasn't bad, The brisket was fantastic. We also ordered truffle fries which were amazing. I would definitely come back if I were in the area, or I wanted to try different types of burgers.  Overall I really like the place especially the Couches with cow skin pattern, a very cute eclectic hole in the wall place.",Dark Side of the Moo Cafe,4.5 star rating,$$,"Burgers,, Cafes,, American, (Traditional)"
41,Swf3MBV1JxohLHxfSo3NVg,Chris R.,5.0 star rating,Simply the best experience!.  My Yak Bacon burger cooked to perfection. A great way to be introduced to Yak. Yes I pulled a piece of Yak off to try it out separately.  Yak is another great meat you have to try out at least once in your life. Chances are you will be back for more. The Truffle fries were pretty good cheese topped and all.  But I do wish sometime in the future Dark side starts offering Kennebec fries cooked in duck fat.Banana wafer pudding thing topped it off well.Great service and suggestions.  You can't go wrong with a meal at Dark Side of the Moo!,Dark Side of the Moo Cafe,4.5 star rating,$$,"Burgers,, Cafes,, American, (Traditional)"
42,_3KlXVIhrKd-LNFZ1dnc7g,Shane B.,3.0 star rating,Small over priced and greasy with little taste. I can appreciate a fresh burger of quality. But every time I've ordered from here the burger is something of a mess and the fries are bland and frozen. This place could be so much better and could learn from a great burger place just down the road.,Dark Side of the Moo Cafe,4.5 star rating,$$,"Burgers,, Cafes,, American, (Traditional)"
43,ok5Uf2EGT_amDgSug3zHhw,Tanya N.,4.0 star rating,"Excellent burgers, fun menu, nice guys working there. It's very much out of the way but a good place to hang out if you want to grab a burger.",Dark Side of the Moo Cafe,4.5 star rating,$$,"Burgers,, Cafes,, American, (Traditional)"
44,GNoG6nFqavtjiojVr1vrVw,Kim D.,5.0 star rating,"Sooooooo happy that Dark Side of the Moo has a brick-and-mortar location!!! I've been a fan of the food truck for years, but I usually have terrible luck in running into it in Hoboken or at events. I know it's been in the works for a long time, and I'm glad it's finally here!I've already been there several times since they opened a few months ago, and the food is always great. If you're feeling adventurous, I would recommend something from the exotic menu options because I love trying new foods and everything is so expertly prepared. But even if you're not into that, their beef burgers are on point. My personal favorite is the Lamburghini burger. They also have a veryyyyy delicious gumbo that's perfect on a cold day.It's a small place with only 2 tables and some counter seating, but the decor is pretty cool, especially the cow print booths. Lol. And on a nice day, I like to take the food to go anyway and eat in the park a couple blocks away.If I could tho, I would give them 4.5 stars because the service is a tiny bit lacking. Everyone is very friendly and the food comes out pretty quickly, but not all the employees seem to know what's going on. For example, inability to answer simple questions about the food, not knowing how to pronounce the menu items, easily overwhelmed by multiple customers or orders. However, be patient because it's a new business and everyone is still learning. Plus, the food is so worth it!",Dark Side of the Moo Cafe,4.5 star rating,$$,"Burgers,, Cafes,, American, (Traditional)"
45,DvOVei_FUicKnOYBZVHgDA,Molly K.,5.0 star rating,"So impressive! The menu has some outstanding options. Really exotic options. The burger was delicious, the fries were amazing, and the owner was really nice!! I really recommend trying!!",Dark Side of the Moo Cafe,4.5 star rating,$$,"Burgers,, Cafes,, American, (Traditional)"
46,P4OLWXzi089E9DS0G0jObg,Fabiano M.,5.0 star rating,This place was awesome!! Best burger I have ever had. The 4 horseman was legit! Staff was awesome. Owner was there and was extremely helpful. Can't wait to go back to try different menu items like the kangaroo burger and more of the wild game options. Venison cheek was highly recommended and I might try that next. Great experience all around!,Dark Side of the Moo Cafe,4.5 star rating,$$,"Burgers,, Cafes,, American, (Traditional)"
47,qiEXMA5iSEYWauKWEqQGrQ,Carlo M.,5.0 star rating,"I came back in for breakfast on a beautiful Sunday morning and was disappointed to find out that they stopped serving that delicious breakfast sausage sandwich. I couldn't believe it. C'mon people, don't sleep on the specials. They're a labor of love and are fantastic. I hope they bring back the breakfast sausage. In the meantime word is that they have wild boar bacon.",Dark Side of the Moo Cafe,4.5 star rating,$$,"Burgers,, Cafes,, American, (Traditional)"
48,HIioMCfH-S0JO34LzeBVtQ,Brian M.,4.0 star rating,"Came in during the soft open and had the chipotle burger. Maybe I can't really give it four stars YET, but I feel like they can't go backwards once they offer more than the limited menu. Feel me?The cajun fries were amazing and need to accompany anything you order.",Dark Side of the Moo Cafe,4.5 star rating,$$,"Burgers,, Cafes,, American, (Traditional)"
49,NPFn3HB6vQVLwoW4LNcwXw,Ipsita D.,4.0 star rating,"The mac n cheese & truffle fries were both really tasty. The ""lamburghini"" was good, the ""guac zilla"" burger was okay. Both burgers arrived rather soggy unfortunately (delivered by Postmates). Overall this was better than most food I've had in NJ and I will probably try their other burgers since they have some interesting choices.",Dark Side of the Moo Cafe,4.5 star rating,$$,"Burgers,, Cafes,, American, (Traditional)"
50,CJNk8Wb2X8hJ_gFDJWqHlQ,Franco B.,2.0 star rating,"I was so excited to try this exotic burger joint but the whole experience was disappointing. I'll start with the good. The beef used for the chipotle burger was on point and they cooked it medium as it should for most people. The Bun was soft and held the burger very well. Mac & cheese and fries were pretty good but I still prefer the french fries at corkscrew or Fox & Crow. The bad.. chipotle sauce was excessive on my burger. It was dripping off the bun onto the plate. Now The Ugly.. why did I and my wife have to wait for 2 burgers, fries and mac & cheese for 50 minutes? To me that is unacceptable. Nobody from the staff warned us before ordering that it will take this long. Seriously I heard this was a food truck before which entails you gotta be fast on the grill. I also felt bad for the guys that got their orders before us as they waited as long as we did. So please accept this criticism and teach the staff about telling customers they will have to wait  about 50 minutes for their food, in that way one can choose what to do. I have seen the mixed reviews for this spot so I guess I should give it another try in the future.Tyrone, for the record I do have the time I ordered the food and the time I actually got it in my hands. I'll leave it at that. Thank youOk Tyrone first thank you for your lengthy explanation of how this delay in my order did not happen and second no I don't criticize establishments for no apparent reason. I don't appreciate the way you picture things but anyways I'm really glad you are banning me from your great exotic meats joint. I will be honored not be served there ever again. I wish you great success with your business.By the way it was my wife who ordered the food around 7:46pm and not 18:53 and 56 seconds as you stated and she never changed the order as you recalled. Then I went in twice to check the status of the order and finally got my food Lastly please don't make up false accusations about people you don't know. Drunk or high? Come on Tyrone, Do I look like that on your video tape?",Dark Side of the Moo Cafe,4.5 star rating,$$,"Burgers,, Cafes,, American, (Traditional)"
51,4TPLYApXfsK3g3GPeBkyng,Chelsea W.,5.0 star rating,"Delicious!! Seriously, such great food and service! Its a little gem in The Heights! The outside artwork on the building is perfect for this place! The staff is the best and very nice! The head chef is very friendly! We are new to the area and they were so nice, gave us a ton of info about the area and nieghborhood! told us the best ice cream shop in town. In my opinion, so far, this is the best burget spot in town! They sever up Kangaroo, Bison, and all sorts of meats! I had a cuban sandwich and it was freaking delicious! I know for sure we will be coming here often! If your looking for something different, I recommend coming here!",Dark Side of the Moo Cafe,4.5 star rating,$$,"Burgers,, Cafes,, American, (Traditional)"
52,uEPsewex4JodlMIiqp37vw,Flynn R.,5.0 star rating,"*** Foodies paradise **** exotic Meats, * the interior looks a bit runned down, * bathroom here, * parking could be hard, * they have a food truck in Hoboken, * you can find them in locals farmers markets, * no, I did not get a stomach virus! I had to mention it, although The reviewers on Yelp and Google didn't seem legit, it still hurts business when reviews like that are being posted. * they carry jarritos guava flavor, I haven't seen it around. Five star for their lamburghini! Please! please! call ahead to check what exotic Meats they have available before going... Yes! I was highly disappointed that they did not have the Camel, or other exotic Meats that they usually have, but because of that, I had the chance to try their lamburghini... So what intrigued me in the lamburghini is the ""tzatziki sauce"" on the Ground lamb as a burger, and they delivered holy quaqomoly big effing time!  Maybe I'm late to the party! or maybe I'm just getting excited about this combination for no good reason! Maybe!!!   The only thing that I can tell you is that I personally have never seen (yet) ""tzatziki sauce"" on a burger menu....    So the first bite in that concoction was like biting in to a whole new world of opportunity and adventure... Something that I rarely come across theis days in restaurants. So you know the drill, get their with an empty stomach and an open heart, yes parking might be a bit hard, but that shouldn't take away from the transcendent experience you are about to indulge...Pro bonus: the wild boar tacos was my second favorite after the lamburghini, so if you haven't had a chance to try ""wild boar"" I suppose it's about time...",Dark Side of the Moo Cafe,4.5 star rating,$$,"Burgers,, Cafes,, American, (Traditional)"
53,0a5vEDd4q0nXtjt-hw_bdA,Darnell J.,5.0 star rating,Had my first ever havanna. Omg it was filling. Gave me the itis. Shout out to Jesus. Thats my guy,Dark Side of the Moo Cafe,4.5 star rating,$$,"Burgers,, Cafes,, American, (Traditional)"
54,bKU5umbm_k3eeJ-zgtAbZQ,Victoria S.,1.0 star rating,What a shame .... just got this for the first time from pier 13 food truck... they ran out of everything - burger was served on a hoagie roll - was tiny - no sauce - ran out of ketchup... fries were soggy and cold... if you run out of ingredients - close up and go home.. don't just give anything to customers! Waste of money and dinner!,Dark Side of the Moo Cafe,4.5 star rating,$$,"Burgers,, Cafes,, American, (Traditional)"
55,IOsgBnvpvpFJvHx41WTbbw,Alex M.,4.0 star rating,"Several weeks ago I ordered buffalo wings to go.  The chicken was cooked right and the flavor of the sauce is ""spot on"".  When I brought it home the skin was soft.  My mistake was getting it ""to go"".  The enclosed package holding in the heat and creating a little moisture most likely made the skin soft.  Next time I'll just have it to stay.",Dark Side of the Moo Cafe,4.5 star rating,$$,"Burgers,, Cafes,, American, (Traditional)"
56,DFIZWYHxIFIB2-OGGJRDvA,Rosina R.,5.0 star rating,"Love their ""exotic"" array of meats for burgers. Thus far each burger be it yak, camel or kangaroo was tasty!",Dark Side of the Moo Cafe,4.5 star rating,$$,"Burgers,, Cafes,, American, (Traditional)"
57,5T0ZlFzC3fkmi_VKSISHLw,Scott W.,5.0 star rating,"This review is for the storefront location:Unpretentious, fun, and delicious, Dark Side of the Moo is the quintessence of the JC Heights and what it should aspire toward. The camel, kangaroo, and yak burgers are solid options for a clean, filling meal. Thankfully, there's an option to turn your burger into a double for a $3 upcharge and it is worth it. Otherwise, the meal would be a bit paltry. Fries are extra ($3 for a small, $6 for a large). Opt for a large! Cajun fries are tastier than truffle fries, but that's probably a matter of opinion.Downsides: the place is small, seating meager, and, if you dine in, your clothes will smell like freshly cooked exotic meat.Upsides: Very friendly, funny, and ultimately CHILL staff. Will always accommodate requests/throw in some extra sauces if you want. That said, try the Moo sauce. Decor is lit and specials are inventive and on par. Ozztrich burger was great. Sometimes they play hip hop inside.My recommendation: Grab a pounder of light beer from a nearby bodega, bring a friend, and order a couple yak burgers and a large Cajun fry.",Dark Side of the Moo Cafe,4.5 star rating,$$,"Burgers,, Cafes,, American, (Traditional)"
58,TINgV4sYBqyGuJB6j1PH0w,Mickey M.,5.0 star rating,"Had the Nightmare on Elk Street and the Once you go Yak, You Never go back. I'm obsessed with these exotic burgers! Definitely worth going here for lunch from now on. Reminds me of a Bob's Burgers burger joint. The salted and Cajun fries taste great! We also had the chocolate cake, and the Smoothies OMG I can't wait to try to Waffle Sundae! The new staff is awesome, they're very respectable and efficient. Keep up such a great place!!",Dark Side of the Moo Cafe,4.5 star rating,$$,"Burgers,, Cafes,, American, (Traditional)"
59,QX7xwMyjLdhFQul72T7R7w,Calla F.,5.0 star rating,"The burgers are phenomenal - some of the best I've had anywhere in Jersey City. Better quality than most ""burger places"" downtown. The price point is excellent too, and the owner is friendly and welcoming. I had the Four Horsemen of the Aporkalypse burger with a side of fries, and it was so satisfying and really hit the spot. Burger craving satisfied! I will definitely be ordering from here again!",Dark Side of the Moo Cafe,4.5 star rating,$$,"Burgers,, Cafes,, American, (Traditional)"
60,7F0aZojFtGAobx13XCuREg,Jim N.,3.0 star rating,"Tasty burger but I had to wait twenty minutes while people who ordered after me got their meals.  I was ready to ask for my money back when the burger came up.Despite ordering medium-rare, I got well done.I will accept the business' explanation for other customers getting served before me and will, thus, add a star.",Dark Side of the Moo Cafe,4.5 star rating,$$,"Burgers,, Cafes,, American, (Traditional)"
61,d6m6GxJoie8SGDDLW6BmOA,Omer A.,5.0 star rating,"One good burger!We ordered one double burger, one bison burger and two fries (Cajun and truffle) and for sure one of the best we had for quite some time!The burgers was cook amazing, the fries was so good and so tasty and done to perfection, the moo sauce is really foot and add so much to the burger and it's a great dipping sauce!So we will definitely going back!!!",Dark Side of the Moo Cafe,4.5 star rating,$$,"Burgers,, Cafes,, American, (Traditional)"
62,CCwopOkEQ9DaRnapBpRNEg,Michael G.,5.0 star rating,I will just start off saying this place was excellent. Food was great and cooked perfect.Went there with a friend and wasn't quite sure what to expect. Small place on a small street more of a hidden gem. Very friendly inside with a nice sized menu with very interesting things to choose from.I had a camel burger with truffle fries and my friend had the kangaroo burger with canun fries. We both tried to eat as slow as possible so that it lasted longer because of how great it tasted. I will be going back there againWas well worth the bit of a drive i took.,Dark Side of the Moo Cafe,4.5 star rating,$$,"Burgers,, Cafes,, American, (Traditional)"
63,Osxg8AppTNPpLZ1ySSu9Rg,Kimberly C.,4.0 star rating,"We just moved to the area (literally across the street), decided to give it a try for dinner and we really enjoyed our burgers. I had the bison burger with truffle fries and my husband had the yak and regular fries. Burgers were great! Fries could have been crispier but overall very good. We will be back!",Dark Side of the Moo Cafe,4.5 star rating,$$,"Burgers,, Cafes,, American, (Traditional)"
64,GIm65ERUIDDLVZq-XlSukw,Katherine A.,5.0 star rating,"Great burgers, great prices, great staff .. can't wait to come back. The southern comfort burger was absolutely delicious. My fiancé had the bacon BBQ burger and loved it also. Plus .. You can't really go wrong with a Pink Floyd inspired name :)",Dark Side of the Moo Cafe,4.5 star rating,$$,"Burgers,, Cafes,, American, (Traditional)"
