,user_id,user_name,user_rating,user_text,restaurant_name,restaurant_rating,restaurant_price,restaurant_type
174,dIqCAI6ui1b0LLWu7ef0gg,Alec T.,1.0 star rating,"I've visited Dino & Harry's a few years ago, and LOVED it. Sadly, I can't say the same about my most recent visit. I made a reservation weeks in advance, as my mother was coming to Hoboken from PA to celebrate her birthday. When 1 of our party of 5 was running late, the hostess told us there was no way the 4 of us could be seated until he arrived (which I informed her would be in a half hour). We were hoping to be seated and order appetizers and drinks until he arrived (generating the restaurant revenue). She told me when he finally arrived we would be seated. The restaurant was excessively crowded, and we shuffled around the piano/bar until our 5th finally arrived. When I returned to the hostess to inform her we were ready to be seated, I was met with attitude and told we'd have to wait another half hour for our table. We were finally seated an hour and a half after our original reservation. Our waiter treated us as if we were an inconvenience, and we had to flag down other servers for requests, like a missing baked potato (which was comped). The food was underwhelming, the ambience was loud, and the customer service was TERRIBLE. What happened Dino & Harry!? You used to be one of my favorite spots in Hoboken, but you've really disappointed me this time!",Dino & Harrys Steakhouse,3.5 star rating,$$$,"Steakhouses,, Wine, Bars"
175,oxq0L9lJw6RcIUI2kwoF6w,Silva S.,3.0 star rating,"Steak - delicious.Arugula salad - perfectly dressed (pairing it with beets and goat cheese is a little too obvious, but it's a great starter).Creme Brulee - NOT creme brulee. I almost walked back to the kitchen to do a little demo on how to make proper creamy custard. ""Dulce de Leche"" is also not really a tasty version of it. The atmosphere was amazing. There was a piano player (reading sheet music from an iPad!), playing classics and new hits. The wait staff and runners were pleasant. I see other reviewers raving about the wine list, but it is definitely not impressive. I can think of at least 10 bottles of Oregon pinot noirs and California cabernets that would pair well with steak and would be on the more affordable end. No need to put La Crema, Santa Margherita and Sebastiani on there as the ""affordable"" options.Overall very pleasant experience, but I had to voice my disapprovals :)",Dino & Harrys Steakhouse,3.5 star rating,$$$,"Steakhouses,, Wine, Bars"
176,0jGLOr-2RwUzealqLccdsA,Marc F.,3.0 star rating,"I got the ribeye, about a third of it was inedible because I had to eat around the huge sections of fat. Yeah, I expect ribeyes to be fatty, but I expect the fat to be much more evenly distributed and marblized than what I got. The signature dessert, the Snoboken, was something straight out of Dairy Queen but not as good.To sum up, disappointing. I got a better ribeye at Teak, which isn't even a steakhouse. Go to Zylo if you want a steak in Hoboken.UPDATE:Went back here and got the porterhouse. It was pretty good. Someone at my table got the ribeye...still wasn't good...just stay away from the ribeye and you'll be ok.",Dino & Harrys Steakhouse,3.5 star rating,$$$,"Steakhouses,, Wine, Bars"
177,EccxdCwn5iz0VZDuDyHFfw,T U.,2.0 star rating,"Not a person in the placeand we get walked to a little side alcove. Felt very alone...candles were not lit till after we ordered the wine.Sevice is OK...but we saw more of the bus boys than the waitress...Bread...seriously...commercial bread sticks with sesame seeds,  bland COLD baguette...maybe local but about as pedestrian as you can get...butter was close to frozenOdered a Caesar Salad...please...I know this tells them I am a scum... but it should have been alot better...chopped lettuce,  dressing was light...and it came so fast you knew they had them either plated or someone was just waiting...pacing in a nice place is important...at least make me feel like you did some work on it.Bottle of Heitz Cellars Cab...best thing about the night...but if you are having trouble keeping the wine room stocked...the waitress should not look at a cheat sheet and go ""Whew...we have that one...great!""By the way...the list says ""05""...we got an ""07""...Steaks came...my ribeye was medium...not a juicy bite in it...the cap meat along the outside which is the best part of the steak was well done. Don't tell me to send it back...it was $45.  My partner had a sirloin...it looked fine.Steak was tough...did not seem aged...it looked good....tasted good with the House made Steak sauce. on the tableScalloped poptatoes were fine...a little sparse but tasty.Salad, Steak, Wine Potato ...230 bucks...plus tip   which I am OK with.Bus boy offered to box up leftovers (Waitress???)...each of us had some steak...and some potatioes...he put the potatoes in a huge tin foil pan...and when I opened the steaks when I got home...one was missing. Oh well...we left after about an hour...two large parties had come in...place was still empty...the owner was at the bar talking...he waved thanks...what would it have taken to come over to our table and say hello...I might not be writing this...We had a great time because the wine was terrific and the steaks passable...but for a five star place...Zagat rated...didn't do it for me.",Dino & Harrys Steakhouse,3.5 star rating,$$$,"Steakhouses,, Wine, Bars"
178,Jwr3mcj47SKJZZRIIuhGCA,Maria Z.,3.0 star rating,Enjoyed my dinner. Lamb chops were perfectly cooked med. rare. I did not give it another star because it took a very long time between courses. I thought they had forgotten us. After asking the waitress why the delay she said it takes a long time to cook lamb chops!  Really?,Dino & Harrys Steakhouse,3.5 star rating,$$$,"Steakhouses,, Wine, Bars"
179,1HDPkgoHp3NV5xRQIjziog,B B.,5.0 star rating,"Oh yea, the steak is good too. Dino's has so many delicious dishes always perfectly cooked. And the dishes come as complete meals, as opposed to the steaks which are generally a la carte as in most steakhouses. The salads are perfect, sides amazing (a secret is the hash browns), and all courses consistent and tasty. We also just went for restaurant week and that was fantastic! Compared to other steak places this is a great deal and love the diversity of the menu. We find we can never go wrong here.",Dino & Harrys Steakhouse,3.5 star rating,$$$,"Steakhouses,, Wine, Bars"
180,GO20yLITzq_1wvGOuyC-WQ,Dave a.,5.0 star rating,"Dino and Harry's is always a great meal and last night was no exception. Whether it's fish, fowl or steak you can't go wrong and the variety of sides and starters is great !!",Dino & Harrys Steakhouse,3.5 star rating,$$$,"Steakhouses,, Wine, Bars"
181,_gtEweVCf77jvKf6mPH-Ew,Jennie R.,1.0 star rating,"Awful experience! Hostess didn't greet us when we arrived. She sat there with her arms crossed and looked annoyed that we were trying to check in for our reservation. We went to the bar to have a drink. When we asked the hostess about sitting down, she said you have to sit right now, otherwise you'll have to wait. We said that we were ready to sit and she asked us are we sure. At that point we turned back to the bar, amazed at the way we were being treated. The hostess came back over to us and at that point we told her that she was rude to us and we decided to leave. On the way out the hostess & presumably the owners (a man & a woman) were at the hostess stand and the woman said to the other two, ""they're canceling their reservation"". I was astonished that no one cared that a party was walking out of their restaurant w/o even asking why. I told the owner that they have terrible service and an attitude and that I would be writing a negative review about our experience. He followed me outside and said that I threatened him!!!! My husband got upset and told him not to speak to a woman like that.  He took out his cell phone and offered to ""see how many cops he could get there"". He caused a scene on the street and everyone inside the restaurant could see what was unfolding. Someone from the restaurant had to bring him inside b/c he was following us to the corner screaming at us. Don't go here if you expect to be treated like a human being!",Dino & Harrys Steakhouse,3.5 star rating,$$$,"Steakhouses,, Wine, Bars"
182,b9Kc--8f4U6zJg-RkPSlRQ,Steve b.,5.0 star rating,"Beet salad was substantial, cocktails expertly prepared, filet perfect and tuna was done perfectly. 3 people,  1 cocktail, 1 bottle of wine, 2 salads, 3 dinners, three sides of veggies, 3 after dinner ports $500 with tip.",Dino & Harrys Steakhouse,3.5 star rating,$$$,"Steakhouses,, Wine, Bars"
183,mPccdzeCLMNFGQmLqQCAeA,Vard T.,1.0 star rating,"I would recommend checking out David S. review a few before mine. I went to dinner with him and a few of our friends. His experience was a little worse than mine as he ended up waiting longer than the rest of us for his food, don't get me wrong I also waited waaaay toooo damn long.I'm looking through other reviews and just can't figure out why they are so high for this restaurant. Maybe it's because when you first walk into a restaurant you really do feel like you're in a steak house, I for one always care about ambiance but that doesn't compensate for all the other negatives.Service was terrible, the waitress was nice but once again that doesn't compensate for fact that we waited so long for our orders. Took about 20 minutes after sitting down to even get a chance to order wine, in the mean time we had to split 2 pieces of bread between the seven of us. It was restauant week so you knew everyone was going to order appetizer, entree, and desert. So why was it so difficult to bring each of the courses out together? there were 3 appetizers to choose from and we ended up ordering at least one of each for the table but they all came at different times, personally i feel so awkward having to eat my food as a friend sits there without his arriving yet. then by the time his arrived we were already getting our entree. This isn't applebees so i don't understand why the service was so poor.D&H is supposed to be a steakhouse, so how come every single one of our steaks was cooked incorrectly. Either undercooked or overcooked, I'd understand if some of the other food wasn't done right since it can be expected from a steakhouse but how can you scew up the only staple a steakhouse is supposed to have?As far as i can tell the only part of meal that surprised everyone was how delicious the snowboken desert was. But once again, this was a steakhouse so how can the desert be best part of the meal?",Dino & Harrys Steakhouse,3.5 star rating,$$$,"Steakhouses,, Wine, Bars"
184,M-ybeXy64jkEavenAE1r7g,Elizabeth S.,5.0 star rating,"If there was an option for 10 Stars I would give that! This place is the BEST steakhouse I've been too thus far. I took my dad here for his birthday along with my boyfriend and it was by far one of the best dinners. The Oysters were so fresh, I could have eaten another dozen, very well cleaned and perfect balance for the horseradish cocktail sauce. I had the lamb chops which were amazing, my bf had the blue cheese encrusted steak which I was allowed a small bite of and the flavor was absolutely incredible. Dad had the calf's liver with bacon and onion which he thoroughly enjoyed as well. We had a few bottles of the Simi Pinot Noir wine (stellar!) And to finish off the evening, the chocolate cake. This is the second time I've been here and cannot WAIT to go back! The steaks are perfectly seasoned and just melt in your mouth! Book without hesitation!",Dino & Harrys Steakhouse,3.5 star rating,$$$,"Steakhouses,, Wine, Bars"
185,Xz7JMDolLFp6ulk8UBQtmA,KB C.,2.0 star rating,Cannot believe that this joint has gone down hill so fast.  We've been here a number of times and the the steaks were generally pretty good.  Last night all the food was way below average.  Bone in filet was just bad- the salad was tasteless the fish was dry...the good things were the piano player and the $150 bottle of wine I purchased.  Our very expensive meal as a means of celebration had us leaving very fast without eating even half of our entrees...it used to be so much better.  Note to management:  the quality of food that you're buying is saving you money but you're losing customers as a result.,Dino & Harrys Steakhouse,3.5 star rating,$$$,"Steakhouses,, Wine, Bars"
186,-a0NRulXze0Smd90UtYLlg,Susan A.,4.0 star rating,"It really is a beautiful setting if you like the dark wood, stain glass, steakhouse look.  There is a big bar as you walk in that is welcoming and well run.  We had octopus for an app., shared a chopped salad and on to one sirloin, one rib-eye, and one salmon.  All very good.  Service was good, not great.  Wine list is very appropriate with good  prices.  I like having a solid steakhouse in town without crossing the river.  Is it the best you will ever go to?  Probably not, but no complaints.  As all good steakhouses go it is not cheap.  There is also, as always, a strong testosterone feel to steakhouses.",Dino & Harrys Steakhouse,3.5 star rating,$$$,"Steakhouses,, Wine, Bars"
187,Tp03PbjV9mLV_uMo88CL0A,Jeremy W.,5.0 star rating,"Still outstanding food in an old-school environment.  Piano/bass two piece band greets you when you walk in.  I thought the service, aside from someone in our party speaking to someone who was rude on the phone, was otherwise excellent.The steak is far and away the best in Hoboken.  Our table shared a bunch of appetizers - empanadas, calamari, bacon - all excellent (although I like the longer strips of the double cut bacon as opposed to the shorter, quadruple cut they served), and everyone passed around 2x porterhouse ($88ea)  for 2 and a ribeye ($43 maybe?), everyone's two favorite cuts, and either was as good as any steak I've had.  Wine list featured a wide price range, starting at $30.",Dino & Harrys Steakhouse,3.5 star rating,$$$,"Steakhouses,, Wine, Bars"
188,EC289udyAsfX5qHtpNc2kw,JJ R.,4.0 star rating,"The food is absolutely amazing, and the service from our waitstaff has been consistently great.  I do take a star off, b/c to agree with another reviewer - the hostess is just terrible.  We were greeted with a scowl, and giving our name (and spelling it), she said ""For 4?""  We responded ""No, just 2"" and were met with a hostile ""Well, SOMEONE called.'  We assured her nobody in our party had, and she said that the (name somewhat similar to ours, but clearly different) party had made a short notice res.  We are generally very easygoing people, but had to correct her in an equally curt fashion.   Response: ""Oh, yeah, here you are... OK""They were NOT busy, so there was absolutely no reason for the rushed/terrible greeting.  Again, a fantastic place otherwise.  You can't beat the historic setting and great food. - if you can get through the front door without your heart rate being raised.",Dino & Harrys Steakhouse,3.5 star rating,$$$,"Steakhouses,, Wine, Bars"
189,9uzcsNA0CGK_339z56__HQ,Vic L.,3.0 star rating,"Very good steaks, but just very expensive.  Service is just ok for the prices but not bad by any means.  I did see that the staff when closing down was in gym shorts/jeans etc which I found pretty unprofessional.Also not really a big deal but they don't validate parking anymore even though it says they do here on yelp, so may want to change that.",Dino & Harrys Steakhouse,3.5 star rating,$$$,"Steakhouses,, Wine, Bars"
190,bA-33YGuBjAJwFOTF-u9sw,Mike L.,3.0 star rating,"Went here for a surprise 40th birthday party.  The place itself is really nice, the decor is old school with lots of dark, rich woods (rich Mahogany anyone?)  I had the Porterhouse steak, which was OK.  The filet side was like butter, so tender.  The sirloin side was a little more tough, even though I asked for it medium, it was more medium/well.  Overall, I am not a huge steak guy though I was not disappointed going here.",Dino & Harrys Steakhouse,3.5 star rating,$$$,"Steakhouses,, Wine, Bars"
191,JJOOhb6X1_KR3-jQ8514Hw,J K.,2.0 star rating,"The space is so beautiful with details that make the room really sparkle... too bad the food was mediocre (both entrees and dessert), and the service, less than genteel... felt as though we were at a diner. How disappointing.... may be have a drink at the bar and order the bacon appetizer (yum) then go for dinner elsewhere.",Dino & Harrys Steakhouse,3.5 star rating,$$$,"Steakhouses,, Wine, Bars"
192,bJGOmgmBmCXIaQ9_9boWLw,Amy G.,4.0 star rating,"A year later I went back for a second run, I was actually pleasantly surprised this time.  Steak was prepared perfectly and seasoned just enough.  Sides were scrum and they even split the wedge for us after we said we were sharing it, which was also delish.  Bottom line is they will go in to the rotation, no every week but a couple times a year for sure.",Dino & Harrys Steakhouse,3.5 star rating,$$$,"Steakhouses,, Wine, Bars"
193,mrnoWAmfJ0fkztnmq1dnrQ,Kathy F.,1.0 star rating,"Worst Steakhouse Ever. If you want a good steak don't come here. We ordered the porterhouse which came out raw. Our waitress was miserable and couldn't be found. I finally had to get up and grab a bus boy and asked him to please have the chef cook the steak a little bit more. Still no waitress. When he brought the steak back it was charred on the outside and still undercooked. (we asked for it medium) We finished our bottle of wine...still no waitress. Very poor service, menu seemed outdated. Asked for our check, yeah!!! finally saw the waitress, who BTW could care less that we were unhappy. Plopped the check down and walked away. Such a shame! We drove a good distance to try this place.",Dino & Harrys Steakhouse,3.5 star rating,$$$,"Steakhouses,, Wine, Bars"
194,3MsvlOQJp7pWxOkBzjUe7A,Thea Z.,4.0 star rating,"Very big and bold flavors however some times it was overdone (salad was very intense with too much dressing). Steak was excellent but maybe not New Jersey's best. The wine list lacked wines by the glass but if you asked for that, they have it, but not on a menu. If you like bacon, the app is incredibly flavorful but full of fat.",Dino & Harrys Steakhouse,3.5 star rating,$$$,"Steakhouses,, Wine, Bars"
195,utx6wpBCN0P4C6z8r8llNA,Jordan S.,4.0 star rating,"If I was poppin' dollaz I would be at Dino & Harry's every week.  Sadly, I live the meager lifestyle of a recession-era college graduate, so I will be saving my pennies for my next trip.I've had a few steakhouse experiences in my life (all on other peoples' dimes, of course), and have to say this is the best steakhouse I've been to.My BF and I went for a quiet Sunday night dinner and were happy we did.  I loved the quiet and intimate setting of the side room off of the main dining room/bar area.  The waitstaff was very helpful and knowledgeable in both the food and wine menu.My BF had the porterhouse, and I had the pork chops.  Both were fantastic and very large (we both ended up having enough leftovers to gorge ourselves for lunch the next day).  I could have asked for better quality and quantity of the asparagus side dish we ordered, but the potatoes au gratin were out of sight.But I have to say the highlight of the meal was dessert: New-York style cheesecake.  I've made and consumed a lot of cheesecake in my day, and have to say it's the best cheesecake I've ever had!  It was incredibly creamy and not overly-sweet like most, with a delicate strawberry sauce on top.  Even if I can't afford to do the entire meal experience again sometime soon, I will go back for a cocktail or espresso (also incredible) and a piece of that cheesecake.",Dino & Harrys Steakhouse,3.5 star rating,$$$,"Steakhouses,, Wine, Bars"
196,XiW6DF4ez5Ma-Y0NTu8XhA,Charles B.,4.0 star rating,"Went here for a large group birthday dinner.  This is a bare knuckles, old school steak house.  It looks and feels like Peter Luger but making reservations for large parties is a lot easier.  This spot gets crowded quickly even though it's away from the crowds of downtown Hoboken.  There's a good variety of items on the menu and it's hard to think of this place as a steak house through and through given the fact that there's almost as many non-red meat choices as there are steaks on the menu.  Like most steakhouses you won't be disappointed by the seafood.  Hard to believe that butchers and connoisseurs of the cow can be so good with the meat from the sea but this is one more example of a steakhouse that serves up great oysters, clams, prawns and other seafood items.  The service is attentive and friendly and every once in a while you feel like you're in the old world confines of a Morton's, The Steakhouse of old - private, intimate, reliable with prices (not completely reasonable) to remind you of Luger or Morton's today.  However, it's definitely worth going back.  Cheers!",Dino & Harrys Steakhouse,3.5 star rating,$$$,"Steakhouses,, Wine, Bars"
197,P_m_I4JLzRmx-0quCkvvEg,Marley L.,4.0 star rating,A MUST for Hudson restaurant week! Also a really nice place for a special dinner out. The bacon appetizer is dreamy.,Dino & Harrys Steakhouse,3.5 star rating,$$$,"Steakhouses,, Wine, Bars"
198,shbH45t0BLRGzU35ww0bWg,Dennis D.,5.0 star rating,"Incredible food, but obviously expensive, so more of a ""special occasion"" place",Dino & Harrys Steakhouse,3.5 star rating,$$$,"Steakhouses,, Wine, Bars"
199,C6zRTBI5gCTDi_dRExZH7A,Jean G.,2.0 star rating,Steaks were definitely not worth the price.  Waiter was very rushed and service was poor.  Won't go back unless I hear that they have better service and steaks that justify the very high prices.,Dino & Harrys Steakhouse,3.5 star rating,$$$,"Steakhouses,, Wine, Bars"
200,OEwG9G5NVdwTbMWwOAa7Sg,Alex C.,4.0 star rating,"Came here during Hudson Restaurant Week with my girlfriend.  Prix Fixe menu included the steak as an entree, so after all the great things I heard about it I got it.  Pretty small filet, but you have to expect that at most steakhouses or anywhere to be honest.  I started with the applewood smoked bacon with coleslaw which was delicious.. ambience was great, drinks were pretty expensive but we saved a bunch with the prix fixe so it wasn't a big deal.  Desert was amazing, if there definitely get the snoboken (mix of chocolate cake, vanilla ice cream and coconut in a wine/cocktail glass, delicious!)would recommend the steak to any steak fan and my girlfriend got the ravioli which was also delicious.",Dino & Harrys Steakhouse,3.5 star rating,$$$,"Steakhouses,, Wine, Bars"
201,vDBuR62f8Yz8p2CPWEKR8Q,Ryan B.,5.0 star rating,Best steakhouse in Hoboken. Applewood smoked bacon appetizer was amazing! Lovely wines. Can't fault the fantastic service. Absolutely delicious melty steak. Wife is still drooling over the cheesecake. AND they have a piano player!!,Dino & Harrys Steakhouse,3.5 star rating,$$$,"Steakhouses,, Wine, Bars"
202,qLwOshCCUxnN0LGSMdZulg,Jarod R.,4.0 star rating,"I made a reservation online but when I arrived they said that even though I had a reservation I had to wait 45 minutes for a table for two.  Despite that, they were nice enough to give us a call when our table was ready (we went to another bar to kill some time).  As with other reviews, don't go here and expect great service, just go here for the food.  The hostess wasn't very friendly and I think I only saw our server when she took our order and when she dropped off the check.  We both ordered steaks which were cooked perfectly (medium rare) and tasted awesome.  We also ordered sides of spinach and mashed potatoes which also were amazing.The old school decor makes for a very nice ambience also.  Five stars if the service was better, but definitely going back.",Dino & Harrys Steakhouse,3.5 star rating,$$$,"Steakhouses,, Wine, Bars"
203,wsrt5v3pUTOpfu61urBriA,Luca R.,5.0 star rating,"My husband and I LOVE going to this steakhouse. Nothing like walking to the movies and eat at Dino & Harry's :) All steaks and pastas are yummy. Great service. Love the ambiance, different from all the college bars in downtown.",Dino & Harrys Steakhouse,3.5 star rating,$$$,"Steakhouses,, Wine, Bars"
204,7PuqbEI6GsS4nIeU9t8dpw,Bennett S.,4.0 star rating,Never had a bad meal here.  I stick with the ribeye and porterhouse for two.  The applewood bacon app is great and the Brussels sprouts and pancetta is a great side,Dino & Harrys Steakhouse,3.5 star rating,$$$,"Steakhouses,, Wine, Bars"
205,b5Jtg0CX6pbHM754_nEgOg,Marissa R.,4.0 star rating,"Food *****Petite Fillet, Sirloin, Lamb Chops were all up to par and flavorfulNote- ""medium rare"" is closer to medium, but lets not play that gameDecor ****Pretty cozy away from the bar...bathrooms were nothing to write aboutServiceNo I did not forget the stars, it was totally lacking. Our waiter had no personality but managed to give us some attitude. The owner also wasn't super friendly.Overall ****Reviews are about food and ambiance therefore I would return. Definitely a great steak spot in Hoboken, and an enjoyable night.",Dino & Harrys Steakhouse,3.5 star rating,$$$,"Steakhouses,, Wine, Bars"
206,DXcy8CHaG9PxywoVW9fGxw,Jason M.,1.0 star rating,Everything about this place was terrible.Tables on top of one another with no ambience whatsoever. Old decor and a dirty bathroom. Now onto the food.... I ordered the rib Eye and half of it was complete fat. My girlfriend ordered the sirloin and asked for medium and it was overcooked.,Dino & Harrys Steakhouse,3.5 star rating,$$$,"Steakhouses,, Wine, Bars"
