,user_id,user_name,user_rating,user_text,restaurant_name,restaurant_rating,restaurant_price,restaurant_type
119,s2binw8lqJ7Uq17h---CVQ,Nicole R.,5.0 star rating,"This my and my husband's ""celebration"" spot! If you're going to splurge on a night out, Dino and Harry's is hands-down the place in Hoboken to do it. The service is so attentive at all levels, and our waiter was knowledgeable about the wine list and was able to guide our selection. We had the tuna tartare and Ceasar salad to start. Both were delicious and the perfect amount of food to start. I had the petite filet and my husband had the sirloin--both steaks were cooked exactly as we ordered and were out of this world! I couldn't recommend a better place for a celebration or a reason to get dressed up. We love Dino and Harry's, it's a Hoboken gem, and we will be coming back time and again!",Dino & Harrys Steakhouse,3.5 star rating,$$$,"Steakhouses,, Wine, Bars"
120,BdFuwLNPk42mtjNkhvnFeQ,Joe E.,1.0 star rating,Just got in with reservations and I was informed that I have to wait 10 minutes. Not impressed so far. What's the point of reservations if I have to wait for a seat.,Dino & Harrys Steakhouse,3.5 star rating,$$$,"Steakhouses,, Wine, Bars"
121,_f5r4pgK8A2AcJH0TUHd6Q,Matt N.,1.0 star rating,"In the mood for steak and not wanting to travel back into the city, or Weehawken for that matter, my fiance and myself, along with a friend decided to give it another shot here.  I wish I hadn't wasted $360.  This is the second time I've been here.  In these two times, we've ordered a total of 4 steaks.  Out of 4 steaks ordered at a steakhouse, ZERO of them have been cooked properly to temperature.  In the previous review, they may as well have served a cow on the table this thing was so rare.  This time, my fiance got a ribeye rare.  I had a T-bone, and our friend had the sirloin.  Fiance's came out Medium well (ordered rare).  Mine came out well (ordered medium). Our friends came out well (ordered medium).  It's beyond shocking to me that a STEAKHOUSE can't cook a steak properly.  My fiance knew the steak was overcooked before she cut into it just by pushing on the meat.  If she can figure this out, how is someone employeed to cook these cuts of beef not able to do it properly?Everything else was immemorable so I won't bother boring anyone else on the details since I don't remember.  Never again.",Dino & Harrys Steakhouse,3.5 star rating,$$$,"Steakhouses,, Wine, Bars"
122,4b09OA4FxVITdue82Rt2sw,Tamer C.,1.0 star rating,"I've been going to D&H's for several years and never had a problem. Always enjoyed the food and service.Unfortunately, this past Saturday night my opinion of this place changed forever. A few points to preface. First of all, my wife, son and I have probably eaten here half a dozen times in 2013 alone. We always come between 5:30pm and 6pm and never have an issue getting a seat. Also, they do not take reservations, so it is first come first serve. On Saturday, we brought our nephews so we had five people in total. When we arrive, at 5:55pm to a restaurant that is 75% EMPTY, the hostess says it is going to be a problem seating us because a party of over four people needs a reservation. I hate when restaurants go in between like this. Either require a reservation or don't. There is no point in doing both.She checks with the manager and they say the next time they can seat us is 7:30pm. This is impossible since my son is 2 and would be a wild man halfway through dinner at that time. This brings up another interesting point. They are counting my son as a fifth when a two-year-old really shouldn't count in the equation.Since they were unwilling to help us out, even though we had three children, all under the age of 10, we left. The manager sensed we were quite angry and chased after us saying ""what do you want me to do it's the holidays, I have a lot of parties coming"".Maybe take care of your best customers, especially when they are trying to show their nephews a nice dinner in Hoboken.I will never go here again. I hope they don't treat future families like this or they'll be out of business quickly in a town that has a lot of other dining options.",Dino & Harrys Steakhouse,3.5 star rating,$$$,"Steakhouses,, Wine, Bars"
123,oMVnqtBt63iYlZAxPoHbIA,Donna F.,4.0 star rating,"Went here last Saturday (11/23) with my boyfriend with no reservations and we were seated quickly, which was surprising as it was past 7. We sat at a cozy table for two in the back and ordered a glass of wine each (I ordered the 1919 Malbec and he ordered Merlot), both of which were excellent. For appetizers, I had the crab cake with remoulade sauce and he had French onion soup. The crab cake was huge and could almost have been a meal, and was stuffed with giant pieces of succulent crab meat. For our main entrees, I ordered pan-roasted salmon with potatoes in a boullionaise sauce and my boyfriend ordered porterhouse steak (medium rare). The salmon was cooked perfectly, but was so large I couldn't finish it. Likewise, my boyfriend couldn't even get through half his steak. The service was pretty good, if a little slow, but a word of caution: do NOT eat any of the flatbread sticks in the bread basket. They are highly addictive.",Dino & Harrys Steakhouse,3.5 star rating,$$$,"Steakhouses,, Wine, Bars"
124,U3paoITfdtq6v99YPtBTEQ,Summer R.,2.0 star rating,"First of all, we were recommended by a friend to come here so we were expecting a great experience. However, it ended up being the complete opposite. The food was definitely good but the service absolutely sucked. The hostess had such an attitude and seated us at a very isolated area of the restaurant when i clearly told the hostess it was my dad's birthday; I even put it in the description box when I made the reservation. In the end, the hostess did not care to communicate the information to our waitress and had such an attitude throughout the whole process of switching our tables. The bottom line is: the food was good but the service, especially the hostess, was absolutely awful!!",Dino & Harrys Steakhouse,3.5 star rating,$$$,"Steakhouses,, Wine, Bars"
125,6es_04FrajEYVhuFv4Xpgw,Kristina P.,5.0 star rating,"Went to Dino & Harry's last night with a group of four for a friend's birthday. The reservations were made online and the date somehow got switched, so we showed up unknowingly reservation-less. They were very accommodating and were still able to seat us within 20 minutes. We ordered crab cakes as an appetizer and everyone loved their meal. They brought out pumpkin cupcakes with a cream cheese frosting and candles as the pianist played the birthday song for my friend- also delicious. After dessert we ordered a bottle of champagne, sat around and chatted for a while and never felt any pressure to get out or pay the bill. The waiter Louie was awesome, everything was great. Definitely will be back!",Dino & Harrys Steakhouse,3.5 star rating,$$$,"Steakhouses,, Wine, Bars"
126,1ar9gSI6gW8kuJilFIeiIA,Bill C.,5.0 star rating,"Terrific steak and a great atmosphere. My partner and I got the porterhouse for two. WOW! Huge and delicious. Fantastic wine selection, and we really enjoyed the classic vibe of the place. This is a ""you get what you pay for"" steakhouse. Worth it!",Dino & Harrys Steakhouse,3.5 star rating,$$$,"Steakhouses,, Wine, Bars"
127,HIm8-TcKyjCH_YI_vKjMDQ,Jami A.,5.0 star rating,"So, Im actually annoyed with myself for not having eaten here sooner. Rookie mistake for a long time resident. I just recently came for dinner with girlfriends before the holidays and was totally thrilled with my experience and meal. I got there early so I had martini by the bar and I have to say it was absolute perfection. How hard is it to screw up a martini I know right? well trust me I've had enough crappy ones to appreciate the great. Once our party arrived we were seated promptly in the back. The atmosphere was nice old time but quaint. Loved that they have a piano player. Feels like you're taking a step back in time while you enjoy your meal.  Our server was knowledgeable and attentive. She kept the wine flowing which was much appreciated. As for the most important part.. the food. Incredible. For apps we had some oysters, shrimp tuna tartar and these short rib balls that were awesome. For entrees myself and a girlfriend ordered each the petite filet and split mashed potatoes and grilled asparagus. Our steaks were cooked medium to perfection. Another friend got the scallops which she loved and the last ordered 1/2 order pasta dish. We left stuffed, tipsy and happy! This isnt your every day restaurant- well my every day restaurant- but for a special occasion or on someone else's dime this is the place to go.",Dino & Harrys Steakhouse,3.5 star rating,$$$,"Steakhouses,, Wine, Bars"
128,i1OUN7JbHUEvtTGlQVm1Qw,Brittany H.,5.0 star rating,Best filet mignon I've ever had in my life. Worth every penny... Can't wait to come back!,Dino & Harrys Steakhouse,3.5 star rating,$$$,"Steakhouses,, Wine, Bars"
129,2z-gPfioN-iMKyBz85E9kQ,Nicole S.,4.0 star rating,The one and only steak house in Hoboken. Love the old school steak house feel. They have a coat check right up front. There is a long bar and several different seating areas that are cozy and romantic. We were there for Hudson Restaurant Week. The staff was friendly and quick with water refills and checkins. Nice bread selection prior to the meal. Meal was very yummy- we started with the bacon and then had the steak and for dessert had the snoboken. All was very yummy and big portions. Would love to come back for another fun and romantic night.,Dino & Harrys Steakhouse,3.5 star rating,$$$,"Steakhouses,, Wine, Bars"
130,C3fh9OFw6qQOiKGD1egpiQ,Jenny S.,3.0 star rating,"Just left the restaurant.... Can't complain about the food but very disappointed in the service at bar.  The female bartender was rude and this was possibly the worst service I have had a restaurant.  We were not offered water, bread, wine list etc.  She didn't seem to care that we were there except when she wanted us to leave and pay out check.  During the entire two hours we were there the bartender did not ask how we were doing or how our food was.  I'm just surprised that her behavior is acceptable, this was NOT how I wanted to spend my Friday night.",Dino & Harrys Steakhouse,3.5 star rating,$$$,"Steakhouses,, Wine, Bars"
131,GI9Qt2FisPEgBUqFhxwb6Q,Tanya G.,5.0 star rating,"Between atmosphere, hospitality, service and food, this restaurant is the holy grail of fine dining in Hoboken. Upon walking in, the stately decor is intriguingly offset by the diverse combination of both old and young diners. My boyfriend and I were sat in a cozy nook by the windows, off of the main dining room. The loudness of the dining room was pleasantly muffled and made for a romantic experience.Our server was a lovely, grandma-esque lady who was attentive but not overbearing. We began our meal with the Salmon Tartare, which was incredible. A perfect combination of the fresh fish flavorfully combined with ingredients that stood alone yet melded together in harmony.Our main course was the 48oz Porterhouse for 2 - Medium Rare, Augratin Potatoes and Brussel Sprouts with Pancetta. The steak was very well seasoned (perhaps, for some, overseasoned) with a nice dark crust, and the Filet portion was perfection. Unfortunately, we discovered that the New York Strip side was gristly and inedible for the price tag. Our waitress realized something was wrong, so we told her our disappointment with the steak. Without hesitation, she offered us an entirely new Porterhouse, despite the fact we had demolished the Filet side. Seeing so much meat as overkill, we suggested that she simply bring out a new NY Strip, which she quickly fulfilled.We left Dino & Harry's with full bellies, an entire meal of leftovers, a bill charging us only for a NY Strip versus our 48oz Porterhouse, and a renewed faith in humanity.",Dino & Harrys Steakhouse,3.5 star rating,$$$,"Steakhouses,, Wine, Bars"
132,IlbKxrvsSifMeZGx6B3RTg,Diane C.,2.0 star rating,"Two experiences here, both decidedly two stars.  (I'm not happy about this either.)  First time my husband and I came it was our first week in Hoboken and we decided Dino & Harry's would be a great celebratory dinner to celebrate our move from NYC.  We used to live down the block from Knickerbocker Bar & Grill in Greenwich Village and were hoping that Dino & Harry's would be our new neighborhood steakhouse and we could eat there once a week like we did at Knickerbockers... unfortunately, we left the experience knowing that would not be happening!  We didn't make reservations so we were seated at the bar... which didn't phase us at all because we LOVE sitting at the bar.  However, this particular bartender didn't acknowledge us upon sitting down, we had to ask for menus and he didn't seem to care that a drunk guy was crowding me and spilled his white wine on me (obviously a regular as the bartender knew him by first name).  As our dinner progressed and my husband and I were trying to enjoy ourselves, the bartender continued to ignore us and talk over us to the drunk group next to us and specifically the drunk guy who took up standing behind me.  I was pretty disgusted as I thought this would be an upscale steakhouse.  I had the sea bass and it was decent.. but I was bitter that my $34 entree order yielded such a ridiculously poor service experience!  We left highly disappointed and feeling pretty much disrespected.Three months later we decided to give it another shot since, well, there aren't many steak options in Hoboken.  This time we made a reservation and were treated kindly by the waitstaff.  They were highly professional and did their best to serve us.  However, I feel the kitchen failed us this second time.  My husband ordered a T bone steak, which he enjoyed and was cooked exactly as he wanted (medium rare).  I was not so lucky.  I ordered a special of the day, which was a skirt or flank steak that came with string beans.  I also specified I would like it medium rare.  When it came to me, the steak was completely cooked through and there was so much juice on my plate that my steak and string beans was swimming in liquid.  The dish was just totally unappetizing.  My husband's steak was perfect though.  I guess my lesson learned is order the steak... straight up!  I would give it another shot but so far not impressed.",Dino & Harrys Steakhouse,3.5 star rating,$$$,"Steakhouses,, Wine, Bars"
133,cQxiAHKd7RD4U90d7VPsSA,Stephanie Y.,4.0 star rating,"This place is expensive but delicious!  I enjoyed thoroughly.  The porterhouse for 2 was so delicious. The $9 brussell sprouts were amazing though lacking in quantity.  The desert was great.  Again expensive but a really great steak and quality of food. I even forgot the best part - the special appetizer - the Crab Cakes - AMAZING!A decent ambiance, a live piano player - they have free parking - I would go back for a special occasion.",Dino & Harrys Steakhouse,3.5 star rating,$$$,"Steakhouses,, Wine, Bars"
134,j2SH7FPzPKBCt17YUaDkng,Emmy L.,4.0 star rating,"Great food great service. A bit loud couldn't hear the piano player, table was super small and  too close to the other tables.  I would visit again maybe not on a Friday.",Dino & Harrys Steakhouse,3.5 star rating,$$$,"Steakhouses,, Wine, Bars"
135,hWL-YSB7uxobqiyzGoX2jw,russ k.,1.0 star rating,"We came here 15 minutes to 5pm, its 5 degrees out and they chased us out bc they open at 5 pm. Way to go out of your way for your customers guys.",Dino & Harrys Steakhouse,3.5 star rating,$$$,"Steakhouses,, Wine, Bars"
136,FpKteYrTbB-9KlK6pJCt-w,Adrienne A.,4.0 star rating,"Delicious meal and good service. I always forget how much i like it here, and when I come back I'm always pleasantly surprised.",Dino & Harrys Steakhouse,3.5 star rating,$$$,"Steakhouses,, Wine, Bars"
137,797EmseWrV2WhelZpqycaA,Heather G.,4.0 star rating,"Great food, good service. I ordered the roasted chicken which was delicious but my boyfriend got the steak... His dish was even better. I was pushed up against a wall in a tony, dark room (poor ambiance) but besides that no complaints!",Dino & Harrys Steakhouse,3.5 star rating,$$$,"Steakhouses,, Wine, Bars"
138,OjoVF5i6OzgC4fUET7S0YQ,Jessica D.,5.0 star rating,"I have been going to this spot for many years and it is fabulous! The service is good, the food is amazing! I love the ambience and the owner, Dino! I recommend the cream of spinach and filet mignon!!",Dino & Harrys Steakhouse,3.5 star rating,$$$,"Steakhouses,, Wine, Bars"
139,9G-YfgoM4FrSGYbco87YGw,Leigh E.,5.0 star rating,I would recommend this place to ANYONE! Both the food and the service are fantastic. It's such a nice place for both locals and visitors!,Dino & Harrys Steakhouse,3.5 star rating,$$$,"Steakhouses,, Wine, Bars"
140,YcInfOjRPmli1b5FXZB_7Q,Ashley C.,3.0 star rating,"I loved the food at Dino and Harry's so my rating is based on the whole experience. I had the tomato/basil soup for an appetizer, which I must say may be the best I have ever had. It was thick and bisque-like so I really enjoyed it. For dinner I had the filet mignon and my boyfriend had the porterhouse. Although both were medium rare, I thought his steak was way more flavorful. Either way I enjoyed both ! For sides we had the lobster mac and cheese which was to die for and the mashed potatoes, also very good. They had a great wine selection and the drinks were nicely made. So why not 5 stars you ask? Well for starters the hostess sat us almost 40 minutes after our reservation. She was on her cell phone when we arrived and after about a minute looked up so I could tell her my name. For the 40 minutes we were at the bar (which was not bad since we had some coctails) she proceeded to tell us that she didnt know where the bus boy was and that our table would be cleaned any minute. This was not very professional at all. Once seated our server was a little slow getting everything to us and only checked on us about once. The ambiance was very loud as well. Not what I expected for an upscale steakhouse. All in all, if you don't mind mediocre service and disruptive noise while eating this will probably be your favorite steak joint.",Dino & Harrys Steakhouse,3.5 star rating,$$$,"Steakhouses,, Wine, Bars"
141,W_IMELIgKjYpCW-V1mV7tA,John F.,4.0 star rating,"I had a great steak and a great time at Dino and Harry's.  But for one mistake, this would have been a five star experience.The Mistake:  I ordered my porterhouse medium rare, I got it medium well.  This is obviously a huge mistake.  However, this can't be the chef's fault.  Steak chefs know how to cook a steak medium rare.  Odds are, the server plated and served me the wrong steak. I showed the server my overcooked steak, she apologized and returned the steak to the kitchen.The Fix:   I had a perfectly cooked, delicious medium rare steak on my plate within 10 minutes.  Steak was tender with that hearty, buttery flavor I love.  Before I had my steak, I enjoyed the applewood smoked bacon appetizer, which was delicious.  Although this spot is expensive, you certainly get what you pay for.  Considering the amount of food/drink we ordered, our tab really wasn't that bad. Come here for a special occasion or guy's night out.  Say hello to Dino if you see him around.  I met him and he's awesome (you'll know him when you see him).  I'm looking forward to coming back.",Dino & Harrys Steakhouse,3.5 star rating,$$$,"Steakhouses,, Wine, Bars"
142,Q4qSHn7oAO6ZLePvFm3fpA,Chris C.,5.0 star rating,"What a place! Simply a great local joint for those in / close to Hoboken.Old school steakhouse atmosphere, friendly staff, and delicious food!I usually start with the bacon and possibly a wedge salad or shrimp cocktail and then cap the night off with a beautiful Porterhouse or Filet, depending on my appetite.Wash it all down with a glass of wine or your choice of cocktail and you have yourself one of those great Hoboken nights.",Dino & Harrys Steakhouse,3.5 star rating,$$$,"Steakhouses,, Wine, Bars"
143,2GxYN1egM3BhHe_pHw51Dg,michael w.,4.0 star rating,"Went here on recommendation from friend. This is a very nice steakhouse, by any standard, and won't hesitate to return. The selections are plentiful, and both mine and my partner's steaks were done perfectly (I like med rare, she likes med). The side were delicious...sauteed green beans and mashed potatoes.The wine list is nice, not overwhelming, but broad.The only thing  that prevents a 5 star rating is the desert menu, which left me without desert. perhaps if the creme brulee wasn't *espresso*, I'd have tried it...The staff is attentive without being overbearing, the wait was not bad.Watch out for the parking...all the streets are residential permit only, so we ended up in the garage around the corner...but that's was all of $8.00. not an issue, IMO.bottom line...go for diner and socializing. you wont be disappointed.",Dino & Harrys Steakhouse,3.5 star rating,$$$,"Steakhouses,, Wine, Bars"
144,ci-pPvH-QySQVZ8MZgTsoA,Liang Z.,4.0 star rating,"One of the better steakhouse around. Come for the steak or don't come at all, actually come for the atmosphere or special occasions",Dino & Harrys Steakhouse,3.5 star rating,$$$,"Steakhouses,, Wine, Bars"
145,Y1dsEus_wRxgl6qmQUtpTw,Dave J.,5.0 star rating,"Here's the Deal: I've been to this restaurant many times...I've never had a bad meal...love the environment, the owner is always around to ensure you're having a great experience.   You can catch some celebrities or athletes coming in from time to time!   They provide a great variety of wines and an experienced staff always makes this place special!   And oh...their Porterhouse for two is amazing...",Dino & Harrys Steakhouse,3.5 star rating,$$$,"Steakhouses,, Wine, Bars"
146,d0BQLkOqoGtwX5TmgJcjfg,Vinod S.,4.0 star rating,"I was here for an all-guys birthday dinner. Great place for that... steak and Scotch in an upscale atmosphere. We had the fried calamari and empanadas for apps, both delicious. I had one of the specials, the 18 oz. sirloin steak covered in blue cheese... and it was delicious. A few of the guys got the 24 oz. Porterhouse... man that steak is a beast... and they thoroughly enjoyed it. Another enjoyed his filet. All-in-all, a good time.",Dino & Harrys Steakhouse,3.5 star rating,$$$,"Steakhouses,, Wine, Bars"
147,vRkR9Q6iusLL1wuPVYPDlw,Richard H.,4.0 star rating,"The last time I made it to D&H's was on a holiday weekend, and it was an incredibly mild scene.  Though the food & service were great, it was a lackluster evening.  This time, was exactly the opposite!My fiance & I had dinner here last night, and loved every minute!  The bar scene was vibrant, with a piano going & people crowding around.  We sat at a table in the back.  I will say that it was crowded, and the table next to us may as well have joined us.  Would be nice if they took one or two tables out to make it a little more comfortable.Beyond that, I have NO complaints!  I had a martini, Hendricks, which they were glad to garnish with a cucumber (try it, trust me), and she had a Cabernet.  We started with some Blue Point oysters, and moved seamlessly into our entrees - she had the Rib Eye & I the T Bone, which we accompanied with the ridiculously good mashed potatoes & some sauteed spinach.Great cuts of steak cooked perfectly.  Nothing more to say about that.Another update from last visit: the service was great.  Prompt, friendly, accurate.  What more do you need?$$$$, but with two 24oz steaks, we have enough for lunch today!",Dino & Harrys Steakhouse,3.5 star rating,$$$,"Steakhouses,, Wine, Bars"
148,MEayx52RFXH0h_Zj5IVzjw,Bobby M.,4.0 star rating,"Wonderful Steakhouse. Our absolute go to when I visit from California for a small town, great service steakhouse. I am a man that loves to eat at the bar with my lady. We always enjoy the times here and our meal is simple: go in looking nice,  smiling,  order jameson and beers, sharing oysters, more drinks,  pork belly,  a wedge,  and a medium rare bone -in rib eye (sliced), shots with the bartenders if possible,  and a delicious Snowboken for dessert. Kisses all around and a fun walk home. Try it.  Cheers.",Dino & Harrys Steakhouse,3.5 star rating,$$$,"Steakhouses,, Wine, Bars"
149,MuWEtdhLKlZ-8P82wKcf9Q,Michael S.,5.0 star rating,"We hit Dino & Harry's last night, as soon as we got into town. Absolutely amazing. Everything was on point. I had the bone in ribeye, it was cooked perfectly. The sides were great and the wine, Flora Springs, Trilogy, 2010, was delicious. The staff was very accommodating, and our experience couldn't have been better.",Dino & Harrys Steakhouse,3.5 star rating,$$$,"Steakhouses,, Wine, Bars"
150,05iD1PMV7Ua2a1gtzcPBGQ,Farhan A.,4.0 star rating,"Excellent Local Steakhouse!  After 3 visits, I rank this as my fourth favorite steakhouse.  I recommend the Sirloin Steak (rare) as your main with either the trio of empanadas or the calamari to start.  Generally, I always go with the Rib Eye at most steakhouses, but after having both, the Sirloin Steak edges out the Rib Eye by a little bit.As far as dessert goes, The SnoBoken is great, but I drop the coconut flakes because I hate coconut.  Oh, non-steak foods you say?  Wife had the daily ravioli entree (wild mushroom) and it was excellent (for not being a rare piece of meat).  The side's are solid,  but nothing stands out as well as the Sirloin.",Dino & Harrys Steakhouse,3.5 star rating,$$$,"Steakhouses,, Wine, Bars"
