,user_id,user_name,user_rating,user_text,restaurant_name,restaurant_rating,restaurant_price,restaurant_type
196,6L8uYvhTdJHOAqXpqq2jDA,Victor A.,5.0 star rating,"Excellent find!  It's a few blocks west of Washington so the parking is more readily available.  Looks simple from the outside.  Very nice inside. Lots of light for daytime eating. Huge brick oven.  Smells great in here. Front area is spacious.  The kitchen seperates the front from the back.  The back has long tables designed for family style gatherings.  My buddy has his birthday there and had the back reserved.  They were serving bites with proscutto, cheese, and tomatoe.  All were great.  Then came the pizza.  Great pizza. Nothing like fresh out of the oven pizza. BYOB.  Oh yeah. And bocci ball court in the back. With large outdoor eating area.  Lovely place. Will be back",Dozzino,3.5 star rating,$$,Pizza
197,JYCzshVF66yFaVQvK3RSZw,J D.,3.0 star rating,"I really like this restaurant and I want to like it even more but 1. parking is a bitch...I guess that can't be helped. 2. They have some weird habits/hours. -  I went on a Thursday night a few months ago and my hubs and I decided to go again that Saturday we called once at about 1 and they said they are having a private party but people are invited to come after 5pm, then we went at 5:30pm and they turned us away....why you may?....they ""ran out of dough!?!?"" oh... that is totally normal for a pizza place to run out of dough. My husband nearly went crazy. 3. To me it is a bit expensive when compared to other brick oven pizza places in both Hoboken and Jersey city...don't be overpriced like Franny's check out their reviews...ouch!.",Dozzino,3.5 star rating,$$,Pizza
198,PUpZ5PqxBDcuhBL9PrI86w,MC D.,3.0 star rating,"Really good pizza - great variety to chose from, BYOB - all GOOD.  However, do NOT order the rice balls!  $12 for a tiny crusty ball of basically RICE - microscopic meat (?) and miniscule cheese.  Sent it back - are you kidding me?  Also, do NOT order a side of sauce (for dipping).  It comes ICE COLD because they do not have a stove (and the 'sauce' is just crushed tomatoes).  Seriously?  Get a STOVE or a microwave!  This is a restaurant and we do not care if it is not hippie to have only a wood fired pizza oven.  We WILL go back but ONLY for pizza.  But if it's cold outside, do NOT sit near the big glass doors.  We were freezing :(",Dozzino,3.5 star rating,$$,Pizza
199,YRAACOW_vYIPCDJjNsgSJQ,Bill S.,5.0 star rating,Amazing food! The atmosphere is right and the staff is very friendly.  Perfect for friends looking for a BYOB in Hoboken with a chill atmosphere.,Dozzino,3.5 star rating,$$,Pizza
200,7W3aMJoZKKnd7d6i7uK4bA,Gabrielle B.,1.0 star rating,"The first time I came here was on a Friday night with a party of 6 around 9pm. We waited for 30-40 minutes and when the host came over to us, he said he had good news and bad news. The good news was our table was ready, that bad news was that they only have enough dough left for 2 pizzas. This pizza place is a disgrace for running out of pizza on a Friday night at 9:30.I decided to give it one more try. I went on a Sunday night and sat in the back room. The service was very slow. We were told they didn't have any pizzas with meat on it (which is about half the menu) so that immediately threw off our order. We ended up ordering a poor excuse for bruschetta; basically it was chopped tomatoes on stale bread. Then we got the ""la pizza"" which was extremely burnt on the crust making it nearly inedible. I sent it back (which I never do) and we ordered the white pizza . This also came out overcooked and tasting like Domino's cheesy bread. This place is overrated and overpriced.",Dozzino,3.5 star rating,$$,Pizza
201,gxVoc9NmkpRr33iDIx6xag,Lily W.,4.0 star rating,"My boyfriend used to live right down the street from this place and we always thought it looked cozy. Finally we went one Tuesday night. I like the decor a lot. We got a big table by the window. There was a group in the back that was pretty loud but no big deal. We got there a little later (around 9) so we didn't have to wait for a table and it was emptying out.We got some meats, crostinis, and two pizzas. I thought they were very good! I got the white and my boyfriend got the soppressata. We liked it a lot and tried to go back but it gets crowded on Friday nights!",Dozzino,3.5 star rating,$$,Pizza
202,k3PDetvYquyBrNPY-ijuvQ,Nate S.,1.0 star rating,"I'd really like to like this place, but I can't.  I won't repeat the previous reviews discussing the waitstaff's shortcomings other than to say they should know all the items on the menu since there are only about 20.  Also, the specials should be special, one of the specials was basically the three-cheese pizza without the basil that comes on the menu item - sort of the opposite of special.The menu is really, really basic.  If you want boring crust, cheese, and a topping, this is your place.  We ordered 4 dishes, tomato basil pizza, spinach artichoke pizza, mortadello calzone, and a white pizza.  The tomato basil pizza had 15 cherry tomatoes, 4 small basil leaves, some cheese, and the crust.  The spinach artichoke was not very tasty.  The calzone consisted of ham and cheese in crust.  Overall, we were very disappointed.The place is obviously striving to be minimalist, and it succeeds at that.  The setting is pretty decent, but not fantastic.  I would suggest some sauce (gravy) and an introduction to the spice rack.  Even if there were spices, it was impossible to tell.  We'd really like this place to be better as it is a short walk away.",Dozzino,3.5 star rating,$$,Pizza
203,npl69o5yX_hg4z5oTUAuXA,Tony F.,5.0 star rating,"Wow great artisanal pizza right here in Hoboken.  Went in with no expectations and was pleasantly surprised at how good it was.  Menu is somewhat limited but seems like they change the specialities around to keep things interesting.  Agree with another reviewer - it's pizzas are on-par with ""Company"" in NYC.  Meats served were all from local butchers too - a real nice touch.  This place is at least as good as Grimaldi's.  Would highly recommend it!",Dozzino,3.5 star rating,$$,Pizza
204,GeWAE6u0ImKdMQ6B7a9xrg,Chris B.,5.0 star rating,"All artisanal pizzas.  very simple menu and decor, but it just fits in with the simplicity of the ingredients.  Diavola pie is my favorite, but they also have a new menu of their ""riserva"" pies as well as daily specials.  Oh, and they have Mexican Coke!",Dozzino,3.5 star rating,$$,Pizza
205,ab4ogjgbUWwbBYhD3FGyyg,K F C.,3.0 star rating,"I was beyond excited to try Dozzino...I used to live down the block and had never made it in, but recently my guy and I decided we had to check it off our list because it sounded so amazing (fresh ingredients! homemade dough & cheese...mmm)So we had heard that they sometimes run out of things at the end of the night, so we went earlier on a Friday night to be sure we could get what we wanted.Now, to be fair, we only ordered two pizzas, and I have a dairy allergy, so I couldn't try the cheese.With that being said, they were not able to offer me much in the way of pizza...Along with the dairy allergy I also cannot eat garlic (sometimes it's more than I can bear).  So, pizza is really difficult for me....BUT I have had amazing cheese-less or dairy-free cheese pizzas without garlic that have been magnificent!Here, the options for me were very limited.  They basically had no ingredients that were made-to-order, which I was super surprised by...I feel like a place that is all about ""freshness"" would have some fresh food on hand....Almost all the available toppings were pre-made or pre-mixed (in what?) and contained garlic.So I was basically just judging sauce, dough & meat.  I asked for prosciutto with fresh tomatoes on my pie.  The tomatoes were very fresh & delicious, like straight from a garden taste.  But the prosciutto was literally like 3 large slices just placed on top of my pizza.  Not really cooked, not cut up or sliced so you could actually eat it on the pizza, just plopped on like an afterthought.  So weird!And the dough!  It was good, but wow, waaaaay heavy and ""doughy"" for lack of a better word.  And I am a dough devour-er!  And I like it thick, but this was too much.  And very taste-less.  I honestly was largely disappointed with the flavor overall of everything (except the tomatoes!).I'm always disappointed when it seems like the only flavor adding ingredient restaurants use is garlic.  There are other spices, ya' know...(just sayin')Dan had gotten a pizza as well, and said it was good, but nothing to write home about.After our meal, we got the check....that was another disappointment.  I felt in general things were a little overpriced...and I don't usually mind paying a little extra for amazing food.  But on top of that, my pizza, (which was a regular pie on their menu for $12) WITHOUT cheese & with prosciutto was $18.  $6 for a few slices of prosciutto? Maybe...but at least take a couple bucks off for the cheese that I didn't eat. (Ok, I'm ranting a little, but I really wanted them to be better!)Overall, not the worst place in the world, but I can certainly think of several places I'd rather spend $18 on dinner.Boo, Dozzino, boo.",Dozzino,3.5 star rating,$$,Pizza
206,M65VFl3v3Cz6hEPKdexFCQ,Peter A.,2.0 star rating,Went last night with a group of four. The pizza looked good. Atmosphere is cool w communal tables. Outside was set up nicely. The pizza was fresh. My issue was the pizza lacked any real flavor. I really wanted to like it more. But placing kale and one tiny Italian  meat on the pie doesn't do it for me. Good crust.  The spinach and artichoke was also bland. Two stars for atmosphere. So many better pizza spots for pizza.,Dozzino,3.5 star rating,$$,Pizza
207,utx6wpBCN0P4C6z8r8llNA,Jordan S.,5.0 star rating,"Love this neighborhood place off the beaten path of the pizza smorgasbord that is Washington Street.  This place has authentic thin-crust goodness that reminds me of eating pizza in Italy.  The menu and the food are simple but that's okay because the quality ingredients don't need to be dressed up to taste fantastic.But there are three things that pushed this place from a 4-star to a 5-star in my book:  1) BYO, 2) Outdoor seating in a secluded, quiet backyard patio, 3) Locally-sourced ingredients.Looking forward to late-night summer dinners to come!",Dozzino,3.5 star rating,$$,Pizza
208,yzn3mTJJUiJyyeAB8CkEKQ,Sean R.,1.0 star rating,"Walked in they said 3 mins for a table, we waited 35.  Ordered a salad a crostini and a pizza.  We finished the crostini and salad and our pizza was taking a while so we ordered another crostini.  We got the crostini and finished it and the waiter asked us if we were done.  We told him we ordered a pizza, and after checking in it he told us they were out of dough.  So it looks like we are heading elsewhere two and a half hours later to try and find dinner at 10:45.  Come on man!",Dozzino,3.5 star rating,$$,Pizza
209,R_GCeJehReRxquJO6dY_QQ,David F.,5.0 star rating,"This is my favorite pizza in the area. As far as NYC/Hoboken/JC are concerned, it doesn't get any better.  Excellent menu with incredibly fresh ingredients. The service is always friendly and fast. The prices are very reasonable, plus it's BYO so that keeps the cost of drinks down to a reasonable level. The desserts are excellent as well.It can get crowded and sometimes they run out of pizza, but this is really only a testament to how incredible the food is. My advice, go on a weeknight, or show up early on the weekends.This place is not to be missed.",Dozzino,3.5 star rating,$$,Pizza
210,J0G8k8VlkYVWfC8TNy7Kgg,Rodrigo M.,1.0 star rating,"Bad pizza. They told us that is was a big pizza, but it's not. It's a personal pizza. I won't recommend it",Dozzino,3.5 star rating,$$,Pizza
211,Tr2nrnrbTT8kwAcUBGcnVQ,Joe C.,3.0 star rating,"Not my favorite pizza in town. Lack of toppings/cheese being my number one complaint. It's not terrible though, and I know people that enjoy it there, so it may be worth your time to give it a shot.",Dozzino,3.5 star rating,$$,Pizza
212,xYK-FWbn8TyUkDH6k2m3uQ,John G.,4.0 star rating,"I live down the street from this place and finally went for the first time a couple months ago.  I like it.  My gf loves it.  So therefore, I love it.  We have only been in the fall/winter, so we have yet to experience bocci in the back.  However, the place is very cool inside, pretty casual, and great for groups in the backroom.  The pizza is good (I recommend la roma - inhouse cheese and thin sliced salami), but we were disappointed with the crostinis.  Oh yeah, it's BYOB so it's pretty easy on the wallet.  Definitely recommend.",Dozzino,3.5 star rating,$$,Pizza
213,Vx06bT1iOC3fYxtHSRoZDg,Christina P.,1.0 star rating,"I live on 6th and Adams and was SOO excited to try Dozzino. I heard good things, so 2 of my friends and I decided we would try it out last Saturday night.We went in around 7:30 pm. (We didn't think this was very late...) As soon as we walked in, we stood at the door and the people behind the counter just looked at us and went on with what they were doing. Finally, we walked up to the counter and the girl just looked at us. We said, ""Can we be seated?"" She replied with:""We ran out of pizza dough."" We just looked at her and then she walked away. I am understanding of the fact that it just opened, but come on 7:30 PM, Saturday night, a pizza place runs out of pizza dough?! They certainly lost my business.",Dozzino,3.5 star rating,$$,Pizza
214,tfh4Z4yBGTz6qAH1P_pZSQ,Tom G.,5.0 star rating,"If you are serious about food, go to Dozzino. The food is delicious and the people who run this place are serious about food. If you consider yourself a ""foodie,"" a food critic, etc., do all of us Dozzino fans a favor and stay home. Dozzino is a restaurant that serves simple, fresh food and that is all. The salumi plates are just as you would get them in Italy; salumi only! No bread rubbed with garlic, no cheese, no drizzle of balsamic, just...salumi! If you want those other things, go to Tutta Pasta or some such place. If you want free food because you don't think the dish you ordered is as you thought it would be (but is exactly as described on the menu), then maybe Applebee's is more your kind of place.If you crave a serious, no frills but absolutely fresh and delicious meal, and you are not a prima donna, go to Dozzino.",Dozzino,3.5 star rating,$$,Pizza
215,9EYYLx31Sf3yyZq1fLO2fg,Al M.,1.0 star rating,"We had a much better meal here last year but the pizzas we had last weekend were much smaller, cold and sparse toppings.  Very poor value given the alternatives in Hoboken.",Dozzino,3.5 star rating,$$,Pizza
216,XgXn_HvA-OwLNRu7f4-IlQ,Christian M.,1.0 star rating,"I have dined in at Dozzino a few times before and they put out a quality pizza in a nice location.  What prompted me to write this review is the piss poor service I just experienced with a take out order I picked up.  I walked 4 blocks over, picked up my order, and left a generous 15% tip for take out (maybe because their iPad suggested it). When I got home I discovered I had a cold pizza which was also the wrong order. I had ordered a pizza with soppressata ($12) and what I got was a plain tomato, mozz, and basil pizza ($10).  Okay, annoying but no big deal. What happened next destroyed my faith in this place.  I called to report the mistake expecting at best a delivery of the correct pizza. Here is what transpired. It was 9:30 PM on a Thursday.me - ""Hi, I was just there to pick up a order and you gave me the wrong pizza"" dozzino - ""Oh man, sorry we just shut down our oven""dozzino - ""You can bring the pizza back over and we can put some meat on it""me - ""I really don't feel like walking 4 blocks each way again to get some meat ""dozzino - ""Okay, later bro...(hang up)""Summary:I paid for a pizza with soppresata for $12 + tax + 15% tipI received a $10 cold pizza with mozz cheese, tomato sauce and two leaves of basil.I was told to bring that cold pizza back and they would do me the favor of ""putting meat on it""I might even be okay if the mistaken pizza they gave me was good. It was horrible and looked like it had been sitting out all day.  I suspect anyone who orders after 9 PM on Thursday will just get the pizza that nobody picked up.  Dozzino please defend yourselves if you can.  I would love an explanation.",Dozzino,3.5 star rating,$$,Pizza
217,IEu8avCvKfranE7qUWh5yA,Stephanie S.,4.0 star rating,"I first went to Dozzinos last January and immediately loved it.The price is higher than I was expecting for pizza, but the pizza has all local, fresh ingredients and you can taste the difference.My favorite is the diavola, it has salami and a good kick of heat. If you're like me and like some spice but not for your whole mouth to be on fire, you can ask for the diavola  lite, which means less pepper flakes. The pizza has a thin saltier crust that melds well with the calming cheese and spice. Note: the pizza are individual sized. The atmosphere is a really relaxed SoHo type of vibe where you can be dressed up or down and feel right at home.",Dozzino,3.5 star rating,$$,Pizza
218,evgnjhItW_HII0ksEliYEg,Tricia S.,5.0 star rating,I would definitely go back here. The menu is strictly pizza and whatever special(s) they have that day. Perfect for a group of people because you can get a bunch of pies and share them. We had almost every pizza and they were all amazing. The crostinis are great to start with.,Dozzino,3.5 star rating,$$,Pizza
219,Z3_IaLBpUwlCCjyFWU2KPA,marullos s.,1.0 star rating,"Worst customer services I have experienced in my life. Many things went wrong that night, but the highlights were:1. They do no work around for people who have food allergies. So, someone in our party who has a lactose allergy couldn't eat any of their pizzas and aks for it to have no cheese, unless the pizza already said it had no cheese. They wouldn't even put some extra ingredients on the dry pizza she got, even though she would pay extra for it, because it wasn't part of the what was presented on the menu. For example, since she was basically getting bread, she asked if they could put tomatoes on it. They said no. The waiter said they weren't allowed... ?2. Several people ordered spinach and artichoke pizza. Two of the three got no artichokes on their pizzas. That is, pizzas arrive, they had spinach on top, but no artichoke at all. They called the waiter to see of they could put some artichokes on the supposed spinach and artichoke pizza. He said no. Not allowed. They called the owner/manager. He said that he couldn't do anything about the lack of artichokes because he makes the mix in the morning, and when the mix is placed atop the pizzas... sometimes you get artichokes... and sometimes you don't.... Feel free to burst out laughing now. This should then be named the ""spinach pizza, where if you are lucky, you may experience some tiny artichoke bits"". We expressed our feelings about this, namely, that it was ridiculous. He then proceeded to get agitated, talking about how he has a ""vision"" and that we didn't understand his vision. He yelled at us. Who does that???3. After such a disappointing experience, we paid the bill and left a tip still, because in the end it was not the waiter's fault.  We left 15% in tip. The owner came back with complete exact change, as we were leaving. Granted, maybe he thought we wanted the change, but really, it felt like a slap in the face, as if he didn't want anything to do with is.We are never visiting this  place again. Oh, and on top of that, the food was bland. Very very bland. I make better pizza dough myself (even if not baked in a wood fire). And the cheese is not tasty.The End.",Dozzino,3.5 star rating,$$,Pizza
220,XYf3NqUIdEUvxpao4Ptk0Q,Jennifer A.,1.0 star rating,"Food was pretty good but the service was terrible. The servers were rude and inattentive. Also, they only accept one credit card per table - which is fine, but they do not advertise this at all. When I commented on this, the server told me they that say it on their website. Not helpful. Will happily get take out here again but will not return to the restaurant.",Dozzino,3.5 star rating,$$,Pizza
221,RHBMClJiBIW-9QDZmj21eA,Jenn T.,4.0 star rating,"i liked it. BYO is always appreciated. As said, the staff is really great and the vibe is cozy but not cramped. the food; i'm a veg so I got the spesto crostini- SO good. I could eat a bowl of the spinach, cheese and walnut pesto. I also enjoyed the special Garbanzzino. SO SO tasty, a rustic hummus seasoned just right. i even asked if they could serve me some fresh mozzarella (it wasnt officially ""On the menu"") and wow, it was so tasty. Thanks Dozzinos!everything is SO fresh from the market. not a ton of options for a veg- next time ill try their salad special, but it's def enough for a nice, cheap but still hip, night out.",Dozzino,3.5 star rating,$$,Pizza
222,crfMmzNI5hI9GuyoJNAqxA,Jill I.,5.0 star rating,"I lived in Hoboken for two and a half years, recently moved and I dream about this place.. Most amazing thin crust pizza you will ever try, everything is made fresh, you can bring your own alcohol (best part), laid back feel, and friendly staff",Dozzino,3.5 star rating,$$,Pizza
223,l5MOPb9-ItaTrds1qaysxw,NYJets D.,1.0 star rating,"I wish I could give you a review on the actual food. However it was unfortunate to learn that the comments about service still hold true as of yesterday. I gave them the benefit of the doubt of being a new place, but it's just not meant to be apparently.Two of us went in last night to an empty restaurant, save for one full table in the front and one in the back. No open two-seaters but no shortage of larger tables. Us and the other couple were the only two groups waiting at 7:30pm. The girl wouldn't place the couple in front of us. They were obviously agitated. The hostess openly stated that she wasn't going to use a larger table. The tall lanky manager didn't seem to have a clue either. The cook had to put his head out of the window and mention all the space in the back. No matter, the hostess didn't know what to do.We left, Three A's had space for us, and they were as good as their reputation is.Too bad.",Dozzino,3.5 star rating,$$,Pizza
224,N-neFHVjcnYtJ7YWjaDv9Q,John M.,4.0 star rating,"This place is bomb.  I went last night for my buddy's b-day party.  We had the back room locked up for our crew.  Dozzino is BYOB and has the dopest bocci ball court in the back yard.  What's better than good food, cheap booze, and free bocci ball?  For appetizers, we had 2 kinds of bruschetta.  1 kind had small tomato slices on it, and the other had some sort of shredded green veggie with cheese.  They were both very very good.  We also had platters of prosciutto, salami, and other deli meats.  For dinner, we had 4 kinds of pizza.  They were all really really great.  We had a normal margarita style, a spinach artichoke style, a white basil style, and a meat style too.  They were all so good.  Also, we had NBA playoffs on the flat-screen, and hip-hop on the speakers.  Dozzino is a great spot to hang out.  More places need bocci courts.",Dozzino,3.5 star rating,$$,Pizza
