,user_id,user_name,user_rating,user_text,restaurant_name,restaurant_rating,restaurant_price,restaurant_type
0,xVCNoPE_c6ciBMZ0siDUog,AJ F.,5.0 star rating,"Classy Classy Classy Classic European style vibe! Definitely not some hipster joint you visit to grab a beer and or light decaf coffee. Just entering the place you kinda get the feeling of being in another country. The interior is pub-like/wooden non-rustic classic, old school decor. Starting  from the first half of the restaurant and the back room where the more lively seating with huge windows and just gives the place a fresh feeling. This place won't disappoint you, trust me. The service was on point and really friendly. The wine/beer selection was great and I heard more likable comments about the mixed drinks from a man seated right by me. The FOOD:Amazing, not dry, and super delicious. Squid good, risotto amazing, and         ....................THE FRIES MAN! BRO....truffle garlic fries...... Phew.... Still dreaming about the perfection! 0/100 real quick. No but really though get these fries^^^^The SERVICE: We were seated right away and absolutely was on point with the water and quality of personal respect. The waiter just seemed like he was actually happy to help. (if that makes any sense).Over all perfect score! CONS: Parking is horrible in Hoboken. PERIOD",Elysian Cafe,3.5 star rating,$$,"American, (New),, French,, Bars"
1,4lAQYtRnSB6qdinlNEwDcA,Lindsay M.,3.0 star rating,"This restaurant was very cute for brunch. When I first walked in, it felt like I was in a cafe in Europe. I was quite pleased.However, it was very sad to see that they were quite understaffed. I had to walk through the restaurant to find someone to put my name down on a waiting list. No one came up to me for 15+ minutes. Once we got seated, it took another 15+ minutes to put in our drink order. I felt bad for our waitress.When we went to order, I asked for a custom omelette with cheese, tomato and spinach. I thought it was a pretty simple request, but they would not take any special requests off the brunch menu given they were busy and understaffed. This was quite disappointing. I ended up settling with Eggs Benedict & my boyfriend got a Burger. Both were satisfying. Overall, I'm sad this wasn't as good of an experience as I had hoped.",Elysian Cafe,3.5 star rating,$$,"American, (New),, French,, Bars"
2,BWKBWyDlO3CtpA21JhEF2w,Mayor Of Flavortown 2.,5.0 star rating,"This review goes out to Blair G., who happened to be sitting next to me this morning and gave this fine establishment a one star review because 1) he's cheap (see his complaints about refills); 2) his kids wouldn't shut up the entire meal; 3) he brought about 15 pieces of luggage to the seating area, obstructing the walking space for waiters and making it uncomfortable for others trying to be seated; and 4) because Blair G. is a miserable dude with low self-esteem. Blair G. most likely hates is life and just takes it out on other people through Yelp reviews. Maybe you shouldn't bring your infant to brunch? Maybe that would have made your experience better. I felt compelled to come on Yelp and post my opinion in response to Blair G.'s totally unjustified, baseless review. Just to show you what kind of slime we are dealing with here, at the conclusion of his meal, Blair G. announced, ""I'm giving this establishment a one star review!"" Really. The guy really did that. His poor wife and kids have to live with this d-bag. I give that family a four star review for living with you, Blair. Also, the food was ""solidly mediocre""? Weird to hear that from a dude who finished his entire plate. Learn to tell the truth, my dude.This is an excellent establishment. The food is fantastic. The service is great (Love you, Benny!). And the atmosphere is pure comfort with a classy finish.",Elysian Cafe,3.5 star rating,$$,"American, (New),, French,, Bars"
3,zgVfsfrvRT8oXcB79GwK1w,Katie A.,4.0 star rating,"Great ambiance, delicious brunch options, and fast, attentive service. I've always wanted to try Elysian Cafe and was able to check out their Saturday brunch today. I had the smoked salmon eggs Benedict with fries on the side, in addition to a few bellinis!Important to note that they don't take reservations for parties with less than four people. My boyfriend and I didn't want to wait for a table, so we opted for bar seats instead, which was fine! Overall, I think it's worth checking out if you're in Hoboken!",Elysian Cafe,3.5 star rating,$$,"American, (New),, French,, Bars"
4,cWmUKEcIZu0Nxyx-eT_o7Q,Tiffany M.,4.0 star rating,"Dined in for Sunday brunch with a group of friends. We made sure to make reservations. When we got there the restaurant was already filled but we didn't have to wait long for our table. Each table is kind of close to each other and the space is tight. It was Halloween season so the restaurant was decked out in decorations, very cute! I opted for the Croque Madame (Ham, Gruyere, Fried Egg, Pommes Frîtes). Delicious and I would get it again. They also serve alcoholic breakfast beverages so we got mimosas & bellinis.",Elysian Cafe,3.5 star rating,$$,"American, (New),, French,, Bars"
5,kfar0wqf3tlsai5FgDqKYg,Joseph S.,4.0 star rating,"Cool restaurant in Hoboken.It has a section with a bar and tvs, playing sports usually and a section for quiet dining.They have amazing mussels and fries and the grilled octopus was decent. Big selection of wines.The staff and waiters are friendly, though they kept forgetting to get me my beer ‍.I would recommend this for a date night, and a nice dinner.",Elysian Cafe,3.5 star rating,$$,"American, (New),, French,, Bars"
6,A206Z5UEmH6aTGjLPN5RSQ,Gisele Y.,3.0 star rating,An average place to have a brunch or dinner. The food quality is ok but nothing special about it. For a holiday weekend it was one of the only places we found that were open,Elysian Cafe,3.5 star rating,$$,"American, (New),, French,, Bars"
7,i2G3Ty5bPDWEim5Vk0QNbg,Sam L.,4.0 star rating,"The background on this place alone is cool, and the way they really hone in on the cool facts about the restaurant is a fun time. I was in Hoboken, NJ visiting friends who live in the area. They insisted we go to this restaurant based on the french onion soup. I did not get the french onion soup, but goodness it smelled and looked awesome. I ended up getting the mussels and I was beyond happy with my choice. The waiter (who was wonderful) even brought me out extra bread to dip in all the extra juices from the mussels (YUM!)When I get back to Hoboken, I'll definitely visit this place again.  Great interior, and awesome patio (although it was raining this day so we couldn't sit outside) and great product.",Elysian Cafe,3.5 star rating,$$,"American, (New),, French,, Bars"
8,LcWOq7p7Mhtv9hIlDrhy9A,Mel T.,3.0 star rating,"Elysian looks like an old cafe that has a lot of charm. My boyfriend has been living nearby for about four months and we finally got the chance to try it out after all that time. We came in on a beautiful, sunny and warm Saturday at about 1 pm for brunch. The wait for an outside table was only 15 minutes.We were seated pretty quickly and they took our drink and food orders swiftly as well. The drinks came out shortly after, but our food was nowhere to be seen until about a half an hour later. People who were seated after us, got their food before us. I think it was a fluke (I hope). I'd definitely be willing to give it another chance because I really enjoyed the grilled chicken sandwich (with bacon, avocado, lettuce, tomato, herb mayo, and French fries) when I did finally get it. Plus, it's relatively inexpensive. For $13, you can get a plate of steak and eggs with home fries and toast. Hoping it'll be a better experience next time. Not sure I want to unleash the inner Hulk that takes over when I get hungry.",Elysian Cafe,3.5 star rating,$$,"American, (New),, French,, Bars"
9,W8gPSfYsstwBYEpM-_fWjA,Yinglu W.,4.0 star rating,Actually i like the environment more than the food itself. Wall decoration attracted me a lot. I ordered salmon egg benedict. Salmon tasted really good while the English muffin was overcooked. Frities were tasty as well. Nice brunch place overall.,Elysian Cafe,3.5 star rating,$$,"American, (New),, French,, Bars"
10,5FW6iNXiPLxfi6SkYCuWSw,I D.,5.0 star rating,"One of my favorite places in town. The quaint atmosphere, not to mention the adorable outdoor space, in combination with the great food, makes it a frequent go-to spot. Best French fries hands down and brunch, lunch and dinner menus offer variety.",Elysian Cafe,3.5 star rating,$$,"American, (New),, French,, Bars"
11,RoaOc5RYhIaVyL61NI6Owg,Nicklaus D.,5.0 star rating,"Loved the interior mood. Cool unique food options and kid friendly, a rare combo. Good drink choices. Our family had a great time. Thumbs way up!",Elysian Cafe,3.5 star rating,$$,"American, (New),, French,, Bars"
12,K_aVWhHeEN_77wTx5VSgBw,Emma S.,5.0 star rating,"Best brunch I've had in a long time! This place is so pretty and the food was great. Not too loud either, for as busy as it was.",Elysian Cafe,3.5 star rating,$$,"American, (New),, French,, Bars"
13,D7Gg0MPqQPKPvbgX5XT0fQ,June C.,5.0 star rating,I tried their lunch on the weekday. It's really amazing to have such good cheap food in the old historical building. They recommend me their chicken sandwich with avocado inside. It's taste very good and only $9. Would like to come again and try other kinds of sandwiches.,Elysian Cafe,3.5 star rating,$$,"American, (New),, French,, Bars"
14,2glsi4d0P3jwZUozZCPz5A,Penelope H.,3.0 star rating,"The food here is mediocre, though its decor, waitstaff, outdoor seating, layout, and ambiance definitely make it a nice venue. We came here last year for Mother's Day brunch and ordered The Elysian Burger, Two Eggs Any Style, and Cinnamon-Amaretto French Toast. If you sit outside, your pet is allowed to join you so long as they don't make a commotion. The star of the meal was the french toast, and something I would most definitely recommend a thousand times over. However, the remainder of the meal was standard. Even the bellini was sub par. When returning for Father's Day this year, my father took a look at the menu with dismay and we ended up leaving and dining elsewhere. The brunch menu is very limited, and for a man who regularly craves a Western Omelet, simply a Egg White Omelet and Fromage Omelet don't cut it.For lunch/dinner, the fish and chips are definitely a hit, and I've yet to find anywhere else in Hoboken that's worth venturing to for fish and chips. However, some of their other entrees are a little lackluster. As for it's overall quality of French cuisine, it definitely isn't comparable French Bistros in Paris, and had it not been but for the fact that Brasserie de Paris closed, that's where I would be recommending you dine at instead.",Elysian Cafe,3.5 star rating,$$,"American, (New),, French,, Bars"
15,agc8xW_K52K_QJGhfKdmjw,Leena T.,3.0 star rating,"My fiance and I came to Elysian right when they were completing their brunch menu and opening up the bar menu (~3ish pm on a Saturday).No wait at all for seating outside during a sunny but windy day and prompty received excellent and courteous service.We both ordered the lamb burgers- one of us opting for a salad and the other for fries.While the lamb itself was juicy and cooked to perfection and complemented nicely with the included pesto, the bun itself was a bit hard to take down: seemed a bit old, noticeable in both flavor and texture. The salad was decent as well, but nothing to write home about, and the fries-- while thin and crispy, were extremely salty.We had an average meal here that satisfied a late lunch craving; a bit pricey for what it's worth so will likely opt to try another Hoboken offering next time we're in the area.",Elysian Cafe,3.5 star rating,$$,"American, (New),, French,, Bars"
16,frKbf63rhAWDIbVtL_kSxw,Sara J.,3.0 star rating,"Met a friend here for brunch on a Saturday afternoon. My friend enjoyed the french toast while I had the steak and eggs. Food and service were both just okay. My steak was kind of dry and their bloody Mary's are on the smaller side. However, they're only $6.I wouldn't rush back here as there are better brunch spots in Hoboken. But I also wouldn't be completely against patronizing this restaurant again either.",Elysian Cafe,3.5 star rating,$$,"American, (New),, French,, Bars"
17,wegVIHsXdr3jZ6kBB-M7UQ,Brandon L.,4.0 star rating,I went here for my birthday for dinner. The food was delicious and the staff were very polite.  Their happy hour specials are great as well,Elysian Cafe,3.5 star rating,$$,"American, (New),, French,, Bars"
18,rtuQ25-IiYnFnUDnBM1dSw,Marissa Z.,5.0 star rating,My girlfriend Laura lie was here in Manhattan and wanted to meet you up with me and drive to my little home in Nutley but I suggested that we meet in her book and since it was between Manhattan and Notley I chose this place based on the menu when we got there I really liked the old style Decour and we had Tiffany and nice made up girl service she was very sweet and pleasant and she was nice enough to charge my phone I ordered some mussels  as an appetiser and we had croque  Monsour  and my friend ordered a suit because you're with the quicheNoticed that many people sitting around us ordered the quiche and I wish I would've ordered it alsoService was very good here so I gave it a five star I will definitely return to this place the food was great the French fries everything they brought out was heart untimely the wine was great and my friend Even mentioned that I couldn't have possibly chosen a better place to eat out,Elysian Cafe,3.5 star rating,$$,"American, (New),, French,, Bars"
19,4-uFttmAMzoqPTNOSrNRvw,David D.,4.0 star rating,We've eaten here probably 50 times and normally the food and service is excellent.  They change their menu every few months and they always have a salmon dish on it which I love.   We also love their weekend brunch - frisée salad is my wife's favorite and I normally get the steak salad but with salmon instead.   And we drink down and couple of bloody Mary's and bellinis.   A great time. But what you must never do - I've tried it twice  and failed both times - is get takeout from here.   They package it like crap.   Don't do it.,Elysian Cafe,3.5 star rating,$$,"American, (New),, French,, Bars"
20,xVCNoPE_c6ciBMZ0siDUog,AJ F.,5.0 star rating,"Classy Classy Classy Classic European style vibe! Definitely not some hipster joint you visit to grab a beer and or light decaf coffee. Just entering the place you kinda get the feeling of being in another country. The interior is pub-like/wooden non-rustic classic, old school decor. Starting  from the first half of the restaurant and the back room where the more lively seating with huge windows and just gives the place a fresh feeling. This place won't disappoint you, trust me. The service was on point and really friendly. The wine/beer selection was great and I heard more likable comments about the mixed drinks from a man seated right by me. The FOOD:Amazing, not dry, and super delicious. Squid good, risotto amazing, and         ....................THE FRIES MAN! BRO....truffle garlic fries...... Phew.... Still dreaming about the perfection! 0/100 real quick. No but really though get these fries^^^^The SERVICE: We were seated right away and absolutely was on point with the water and quality of personal respect. The waiter just seemed like he was actually happy to help. (if that makes any sense).Over all perfect score! CONS: Parking is horrible in Hoboken. PERIOD",Elysian Cafe,3.5 star rating,$$,"American, (New),, French,, Bars"
21,4lAQYtRnSB6qdinlNEwDcA,Lindsay M.,3.0 star rating,"This restaurant was very cute for brunch. When I first walked in, it felt like I was in a cafe in Europe. I was quite pleased.However, it was very sad to see that they were quite understaffed. I had to walk through the restaurant to find someone to put my name down on a waiting list. No one came up to me for 15+ minutes. Once we got seated, it took another 15+ minutes to put in our drink order. I felt bad for our waitress.When we went to order, I asked for a custom omelette with cheese, tomato and spinach. I thought it was a pretty simple request, but they would not take any special requests off the brunch menu given they were busy and understaffed. This was quite disappointing. I ended up settling with Eggs Benedict & my boyfriend got a Burger. Both were satisfying. Overall, I'm sad this wasn't as good of an experience as I had hoped.",Elysian Cafe,3.5 star rating,$$,"American, (New),, French,, Bars"
22,BWKBWyDlO3CtpA21JhEF2w,Mayor Of Flavortown 2.,5.0 star rating,"This review goes out to Blair G., who happened to be sitting next to me this morning and gave this fine establishment a one star review because 1) he's cheap (see his complaints about refills); 2) his kids wouldn't shut up the entire meal; 3) he brought about 15 pieces of luggage to the seating area, obstructing the walking space for waiters and making it uncomfortable for others trying to be seated; and 4) because Blair G. is a miserable dude with low self-esteem. Blair G. most likely hates is life and just takes it out on other people through Yelp reviews. Maybe you shouldn't bring your infant to brunch? Maybe that would have made your experience better. I felt compelled to come on Yelp and post my opinion in response to Blair G.'s totally unjustified, baseless review. Just to show you what kind of slime we are dealing with here, at the conclusion of his meal, Blair G. announced, ""I'm giving this establishment a one star review!"" Really. The guy really did that. His poor wife and kids have to live with this d-bag. I give that family a four star review for living with you, Blair. Also, the food was ""solidly mediocre""? Weird to hear that from a dude who finished his entire plate. Learn to tell the truth, my dude.This is an excellent establishment. The food is fantastic. The service is great (Love you, Benny!). And the atmosphere is pure comfort with a classy finish.",Elysian Cafe,3.5 star rating,$$,"American, (New),, French,, Bars"
23,zgVfsfrvRT8oXcB79GwK1w,Katie A.,4.0 star rating,"Great ambiance, delicious brunch options, and fast, attentive service. I've always wanted to try Elysian Cafe and was able to check out their Saturday brunch today. I had the smoked salmon eggs Benedict with fries on the side, in addition to a few bellinis!Important to note that they don't take reservations for parties with less than four people. My boyfriend and I didn't want to wait for a table, so we opted for bar seats instead, which was fine! Overall, I think it's worth checking out if you're in Hoboken!",Elysian Cafe,3.5 star rating,$$,"American, (New),, French,, Bars"
24,cWmUKEcIZu0Nxyx-eT_o7Q,Tiffany M.,4.0 star rating,"Dined in for Sunday brunch with a group of friends. We made sure to make reservations. When we got there the restaurant was already filled but we didn't have to wait long for our table. Each table is kind of close to each other and the space is tight. It was Halloween season so the restaurant was decked out in decorations, very cute! I opted for the Croque Madame (Ham, Gruyere, Fried Egg, Pommes Frîtes). Delicious and I would get it again. They also serve alcoholic breakfast beverages so we got mimosas & bellinis.",Elysian Cafe,3.5 star rating,$$,"American, (New),, French,, Bars"
25,kfar0wqf3tlsai5FgDqKYg,Joseph S.,4.0 star rating,"Cool restaurant in Hoboken.It has a section with a bar and tvs, playing sports usually and a section for quiet dining.They have amazing mussels and fries and the grilled octopus was decent. Big selection of wines.The staff and waiters are friendly, though they kept forgetting to get me my beer ‍.I would recommend this for a date night, and a nice dinner.",Elysian Cafe,3.5 star rating,$$,"American, (New),, French,, Bars"
26,A206Z5UEmH6aTGjLPN5RSQ,Gisele Y.,3.0 star rating,An average place to have a brunch or dinner. The food quality is ok but nothing special about it. For a holiday weekend it was one of the only places we found that were open,Elysian Cafe,3.5 star rating,$$,"American, (New),, French,, Bars"
27,i2G3Ty5bPDWEim5Vk0QNbg,Sam L.,4.0 star rating,"The background on this place alone is cool, and the way they really hone in on the cool facts about the restaurant is a fun time. I was in Hoboken, NJ visiting friends who live in the area. They insisted we go to this restaurant based on the french onion soup. I did not get the french onion soup, but goodness it smelled and looked awesome. I ended up getting the mussels and I was beyond happy with my choice. The waiter (who was wonderful) even brought me out extra bread to dip in all the extra juices from the mussels (YUM!)When I get back to Hoboken, I'll definitely visit this place again.  Great interior, and awesome patio (although it was raining this day so we couldn't sit outside) and great product.",Elysian Cafe,3.5 star rating,$$,"American, (New),, French,, Bars"
28,LcWOq7p7Mhtv9hIlDrhy9A,Mel T.,3.0 star rating,"Elysian looks like an old cafe that has a lot of charm. My boyfriend has been living nearby for about four months and we finally got the chance to try it out after all that time. We came in on a beautiful, sunny and warm Saturday at about 1 pm for brunch. The wait for an outside table was only 15 minutes.We were seated pretty quickly and they took our drink and food orders swiftly as well. The drinks came out shortly after, but our food was nowhere to be seen until about a half an hour later. People who were seated after us, got their food before us. I think it was a fluke (I hope). I'd definitely be willing to give it another chance because I really enjoyed the grilled chicken sandwich (with bacon, avocado, lettuce, tomato, herb mayo, and French fries) when I did finally get it. Plus, it's relatively inexpensive. For $13, you can get a plate of steak and eggs with home fries and toast. Hoping it'll be a better experience next time. Not sure I want to unleash the inner Hulk that takes over when I get hungry.",Elysian Cafe,3.5 star rating,$$,"American, (New),, French,, Bars"
29,W8gPSfYsstwBYEpM-_fWjA,Yinglu W.,4.0 star rating,Actually i like the environment more than the food itself. Wall decoration attracted me a lot. I ordered salmon egg benedict. Salmon tasted really good while the English muffin was overcooked. Frities were tasty as well. Nice brunch place overall.,Elysian Cafe,3.5 star rating,$$,"American, (New),, French,, Bars"
30,5FW6iNXiPLxfi6SkYCuWSw,I D.,5.0 star rating,"One of my favorite places in town. The quaint atmosphere, not to mention the adorable outdoor space, in combination with the great food, makes it a frequent go-to spot. Best French fries hands down and brunch, lunch and dinner menus offer variety.",Elysian Cafe,3.5 star rating,$$,"American, (New),, French,, Bars"
31,RoaOc5RYhIaVyL61NI6Owg,Nicklaus D.,5.0 star rating,"Loved the interior mood. Cool unique food options and kid friendly, a rare combo. Good drink choices. Our family had a great time. Thumbs way up!",Elysian Cafe,3.5 star rating,$$,"American, (New),, French,, Bars"
32,K_aVWhHeEN_77wTx5VSgBw,Emma S.,5.0 star rating,"Best brunch I've had in a long time! This place is so pretty and the food was great. Not too loud either, for as busy as it was.",Elysian Cafe,3.5 star rating,$$,"American, (New),, French,, Bars"
33,D7Gg0MPqQPKPvbgX5XT0fQ,June C.,5.0 star rating,I tried their lunch on the weekday. It's really amazing to have such good cheap food in the old historical building. They recommend me their chicken sandwich with avocado inside. It's taste very good and only $9. Would like to come again and try other kinds of sandwiches.,Elysian Cafe,3.5 star rating,$$,"American, (New),, French,, Bars"
34,2glsi4d0P3jwZUozZCPz5A,Penelope H.,3.0 star rating,"The food here is mediocre, though its decor, waitstaff, outdoor seating, layout, and ambiance definitely make it a nice venue. We came here last year for Mother's Day brunch and ordered The Elysian Burger, Two Eggs Any Style, and Cinnamon-Amaretto French Toast. If you sit outside, your pet is allowed to join you so long as they don't make a commotion. The star of the meal was the french toast, and something I would most definitely recommend a thousand times over. However, the remainder of the meal was standard. Even the bellini was sub par. When returning for Father's Day this year, my father took a look at the menu with dismay and we ended up leaving and dining elsewhere. The brunch menu is very limited, and for a man who regularly craves a Western Omelet, simply a Egg White Omelet and Fromage Omelet don't cut it.For lunch/dinner, the fish and chips are definitely a hit, and I've yet to find anywhere else in Hoboken that's worth venturing to for fish and chips. However, some of their other entrees are a little lackluster. As for it's overall quality of French cuisine, it definitely isn't comparable French Bistros in Paris, and had it not been but for the fact that Brasserie de Paris closed, that's where I would be recommending you dine at instead.",Elysian Cafe,3.5 star rating,$$,"American, (New),, French,, Bars"
