,user_id,user_name,user_rating,user_text,restaurant_name,restaurant_rating,restaurant_price,restaurant_type
108,3RC4rRMLgY669VKUGp5i0g,Tiffany L.,5.0 star rating,"I've heard about this place, but never knew where it was until the other day. I realized that it's directly across from You Lucky Dog (where my stinky yet adorable dog gets bathed) AND it's also dog friendly! It was an absolutely gorgeous day and Elysian's quaint outdoor patio was calling our name! The patio is comfortable and the best seats are the ones that are shaded underneath the large tree. Dogs are welcome, which I of course love, but I love even more that they came over right away with a water bowl for her.Our waitress, a young brunette, was super friendly and very attentive. She told us about her dogs and shared stories and made a lot of small talk, which is nice. She was a great waitress. We both got the unsweetened iced tea (it's very unlike me not to order wine, but I was wildly hungover). The tea was delicious.Their lunch menu is incredibly affordable. We both decided to go with their half sandwich and soup option. What a STEAL at $9! We both got French Onion Soup which came piping hot and topped with a very generous amount of melty gooey cheese. The soup was amazing, and not overly salty like a lot of French Onion soups can be. The amount of cheese was perfect.For my half sandwich, I got the Chicken which came on Rosemary Foccacia, thick cut bacon, a creamy herb mayo and avocado, lettuce and tomato. Wow. It was amazing. For something that sounds so simple and like it could be subpar, it was full of flavor and that thick slab of bacon really made it. My husband got the Croque Monseuir which is basically a French grilled cheese with ham. It was very tasty and came with mustard for dipping, but a much smaller sandwich compared to the chicken.We got a side of Pommes Frites and they are a must, must, must! A little pricey at $6 a side but these perfectly crunchy, oh so salty, savory mouth-watering fries are so worth it! I'm not even the biggest french fry fan, but I will admit that these are done right!I can't wait to come back for dinner.",Elysian Cafe,3.5 star rating,$$,"American, (New),, French,, Bars"
109,5gcsK1ovNSUroFw1LXptZA,Mike D.,1.0 star rating,Had high hopes but very very average. We went for brunch this Saturday and it was like 100 degrees and they had no AC on and all windows were closed! The food was not horrible but that's the best I can say about it and the Bellini was terrible along with the champagne they put in it. Our brunch was very disappointing!!,Elysian Cafe,3.5 star rating,$$,"American, (New),, French,, Bars"
110,QxTNaHoxTL8f7jAK5nwQ1g,Nicholas G.,3.0 star rating,"Came here for a mid-week dinner and enjoyed a good dinner.  We ordered the skirt steak and the roast beef sandwich.  The skirt steak was a little on the chewy side but the risotto was very good.  The roast beef sandwich was full of flavor so nothing to complain about there.  To be honest, both dishes were even better as leftovers the next day!Is Elysian spectacular... no.. but will you be able to get a good meal here every time.. yes.Check this place out if you haven't already.",Elysian Cafe,3.5 star rating,$$,"American, (New),, French,, Bars"
111,wDrN-7KG0aNpCIliY4wNFQ,Augie W.,3.0 star rating,"Food is very, very good. The atmosphere is classic bougie historical bar type. However, the staff has to pick up their game. Inattentive, laid back ""I know your there"" attitude. They should all take smiling lessons.",Elysian Cafe,3.5 star rating,$$,"American, (New),, French,, Bars"
112,NFsxHSryxiSJKpgWejxrMg,Heawon K.,4.0 star rating,"This review is 3.5 stars but I bumped it up because of the awesome decor and service. Walking into this place you feel almost as if you're traveling back into the victorian era; the decor of this cafe is simply splendid and extremely detailed. At Elysian cafe you can choose to sit either outside, by the bar, at the tables alongside the bar, or in the sectioned off back room. My boyfriend and I chose to sit at one of the tables by the bar simply because it was too sunny and humid outside. MY boyfriend ordered off the lunch menu and got half the smoked salmon sandwich and a cup of the tomato vegetable soup. I chose to try out the fish 'n' chips. My boyfriend's food arrived first and then mine, or what was supposed to be mine. I was delivered fish tacos incorrectly, but I let my server know and ten minutes later I received the correct order. This was a bit off putting because by the time I had received my food, my boyfriend was halfway through with his food. My boyfriend's salmon looked and tasted incredibly fresh, with the tomato vegetable soup being the perfect complimentary soup. My fish 'n' chips on the other hand, was literally half good. By this I mean, only one of the two pieces of the breaded and deep fried was good. The other piece had way too much breading that once the fish cooled down, the fish completely separated from the fried part.  I was upset with the inconsistency of the dish and a bit agitated that I had to wait for such an inconsistent dish. If you do decide to come to this cafe, I would suggest you stray from the fish 'n' chips-- not worth the gamble. Tip: the root beer is delicious!",Elysian Cafe,3.5 star rating,$$,"American, (New),, French,, Bars"
113,T3fsrx6Gj9e428n3dOZwKQ,John C.,4.0 star rating,"Visited the Elysian Cafe on a Sunday morning for Brunch.  Arriving at around 10:15, we just beat the rush and were able to secure a table outside for 3 right away.  We were in the shade and, for a fall morning in Hoboken, the breeze created a bit of a chill.  While others around us asked to be moved to the sunny tables, we toughed it out.Our group started with a Bellini, a Mimosa, and a John Daley.  All delicious ways to kick start a morning.  I ordered the Eggs Florentine with pommes frittes (fries).  I enjoyed the meal but was left wanting for a bit more hollandaise. It might just be personal preference but I'm a total glutton for that silky sauce.  The poached eggs were great and the sauteed spinach had good flavor.  The fries were really well seasoned too and came in a pretty cute little bucket.  The food got cold quickly but that's just the fault of where we were seated.Our server took excellent care of us.  Also, we were AMAZED by how quickly our food came out.There are lots of great restaurants in this area and this is one I would return to for brunch.",Elysian Cafe,3.5 star rating,$$,"American, (New),, French,, Bars"
114,YCqDo79jkCwAi42QnSNEjA,Michael V.,5.0 star rating,"love this place, especially for brunch one of my go to places..i love there grilled cheese one of my guilty pleasures lol. but all around a great menu with a good mamosa..",Elysian Cafe,3.5 star rating,$$,"American, (New),, French,, Bars"
115,FPkh2rNkP82aG5pguh-F8A,Buddy J.,2.0 star rating,"My wife and I went for brunch on Mother's Day. Three problems: 1) I ordered the steak and eggs and the skirt steak was very tough; 2) my wife's eggs Benedict arrived cold; 3) the Bloody Marys had almost no vodka in them. I drank two and felt absolutely nothing. I realize Mother's Day isn't the best day for dining out since the restaurants are very busy but still, I was disappointed.",Elysian Cafe,3.5 star rating,$$,"American, (New),, French,, Bars"
116,0eFcrvjJhE1b3WRNNZrwUQ,Sally A.,3.0 star rating,"I go to Elysian at least once a week, mainly for their happy hour. From 5pm - 7pm Monday - Friday happy hour is half off all cocktails and selected wine and beer. Their cocktails are my favorite in all of Hoboken mainly because they are always STRONG. The bartenders have been there forever and aren't the friendliest, but get the job done. The most friendly bartender is Tommy, but he only works on Fridays. It's definitely not a ""craft cocktail"" bar, but it's better than most of your run of the mill pubs. Favorite cocktails: Car Chase and Jalapeno MargaritaMaybe one of the best things about Elysian is the decor and ambiance. The owner has done a great job restoring the traditional decor. It is unlike any other cafe/bar in Hoboken, much less any other place I have been. The patio in the spring and summer is picturesque and occupied 100% of the time. The entire experience is worth it just to get a seat on the patio during those seasons. The cafe is lit up at night with cafe lights that are help add to the charm. My only complaint about the establishment is the bathrooms. One of my biggest pet peeves is when a restaurant puts so much effort in to the aesthetic and cleanliness of the restaurant and completely gives up on the bathroom. The restroom is always unkempt and feels like a stadium bathroom. The food is mediocre, but pretty par for the course for bar food. The pommes frites are insanely good and are a weakness every time I go. There isn't anything particularly ""healthy"" on the menu.I would recommend: the burger - big and juicythe grilled chicken sandwich -not healthy at all, but decent flavors. the chicken is often dry, but I power through. the rosemary focaccia bread is tasty, but too bready. I usually end up dissecting the sandwich and eating the chicken individuallyFish N Chips - decent portions of fish, make sure to ask for them crispy, sometimes they can come out soggyGrilled Cheese - really good and made with sourdough breadMussels and Pommes Frites - giant portion of MusselsChicken Caesar Salad - the dressing comes with anchovies so be sure to specify if you want them or not, again the chicken is usually dry",Elysian Cafe,3.5 star rating,$$,"American, (New),, French,, Bars"
117,UVh16npHSc8I2zg58xNPHQ,Rachael K.,4.0 star rating,I love this cute little gem! Its a great place for brunch and would love to try their outdoor seating when the winter passes,Elysian Cafe,3.5 star rating,$$,"American, (New),, French,, Bars"
118,UfqSCUqT6qnu3Hm-RkzCOw,Prasath S.,5.0 star rating,I love this place !!!!My New fav on the brunch menu is the Salmon Eggs Benedict with a side of Lyonnaise Potatoes....SO DELICIOUS !!!!,Elysian Cafe,3.5 star rating,$$,"American, (New),, French,, Bars"
119,qwG7UyL9zKlDm1xBbIZc4g,Sheila A.,4.0 star rating,"Sooo friggin good. After going on an adventure around Hoboken on an unusually beautiful day, my friends and I decided to stop here and grab some food and dranks.I ordered a burger which was delish! It was just a tad too salty, but otherwise amazing. I also got a drink, which was a little too expensive for my taste and it was extremely strong. I couldn't drink it alone, I had to have my friends drink some too.This was only the second time I've been here but both experiences have been fantastic. The service is always great, everyone is always so pleasant and attentive.Def going to hit up Elysian Cafe more often.",Elysian Cafe,3.5 star rating,$$,"American, (New),, French,, Bars"
120,9OEmxUqU3oCeyjQ5jSNxfA,Mina P.,2.0 star rating,"Good food but I will not return for several reasons. There are plenty of places serving great tasting brunch in the Hoboken area as well so just good food won't keep me returning. They have small portions. Service was not exceptional. The kids menu was one price of $8.85 (however there was an additional service charge $1.15 automatically per child), why not just say your kids meal are $10?! The kids burger is a slider. My child never even got his kids drink that came with his meal. When we asked where the drink was at the end of the meal, the server blamed the bar for being backed up. Then she gave us our check and we were about to pay when we remembered she never asked us what we wanted for the kids meal dessert. And when we asked if we can order that, she said ""you can do that anytime!"" But we have our check already! I ordered an iced coffee with my brunch, unlike most places, it's doesn't come with refills. I was also not given my milk for my coffee for a long time, by the time I got it, my coffee was so diluted (sat outside on a hot day). Just wasn't very pleasant. Again, given all the great brunch foods in Hoboken, I just wouldn't choose to come back to here again.",Elysian Cafe,3.5 star rating,$$,"American, (New),, French,, Bars"
121,_Mr_MG3PndCXKcYimu9JyQ,Rosie C.,4.0 star rating,"After living in uptown Hoboken for 4 months and trying all the local spots this is definitely my favorite for a nice and cozy dinner. Love the atmosphere both outside and inside and the food is definitely a notch above most of the other bar fare in Hoboken, without getting as pricey as Anthony David's or Amanda's. My husband and I have tried the salmon, steak and a few sandwiches off the bar menu. My favorite is the salmon. Lobster roll is surprising good - and that's coming from a Massachusetts girl! We have yet to try brunch here. That's up next.",Elysian Cafe,3.5 star rating,$$,"American, (New),, French,, Bars"
122,Pb5jd7I__vz6yuxvKqM8yQ,Alejandro D.,5.0 star rating,"Just finished having an OUTSTANDING meal! Our server, Jack, was friendly, attentive and unobtrusive.The entire meal was stellar from start to finish. We ordered: The cheese plate, the French onion soup, Steak Au Pouvre, Pan Seared Salmon, as well as the pan seared cod special and the bleu cheese & balsamic vinaigrette truffled burger special. We finished with the creme brûlée and the white chocolate & Oreo cheesecake.I would recommend this place to anyone visiting Hoboken. Definitely warrants a return visit!",Elysian Cafe,3.5 star rating,$$,"American, (New),, French,, Bars"
123,s3c-E5yP042P7rTm3Ob5eg,jenny a.,2.0 star rating,"Lived in Hoboken for 10 years and finally tried out this place but was somewhat disappointed. Lobster roll was mediocre, not so fresh and seemed like it was a day old, felt sick with a small case of food poisoning that evening. Husband had the steak frites, found it unremarkable. I will say though the Malbec was nice and the fries were good (it's kinda like McDonald's if you like that) The wait staff was very courteous and accommodating. I just wish the food was better. Also the seating area doors seemed pleasant at first but the seats were wobbly and rusty, our table needed a leveling because it was falling over.",Elysian Cafe,3.5 star rating,$$,"American, (New),, French,, Bars"
124,2mSZlJFPK7ccg2xX0U53Kw,John B.,4.0 star rating,"Elysian is the oldest bar in Hoboken. Fun fact: they shot a memorable scene from Sleepers 1996 here. The incredible ceilings/molding and wood trimmed bar definitely bring you back in time. Unfortunately the food isn't quite as breathtaking as the ambiance. Thumbs up for the burger and fries. No thanks on the eggs benny, omelette, & croque monsieur, which honestly I could do better at home.  Attractive happy hour and friendly bartenders make Elysian a win for pre dinner and catch up drinks w friends. They also have live music, another plus!",Elysian Cafe,3.5 star rating,$$,"American, (New),, French,, Bars"
125,wDQpAORlHNC8HFbLJo4uDQ,Wenjing Y.,4.0 star rating,"If there are half stars I'd give this place a 3.5 for the food, but I'm rounding up as I like it as a reliable local restaurant. The outdoor seatings are very nice. The staffs are friendly. Kids menu is great. Drink menus are very reasonably priced. Food is nothing fancy but solid.     Been here a few times, the steak last time was very well cooked, but I did not like the cod this time - a bit blend, the sides of it reminded me of a chicken noodle soup. The stuffed chicken breast special was quite nice though. I wish the dessert menu has more non ice cream related items but I did like the puffs. I'd come back again.",Elysian Cafe,3.5 star rating,$$,"American, (New),, French,, Bars"
126,kSu8kSSitE7UrGZLm_ncUg,Alex G.,2.0 star rating,"This place has good food and good beers, but after the (lack of) service we had yesterday on the patio I don't think I'll be back for a while. Had two beers and wanted to order food but the server never came back. Left cash for the beers and dipped out to get food elsewhere. Bottom line: there's not a huge selection in Hobo, but for springtime sun, you may have better luck elsewhere.",Elysian Cafe,3.5 star rating,$$,"American, (New),, French,, Bars"
127,9wMWWTkXCHWYzhElSKl93A,Lena D.,4.0 star rating,"Came here for brunch this weekend.waited for about 5 minutes for a table. In the interm we had drinks at the bar, I had the High Apron, which was refreshing,  perfect for a summer day.I had the blueberry pancakes (gateaux chaud) with ham. For $8.50 it was a good deal, just somewhat of a disparity that my drink was $10. They do have a list of brunch cocktails for $5.25 (bloody maries, mimosas etc.)",Elysian Cafe,3.5 star rating,$$,"American, (New),, French,, Bars"
128,plhbOsgxdGo2RcK0B1PpWg,Payal M.,1.0 star rating,Visited this place for brunch with a group of friends.. The place looked great and the food was good too.. But surprise.. At the end of the meal one us ordered coffee and once she added the cream to it.. 3 roaches floated to the surface. We called them and they cleared the table immediately as if nothing had happend.. Our server was unapologetic and so was the manager. Im not going back!,Elysian Cafe,3.5 star rating,$$,"American, (New),, French,, Bars"
129,RT6XWz2TGpD63_YY8RGhqw,George P.,4.0 star rating,"Service was good. Had trouble with the seating when we came in. One of the hosts was so preoccupied with a customer requesting seating that everyone else was overlooked while waiting for a table. Luckily the other hostess managed to seat us. It was definitely crowded but the ambiance was nice and he deride from our waiter was very pleasant.I ordered the smoked salmon club and my girlfriend had the BLT. I was surprised at how great the BLT was. The smoked salmon club was good but the ratio of sauce and greens to the salmon was a little off. The sandwich seemed more like just a straight smoked salmon sandwich. The sauce was faint and the texture was more soft than anything else. we also had a dessert, the double fudge sundae which was chocolate bread pudding with ice cream whipped cream and warm chocolate syrup (really tasty for chocolate lovers).I would definitely come back tho regardless because the other menu items looked really good and I enjoyed my meal overall. Just remember the BLT is reaaaaaallly good.",Elysian Cafe,3.5 star rating,$$,"American, (New),, French,, Bars"
130,94V-snVUg2Gd-OPd7rcZEg,Laila D.,3.0 star rating,"Finally made it to this beautiful and historic renovated venue! Beautiful ceilings and old school decor. Warm and kind service.  Food was just ok.  Came for brunch and got the steak which was good, eggs ok, nothing special. Home fries also very good but not superlative. Coffee pretty subpar and weak. Mimosa soso, also weak. Donuts were excellent, I would guess from Schnackenberg's.  would not go back as prefer other brunch spots in area.",Elysian Cafe,3.5 star rating,$$,"American, (New),, French,, Bars"
131,nn8i1waE3VAT_Jnfj-5A-Q,Ali S.,1.0 star rating,"I ate here once and liked it a lot so I staged (work for free) in the kitchen for a job a year ago but decided not to work there when I saw how dirty the kitchen was. French fries everywhere, bugs creeping out of corners, sandwiches made with dirty bare hands after handling raw chicken. The floor looked like it hadn't been sweeped in weeks. The first thing I did was quest for a broom. Could never forget what I saw there. Was so appalled that I never returned to eat there.",Elysian Cafe,3.5 star rating,$$,"American, (New),, French,, Bars"
132,DuhFNe6w3MTVfBLCWF5HXQ,Sui B.,3.0 star rating,"This is when I wish yelp can give stars on a .5 increment. It is like when certain shoes brands does not come in half sizes, well, what if my feet is neither 6 of 7?!? Anyway, the food was just decent but the service was really good, fast and efficient, out door seating is nice, even a nice big bowl of water for my doggie. I do wish their brunch menu was a little bigger...",Elysian Cafe,3.5 star rating,$$,"American, (New),, French,, Bars"
133,kjoeuqQnxocQlJUltR1Rhw,Waz W.,3.0 star rating,"I recently made a brunch pit stop at Elysian Cafe during a long Jersey City to Weehawken walk. Elysian Cafe is the oldest continually operated restaurant in Hoboken with a French bistro style menu. I find this place absolutely adorable, and the outdoor seating is very popular during brunch hours. They had decorated the exterior with a few flags for Memorial Day weekend.The brunch menu was very reasonably priced, and they also offer brunch cocktail specials (around $6, if I'm remembering correctly). There were several cute dogs accompanying their humans for brunch, but sadly, there was nothing on the menu was intended for them. Every time someone accidentally dropped some food, the dogs got really excited.We started with a couple bellinis, but the peach puree seemed to be lacking slightly. The bubbles were still refreshing though. John ordered the Fromage Omelet ($8.75) with pommes frites on the side. I had a bite of the omelet, and that fontina cheese was yummy, but so rich! I don't think I could have finished that entire omelet all by myself.Unfortunately, there was mix up with my order. I had ordered the Eggs Florentine ($9.75) with Lyonnaise potatoes on the side. The waiter first brought me an omelet with the potatoes, then went back to the kitchen to fix my order. He then came out with Eggs Florentine with fries, as well as a comped cocktail. Since they were already giving me a free cocktail and were incredibly apologetic about the wait, I didn't want to mention that I actually wanted potatoes, not fries. It's all good, and the fries were tasty. I typically judge a restaurant's brunch based on their Eggs Benedict-type dishes, and Elysian Cafe hit the mark, especially for the price. Lots of spinach, perfectly poached eggs, a nice hollandaise sauce. Perhaps next time I'll finally try the Lyonnaise potatoes. I'm a carbaholic, and I sure do love my potatoes.",Elysian Cafe,3.5 star rating,$$,"American, (New),, French,, Bars"
134,1PHW2WZpkyymy6muwVwtJw,Social C.,5.0 star rating,"I had a meeting in an office nearby. I was really early and hadn't had a chance to stop for lunch. I haven't really been around this area in Hoboken and was afraid I wasn't going to find a place to eat something good, hearty and reasonably priced. To my surprise, they had a great menu serving all variety of options and from different prices. I chose the Salmon Club and loved it with their side salad! Would love to come back soon!!",Elysian Cafe,3.5 star rating,$$,"American, (New),, French,, Bars"
135,Fnzy4nNV04pFuCXoY-bn_A,Bridget K.,3.0 star rating,"Beautiful outdoor terrace in Hoboken. I went for brunch with a group of friends, and the service and food were just ok.",Elysian Cafe,3.5 star rating,$$,"American, (New),, French,, Bars"
136,jqcq414eimE6N47ydNcLGQ,Colleen V.,5.0 star rating,"Review is for lunch only and during off hours. I've been here twice for a late lunch with my mother in law and really enjoyed our food both times. We sat outside and service was great. Granted they weren't crowded as it was 2pm lunch on a Monday. Service was attentive. They brought water out right away for our pup. We split the BLT and grilled cheese. Both were awesome. Thick cut bacon with yummy roasted tomatoes and avocado. Came with a large side salad. Fries were cold but they brought out hot ones. Dog friendly inside the patio. Most places have you keep the dog on the sidewalk. I will keep going back as both sandwiches were really good. Honestly, it's more like 4.5 stars but I will round up. Prices seemed reasonable--sandos were big as were the sides.",Elysian Cafe,3.5 star rating,$$,"American, (New),, French,, Bars"
137,Vavtd5JwMKYgxYz-X3Uyew,Huw P.,3.0 star rating,"I have been here many times over the last 10 years and have had pretty good experiences over all, however I now have realized where I went wrong, I only eat here during the week at weekends it gets really busy and the quality goes way down.The burger is my favorite here and the sandwiches are good too I like that you can get wine in a carafe and the rooms are nice not too noisy and during the week a good place to meet for a chat over lunch.As I said above its a different story at the weekend way too many strollers for me and groups of loud young people recounting who they were sick on the night before !!!!",Elysian Cafe,3.5 star rating,$$,"American, (New),, French,, Bars"
138,Y59HQNazSLR1EUMUmMOaFg,Greg W.,2.0 star rating,"This place is just always a pain in the a*s.  Brunch, late lunch, dinner... whenever I try to go there is always some problem, wait here, wait there - stand awkwardly at the bar because there's never a seat at the bar to wait.And honestly the food, while OK, is a bit overpriced for what it is - I get the whole smaller portion because of the french influence, but french food is amazing when well executed not just OK but smaller.Too bad mediocre or lackluster experiences here to rate higher than a two!",Elysian Cafe,3.5 star rating,$$,"American, (New),, French,, Bars"
139,gyKg3c6qRtBztDWHE0Va7A,Stephanie B.,4.0 star rating,"Mondays are buy one get one off the bar menu which is a sweet deal! But, I decided on going for the braised short ribs, which was delicious!! We started off with the garlic Parmesan truffle fries and cheese plate. The fries were really good. Crispy and flavorful. But, the cheese plate could of used a better presentation to make it more pleasing to the eyes. It wasn't bad, but, I would skip it next time. For dessert, we had creme brûlée which I definitely recommend. Service was great! One star off because we had a party of 7 with reservations, but, still had to wait 20 minutes for the table to clear.",Elysian Cafe,3.5 star rating,$$,"American, (New),, French,, Bars"
