,user_id,user_name,user_rating,user_text,restaurant_name,restaurant_rating,restaurant_price,restaurant_type
206,dl4ENy4Bk6-lCu59A8vxbg,Bloss C.,3.0 star rating,"I'm a fan.  Yes it's a little pricy, and if I'm gonna spend it I think I'd prefer Amanda's, but this is definitely a great neighborhood spot, the kind of place where if you're a regular everybody knows your name.  I had the baked cod and it was really good. I am tempted to go 4 stars on it..... And on their affordable wine list.  Siting outside is boss too.",Elysian Cafe,3.5 star rating,$$,"American, (New),, French,, Bars"
207,bH6c4p_sODIMPZdalK6NQw,Joe C.,1.0 star rating,"Ive never written a review for food before but i felt compelled to come on here for the good of humanity. i mistakenly reserved a spot on valentines day (mind you, i knew the fixed course menus anywhere on valentines day would be subpar, but i figure, how bad could it be?) well, let me tell you friends. for an absolutely absurd price, you can get 5 fried oysters in spicy mayo, 4 small slices of skirt steak, and 2 cold crepes. id also like to emphasize that ive donated to soup kitchens before and ive tried their food. the meal was on par with 2 of them and im pretty sure the one in new haven had far better food than elysian. it was crystal clear the ownership was trying to wring every penny out of this holiday and i was just a sucker along for the ride. do yourself a favor and dont make the same mistakes i did. everytime i pass by, i will salute to the day i had the worst meal ive ever had in my adult life. thank you elysian for teaching me that lesson. you wont take another dime of my money.",Elysian Cafe,3.5 star rating,$$,"American, (New),, French,, Bars"
208,JOwlpgapqz9NTeOwJKuwXw,Jacob M.,5.0 star rating,"So French. So, so French. This cafe (which is a sister restaurant with Amanda's just down the street) is a beautiful little spot to grab a weekend brunch and just relax.  The decor in the building is beautiful, with rich ornamentation and gorgeous cerulean walls. It was also surprisingly spacious since after seeing the outside seating, I imagined the indoors to be even smaller!The boyfriend and I were yet again on the brunch exploration. I ordered my staple: eggs florentine. And man, this place did it right. The hollandaise was creamy and tangy. The eggs were poached perfectly. The spinach delish. What was a bit different, however, was that it came with pommes frites instead of the more typical hash browns or home fries. When I bit into them, however, I didn't care. Those were some delicious French fries.After sipping some coffee for a while (also good), we got the bill which was meh. Not cheap, not expensive, right about where it should be. Not as fancy/gourmet as Amanda's, but it's cheaper and more laidback. A hardy yes to visiting this one again!",Elysian Cafe,3.5 star rating,$$,"American, (New),, French,, Bars"
209,SjKSqmZnIaLqwXkvrybjUg,Nicole G.,4.0 star rating,Great fries.  Mussels are tasty.  The Chocolate bread pudding is delicious.  The bar menu overall is good.  The brunch is pretty good. The outdoor seating is awesome.  Great overall atmosphere.,Elysian Cafe,3.5 star rating,$$,"American, (New),, French,, Bars"
210,ClPDFyCXjSie6H9hxx74YQ,Lisa R.,5.0 star rating,Amazing!!!!! Delicious!!!! Great service!!! Highly recommend it for brunch with the family!,Elysian Cafe,3.5 star rating,$$,"American, (New),, French,, Bars"
211,Y1T5yVBHiRvlH5PYxiznww,DailyDeal M.,4.0 star rating,"Excellent food! We sat outside and it was a beautiful night. Lobster roll was great, as were the mussels in white wine sauce (PEI mussels...double positive!). Wine is affordable... the cheapest pino noir was light and delicious.Will absolutely go back. Dog friendly too!",Elysian Cafe,3.5 star rating,$$,"American, (New),, French,, Bars"
212,nIX14k62rYOzhbXINN83FA,JB S.,4.0 star rating,"Great brunch or dinner spot.  Sit outside if weather permits, nice corner location and garden-like feel.  Food is what you would expect at a decent bistro, it's good, not great.  Prices are ok overall.  The back room has some cool character and history.Avoid the bar area for dinner as it gets quite crowded and cramped at those tables.",Elysian Cafe,3.5 star rating,$$,"American, (New),, French,, Bars"
213,krGhEGcZoGIXNxGU_xl3uw,Carrie W.,1.0 star rating,"I was excited to take my family here, but unfortunately, we had a really disappointing experience at the Elysian Cafe last night.Knowing it can get crowded on the weekends, we had walked in the night before to make reservations. The hostess wrote my name, time of reservations, and group number down on her pad of paper.On Saturday, we show up prior to our 7pm reservations. I approach the hostess and tell her we have reservations for five at 7pm. She immediately tells me they do not take reservations for fewer than six on Saturday nights. I explained to her I had not been informed of that policy and the hostess the night before had told us we were good to go. She tells me to wait and goes inside to get her manager. A couple minutes later, the manager walks out to speak with me explaining that they do not have record of me in their system and again, that they don't make reservations for less than six people. Rather than being apologetic or accommodating for the error, he continued to make excuses and push the blame onto me (and his hostess from the night before) for their mistake.  Not yet wanting to give up, I asked how long the wait was. He informed me there was no wait for the outside (it was getting chilly out), but a thirty minute wait for the inside because they ""had reservations."" Apparently the reservation I made the night before was not worth honoring or acknowledging. Annoyed with the lack of customer service and the manager's smugness, we decided to not give them our business.I can thank them though. We went elsewhere in Hoboken and had a lovely meal without the pretentiousness of the Elysian Cafe. I will probably never go back.",Elysian Cafe,3.5 star rating,$$,"American, (New),, French,, Bars"
214,idkyzxAy7jv-TWdKU-JFRg,Vinay K.,4.0 star rating,One of the best places for brunch in hoboken. The downside being the wait but theres plenty of seating at the bar to get your table. I had the Salmon eggs benedict which i always do over there its by far the best brunch item along with couple of mimosas adding on the perfect weather and outdoor seating made it for an awesome brunch.,Elysian Cafe,3.5 star rating,$$,"American, (New),, French,, Bars"
215,Z-1QngvHNkiMNYcwZempVA,Harrison N.,5.0 star rating,"With Anthony David's being as great as it is, Its easy to forget about Elysian. The grilled chicken sandwich is amazing.",Elysian Cafe,3.5 star rating,$$,"American, (New),, French,, Bars"
216,NfwOkx4uGRVNS9Io68975Q,Alexis B.,1.0 star rating,The food was a step or two above McDonald's... Not fucking kidding. The ham that was on my croque Madame looked like spam and tasted like it was drowned in salt. Fries are exactly like McDonald's maybe worse. My girlfriends hanger steak and scrambled eggs looked somewhere between a continental breakfast and cafeteria food. Inedible steak once again drowned in salt and the eggs? Just lol. Don't be fooled by their nice prices because in reality it's expensive for how shitty the food actually is.,Elysian Cafe,3.5 star rating,$$,"American, (New),, French,, Bars"
217,dZ77Vlt2uY5ApHUeRqwfTw,Hugh W.,2.0 star rating,"Wow, the bartenders are really, really douchy. I know that I am not a twice a week regular, but seriously, wife and I sat at the bar for a saturday 9pm dinner and got the most attitude, and most in-attentive service I have ever gotten.  The food is great, but if it served by a non-engaged brat than I don't see the point.  P.S. guys that's how you develop regulars that feed you a steady stream of great tips. There are plenty of places to spread the joy and money in Hoboken, Work Harder.",Elysian Cafe,3.5 star rating,$$,"American, (New),, French,, Bars"
218,3MsvlOQJp7pWxOkBzjUe7A,Thea Z.,4.0 star rating,"Great place for dinner in Hoboken, whether its for 2 or a small group of friends. Its a refreshing change from some of the other more generic ""steakhouses"" or ""quick dinner"" places that are found abundantly on Washington. If you are a foodie, dont miss it. I just recently went to celebrate my birthday there and I am very happy with that choice. It was easy to make reservations and they sat us right away. The service was good all night, they had 2 different people working our table to ensure we had everything we needed. Our waitress was very attentive and made some key recommendations for us. The ambience was probably one of my favorites and we werent even outside on the adorable patio surrounded by a lush garden on the sidewalks of hoboken. Food wise we had the crispy calamari salad (packed with flavor) and the goat cheese and beat salad (if you like those kinds of salads dont miss this one). Their Pomme Frites were definitely worth ordering. Dinners were a hit with everyone all around which included the salmon, seafood stew, and a few of the steak choices. Dont miss this place! I am sorry I have not gone there earlier, but happy I know how great it is now.",Elysian Cafe,3.5 star rating,$$,"American, (New),, French,, Bars"
219,gDziE_BnL9rV-VkrU7IP8w,J.C. S.,4.0 star rating,"I live across the street from here - I am lucky to have such a great little restaurant so close to home! Even if I didn't live so close, I'd be a regular.The burger is my favorite burger in Hoboken, hands down. Super flavorful and juicy. Their fries seem to be laced with some sort of addictive magical ingredient because once you have one, you keep going! My girlfriend loves the crispy calamari salad.Elysian is also a great brunch spot. Have a mimosa or a bloody mary to start off your day. The salmon eggs benedict is great.Outdoor seating is great option that only adds to the charm of this place! Enjoy!",Elysian Cafe,3.5 star rating,$$,"American, (New),, French,, Bars"
220,LhIA4A7rRdPm8E7nGeeCAw,Mike V.,3.0 star rating,"The food is 3 stars but the experience is at least four stars if you can get an outdoor table, especially on a sunny day. The brunch and lunch food is mainly standard fare done well enough. The beer selection is good too. In a city of brunch spots, Elysian doesn't stand out. If only Yelp allowed 3.5 stars.",Elysian Cafe,3.5 star rating,$$,"American, (New),, French,, Bars"
221,298XFRjPkhXJYrZinNZkGw,Tony C.,2.0 star rating,"It is not very French but pretends to be.It is pricey because it is in Hoboken, the setting is nice but the food is not great.The cheese platter was good but the waiter didnt even know what cheeses came with it.    My steak was over cooked and probably choice.Ok, so here is the breakdown, setting is very French, the staff is not informed to say the least.  Also, the prices higher than they should be considering the food quality.  The atmosphere is cool but overall a 2.5...I have been many great French places, including: Le Cirque, two greats in Vancouver: La Crocodile and Lumiere(which is not what it used to be after Rob Feenie left).",Elysian Cafe,3.5 star rating,$$,"American, (New),, French,, Bars"
222,xyeBTa1du0GZ92UtC_BlMg,Taryn C.,2.0 star rating,"I'm still pissed off over New Year's Eve plans here from like six years ago.  I am not one for doing NYE up, but I felt like going out and celebrating, so my SO and I went, got dolled up and we had made reservations at Elysian a few weeks in advance.This place is where I decided that prix fixe NYE meals is just a rip off and that I will never ever go again.  No matter where.  Anyway, we paid something like $35/head but the kicker was that it was that we couldn't get the closer to midnight one (seating at 9:30 pm) so we opted for earlier seating (like 7:30 pm).  They made it clear no alcoholic beverages were included in the price, which was more than fine.  My SO didn't drink anyway.  I just wanted a glass of champagne. Here's the kicker though - soft drinks weren't  included either.  So if you wanted seltzer water - $3.  Two coffees?  Extra.  Soda?  extra.  It just absolutely killed me that they nickel and dimed EVERYTHING.  So by the time all was said and done, it ended up being $60/head on average.Oh but that wasn't all.  The food was absolutely disappointed.  Like ""braised short rib?""  Yeah, if I wanted beef stew I would have just gone to my mom's for NYE.  We ordered a shrimp cauliflower bisque as our appetizer...it was 2 pieces of SMALL shrimp (to their credit, not ""baby""), with a cauli puree over it.  I was all - what?  And the dessert was a chocolate peanut butter tart, which was a fancy phrase for ""Giant Reese's Peanut Butter Cup.""The best part?  After all was said and done?  As we walked home, I turned to my SO and said - are you still hungry?  He nodded emphatically.  We had to get Benny tudino's to go on the way home!  Ridick!  Spending $120 on overrated food and beverages (regardless of whether they were ""adult"") and then have to get pizza.  Yeah, I lived near Elysian for three years, and it left such a bad impression on me, I never returned.  I also made it a point the next year to just skip the hullabaloo and order from Benny's.  Now I just make my own dinner that night.",Elysian Cafe,3.5 star rating,$$,"American, (New),, French,, Bars"
223,TRgnYnm64N3OOqBpbxPrAQ,Chris V.,5.0 star rating,"Why have I not reviewed Elysian?? The better half of the duo and I had lived across the street for years and have always made it our stop. Never a bad time, always a good drink -- Bubba, Josh ... even Aimes, most of the time -- you can not go wrong :)  So what if you had a bad burger one time here ... it will be fantastic next time. A talented kitchen makes it happen on a regular basis. I have sat in this restaurant countless times and still find new details that map me smile ... truly a great spot on the desolate crap-scape that is Hoboken restaurants.",Elysian Cafe,3.5 star rating,$$,"American, (New),, French,, Bars"
224,NkUWBDpJl0AnAy8vCiWiTA,Honest B.,1.0 star rating,"Unless forced by aliens, I would not return to this restaurant.  I went there for dinner with a friend of mine on a Friday night.  I ordered the short ribs, she ordered the steak.  Neither of the meals were cooked properly.  My beef was full of fat, the onion rings were covered in oil, and the mashed potatoes had so much gravy on them that they lost their flavor.  McDonald's probably cooks with less oil than this place.There are PLENTY of other restaurants in Hoboken that offer better food and service for the money spent on mediocre food.",Elysian Cafe,3.5 star rating,$$,"American, (New),, French,, Bars"
225,Y1LxIDD0VMpY-L2T_EM8LA,Leslie B.,4.0 star rating,Service was excellent. Chicken Caesar salad was ok - dressing was tasty but the chicken seemed reheated.  French fries and croque Monsieur was great! Lovely little restaurant. Would definitely try brunch here as I hear it's wonderful.,Elysian Cafe,3.5 star rating,$$,"American, (New),, French,, Bars"
226,gflGmkOSPxb7j2bKAJZ_5g,Andy P.,4.0 star rating,"I lived on this block 20 years ago.  I wish this place had been around back then.  What I like:Their happy hour, featuring 2 for 1 entrees from the bar menuCarlton 077XX IPA on tapTheir burgersThe lovely people from the neighborhood sitting at the bar with meWhat I didn't like:The somewhat unfriendly and unattentive bartender (a big, doughy, twentysomething kid)This bartender's awful music playing from his iPhone.  We are talking the hoariest of classic rock songs.  Like Kansas.  Yuck.But I'd go back for the burgers and Carlton IPA. :)",Elysian Cafe,3.5 star rating,$$,"American, (New),, French,, Bars"
227,sU_QYGupm7VTy8xoQxtAbg,Rockstar N.,5.0 star rating,Great bartenders casual yet from atmosphere excellent food. And live music on Friday and Saturday evenings. You can't lose!,Elysian Cafe,3.5 star rating,$$,"American, (New),, French,, Bars"
228,wTukN5Gj5-EuzorcFp0rrg,Jeff G.,5.0 star rating,"We stopped here randomly while visiting for a day. The decor was from another era - very 1930's France with marvelous ceilings and light cascading in from the windows. We had excellent French Onion soup, very decident Mac and cheese and some of the best corned beef hash I've ever had on a Ruben. Would highly recommend. Good outdoor seating, too.",Elysian Cafe,3.5 star rating,$$,"American, (New),, French,, Bars"
229,ULCaKmHljtOBxgIIYnOGVA,Emily G.,3.0 star rating,"I moved to Hoboken about five years ago, and had always been curious about Elysian Cafe.  The outdoor patio looked particularly inviting, and there never seemed to be an empty table whenever I would walk by.  My boyfriend and I were eager to give it a try, so we brought our healthy appetites over to Elysian for brunch.  Our server was friendly, and the steak and eggs were cooked perfectly.  So far, so good.Given how much I'd enjoyed my first experience at Elysian, I decided to put their dinner menu to the test.  I was just as impressed with their dinner selection as I was with their brunch menu - the steaks and truffle fries were delicious, and I ended up pairing the experience with a nice glass of wine and dessert.  It was surprising to see that they were just as busy during dinner as they were during brunch, as in my experience most restaurants only specialize in one meal.With that in mind, my boyfriend and I decided to stop by for lunch on his birthday.  What better way to celebrate?  Unfortunately, this is where Elysian fell short on its offerings.  We ordered a grilled chicken sandwich and a burger, which were both mediocre at best  --  and it didn't help that a baby at a nearby table vomited all over herself (and the table, and the floor).  Not really what comes to mind when you're looking to celebrate a special occasion!  The family was scrambling around to clean up, but I didn't see anyone else rushing over to help them.  I would have at least expected a manager or server to apologize for the disruption, but we were left to ourselves.That being said, I would still return for brunch or dinner...but I'm removing two stars for the disappointing lunch experience.",Elysian Cafe,3.5 star rating,$$,"American, (New),, French,, Bars"
230,5rL4OuhdE_ybWSzCvTWOPA,Rosie C.,4.0 star rating,"Here's a tip, fellas: girls LOOOOVE the Elysian Cafe. I don't know what it is--maybe the combination of fancy woodwork with modern elements, the neighborhood atmosphere with elevated food, or the cozy lighting and friendly staff--but every girl I know has fallen in love on the first visit.I tend to go on Monday nights for the two for one bar menu. Love the mussels and fries!",Elysian Cafe,3.5 star rating,$$,"American, (New),, French,, Bars"
231,vV9lIhAfa1KEkJxi-c4ISg,Cathy S.,1.0 star rating,I went into Elysian Cafe today for lunch with four of my coworkers. We had never been here before so we decided to try it out . We were initially greeted at the bar by the bartender who threw out menus at us like if we were a bother to him for sitting at the bar . After ordering one of my favorites Stella Cider I continued to order my lunch. The bartender looked at us terribly with an attitude that I could not describe . I didn't understand what the problem was . I didn't want to stay there but our lunch break was beggining to cut short . My check came out to 14 dollars . I usually leave 20% or higher. I left him 5 dollars and left . He didn't deserve a tip at all after the way he treated us. I will never come to this establishment ever again.  Please find more personable servers and bartenders .,Elysian Cafe,3.5 star rating,$$,"American, (New),, French,, Bars"
232,a8Q7h6C3J48DMkLYZgGGwQ,Tom K.,1.0 star rating,"Went here for Sunday brunch with my girlfriend. It took a long time to get our order taken. I got the Croque Madame and she got Steak and Eggs. We waited about 30 minutes for our food to come out, and when it did, it was room temp. My sandwich could have been thrown together in a college dorm room, there was really nothing interesting or delicious about it. The french fries were literally MacDonald's fries, maybe even a little worse. My girlfriend's steak was tiny and well-done, even though she asked for it to be cooked medium. The potatoes that came with her meal were soggy and room temp, and there was only a small pile of them on her plate. We were still hungry when we left. Brass Rail is way better, we will not be back.",Elysian Cafe,3.5 star rating,$$,"American, (New),, French,, Bars"
233,_CDgCBwNa0wLSdKoaHouRg,Nico L.,4.0 star rating,"Always a line for Sunday brunch! Plan accordingly.If you don't mind the servers butchering the French language, but serve VERY tasty meals, then come here (at least for brunch).A little pricey for special brunch drinks, so steer clear unless you want a mimosa. Very cramped as well, though it may change when it's warmer outsideI had the steak and eggs... damn good steak and VERY GOOD MUSTARD. The bacon on the side is hard to top as well. All in all, if it weren't for the wait and the pronunciations, I'd say it was perfect.",Elysian Cafe,3.5 star rating,$$,"American, (New),, French,, Bars"
234,5CHfemFzq-7mL9b3Ng9HrQ,Foodie F.,1.0 star rating,"Went today had the Lobster roll. It tasted and smelled fishy.  It had lettuce and tomato I thought that was strange. Also the bread was not toasted nor did it have mayo.  It was so bad I could not eat it after just 2 bites. The arugula and fries it came with was good. Had creme brûlée the shell was perfect, unfortunately the creme part was eggy.  Safely I would not go back.",Elysian Cafe,3.5 star rating,$$,"American, (New),, French,, Bars"
235,wP8msNqrLrwtLEiydDUfxg,Francesco M.,3.0 star rating,"I guess you can say this was a ""pleasant surprise"". We actually didn't know anyone who had heard of Elysian Cafe but wanted to go to Hoboken and basically stumbled on the place. Typical American bar setting. Dimly lit, small tables (a bit cramped especially when servers are taking orders next to you). But all in all, just basic food done well. French soup was legit (my girlfriend is a pro!). I had the Lobster Roll which was really good as well. Nice spot, nothing crazy, but would definitely go back.",Elysian Cafe,3.5 star rating,$$,"American, (New),, French,, Bars"
236,XXXwNcsF3AlpMX44jw8_CQ,Natalia B.,5.0 star rating,"This place reminds me of Cafe de Flore in Paris. In fact, every time I come here, I do not want to leave! Maybe it is the ambiance, with stained glass windows, damask-style wall relief, and their mahogany bar, what is not to like. I am certain the owner takes great pride in every detail they chose for this place - this intricacy is reflected in their food as well. Take their french onion soup, my brother tried this dish from every restaurant we went to in Montreal, then we came to Elysian and he exclaims it is the best he has ever had. Is it the broth, the crostini, or the cheese, I will never know. Yet, it is now six months later, and he still cannot stop talking about it. This is my favorite brunch in Hoboken, hands down. I think it was the fromage omelet that did it for me, but then there is also the salmon benedict. No, definitely the cinnamon-amaretto french toast. See, as I am recollecting all of this I am making myself hungry at 10:50 pm - now imagine yourself  ""unwinding"" from a great Friday night here. You may not even speak a word of French, and suddenly you will find yourself OOoouuu-ing and AAAahhh-ing. But be careful, there will be children in strollers around, so do try to be discrete about it. Honestly, I cannot think of a single reason why I have not come here for dinner. I bet it is just as good if not better than the brunch/lunch. This just reminded me to do just that!  This is owned by the same people who run Amanda's (and I've had dinner there) - I know I will not be disappointed!",Elysian Cafe,3.5 star rating,$$,"American, (New),, French,, Bars"
237,reeG1ReoKRcH7qvh1Zw-_w,Judy C.,4.0 star rating,"I can only speak for the weekend brunch here. Thanks to fellow Yelpers, we chose Elysian Cafe to meet for a Sunday brunch. Charming cafe on the corner of Washington Street, it was great for us to sit outside to enjoy our meal. We met up quite late around 2 PM, so there was no wait at that time.Service was good as I arrived late and ordered my food after my friends, yet I received my dish minutes after my friends. Coincidentally, 3 of us got the Cinnamon-Amaretto French Toast with a berry sauce.  No complains about the toast.  My other friend had the burger, and he seemed to enjoy it.Definitely a spot to consider for a nice Hoboken weekend brunch.",Elysian Cafe,3.5 star rating,$$,"American, (New),, French,, Bars"
238,nSH8j0-yNoUgVFkXVXpufg,Lisa V.,5.0 star rating,"This is, hands down, our favorite place in town. Delicious food, friendly staff, comfortable atmosphere. Great seafood, delish steak frites. The owners have two other nifty places in town too: Amanda's, for fancier occasions, and Schnackenberg's luncheonette for breakfast and lunch. The doughnuts at Schnackenberg's  are out of this world, and go there also to see the awesome mosaic made of tourist plates.",Elysian Cafe,3.5 star rating,$$,"American, (New),, French,, Bars"
239,rKLnRoWpzSDVuetgXNQJ9A,China D.,4.0 star rating,"I absolutely love love love the bar menu here. Cute old fashioned french bistro feel to the interior and lots of outdoor seating. Their cocktails are strong and definitely worth the splurge. Everything on the bar menu is fairly priced and their french fries remind me of gourmet mcdonald's fries (in the best way possible, thin and extra salty). I got the pulled pork sandwich as usual and it was so overflowing i had to eat it with a fork! Love their coleslaw too. Their wait staff was very polite and quick with the orders, i will be coming back!",Elysian Cafe,3.5 star rating,$$,"American, (New),, French,, Bars"
