,user_id,user_name,user_rating,user_text,restaurant_name,restaurant_rating,restaurant_price,restaurant_type
300,egnNuORhWl3cB0oRhVKPlQ,Jennifer R.,3.0 star rating,"Elysian has been on my Hoboken ""restaurant list"" for quite some time now, so when the opportunity to have brunch here came up, I jumped on it. We went on a very hot day and opted to sit inside in the air conditioning. We were seated across from the bar with a very narrow walkway between the table and the bar. We felt like we were on top of the people next to us, and my boyfriend had to keep moving his chair anytime someone wanted to get by. It definitely ruined the experience a little. Now, onto the food and drinks. I ordered a bellini. It was really small and had an odd aftertaste. I ordered the egg white omelet for my meal. It was excellent! It definitely made up for the drink and odd seating arrangement. My boyfriend felt the same way about his chicken sandwich.I would like to give Elysian another try for their dinner, and hopefully we won't be seated in the bar area next time!",Elysian Cafe,3.5 star rating,$$,"American, (New),, French,, Bars"
301,SFVGdfRcxHBkc6kzIZ8r-g,Kevin W.,4.0 star rating,"Elysian is one of those ""go-to"" neighborhood spots.  Its easy and convenient and the food is good to very good most of the time.  The bartenders in particular are very good especially Tommy.  The outdoor seating is great.Stand out items include the calamari salad, cod with basil risotto, and fish tacos.  Brunch is just Ok but pretty cheap compared to other Hoboken spots so bonus there.",Elysian Cafe,3.5 star rating,$$,"American, (New),, French,, Bars"
302,TerJjrDLO7qQhLQJfMPY6Q,Jeff F.,3.0 star rating,Headed into the Elysian for a late lunch today. I was really impressed with atmosphere and the history (even if they're embellishing a bit). This is definitely a cool spot to check out if you want to take someone or meet a group some place interesting in Hoboken. The food is just ok - Chicken sandwich w/ fries and the Spaghetti Bolognese I tried was just average. Worth trying though - service was spot on.,Elysian Cafe,3.5 star rating,$$,"American, (New),, French,, Bars"
303,sXfAk-IEXOzT0SkxwEKkng,Ginger V.,5.0 star rating,"Exactly what we were looking for! We were in Hoboken for the afternoon so we strolled the main drag and decided this spot looked promising. What a great find! The best BLT I've ever had - thick bacon with little fat, roasted tomatoes, avocado and presented stacked with piping hot and crispy fries in a rustic metal cup. Totally enjoyed with a Stella on tap. Friendly service - all was just right!",Elysian Cafe,3.5 star rating,$$,"American, (New),, French,, Bars"
304,aymY2mcJqghOrmrjj2upXQ,Courtney W.,5.0 star rating,"I went for mother's day and had an amazing time. Even though we were super late for our reservation, they were really cool about it. The decor and our waiter was pretty cute. My salmon with sauteed spinach was cooked perfectly. I believe it's the perfect first date place. Now all I have to do is find a date..",Elysian Cafe,3.5 star rating,$$,"American, (New),, French,, Bars"
305,Tp03PbjV9mLV_uMo88CL0A,Jeremy W.,4.0 star rating,"Shocked I haven't dropped a review on here yet, but in listing the town's best bloody mary, I couldn't leave Elysian out of the mix!  Great brunch with delicious pancakes, french toast, fresh fruit...everything is excellent, but the companion drink for $3.50 is a great deal and a great way to start the morning.Lunch/dinner never dissapoints with a great French/American menu, solid service, and sometimes even live music.  Any time of day, this is a classic place with great outdoor seating that will never let you down.",Elysian Cafe,3.5 star rating,$$,"American, (New),, French,, Bars"
306,x9WTPvd8_Bg8F-_vXoNDcQ,Gregg H.,1.0 star rating,"Overall, the food was good and the service was fine. Would totally have gone back and gave it 3-4 stars.  However, while sitting outside I noticed a fly in my beer I was drinking. I told the server and he got me a new beer. When the check came the beer that had the fly on it was on the check. I thought it was a mistake but he said it was not but he would get the manager. I have been to plenty of outdoor bars and I would always get a comp beer if a fly was in it. The manager came as was extremely rude. He told me that I was sitting in nature and that he could not control if a fly went into my beer. The way he talked down to me was unacceptable. he could have much better explained the situation instead of just telling me that ""it is nature"".  As a result I will never go back to the restaurant not because they would not comp me the beer but rather, the rudeness of the manager.",Elysian Cafe,3.5 star rating,$$,"American, (New),, French,, Bars"
307,OLuar_HGSTvZdkAOYVJcHQ,David C.,4.0 star rating,Hit up this place for brunch and the pomme frites does not disappoint! Has a nice outdoor cafe section which is perfect for summer/spring dining. Do yourself a favor and hit up this joint too. You may find me eating next to you!,Elysian Cafe,3.5 star rating,$$,"American, (New),, French,, Bars"
308,2QGh8MSVR4f_0VTughs8Qw,Michaela W.,4.0 star rating,"Elysian Cafe is our go-to lunch/brunch/dinner spot in Hoboken.  Why? Food is always consistently fabulous, you don't need reservations, and it has a casual but hip vibe.  Without a question during the summer you must dine al fresco on their patio.  I have tried just about everything on the menu, but my favorite dish is the Caesar salad with grilled shrimp.  The dish is large enough to share, is perfectly dressed and comes with a healthy portion of jumbo grilled shrimp and two anchovies.  One of Hoboken's bests - highly recommend!",Elysian Cafe,3.5 star rating,$$,"American, (New),, French,, Bars"
309,YA60zHiMZmgNZ8WFKGzGRA,Ahmad M.,2.0 star rating,"Very overrated and overpriced as a restaurant, but probably okay as a bar with food.We ate outside and the waiter kept going missing or messing things up. The food was only okay, and there was part of lobster shell left in the lobster sandwich. I was lucky not to choke. When i showed it, they offered a free dessert, though we were not planning on dessert.Friends tell me Amanda's is the place to eat, while Elysian is for the bar, and they are owned by the same people. My experience is that they are right that Elysian is not somewhere for fine dining, though they try to charge those kinds of prices.",Elysian Cafe,3.5 star rating,$$,"American, (New),, French,, Bars"
310,oj2Jxn-qbozaGMM4yd63xQ,J ..,1.0 star rating,Slow service. Staffs are unfrieny and even racist. Ordered 2 draft beer and took 10 minutes.  Never go there.  You will be disappointed for sure.,Elysian Cafe,3.5 star rating,$$,"American, (New),, French,, Bars"
311,wHrI3tMiIPyxV3PZKp5sGQ,Brian K.,2.0 star rating,"I've been here 3 times and really wanted to like it.  The service has never been more than mediocre and I've never left happy with my entree choice.  There are too many restaurants in Hoboken to settle here for dinner.On the upside: when its nice out, their outdoor seating is great.",Elysian Cafe,3.5 star rating,$$,"American, (New),, French,, Bars"
312,2C6T0ckyROuo2kyo6-pLFw,Brian M.,2.0 star rating,I came with my wife and son for brunch..wait was about fifteen minutes..not bad..it was packed..waited for an hour for our food..my steak on my steak and eggs were overcooked..i expected more from this restaurant...smh,Elysian Cafe,3.5 star rating,$$,"American, (New),, French,, Bars"
313,cT4roxE4zzSOwfOAuF0PJw,Anthony L.,5.0 star rating,"It looked as though this place was going to be crazy getting into, but I got a seat in less than a minute. Great atmosphere, music, staff, and food!",Elysian Cafe,3.5 star rating,$$,"American, (New),, French,, Bars"
314,h1ca-TSzTE0IV_zQ7JKRgA,Erin J.,4.0 star rating,Cute little spot with outdoor seating that is perfect in the summer. Well priced wine list with a few great rose options. Enjoyed the short rib entree. Would definitely return.,Elysian Cafe,3.5 star rating,$$,"American, (New),, French,, Bars"
315,4Pp1NdLWPg4EIPchw-gV6A,Adam K.,4.0 star rating,"This review is a two'fer.  First brunch, then dinner.Brunch:  Went here a few weeks ago for brunch and forgot to write a review.  Got an omelet (i forget what it was, but it was fancy.  I think goat cheese was involved) and homefries.  Both were fantastic, although I feel like they kind of skimped on the potatoes.Dinner:  Amazing.  I got the mussels with fries for $14 from the bar menu.  They were fantastic.  I will be going again soon to get more.  The fries here are absolutely fantastic.  I don't know what they do to them, but they are great.  The mussels were also phenomenal and some of the best I have.  Did I mention how great the fries are here?",Elysian Cafe,3.5 star rating,$$,"American, (New),, French,, Bars"
316,M-SGIyduWocSC1g9ocfsaQ,Dominick Q.,4.0 star rating,"Lived in Hoboken (1st and Garden) for 5 years, and because I was unwilling to schlep my lazy behind a measly 9 blocks uptown...I missed out on a solid go-to dinner spot for those ""nicer than casual"" but ""not too stuffy"" occassions.Elysian has an old-world feel to it in an authentically cozy (not antiquated) way.  Upon further research, this place was originally built as a bar/restaurant in 1895, and then turned into an ice cream parlor during prohibition.  Seems like quite the transition...kind of like the direct opposite of Bob Saget's career.  I did dinner here on a Thursday night.  The shrimp romesco appetizer was tasty, if not unspectacular - 4 big shrimp for $12.  The grilled sirloin salad (a bargain at $16) was over-sized and delicious.  But then again, I think nearly anything with spiced pecans is delicious (that goes for carmelized walnuts as well).The service was very attentive and friendly.  When my Italian friend (read: talks with hands flailing everywhere) knocked her glass of Prosecco over, our waiter was quick to clean off the table, put down a new table sheet, and cracked a few jokes at her expense (to which I laughed harder than I should've).  Biggest drawback is the acoustics.  You can clearly hear conversations going on 3-4 tables over.  So save your raunchy game of Truth or Dare for your next destination.",Elysian Cafe,3.5 star rating,$$,"American, (New),, French,, Bars"
317,PiP3CRbflfnAWkZrJu2mug,Marc G.,3.0 star rating,A neighborhood stalwart.  Good food on the bar menu (which you can order anywhere).I recommend going on a Monday night where you can get 2 for 1.Skip steak night on Wednesday- meat was tough.My lady really likes the cocktails and the fried calamari salad.,Elysian Cafe,3.5 star rating,$$,"American, (New),, French,, Bars"
318,lYRuIOPSlHzfQzvgTLYJuw,chris g.,4.0 star rating,"While you wont get anything new and exciting at Elysian, the food is consistent and well priced. I have been here many times and would go back anytime.",Elysian Cafe,3.5 star rating,$$,"American, (New),, French,, Bars"
319,yzn3mTJJUiJyyeAB8CkEKQ,Sean R.,5.0 star rating,"Pat yourself on the back Elysian Cafe you just earned yourself a spot at the top of the famous ""Gems of Hoboken"" list!  The food here was great, the service was snappy, the decor is awesome and its the oldest restaurant in Hoboken.  My gf and I split the mussels and smoked salmon club from the bar menu and both were banging.  I was not very impressed by the pomme frites though, they taste exactly like McDonald's fries (which are great, but not what I want when I am looking forward to pomme frites). Definitely check out Elysian Cafe if you have the chance!",Elysian Cafe,3.5 star rating,$$,"American, (New),, French,, Bars"
320,HIm8-TcKyjCH_YI_vKjMDQ,Jami A.,3.0 star rating,"I had been dying to try Elysian Cafe out for a while so when the opportunity to head to brunch came up I couldn't turn it down. I think the selling point for this restaurant is its  outside seating. Yes, plenty of places have outdoor seating but there'r something different about this place. Maybe its all the greenery I don't know. I wasn't overly impressed with the menu. It didn't seem overly ""french"" to me but overall my meal was good and priced well. Happy to go back but what french place doesn't have escargot on the menu? I mean really though.",Elysian Cafe,3.5 star rating,$$,"American, (New),, French,, Bars"
321,fmU6H_OSNqkPEz5MOkOc0w,Ilona Ioanna G.,4.0 star rating,"I love this place. Walked by it a thousand times without ever coming in, I regret it now. Very interesting interior design, antique ceiling. Casual, great atmosphere with nice music in the background. Their portions are huge, so be prepared. But food is delicious, so I am sure you will be more than happy with portion sizes. For the appetizer we ordered their Mussels in white wine sauce, and I think they beat any mussels I tried before, or after for that matter! Make sure to ask them for a spoon, because you sure would want to drink that white wine sauce! 1 portion is good for 2 people. For the mains, I ordered their crispy calamari salad, and my brother ordered their famous Pastrami Reuben. I enjoyed my salad very much, but once I tried Pastrami Reuben I was simply blown away. Juicy, tender, flavourful and absolutely delicious! A must try for pastrami fans! It is a little too crowded, but I guess that speaks of the quality of their food =) Overall, a great experience!",Elysian Cafe,3.5 star rating,$$,"American, (New),, French,, Bars"
322,1-vov-NZWUFbE3PTcGLYLA,Brian S.,3.0 star rating,Great outdoor patio and brunch. Service always pleasant.  Pomme frites very tasty.  Food overall is just above ok.,Elysian Cafe,3.5 star rating,$$,"American, (New),, French,, Bars"
323,jbkqP6a0EWwM3n_qYqArDw,Rosalia F.,1.0 star rating,"Worst customer service, even called the manager to go over a bad experience he never called me back after he said he would follow up. Hostess is in her own world, cramped seating and the most overlooked bland menu in town makes Little Town look like the Lambs Club. Never coming back again.",Elysian Cafe,3.5 star rating,$$,"American, (New),, French,, Bars"
324,AwLjkYw8Y9wI76wVn1X1-Q,Claudio M.,5.0 star rating,"I can only speak about brunch, which is awesome with very cheap drinks and food, eggs Benedict are $10 which include French fries. I also tried the amaretto French toast very good! Service is slow but I don't mind. The cafe is one of the prettiest I have seen, read the story on the back of the menu",Elysian Cafe,3.5 star rating,$$,"American, (New),, French,, Bars"
325,8_iEYlKofnZGit78Tb9Sig,Courtney S.,5.0 star rating,"By far, my favorite brunch place in Hoboken.  Their food is great for a Saturday or Sunday brunch, especially in the summer/warm weather because they have a fabulous outdoor seating area.  Their brunch menu has both breakfast and lunch selections and their bellinis/blood marys/mimosas are all around the $4 range.  Who could ask for more?I've never been here for dinner, but I've heard it's good.",Elysian Cafe,3.5 star rating,$$,"American, (New),, French,, Bars"
326,QJ6S_32aRmNgyBnj_tMS5A,C. K.,4.0 star rating,"I enjoyed a lovely brunch here with my husband and one of our best friends last week. While they don't have an extensive menu, they had a good variety of choices in their brunch menu that will satisfy someone looking for either breakfast food or a lunch dish. My chicken sandwich was excellent. The service was good,  and the wait wasn't too long, even though it was really busy. Also, the menu items are very reasonbly priced. I would recommend this place for a nice lunch in Hoboken.",Elysian Cafe,3.5 star rating,$$,"American, (New),, French,, Bars"
327,3jrnezLoqVA4cI7Fjl_VdQ,Vanessa P.,3.0 star rating,"Sooo....from the outside it is super cute and inviting! I would definitely go back to enjoy a glass of wine (& maybe an appetizer) outside in the patio. The food was good but nothing to rave about. I got the smoked salmon club and not impressed. Also had the mint chocolate chip sundae with Oreos and it was good, but not $8 worth of goodness. So in the end- would i revisit? Short answer, yes but only for a drink and maybe app.",Elysian Cafe,3.5 star rating,$$,"American, (New),, French,, Bars"
328,So5DFW-1kKvnhOZJldXPEw,Heather L.,5.0 star rating,Awesome brunch! Very cute little cafe on the main drag in Hoboken... Close proximity to the water/NYC view and lots of window shopping nearby. I had the eggs florentine with french fries and a bloody mary & my friend had the eggs benedict with roast potatoes and a mimosa. Everything was fantastic!!! And sooo inexpensive for the area. I will def go back!,Elysian Cafe,3.5 star rating,$$,"American, (New),, French,, Bars"
329,EreDviInDBQYaOvFfyYHlQ,V P.,5.0 star rating,"Was on my way to Max's up the block. Just note they are not open for lunch. Thank God this place was and I was pleasantly surprised. American fare with a French touch. Ate outside to welcome the spring feel. Imagine a cross between Paris and Hoboken. Perfect way to describe the feel. This is place is away from the hustle and bustle of lower Washngton St. so eating near the street was very peaceful. Food was impeccable, sipped wine like a hipster Hobokener should. Man what a way to relax. Great service, reasonable prices for lunch. Can't name a single flaw. This will be one of my favorite chill spots.",Elysian Cafe,3.5 star rating,$$,"American, (New),, French,, Bars"
330,sm2ZVVC4bhmpR3sIS_czRg,Neil M.,4.0 star rating,"Come here for lunch frequently and love the grilled chicken sandwich with side salad. Have never ordered anything different so can't comment on that. Service is usually pretty good and like the decor. Being able to sit outside on nice days is also a major plus. Look forward to coming back again for yet another chicken......yes, i am boring.....but content.",Elysian Cafe,3.5 star rating,$$,"American, (New),, French,, Bars"
331,K4EVY5uIHdfIH3uJA14UJA,Andre P.,5.0 star rating,"This is possibly the cutest French bistro in Hudson County!  And the food is great too!Very welcoming and while from the outside it looks like a brunch place, it's great for any time of day: enjoy a early afternoon cocktail outside on a lazy day; get a draft beer at the bar while waiting for friends; eat lunch, brunch or dinner in either of the rooms; or simply enjoy a cocktail and an app in the main room while reading a magazine at 4pm.  Soak in the Frenchness!Portions were perfect: not too big and not pretentiously small.  True to the French bistro discipline, you will not be disappointed.  Wine is served in 6 ounce, 8 ounce or 75cl bottle sizes.",Elysian Cafe,3.5 star rating,$$,"American, (New),, French,, Bars"
332,4ZLRkcFFo-pCMpYYa4m-Zg,Mia O.,4.0 star rating,"Came here a few weeks ago with my boyfriend on a friday night.  we didnt have a reservation and we were able to be seated within 5 minutes.  It was packed, and now i  know why! The muscles were fantastic and My bofriend loved his salmon.  The bruschetta pizza wasnt to brag about but now i know what to order there. My bloody mary hit the spot too! Every friday there is a live band and i have to say the guy we saw was great! definitely sit in the dining area, great lighting and vibe.",Elysian Cafe,3.5 star rating,$$,"American, (New),, French,, Bars"
333,g3PhDxKiY8IpjmuhCfbg7w,Dawn O.,5.0 star rating,"Great local establishment with a gorgeous ceiling! The staff is friendly and the food is right on! Extraordinary chicken club sandwich and side salad with fennel.  Really love the decor and ""everyone knows your name"" atmosphere!",Elysian Cafe,3.5 star rating,$$,"American, (New),, French,, Bars"
334,EIOKEQihGX-nqm9gXVJbpg,Conny L.,5.0 star rating,"MUST GO PLACE...  My family love love love this place.  Love the the historical decor, the service, atmosphere and the food is DELICIOUS.  Love eating inside and outside on a spring morning.  Great place to have mimosas with the girls for brunch.",Elysian Cafe,3.5 star rating,$$,"American, (New),, French,, Bars"
335,91ITrAaW5pdqi2pkTjPx1g,Ellen L.,5.0 star rating,"This is one of my most favorite places to make plans to go for brunch in Hoboken! Every thing on the menu is very good and the ambiance is very classy, but not too pricey.Every one of my friends I have taken to brunch here all remember Elysian Cafe as the go-to place for brunch in this city!",Elysian Cafe,3.5 star rating,$$,"American, (New),, French,, Bars"
336,dtgSt7E0KU3rMBuuqQ0YJQ,kay b.,4.0 star rating,"So I love this place for it's architecture with opulant crown molding, gorgeous wood bar, subtle lighting. I'm not very keen on the crowd of undiverse young professionals, so I'll sneak in on a weekday early evening, order my lobster roll & garlic fries. With a meal that delicious, I can eat with a friend of mine and we'll mutually gorge w/ buttery rolls, arugula, a rib eye or some rich mussels. This is my usual routine and I like it best when the restaurant is low key, low pretention. The food is fancy enough, the service is thoughtfully quick and the over all tone can be obnoxious with questionable live music or with easy jazz in the background. Don't expect a diverse clientele, as Hoboken is limited in that arena especially for this price range. Food is solid and tastes better when you bring solid company. The wallet will stretch, but the portions, extensive bar menu, and service ease your spending just a little bit.",Elysian Cafe,3.5 star rating,$$,"American, (New),, French,, Bars"
337,QR_0XC06L6ZIEPAJKX3h5A,Marcel B.,4.0 star rating,"Nice place for brunch. Menu is fairly limited, but the food is excellent.",Elysian Cafe,3.5 star rating,$$,"American, (New),, French,, Bars"
338,CYh1ZGckBa17S2fkz9kaeA,Ryan S.,4.0 star rating,"Went here for dinner with some family, and it was a good choice (especially cause it's a little pricey). This place would probably get 5 stars if it was a little cheaper.I got the steak and fries, and dear god was that a phenomenal decision. I ordered the steak medium - probably got it closer to medium well  - and it was very, very tasty. The steak juices dripping all over the fries made the fries taste just that much better.I'll come back, but I'll come back during one of their happy hours. If I'm not mistaken, I think it's 2 for 1 meals on Monday nights at the bar. That's a good deal for a place as good as this.",Elysian Cafe,3.5 star rating,$$,"American, (New),, French,, Bars"
339,aR8L-VbmDdtFlLBgyYkFOg,Liz D.,4.0 star rating,"One of our favorite places in Hoboken, we do live 2 blocks away!  This place is gorgeous and has a lot of character.  The service is pretty good.  It definitely depends on who is bartending as to what type of service you get.  Some people just want to be there more than others!  Food is always very good, I recommend the vegetable sandwich!  The outside seats are great for warmer months!",Elysian Cafe,3.5 star rating,$$,"American, (New),, French,, Bars"
340,hQB7DwmxMaMVjxBDp_F-vQ,John S.,4.0 star rating,"This place has become our neighborhood ""go-to"" spot. The food is excellent and the service is usually very good. I definitely recommend the burger, but I have not ordered anything that was not very good. The garlic fries are amazing, as is the steak au-poivre.",Elysian Cafe,3.5 star rating,$$,"American, (New),, French,, Bars"
341,80bVG1kmDK01Tb8BUaGi8g,Kristen B.,5.0 star rating,Ate here for dinner in the back room. The food was delicious and the atmosphere was really cozy. Overall great experience. There entrees are a little pricer but well worth it but they also have a nice bar menu with gourmet burgers and sandwiches that are more reasonably priced.,Elysian Cafe,3.5 star rating,$$,"American, (New),, French,, Bars"
342,ejyQ05B3cWm-xAYxWEbJzA,Bill N.,5.0 star rating,"I attended the whisky tasting last night. Our table was in complete agreement that it was a great evening. The food pairings were spot-on, service was impeccable and the presenter was fantastic. The atmosphere was lively and fun. The timing of the courses was perfect. Can't wait for the Brooklyn beer tasting and the Tequila Dinner.If you're in Hoboken and want to avoid the crowds of 20-somethings, this is the place to go.",Elysian Cafe,3.5 star rating,$$,"American, (New),, French,, Bars"
343,DlZ6Sk7DlKNMxeoXQMQVGw,Meghan H.,4.0 star rating,"great quality food, full bar, beautiful outdoor seating (and indoor for that matter).  loads of menu options and daily specials.  probably one of the most reliable spots in hoboken- this is where i take my mom when she's visiting- she swears by the short ribs.although food isn't michelin quality by any means, the simple menu options are elevated, tasty, and nicely portioned.  the theme is french bistro/ brasserie but hobokenized.  for example, don't expect a real croque monsieur, expect a grilled cheese with ham.  anyway- still good.  drinks are good, too.  as far as service, competent, yet blase for the most-part.",Elysian Cafe,3.5 star rating,$$,"American, (New),, French,, Bars"
