,user_id,user_name,user_rating,user_text,restaurant_name,restaurant_rating,restaurant_price,restaurant_type
35,ud7T58Rnp8iNx6ljj_vXfA,Michael M.,5.0 star rating,Place is legit. Really upset that I haven't checked this out until this weekend. I've been here twice in the past two days. Cheese slices ate $3 - Perfectly thin crust with a really thin layer of crisp that turns to nice tender dough when u get thru it. Sauce is great cheese is really great. Very happy. Also got the monroe- arugula and prosciutto- $12 for a small. Very good as well. I was super hesitant about the pre made slices - after walking by so many places downtown with their dry slices sitting out all day. I was VERY pleasantly surprised. After being thrown back in the oven for the perfect amount of time (time enough to make it hot but not too hot and not burnt). Tasted incredibly fresh. My issue with most other wood fire Pizza spots are they burn the crust. There was minimal char if any....Guys working here are really nice and outgoing.Game changer.,Hot House Pizza,3.5 star rating,$,Pizza
36,fUhiDYlNk1dc_elSOqe5jA,Caroline A.,4.0 star rating,"Like many other Yelpers have said Hoboken is a pizza oasis. There are so many pizza spots that I have YET to try them all, and Hoboken is only a square mile! Hot House Pizza is feet away from our apartment so it's no surprise we've been here a few times now.We got a group of friends together for dinner here the other night. We called ahead to see if they could accommodate a group of ten, and the guy on the phone said it wouldn't be a problem. When we got to HHP the service was phenomenal for dining-in, and of course, the pizza did not disappoint. We got one of each of the pizzas to share (we opted for the small sizes). The margarita pizza and Buffalo chicken might have been my favorites. This place is also BYOB if you dine-in in the backyard space, too.Other times that we've either stopped in for a slice or ordered take out we've ordered their meatball subs, salads and garlic knots, and everything was top notch. If you find yourself near the Hoboken/JC border this place is definitely worth checking out",Hot House Pizza,3.5 star rating,$,Pizza
37,LPwspbX1XdUPduI7dRQvug,Eki O.,1.0 star rating,We ordered Pizza online and after 60 min it still wasn't delivered and we called twice and were promised to receive a call back but nothing. We are still waiting. Tried to give them a chance despite bad reviews but I regret we ordered from them. We could have just made our own pizza.,Hot House Pizza,3.5 star rating,$,Pizza
38,FJzmjmPF1RPd1SbAzbznXw,Varun R.,4.0 star rating,"Good pizza, bad pizza, its pizza! And you know what? Hot House Pizza is one of the best spots to get pizza from in Hoboken. We had the large pie with sausage, peppers and onions and one of the biggest issues that is common with other pizza joints is that they let it stay too long under the heat oven and then all the meats get very dry. Not here! Overall great place for anyone to grab a slice from!",Hot House Pizza,3.5 star rating,$,Pizza
39,DHTiCqyWcxiNvjV61I5AlA,Jana L.,1.0 star rating,I ordered a salad and saw the cook grab the lettuce with his bare hands. I won't be back.,Hot House Pizza,3.5 star rating,$,Pizza
