,user_id,user_name,user_rating,user_text,restaurant_name,restaurant_rating,restaurant_price,restaurant_type
156,yBjtojLu4hx0DR9z9udRhw,Marissa N.,1.0 star rating,"Horrible experience. We went here on a pretty dead Sunday night and the service was horrendous. It took about 15 minutes for a waitress to come over to our table and bring us waters, and another 15 minutes for her to even ask us if we wanted to appetizers. She could barely speak english, and when I asked for two of the rolls for my entree, she had to have another waitress come over because she couldn't understand me. She ended up getting the entire order wrong, and brought out all of our entrees (4 of us in total) about 20 minutes apart from each other. The appetizers were good, but no utensils were provided until after the fact. The sushi was probably the worst sushi I ever had. The rolls were extremely small and tasteless, and the rice fell off the rolls upon picking up the sushi with chopsticks. Also, the couple sitting next to us had both of their entrees messed up and look just as annoyed. I'm not a foodie or snob at all, and am pretty easily pleased when it comes to service and dining, but this was such a bad experience I just had to write a review.",Illuzion,3.5 star rating,$$,"Japanese,, Sushi, Bars"
157,mCdG6wRWr_3i3T1-ti6y8g,Xinyu H.,4.0 star rating,"I ordered veggie udon and it came noodles. Ridiculous. But I was chatting with friends so I didn't bother talk to the waiter about it. The noodle soup is very light, which is good. Entree comes with salad and despite of its pinky color dressing, it tastes good.",Illuzion,3.5 star rating,$$,"Japanese,, Sushi, Bars"
158,pqwe5k1WuTS-KozXq3WKAw,Juliette C.,1.0 star rating,"I normally never write reviews. I just had to for this place.THIS PLACE HAS THE WORST CUSTOMER SERVICE I HAVE EVER SEEN.My birthday was on a saturday night, my fiancé planned a surprise party for me with 15 people. First of all he made the reservation for 6:15, i thought it was just the two of us. We got there at 6:20 and the restaurant called him 8 times, because we weren't there at exactly 6:15. I walk in the door, he had called to tell them earlier it was a surprise. We walk in and they say your late with a big party in the back. THERE GOES MY SURPRISE. They rush us the entire time, they are mean to my guests, they can't even understand what we were saying and got 4 orders wrong. Then they give us the bill and we paid. The waitress comes over to my fiancé and says 500$ bill and only 5 dollars tip? instead of saying the tip is not included. I mean who doesn't include the tip in a group of 15 people. Most ridiculous. I can't. This place is freaking horrible.",Illuzion,3.5 star rating,$$,"Japanese,, Sushi, Bars"
159,rhLaIoHcU86yg0XzLum2Pg,Brian L.,3.0 star rating,"I have been here twice - both times I got the Chicken Katsu.  They give you a good amount of chicken here.  The chicken is tasty, juicy enough.  My wife really likes their chirashi - they give plenty of sushi at a very fair price.  No skimping here!",Illuzion,3.5 star rating,$$,"Japanese,, Sushi, Bars"
160,POV1eyOqjefwH0blR9-Aww,Jesse K.,4.0 star rating,"Never been here but I order delivery from here. They do deliver to Jersey City. It is real expensive but its sooo good so ya gotta splurge once and a while, right? Def my favorite sushi place in Hoboken.",Illuzion,3.5 star rating,$$,"Japanese,, Sushi, Bars"
161,JgstDv24QvCjw8BBwnxfYw,Chris J.,4.0 star rating,"Best sushi in hoboken, that isn't saying much though.  Stay away from tempura, not good.  The sashimi is excellent.  Fried rice is great.  I come here every month or so and always enjoy it because I know what to order.  Delivery is also good, always fast.  Other good items: king salmon, salmon and avocado, sashimi appetizer, all rolls without tempura, miso soup, live scallop.",Illuzion,3.5 star rating,$$,"Japanese,, Sushi, Bars"
162,VYKvDrLJFwC9zGozWS9JOA,Rebecca R.,3.0 star rating,"We went on a Saturday during lunch. They have some really great Bento Box specials, the servers there were super friendly, and we were served in a timely manner. The food was pretty good, but it kind of felt like I didn't need to be in there to eat it. It tasted like you did pretty good at finding a legit take-out place...if that makes sense.Overall, can't beat the prices, so maybe it's just one of those places you have to go to a few times to find ""your dish."" We'll be back.",Illuzion,3.5 star rating,$$,"Japanese,, Sushi, Bars"
163,0CUEtlVdC360S2AoU9ESwA,Julie O.,5.0 star rating,I get take out from here at least once a week.  They deliver so quickly too.  Best rock shrimp I have ever had!I do not care for their ginger salad dressing though.,Illuzion,3.5 star rating,$$,"Japanese,, Sushi, Bars"
164,iiyVtyzds2x1ZqLyMMwE-g,Troy L.,3.0 star rating,Great spot for lunch and dinner. I order the chicken teriyaki over white rice. The food was okay. I heard the sushi portion was big if you are into sushi.,Illuzion,3.5 star rating,$$,"Japanese,, Sushi, Bars"
165,-z_Jbj7TJRQitUAEBTTBBg,Mo P.,1.0 star rating,"I finally found a sushi place I love and then I get harassed about leaving a tip when I order delivery. Mind you I always tip. I spent 5 minutes or so on the phone with a lady that works there trying to first understand what she was explaining to me -- then I realized she was saying I must at least tip $3 to her delivery person. I thought that was rude -- because I always tip at least $3 or more. She went on to explain to me that her delivery person gets mad at her because he will drive outside of Hoboken and some people will tip him $1. That is not my issue. And if its been a issue than include that in your policy that outside of Hoboken there will be a fee. But don't have me on the phone for 5 minutes telling me what I need to do because I am not the person you need to be talking to --- besides who does this to a customer? Not to mention one of their delivery guys set my bag of food on the floor while I signed my receipt!! That was rude and I still gave him a $4 tip. Unfortunately, I will have to tell others not to patronize this place because of its poor customer service.",Illuzion,3.5 star rating,$$,"Japanese,, Sushi, Bars"
166,73FUmQWvrUq8dJHfESiHUA,Rosella M.,5.0 star rating,I've been here a few times and I'm never disappointed! The food is always great and I would definitely recommend the green tea tempura ice cream as a dessert!,Illuzion,3.5 star rating,$$,"Japanese,, Sushi, Bars"
167,AFuPrKXv7s5zRALbe_K5ww,Cheng Z.,5.0 star rating,"ramen is the best in town! And I like its sashimi, I'll say it's the best and freshest sashimi in town. Service is perfect.",Illuzion,3.5 star rating,$$,"Japanese,, Sushi, Bars"
168,QCkxHuPy6ev1XvPjM8rLag,Cody C.,2.0 star rating,"I have been to this restaurant twice. The first time I had a pleasant experience, nothing special except byob. The food was decent, but the service was non existent.The second time I came in I wanted to punch myself in the face for eating the frozen chewy fish they served me instead of complaining. It wasn't all frozen, some of the rolls we ordered were ok, but I have definitely had better.The bathrooms were disgusting as well.I think I will pass on Illusion next time I am looking for sushi in Hoboken.",Illuzion,3.5 star rating,$$,"Japanese,, Sushi, Bars"
169,DJRI0RMJYKyr66mFKjpuBQ,Joshua S.,3.0 star rating,"This is your pretty standard Japanese place with standard Japanese fair.  The high point here is that the quality of the food is good and the fish (sushi and salmon dish) is VERY fresh.  If you are looking for a standard Japanese place, this restaurant will do in a pinch.However, there is nothing about this place that makes me go 'wow'.  I honestly think they could do to lower their prices.  Even if they had to cut down on the number of menu items, I'm sure the quality of the food would more than make up for it.  My big knock against it...overpriced.",Illuzion,3.5 star rating,$$,"Japanese,, Sushi, Bars"
170,vRkR9Q6iusLL1wuPVYPDlw,Richard H.,4.0 star rating,"One of my go-to take-out places in Hoboken.  Generally very fast, and mostly accurate.  Interesting chef's rolls: One Tree Hill & The Clown.  Have also eaten in several times & enjoyed it.  Service is generally prompt & always friendly!",Illuzion,3.5 star rating,$$,"Japanese,, Sushi, Bars"
171,oV2C99bdHMtgaTA4-2qDyA,Stephanie G.,5.0 star rating,"I've visited other sushi establishments in Hoboken since my last update, and honestly, you won't get a better deal than at Illuzion. They recently just expanded their menu so there is a greater assortment of specialty rolls, and I gotta say, they have stepped up their game with the quality of their sashimi (new distributor perhaps?).My boyfriend and I come here so often the owner and waiters/waitresses always have a smile on when we arrive, a nice change from the last few months.Recommendations: anything with avocado is just too good here!",Illuzion,3.5 star rating,$$,"Japanese,, Sushi, Bars"
172,x0wi60ZwchCkrZZCvPYtKA,Aneilia M.,4.0 star rating,"Thank you for brown rice as a swap out! I love sushi but I like my whole grains too. I know, I know they put sugar in the sushi rice but still it's nice to have the option of brown every once in awhile. Food came out pretty quickly but service was slow with the check. Seaweed salad was good and my spicy scallop hand roll was yummy. Salmon roll was ok. Lots of vegetarian and vegan choices if you have the need.",Illuzion,3.5 star rating,$$,"Japanese,, Sushi, Bars"
173,5Yb0ZMXV1g_wAap78UOvvg,Sandra B.,4.0 star rating,"Have dined in and ordered delivery. I tend to stick with sushi and sashimi basics rather than the kitschy crazy rolls. I find the sushi here to very fresh with generous portion sizes. Have tried a few entrees, which are also fresh and well prepared. The udon and ramen bowls are downright yummy - I believe that's the technical term. The prices across the board are reasonable for the quality of the ingredients. Yes, the service is a bit inconsistent. When they're busy it can definitely be tough to get a refill on a water, for instance. Not a deal breaker for me.",Illuzion,3.5 star rating,$$,"Japanese,, Sushi, Bars"
174,aEjxysffyFa2G0v47XZjYw,Gail Anthony T.,4.0 star rating,"I love Illuzion.  Been here a few times already; the most recent, a few weeks ago to celebrate a friend of mine's birthday.  The food is consistently good, the staff very hospitable, and it's BYO F'in B.  I brought a six pack of wine to the party, and ended up ordering the following:- Chilean Seabass cake - good- Soft shell crab appetizer - very good- Tempura dinner - very good (breading wasn't over the top)- Ikura roll - very good- Stir Fry Udon - very good- Spicy scallop roll - good- Yellowtail scallion roll - good- Sashimi deluxe - very good (even came with 5 pieces of chu toro)- Avocado salad - good- Lava cake - very good- Tiramisu - goodEven the clientele are friendly.  My 4-year old son was kickin' it to two girls sitting next to us.  He even gave them a ring pop each, and he LOVES ring pops.  One even said, ""No one's ever given me a ring before!"".  And another customer came by the table to give us the rest of his six-pack of beer because he heard that it was someone's birthday at our table.As you can see, our overall experience on this occasion (and on the previous ones) will tell you why I'm a fan.",Illuzion,3.5 star rating,$$,"Japanese,, Sushi, Bars"
175,_0MaWSdjppdVZLsgqkU9iQ,Moo P.,3.0 star rating,"I just got the worst takeout I've ever gotten from here so I have to vent... I got noodle soup. There is no broth in the soup. Just noodles. It gets worse. The noodles are so overcooked that I'm sure whoever cooked them took a nice long nap and packaged them while sleep walking. No conscious chef would serve this to a paying customer.This place has good ambience (+ 2 stars) but suffers the same problem that every single ""Japanese"" restaurant in Hoboken suffers from- totally inauthentic food that is cheap quality (+1 star for food). This town is too close to Manhattan to be filled exclusively with such boring crappy restaurants.",Illuzion,3.5 star rating,$$,"Japanese,, Sushi, Bars"
176,oaBgJEa3cppN0NKiBh2xfg,Jen S.,1.0 star rating,"I would never go to this place again. Horrific customer service. Walked in and waited 20 minutes to even be acknowledged by the staff. When I asked to put my name in and how long the wait would be, the man and woman working the counter were extremely rude and acted like they couldn't be bothered to give me the time of day because they were too consumed with taking orders over the phone. Maybe next time you should pay attention to the people who are actually in your restaurant! Saw a number of people walk out for the same reason.",Illuzion,3.5 star rating,$$,"Japanese,, Sushi, Bars"
177,a64BCqWH_uti60A-LySNWQ,D M.,5.0 star rating,"Illuzion is awesome. If you have not tried their specialty rolls, you're missing out. And that's not just my opinion -- whenever I take visitors from out of town to dine at Illuzion, the majority of them ask to return on their next visit. In fact, quite a few of my friends make the occasional trip to Hoboken specifically to dine at Illuzion. Plus, their delivery is *ridiculously* fast. They're usually knocking on my door within 15 minutes, no joke. They also have their ordering down to a science. It takes me a few seconds to order delivery over the phone as they are able to retrieve both my address and credit card number using my telephone number. I'm a big fan of this restaurant. I hope they remain a fixture in Hoboken.",Illuzion,3.5 star rating,$$,"Japanese,, Sushi, Bars"
178,DlgLQ1m1tkT9DE1Lj98hMg,Colleen K.,4.0 star rating,"I'm a huge sushi fan and I have yet to be disappointed by Illuzion. I've only ever gotten sushi rolls but it always tastes fresh and the service was relatively quick. It's a BYOB restaurant, which is always nice! Would definitely recommend this place!Takeout is just as good, too!",Illuzion,3.5 star rating,$$,"Japanese,, Sushi, Bars"
179,5rL4OuhdE_ybWSzCvTWOPA,Rosie C.,1.0 star rating,"I was here a while ago and haven't been back.One reason: it smelled so, so, so fishy. I have no idea if it was a fluke or an everyday occurrence, but I haven't wanted to return to find out.",Illuzion,3.5 star rating,$$,"Japanese,, Sushi, Bars"
180,2yGjJk0IFGk2u-R_fi2cWw,Tim T.,4.0 star rating,"If you live in Hoboken this is the only place you should be going to get sushi.  I have eaten in and ordered take out from Illuzion easily 20 times over the past two years... it helps that I live two blocks away from the restaurant, but I digress.I have had my fair share of sushi in my life and Illuzion rates up there with the best of 'em, even the overpriced NYC hot spots.  The sushi is ALWAYS fresh and delicious and have never had a complaint.  You really can't beat the prices either for the quality of food you get.  It's BYOB, so order and extra roll with the money you save on alcohol.The staff is always polite, courteous & super friendly.  It's tough to get a table on the weekends (especially in the summer), but the food is well worth the wait.",Illuzion,3.5 star rating,$$,"Japanese,, Sushi, Bars"
181,C1pHBWDd5mUH-6vDKMAg5Q,Kiymet L.,1.0 star rating,TINY TINY TINY TINY place. You're basically on a date with the table next to you. And... $13 for a CALIFORNIA ROLL? Are you crazy? I would not recommend this place at all. Plus the bathrooms are gross. Looks nice from outside but no.. Don't do it.,Illuzion,3.5 star rating,$$,"Japanese,, Sushi, Bars"
182,XdPtOA3GhzotNlv2xN_6jg,Antonio R.,4.0 star rating,"I've only ordered delivery from here, but I've done so many times and the sushi is great!  I highly recommend the Heart Stealer roll.",Illuzion,3.5 star rating,$$,"Japanese,, Sushi, Bars"
183,7MGeMGQgmQcOd-ISARwV4g,Crisel F.,1.0 star rating,"If I could give it zero stars I would. I had ordered from illuzion many times and have always had a pleasant expirience. But yesterday I ordered their tri color sashimi and it was not fresh, it was so old that I only took a bite of the salmon and had to discard the entire thing. When I called to speak to the manager I simply requested that I not pay for something that wasn't fresh, I received a very rude reply and no return on my card. If you promise a ""fresh catch"" and don't deliver then that just makes you a scam artist. BEWARE EVERYONE, next time you order you may end up hurling your lunch up.",Illuzion,3.5 star rating,$$,"Japanese,, Sushi, Bars"
184,60dJP9_KUREQXaDwYhGgOQ,Lisa M.,1.0 star rating,"I placed an order for delivery. They said 20-40 minutes and it took over 1.5 hours. When I called to get a status on my order the women yelled at me and hung up the phone. Finally, the food came but it was the wrong order.  Stay away. They are rude and unprofessional.",Illuzion,3.5 star rating,$$,"Japanese,, Sushi, Bars"
185,TyoQhwd-s5a-wGq_ZEGYJg,Blue L.,5.0 star rating,"So glad I came here! I can always count on my fellow yelpers to point me to the right place! Great sushi and great portions. Generous balance of rice to fish on the sushi & rolls (hate it when rolls are covered in thick layers of rice), and everything is really fresh. Prices are great too. Extremely reasonable for what you get! This will be THE place I go for sushi next time I drop by Hoboken.",Illuzion,3.5 star rating,$$,"Japanese,, Sushi, Bars"
186,GASAN7hVxDoPc4e5-Bjtxg,Ben N.,3.0 star rating,Great sushi but if ordering for delivery beware of their bait and switch price.  They charged us $10 ($2 per roll)  more than what was stated on their website menu.,Illuzion,3.5 star rating,$$,"Japanese,, Sushi, Bars"
187,7XDweWsAwMiqq9q66msPWw,Heena P.,4.0 star rating,"I'm really not sure how this can get less than 4 stars!?  They have great service and its BYOB - Hollahhhh :D   Delicious Food   ::You must, must, MUST order the Miso Black Cod::   It melts in your mouth and the flavors - ahh, so good!  Trust me, its scrumptious.  And my favorite roll is the Spicy Bad Girl ;)  not b/c of the cute name, but b/c it really is delicious.",Illuzion,3.5 star rating,$$,"Japanese,, Sushi, Bars"
188,XXXwNcsF3AlpMX44jw8_CQ,Natalia B.,5.0 star rating,"I absolutely love this sushi restaurant! Whether you come for a table for two or eight, the servers are sure to make your visit memorable. Their green tea is amazing, even if you forget to BYOB.Be sure to try the rock shrimp appetizer, as well as their specialty rolls. With names like ""foxy lady"", ""spicy bad girl"", and ""brave heart"" you will want to try them all. But take my word for it, you will regret it if you don't save room for dessert! Their tempura ice cream is the best I've had anywhere. I've been going to this place for about ten years now, and they change just enough to keep things exciting while leaving your favorites to draw you back. One of my favorite parts of this restaurant (aside from their food) is the ambiance, which includes a modern interior and pop art pieces that are sure to feed any art enthusiast's palate as you eat.",Illuzion,3.5 star rating,$$,"Japanese,, Sushi, Bars"
189,2YlM7B94ygbmLmYy-QgcBg,S E.,1.0 star rating,"I think i got food poisoning from this place so stay away! the minute i walked in it didn't smell right but im picky so i just let it go thinking it was just me.. we got our sushi and it was average nothing great, the next day thats when it went down hill! worst experience ever!",Illuzion,3.5 star rating,$$,"Japanese,, Sushi, Bars"
190,rOwgQyt4XGHweyVtamzkmg,Kaitlin E.,1.0 star rating,"If I could give this negative stars I would, and only for one thing. The delivery driver was SO MEAN I'm honestly astounded that this happened. The delivery came exactly on time, about 30-40 minutes after I ordered, but when the guy got there he literally YELLED AT ME because the drive was too far. Mind you, I live in the heights and this place is in hoboken. It was barely a mile away. He comes up to my door, shoves the food in my hands, and yells ""THE DELIVERY WAS TOO FAR, HOW ARE YOU GOING TO MAKE ME DRIVE ALL THAT WAY, IT'S SO F'D UP!"" I'm sorry, if it was too far someone from your restaurant could have called and cancelled the order? It's completely understandable to have limits to the delivery distance but if the place you're delivering to is within the allotted distance then why would you come up to my front door yelling at me?? And that's really something you should take up with your employer. It's not my fault that you had to do your job.",Illuzion,3.5 star rating,$$,"Japanese,, Sushi, Bars"
191,j2VneDvaq3kfYzKsDmS7PA,Artem A.,4.0 star rating,"The atmosphere is very intimate, and the place is dimly lit.   The quality of sushi is decent, and the choices are numerous, all well prepared.  I'm not sure I would come back - I am not enamored with the layout of the restaurant, but it's a solid choice if you are looking for Hoboken sushi.",Illuzion,3.5 star rating,$$,"Japanese,, Sushi, Bars"
192,RMHTvt5TkgAI2z-Og9wPtw,Qipper T.,3.0 star rating,"Food - The rolls were forgettable, sashimi was forgettable but dessert was a nice surprise.  The prices were very reasonable and I don't remember disliking any food.  I really liked the way they served the tea it was in a proper tea pot and the cups were a nice heavy porcelain just like you are suppose to have green tea.Atmosphere - (Note we came on a Saturday around 8pm)  Mostly filled with people that in their late twenties drinking cocktails before going out on the town.  Not the classiest people but hey, it's Jersey!  I liked how people in there was out to have a good time.Customer Service - The people were very polite and cordial, definitely one of the things I remembered.  Would I come back?Yeah why not?  ** For all my Garden State folks, don't get your spray-tanned knickers in a twist, I'm just poking fun :).",Illuzion,3.5 star rating,$$,"Japanese,, Sushi, Bars"
193,eCnRrvDbZFYldW9F2LvPnQ,Christopher P.,5.0 star rating,3.5 stars? ARE YOU KIDDING ME? This place is amazing. The food is absolutely amazing. The rolls completely rocked my socks off! I recommend 100%!!!!!,Illuzion,3.5 star rating,$$,"Japanese,, Sushi, Bars"
194,IZASIw-IlQ99422jpB_QSQ,Amoli P.,4.0 star rating,"I'm from Chicago and was just passing through Hoboken for a night.  My friend and I decided to pop in to Illuzion for a late lunch and just caught the tail end of their lunch special.  Coming from the land-locked Chicago, where only a few places are really dependable on their sushi quality, Illuzion was a nice change of freshness.We had the entire restaurant to ourselves at 4pm on a Monday afternoon, so obviously the service was attentive and friendly.  The lunch specials include some pretty great deals - you can mix and match rolls, you can go with the standard bento box type of meal, and they have some better sushi and sashimi combo options than most sushi lunch menus.My friend and I both went with the chirashi bowl lunch special.  For only $14.50, we got a huge bowl of sushi rice topped with tobiko and a great selection of sashimi.  The fish servings were very generous, and this was easily a dish that should normall cost $25.  Each bowl had 3 pieces of tuna, 4 pieces of salmon (super fresh salmon I might add), 3 pieces of yellowtail, 2 pieces of striped bass, 2 pieces of seabass, and a generous helping of the large masago...that I can't remember the exact name of.  The bowl also comes with miso soup and the house salad - nothing mind blowing there, but the soup was solid and the salad was just a small bowl of lettuce and a pink fruity ginger dressing.The quality of the fish was excellent and I definitely recommend this place when you're looking for a quick hole in the wall sushi place that's affordable and delicious.  This isn't a fancy Saturday night kind of lounge atmosphere, and it's welcoming and cozy.  They take pride in their food and do a great job.",Illuzion,3.5 star rating,$$,"Japanese,, Sushi, Bars"
195,V1G0mOd7s93wlINGcEOdEw,Jason H.,4.0 star rating,"This is probably my favorite sushi place in Hoboken.  It's unfortunate that Hoboken doesn't really have any great sushi places though but this will do for now.  Illuzion has the most constantly fresh fish and the portion sizes are very good.  Of course the restaurant is BYOB which is always nice and Sparrow's downtown is only a block away.I go here for lunch on the weekend at least once a month.  They have a pretty standard set of lunch specials including plates from the kitchen and the sushi bar.  I tend to get the 3 maki roll lunch which is $12.  The lunch specials all come with miso soup and salad that comes with their yummy version of the standard ginger dressing but Illuzion's adds beets to their dressing for something a little different.  The list of rolls for the lunch special is limited to about 20 rolls but that comes to be expected since you are getting such a good deal. I've been here for dinner with large groups several times as well.  The food is just as good in the evening.  I've had a handful of sushi entrees including the charashi (a mix of sashimi on a bed of rice), an assortment of special rolls, sushi and sashimi.  All of these have been consistently good.  I've also had a lot of their appetizers, one that stood out to me is the octopus appetizer and I would highly recommend it to all who go to Illuzion.  Kitchen entrees are pretty good as well but I have to be honest that sushi has a place in my heart so I usually stick to the fish. Service at Illuzion has always been pretty good.  It's nothing special but your water glass is always full and they your empty plates won't be in front of you on your table for long when you are done eating.",Illuzion,3.5 star rating,$$,"Japanese,, Sushi, Bars"
