,user_id,user_name,user_rating,user_text,restaurant_name,restaurant_rating,restaurant_price,restaurant_type
39,wntwaKYx0DSslaz5W81fBA,Diana R.,5.0 star rating,"Omg! the churrasco is excellent and the fusta salad, the dulce de leche flan, and the sangria.I love Oscarito..",La Fusta Restaurant,3.5 star rating,$$,"Argentine,, Steakhouses,, Seafood"
40,_S04IQNkSFufi6JcaVzchQ,Layla Q.,3.0 star rating,This is the second time i have been to this location the parillada never fails. This time i ordered the fettuccine Alfredo and it wasnt very good. The alfredo could have definitely used some help from like Olive Garden. I personally suggest to not try the fettuccine alfredo. DEFINITELY TRY THE PARILLADA AMERICANO,La Fusta Restaurant,3.5 star rating,$$,"Argentine,, Steakhouses,, Seafood"
41,Oo_932bJjRIPH91DmkNw6A,Martha A.,4.0 star rating,Great Argentinian Parrillada. Food is quickly served and at the perfect temperature. Came to celebrate my uncle's birthday and everything was swiftly. They even sang happy birthday to him. Will definitely need coming back soon.,La Fusta Restaurant,3.5 star rating,$$,"Argentine,, Steakhouses,, Seafood"
42,6B26EEi-r2i1fUpxJFo_gg,Randy R.,4.0 star rating,"I've been here multiple times and have had a good experience. First I came alone and had a half skirt steak and fries with garlic bread. The steak was absolutely perfect. Tender, juicy and delicious. I had it with a glass of sangria which wasn't overly sugary like many other places I've been. It was quite tasty. I also came here for my anniversary and as usual received excellent attentive service. My wife and I ordered the La Fusta American grill which was a combination of various meats, all of which was cooked well. The steak was cooked perfectly the short ribs too. The chicken wasn't anything special and I'm not personally fond of sausage but my wife loved it. I would recommend this place to anyone who enjoys a good steak. I have yet to try the seafood dishes but that's for my next visit.",La Fusta Restaurant,3.5 star rating,$$,"Argentine,, Steakhouses,, Seafood"
43,1IRHFR4mvz92pqutmBMuZA,Ivonne D.,1.0 star rating,Terrible experience. I got a filet mignon and it was over cooked and tough when I asked for medium. I had a side order of mash potatoes and it was definitely not fresh and way too watery. The waiters were so rude and the food took over an hour to come out! Went in on a Saturday afternoon for my mothers birthday. Worst idea. Stay away!!! Food is over priced you're better off at Apple Bees probably will have fresher food there. Not even kidding...,La Fusta Restaurant,3.5 star rating,$$,"Argentine,, Steakhouses,, Seafood"
44,LE5il4w0hzBH8TU_tIG4vQ,Roz S.,5.0 star rating,"Great place!  We stayed at the hotel next door and it was literally the only restaurant we could walk to after a long day of driving.  The food was delicious, as was the sangria, and the service was terrific.  The place was busy when we arrived around 7pm but we were seated right away at one of the two empty tables.  Our server was very attentive throughout the evening, swooping in and refilling glasses as soon as they were empty, yet we weren't rushed and had a very relaxing and enjoyable meal.  It wasn't just a ""road"" meal but a lovely experience.   Definitely get the sangria!!",La Fusta Restaurant,3.5 star rating,$$,"Argentine,, Steakhouses,, Seafood"
45,na7IwU2qh_OIE5pbUaQ6OA,Erika R.,5.0 star rating,This restaurant is great. We always have good service. As soon as you walk in you are greeted and seated. Oscar is an awesome waiter always comes around to make sure everything is ok. The food is delicious it's a bit pricey but it is worth it.,La Fusta Restaurant,3.5 star rating,$$,"Argentine,, Steakhouses,, Seafood"
46,jf-klj6IyipweLSrIaDaHg,Xeneize R.,1.0 star rating,He is back.  damn it!Food is getting worst and worst.  The menu is becoming extremely boring.  Appetizers are from the 1980's.  Owners need to travel back to argentina and see how the food scene has been evolving.   There is an extreme lack of passion in this place.,La Fusta Restaurant,3.5 star rating,$$,"Argentine,, Steakhouses,, Seafood"
47,dojQ85_P3eSh_XhplHaLZg,Javier A.,4.0 star rating,"Delicious, friendly staff and reasonable prices.  I recommend this place if you love to eat meat.",La Fusta Restaurant,3.5 star rating,$$,"Argentine,, Steakhouses,, Seafood"
48,NvuT_fsJ9949D-KrG_ljFA,Lee H.,5.0 star rating,"A strange dichotomy of old school and modern.   At first seemed rather stuffy but after sitting at the bar and having a drink things warmed up.  Its odd though because there is old style high end service, with napkins placed on the bar for your food, thinly sliced and fried (yam) served with a very good chimichurri -and some fresh and warm bread with the meal - along with numerous TVs with mostly soccer being watched (mind you they are Argentinian so had to give them a hard time about Maradonna!)  I highly recommend the bar menu specials which were very reasonably priced and the skirt steak with the garlic fries was excellent.   I saw a gentleman having a very interesting salad and was told it was the watercress, tomato and onion salad.   Came back the next night and ordered it along with linguni carbonara - it was fantastic.  I imagine the other salads would be just as good as my wife had the chicken ceasar salad and it came with all kinds of additions such as hearts of palm, hard boiled egg - that was excellent too.   Very reasonably priced bottles of pinot grigio and very attentive service.   Food took a little while to come out but we were in no hurry and when it arrived was excellent.   The staff warmed up to us and were very attentive and friendly - if you are staying in the nearby hotel I recommend this place for a nice quiet dinner at reasonable prices.",La Fusta Restaurant,3.5 star rating,$$,"Argentine,, Steakhouses,, Seafood"
49,fCphGrJ1Ovx9d_NAbzMt9Q,Louis R.,5.0 star rating,"I've been to Argentina.Eating and drinking in Buenos Aires was life-changing.The food here reminds me, totally, of the parilla-meat-heaven, that is Argentina.And make sure to have a Quilmes beer.Hit it.",La Fusta Restaurant,3.5 star rating,$$,"Argentine,, Steakhouses,, Seafood"
50,S9MLFNOksNyad37qdYzZjA,Pablo S.,1.0 star rating,I was really disappointed with this place. We came here with a party of 12 people on a Wednesday night and the place had 3 other tables. We order empanadas and matambre to start. The matambre was very dried and the empanadas was so oily. Then we order parrillada Argentina the skirt steak was over cook and the ribs were to salty. First time here and I think it will be the last. My family that came from Argentina on vacation were very disappointed.,La Fusta Restaurant,3.5 star rating,$$,"Argentine,, Steakhouses,, Seafood"
51,m2-CiRCHtC4koNBURYIucg,Jim G.,4.0 star rating,"The location of this place is a MESS, but I am telling you , once you get in, Damn, it is heaven.I have been to a bunch of these type restaurants across the US.  This one is right there with any of them.  The quality of the meat was phenomenal, the flavor and taste was off the charts.  The price for what you get is FANTASTIC !The only ding is what a few other have stated, the service is a little light.  I am not overly saying it is bad, but we were one of only a few people in there and they did serve us a little slow and were not overly attentive.  However, you are going here to eat some meat, you will not be disappointed at ALL !On my next trip to NJ, I am stopping in for sure !",La Fusta Restaurant,3.5 star rating,$$,"Argentine,, Steakhouses,, Seafood"
52,tv71xCE_ghZbitEyXTsMwA,Gabriel G.,5.0 star rating,"The 'rents let me take them out for lunch on the condition that they chose the spot. That's how I ended up at La Fusta. This place has managed to remain hidden as it is located in a somewhat seedy-looking part of North Bergen near hardware stores and metal works. Step inside though and you are suddenly in a red-brick countryside Spanish cottage. The food here is outstanding. I ordered the filet minon medallions in mushroom sauce, and the parilla. The parilla is a dish of grilled meats literally piled on to more grilled meats. The portion they served us was just staggering. That dish is easily enough to feed 2 people, maybe even 3. Its a feast on a plate! The filet medallions were just as impressive. The mushroom sauce was magnificent. Additionally the sauce soaks into all the veggies giving them even more flavor.All the meats were juicy, savory, and overall delicious. They have a different take on french fries where they add some ground up dried greens along with olive oil to the fries. I didn't think I'd like it but I was wrong, it was great.  Best of all, the prices are EXTREMELY reasonable for the quality and quantity of the food you get. I was expecting the bill to be MUCH more than what we ended up paying, and we ordered alcohol as well. This place certainly qualifies as ""Bueno, Bonito, y Barato.""",La Fusta Restaurant,3.5 star rating,$$,"Argentine,, Steakhouses,, Seafood"
53,jUtcZiFMpOWgQQk2Uz1DEQ,Alvaro B.,1.0 star rating,"Came here for my fathers birthday, it was our first time here. Food was good, however the service was horrible. It left us a bad experience, we rather go somewhere else.",La Fusta Restaurant,3.5 star rating,$$,"Argentine,, Steakhouses,, Seafood"
54,BPYkJ19YIEW9LAOQ5HwtBQ,Lo V.,3.0 star rating,"We ate here the other night celebrating moms birthday. 6 of us. Really wanted to love this place. My wife is half Argentinian and there are next to zero Argentinian restaurants in the area. Couple that with the fact that i am a complete carnivore and well you get the picture.I had made reservations ahead of time and am glad i did as they were quite busy. We were seated quickly by a friendly supervisor/host. Then we waited. And waited. And waited. After about 10 minutes i walked to the host stand to get some menus. We were finally visited by our server about 5 minutes after that.We gave our drink and appetizer order. Our drinks were average. A ""sugary"" version of red sangria and a few tasty cinnamon martini-ish drinks. The appetizers arrived swiftly. The fried calamari was outstanding. Light, fresh, hot, and perfectly cooked. We had that with a spicy marinara sauce (fra diavlo), which was awesomely spicy. Our letil soup was weak, watery, and lacking of flavor. The house salad was huge enough for pretty much everybody to enjoy.For the entrees... 2 orders of ""La Fusta Americana""- abundant with several flavorful meats. Delicious and plump pork chops. Large tasty chicken breast. Bife de chorizo- traditional Argentinian sausage was good. Beef ribs were o.k. Surprisingly the churassco was underwhelming. My wifes were ordered well done, which is the wrong way to eat it lol. My sisters was medium so i had a piece of both and meh... In addition, the chimichurri was also disapointing. Not tart enough, and overly oily.My sons pork chops as a main dish were wonderful. Large, plump, juicy, properly seasoned and just plain excellent.My filet mignon let me down. Asked for medium rare and receiced medium well. I also was not a big fan of their marinade, which was quite vinegary and lacking of spices and/or herbs.The sides were average...mashed potatoes, sauteed spinach, rice, fries, and sauteed onions.Deserts were hit and miss... Flan with dulce de leche (caramel) was very good. The chocolate mousse was over heated and as a result, ""runny"". My bannana crepes were tasty but too much rum was left behind on my plate which kind of made it feel like pancakes with a shot of Bacardi. The cafe con leches were however, amazing.I felt that La Fusta had a few high points which were muddied by a few low marks. Inconsistent.Couple that with bad, slow, albeit friendly service and La Fusta left me, well, underwhelmed.",La Fusta Restaurant,3.5 star rating,$$,"Argentine,, Steakhouses,, Seafood"
55,chF9YDZeGhcnISWe_0gl9g,V C.,5.0 star rating,This is one of the best Argentinian restaurants !! Not only is the food delicious the waiter Carlos will make your evening spectacular. We had the best time .. He served us with style he joked with us and made us laugh and to top it off he insisted on taking pictures of us. What a great time!! Oh and let's not forget those awesome empanadas !!,La Fusta Restaurant,3.5 star rating,$$,"Argentine,, Steakhouses,, Seafood"
56,iFlZgc45THyXPzK-t06Yog,Kathy D.,4.0 star rating,What a wonderful time I have had today. The food was incredible. I am delighted to have came here. What an eye catching restaurant.,La Fusta Restaurant,3.5 star rating,$$,"Argentine,, Steakhouses,, Seafood"
57,CuNaFcau7sYmao8nQt5JZw,Jason V.,4.0 star rating,"The steak is great! Specially the skirt steak! It's an Argentinian Steak house so eli will find a vast meat menu. Make sure you go on an empty stomach, great for a big party table! You can share the Different ""picada"" with everyone.",La Fusta Restaurant,3.5 star rating,$$,"Argentine,, Steakhouses,, Seafood"
58,e49HOgZoiCv9SW0Fkm_Xtg,Yaya L.,4.0 star rating,This place is good. The location really sucks.  Prob the reason I didn't care to come back.The food was good and was seasoned very well. I did try the sangria and it was def. on point. ( had 2 pitchers  )I do remember this place being a bit pricey than expected. Nice local spot with good appetizers and yummy sangria.,La Fusta Restaurant,3.5 star rating,$$,"Argentine,, Steakhouses,, Seafood"
59,FjdQ1PMeXxRJflsDN7rScA,Michelle T.,3.0 star rating,"Very good restaurant; though very traditional customs, AKA geared more towards the man making all of the decisions. When we ordered wine, the waiter came out and only served a glass to my boyfriend to try, although I would have gladly tried it as well. He also looked to my boyfriend to order the food for both of us. Regardless the food was good; I ordered the steak marsala with a side of pasta with tomato sauce which was great, and my boyfriend ordered a steak with red sauce. Both very good meals which went great with the wine; so only thing that deterred me was the service.",La Fusta Restaurant,3.5 star rating,$$,"Argentine,, Steakhouses,, Seafood"
60,7ye3YpoBt0rAqGGGwi7SPA,Carmelina N.,5.0 star rating,"This place is one of my favorites in the area. Im always willing to drive 25 mins from home to eat here. Their food is beyond good! I usually go with my boyfriend and we get the American Grill. The small one is good enough for two people. If they try to tell u is one person, trust me dont follow it. Me and my bf love to eat, and we eat a lot and this is just more than enough. The only thing I dont like is the location and the parking. If its too busy you cant come in cause the parking lot is fairly small and there's no street parking. I would def recommend this place!",La Fusta Restaurant,3.5 star rating,$$,"Argentine,, Steakhouses,, Seafood"
61,5SDf5_oL51Pzi-5yRNgpVA,Mike H.,4.0 star rating,"Good food, great service. Atmosphere was pleasant. Had the fillet mignon, wasn't the best but it was okay. I do recommend.",La Fusta Restaurant,3.5 star rating,$$,"Argentine,, Steakhouses,, Seafood"
62,k92c2igv0j3n3JCAgkbUeA,Mark M.,4.0 star rating,"La Fusta is my go to spot for excellent skirt steaks and their mixed grilled dishes. I'm Argentinian and I do get my cravings for asado cuisine. Medium rare comes out perfect. Their sangria is really good, it has the right sweet twang to it. It's off of route 1-9. Parking is a bit tight but well worth the feast.",La Fusta Restaurant,3.5 star rating,$$,"Argentine,, Steakhouses,, Seafood"
63,2JQsXWgdYVP_Ca1wziqiIw,April W.,2.0 star rating,"This place is odd on many levels. First, it's in a strange location attached to a hotel. Second, the lights were so bright during dinner that it was awkward. Third, there were so many servers that we couldn't keep track of who was taking care of us... Despite this, the service was horrendous. Drinks took forever even though we were 1 of 4 tables in the place upon arriving. When they eventually arrived, after us inquiring about what was taking so long, they were wrong. Red wine instead of a gin and tonic...??? Dinner was served but we were never checked on to see how it was. My meal was a large portion of sole, but covered with so much cream that it was hard to enjoy. We had to then ask the manager (who was busy doing nothing) for our bill, because not one of the 5 waiters came back to our table to deliver it. I will not be back.",La Fusta Restaurant,3.5 star rating,$$,"Argentine,, Steakhouses,, Seafood"
64,8WZFCrLEou-Vz41m7oj2_w,Mog C.,4.0 star rating,"Parking here is a mess and you're better off going straight to the Comfort Suite hotel parking on the other side.  Also, if you walk in without reservations, come early (7pm) or late (9:30ish).  Otherwise, there can be quite a wait as this place serves as the local ""family reunion/birthday"" as well as a date place.  It means you have large groups of 8-12 battling with couples all angling for each available table.  I ordered the American Mixed Grill (that huge oversized serving of skirt steak, short rib, pork chop, chicken and sausage) while Will R. went with the 1/2 skirt steak.  I only ended up eating the skirt steak part of my dish (mostly bc the serving is just too huge).  Between the two of us, the check was $40 ($15 for 1/2 skirt steak and $25 for the American Mixed Grill)!!  The skirt steak is perfectly cooked and super tender and full of flavor.  Their drinks are equally well priced at $8 per cocktail.  At this prices, we'll be back a lot!",La Fusta Restaurant,3.5 star rating,$$,"Argentine,, Steakhouses,, Seafood"
65,0cIWOFPwMj16Q6P3mfBF4A,Dominic D.,3.0 star rating,"Was craving a steak on a Saturday night and this was the only place open after 11 p.m. so we decided to give it a shot. It was the end of the night so you can tell the place was winding down. I wouldn't know if it was crowded or not because of the few tables left that were trying to pay there bill.Service was terrible. Had to hunt down waiter basically for a soda refill. Granted it was the end of the night, we were ordering steaks and going to tip so we shouldn't have been ignored.We both ordered the Filet Mignon. I got fries with them that were nothing special just regular french fries. The Filet was a big cut but didn't have much taste and was definitely cooked more then the 'medium' I asked for. I ate most of it because i was starving and dying for a steak all day. It wasn't tough to chew or anything but it didn't have much taste. I'm sure there are other good things on the menu people enjoy, and it was late at night so i know the cooks want to leave, but I couldn't see the steak being much better even earlier in the day. Next time I will tend to my craving before 11pm so I can get a real steak elsewhere. But as I said, some of the other menu items looked very good so this is just a rating of the filet i had and the service.",La Fusta Restaurant,3.5 star rating,$$,"Argentine,, Steakhouses,, Seafood"
66,WlibARvwhg5YKjGX__rM2w,Aaron T.,5.0 star rating,"Get the skirt steak, full order, medium rare. Get some red wine. Cover steak with chimichurri. Eat, drink, and die happy. It's one of the finest pieces of beef I've ever had, and cooked to perfection. Better than any of the super-expensive NYC steakhouses.Expect to be there a while. It's not a fast place. They're very friendly to large groups. Last time I was their with a group of 8, we all ordered appetizers, steaks, a total of 4 bottles of wine, and dessert, and they comped our digestif. Wonderful evening out with the guys.",La Fusta Restaurant,3.5 star rating,$$,"Argentine,, Steakhouses,, Seafood"
67,_a2q6Oc8JG-TARFa2ALC_g,Jeff S.,5.0 star rating,Great service and food. Relaxed atmosphere. I'd definitely suggest this place. Sangria was amazing.,La Fusta Restaurant,3.5 star rating,$$,"Argentine,, Steakhouses,, Seafood"
68,bHEjN5z_yCl5n6LtX3kXng,Benjamin P.,1.0 star rating,"Attempted to eat at La Fusta but the service (if you can call it service) was the worst I have ever encountered. First they sat our party of seven and only provided three menus. I could understand if the place was full but there were only three tables in use. Then after 15 minutes without seeing a single employee we had to help ourselves to menus. Finally after 45 someone showed up, no apology just quickly rushed us through our orders. As if we were bothering him. No one bothered to bring bread or refill our drinks. I do not recommend La Fusta. I would not recommend La Fusta to my worst enemy.",La Fusta Restaurant,3.5 star rating,$$,"Argentine,, Steakhouses,, Seafood"
69,gjQvWPOi-FEhN35YPnB7Pg,Barbara M.,5.0 star rating,"I love this Argentinian Grill full service bar and restaurant! Excellent grilled meats and sausages.  The steaks are to die for!  Seasoning is perfect//grilled to perfection.Great ambience-- families, date nights, diverse, clean, sports TV futbol in the background.  I crave their steak at least once month..  The early bird gets the parking, but the staff will make you happy.Has a mishap with a busboy who dropped dishes with food on me as he walked behind my table, it was shocking, cold, messy but thankfully not anything serious.  The manager was more than apologetic, as was the server and busboy.  We were comped a full meal from delicious sangria, to a salad course, I always like the mixed watercress.  The dressing is perfect.  Then to 1/2 portion of skirt steak-_more than enough- I have half of that in my refrigerator now awaiting two over easy eggs in the morning. My wife enjoyed spinach and cheese stuffed ravioli with red sauce and a delicious Argentinian Pinot Grigio.We both savored the taste of flan soaked in caramel sauce and two frothy cappuccinos.  All comped from management.  The meal was well worth the ruined blouse.I will keep going back--",La Fusta Restaurant,3.5 star rating,$$,"Argentine,, Steakhouses,, Seafood"
70,oXPvcSa47-qyCpewXjCiwg,Stephanie N.,4.0 star rating,"Absolutely love this spot!! I cant give it five stars only because the staff can take forever and the parking can be difficult especially since its on tonnelle ave. All my stars go to food. Everything i have ever eaten has been amazing. My faves are the grilled provolone with prosciutto,  churrasco and the complimentary chimichurri sauce. When we are with a large group we get the parriada and it never fails. Plenty of meat for the entire family! Their sangria isnt the best but its still good. Always have a great meal here. Awesome Argentinean restaurant!!!",La Fusta Restaurant,3.5 star rating,$$,"Argentine,, Steakhouses,, Seafood"
71,3AR4oOT_p8OfBZeTP64tKA,Erin F.,4.0 star rating,Wonderful Argentinean restaurant with great authentic flavors. Wine list is great... best empanadas around. Steak and parrillada is on point. Good for soccer watching while eating classic south American classics and drinking wine. It's just in a very obscure location.,La Fusta Restaurant,3.5 star rating,$$,"Argentine,, Steakhouses,, Seafood"
72,m-CAAQeEKw1jlJr-PmSkNA,Erick O.,5.0 star rating,"Came to NJ from LA on a business trip. Wasn't familiar with the area, looked for a decent restaurant on Yelp that was walking distance from my hotel. Found La Fusta. So glad I did. Had the parilla americana which is a carnivore's dream. Was delicious! Service was awesome, place was nice, food was delicious and price was right. Wanted to get me one of their custom La Fusta steak knives as a souvenir!  Anyway, greatly recommend this place.",La Fusta Restaurant,3.5 star rating,$$,"Argentine,, Steakhouses,, Seafood"
73,u7pX1VB1ebBBOK1vTXlMGw,Lawrence B.,5.0 star rating,Came in from out of town and had a craving for steak. I looked up this restaurant on yelp and it had some good reviews so we decided to give it a try. We were not disappointed the food was delicious the wine list was very nice and the pricing was on par. Even our dessert was flaming! I would definitely recommend this place and I would come back the next time I'm here. I had the special  mixed Grill which was delicious but I would've like to know what was on it before I ordered it.,La Fusta Restaurant,3.5 star rating,$$,"Argentine,, Steakhouses,, Seafood"
74,IdnQR2r1G-DNdTiPf1XptQ,Lenny S.,3.0 star rating,Went here for dinner tonight had the skirt steak and fries steak was not bad fries come in a metal basket type container chimichurri sauce is not that good best churrasco steak I've had is at Moonachie Churrasqueria .,La Fusta Restaurant,3.5 star rating,$$,"Argentine,, Steakhouses,, Seafood"
75,QuLgDudEwKvFyD_sKRmw5g,Nahuel Q.,5.0 star rating,"Ive been coming here for a few years now and the food has been consistently great! Very traditional offerings which can be hard to find at times. Steaks are top quality, large portions,  and moderately priced. Overall a great place and excellent value.",La Fusta Restaurant,3.5 star rating,$$,"Argentine,, Steakhouses,, Seafood"
