,user_id,user_name,user_rating,user_text,restaurant_name,restaurant_rating,restaurant_price,restaurant_type
73,OsGx3LRXtzEuznxOe_f6Sw,Marissa S.,4.0 star rating,"My Israeli husband loves Chef Eyal Shani, so we came on opening day.  We both tried the minute steak pita, Reuben, and the cauliflower.  Cauliflower was a whole head and was incredibly soft.  The meats in the steak and Reuben pitas tasted like they were of very good quality, but there wasn't much filling in the pitas - which was my biggest complaint.  The food didn't have as much Mediterranean flavor as I'm used to, which seems intentional.  Call me boring, but this didn't do it for me.  The food seemed confused to me.  For example, I didn't think the flavors in the Reuben worked well together - instead of sauerkraut/cheese, it came with an avocado/aioli type sauce.  I enjoyed it enough to come back and try different things, but not enough to eat on a consistent basis because the pitas just aren't filling.",Miznon,4.0 star rating,$$,Mediterranean
74,YgtlCR1ri7RYPUNorOUAHw,Sami A.,4.0 star rating,"Come for the head of the cauliflower. Seriously, that cauliflower is insane. I also had the cauliflower pita but it wasn't incredible like the cauliflower. In the future, I would come back for the head of cauliflower and get fresh out of the oven pita from Dizengoff with some hummus.If you're into peppers, they also have a tray of peppers for you to take from. Beware, they pack a bit of heat, but I really enjoyed them.",Miznon,4.0 star rating,$$,Mediterranean
75,sMbai9-8Pgc3fms9Rewe9g,Ashley H.,5.0 star rating,So far so good. I had the mushroom pita which was delicious. I can't wait to come again and try something else. The service was great and really friendly too. It's really nice to go to a place where everyone seems human and the food is great too.,Miznon,4.0 star rating,$$,Mediterranean
76,qOJj70R9dRTv3EjawADVvw,Aditya M.,5.0 star rating,This was probably my best ever pita joint. The fillings were creative and out of the box. Must try the cauliflower. The stark pita's are to die for. Can't wait to come back and try the rest of the menu.,Miznon,4.0 star rating,$$,Mediterranean
77,PiLwoukMcU7NWULc8YG4ug,Wendy P.,5.0 star rating,"Fantastic.  Very friendly staff!!   No attitude when just ordering tap water.   We shared a pita stuffed with amazing mushrooms, asparagus and other greens.   The pita itself was light and fluffy - great!!   We will be back.",Miznon,4.0 star rating,$$,Mediterranean
78,fJiF9rSbwcC1JJDylXZOcA,H F.,1.0 star rating,A real tourist trap - this place has perfected an ingenious gimmick - hiding tiny portions of ingredients with fluffy tasty pitas while distracting patrons with the staff swaying to a fun playlist. Totally over-rated!,Miznon,4.0 star rating,$$,Mediterranean
79,pON6rQKpOXLcW30hoQ7VsQ,Ali C.,1.0 star rating,Was so excited that Miznon was opening - Got postmates to deliver a skate pita and the cauliflower pita...and they were both pretty bad - not as good as the meal I had at Miznon in Tel Aviv. The pitas were good but the contents were not... very disappointing!,Miznon,4.0 star rating,$$,Mediterranean
