,user_id,user_name,user_rating,user_text,restaurant_name,restaurant_rating,restaurant_price,restaurant_type
33,W1qGNP3gHeqhA-NGlhfV4Q,Go B.,4.0 star rating,"Try not coming during lunch; 30 min wait for a pita.Been here couple of times and love their pita sandwiches, some of them quite unique. The pita bread is so soft and airy. imo, the roast beef or minute steak pitas are the best, and most filling.Like others have stated, one is not enough, so expect to spend $25-30 w/ tax & tip for two pitas.And, yes the roasted baby cauliflower is a must order here. Israeli celebrity chef Eyal Shani is famous for that dish.Service - good (well, only thing they do is bring your tray of food, but make sure your number is visible, or your server will be doing circles).Recommend: 8 calendarsNote:  Check out on youtube an Israeli tv program w/ Eyal Shani & Shahar Segal. Quite hilarious. Reminded me of Oscar & Felix.",Miznon,4.0 star rating,$$,Mediterranean
34,LqPNYr06nAi2_O5qPg8RUA,Moshe H.,2.0 star rating,"Disappointing.We arrived on Saturday afternoon, there were no long lines which is great, and the have a very good pita bread (probably the best I had in NYC), but overall the food was not more than just REGULAR - we had the cauliflower and mushrooms.At least it's not overpriced as it is in Israel.And they also didn't have Goldstar beer. Disappointing.",Miznon,4.0 star rating,$$,Mediterranean
35,KUvKlxLqMwhmj0PUzPEpAA,Angelo B.,4.0 star rating,"This place was great... easily the best pita bread that I have had, by a big margin. I was taking a break from red meat, so ended up ordering a cauliflower pita. Now I'm not the biggest fan of vegetarian food, but this thing was delicious. Great combination of flavors. And the pita was so soft and tasty. My friends had ordered a lamb pita, and a cheeseburger pita, and both they had very positive things to say. We also ordered for the table:-cauliflower appetizer: this was delicious. Well seasoned-run over potato: DO NOT ORDER THIS. This dish is the reason that I only am giving 4 stars instead of 5. It's a really minuscule amount of potato (which is already a cheap ingredient) with some sauce for $6. Major rip off, and didn't even taste that great. We got there early (11:45 on a weekday) and there were plenty of seats available then. However it did get crowded and there were people stalking tables towards the end. Will definitely return to try out the lamb (but will not order the run over potato).",Miznon,4.0 star rating,$$,Mediterranean
36,8x0PzAD55TJBJZy2RYZ6dQ,Tracy S.,4.0 star rating,"Peppers with every meal were well spicy and a good compliment to the pita, could be charred a bit more. The minute beef pita I found to be mild and overpriced, around $14. Seating is ample both inside and in the walkway of Chelsea Market. Plus, the many staff who were working were friendly. Overall good, not great, but worth a stop if you're in the market.",Miznon,4.0 star rating,$$,Mediterranean
37,yrxmKHlwdDy9EXOMqU8cxw,Amy C.,5.0 star rating,Walked in because we saw the bar and decided to have a drink. While drinking we were amazed by watching the kitchen staff make the food so we decided to split a lamb kebab pita. It was so good we decided to take some food to go! Staff was good and you could tell everyone is having fun!,Miznon,4.0 star rating,$$,Mediterranean
38,f9PEIrlqN7T8HK76KUYnfQ,Adam C.,4.0 star rating,"Good pitas for sure. The bread stands out and the ingredients are good but not sure it lives up to the hype. Definitely expensive for what it is. If I was in the area and the pitas were under $10 I might try something other than the steak, but won't be running back .",Miznon,4.0 star rating,$$,Mediterranean
39,inddEa_CB0TTmYjGj0GGZQ,Amy S.,4.0 star rating,"Wow, the pita bread is SO soft and heavenly, you have to try it. Prices are pretty average for the area ($7-12 for a pita pocket depending on the filling), and there's a lot of seating and the cashiers/servers are funny (went along with my request to call me by the name ""Miss Wonder Woman"" with no hesitation). I wound up with the Lavan C, Flowers in a Pita. Unfortunately the cauliflower was cooked too well(almost burnt but not quite) and was over-salted. But the sauce and textures overall were great. And the pita bread, like I said before, is amazeballs. They throw in an extra roasted long green chili pepper, and that adds just the right kick to the meal. I'm def coming back for the other pita wrap options -- if anything the bread and the reasonable prices are enough. Def check out if you're in Chelsea!",Miznon,4.0 star rating,$$,Mediterranean
40,G2jZQu83YQcc3jPWEd9O7Q,Nicole S.,5.0 star rating,"Amazing food , very fast and efficient .Mostly cooked on the girl or oven. Large Fresh vegetarian food and for meet loves .",Miznon,4.0 star rating,$$,Mediterranean
41,fRedBjXK7zFs7B7q2YWyQQ,Tania S.,4.0 star rating,"The food here is delicious, to be sure. I got the rib eye roast beef. The sandwich overall is well balanced and absolutely scrumptious. Do I wish there was a little more meat in it for that price point? Sure. But that won't stop me from coming back and trying other items.",Miznon,4.0 star rating,$$,Mediterranean
42,IiqAV9NPDWpg_IGKxBppRw,Stacey C.,4.0 star rating,Great place to stop for lunch........loved the minute steak in delicious pita with pickles and tahini.....but I can make a better roasted head of cauliflower at home......I will go back and try another sammie in pita.....very nice service too.:),Miznon,4.0 star rating,$$,Mediterranean
43,PtRtimXdH4nHa8GcjVFJFQ,Roey S.,5.0 star rating,"The best pita in town!!!A creative chef cuisine that brings the flavors and atmosphere of the middle east to the heart of Manhattan.A delicious concept pita kitchen with the best ingredients.The kebab was amazing!!!Note to the chef (Eyal Shany) - you should bring the ""dak dak"" pita into the menu.",Miznon,4.0 star rating,$$,Mediterranean
44,iwaPRYTyLbR80Sf9rhRdvg,Daniel J.,5.0 star rating,"Great Pita!!I tried the minute steak was amazing, the mushrooms were amazing and also the cauliflower!Ruben was the one i liked less..run over potato was great as well, prices are reasonable for what you get!Will go back again..",Miznon,4.0 star rating,$$,Mediterranean
45,ltrTtezUaw3cdOHH9uOmiw,Noel D.,1.0 star rating,"I can only like a place in NYC that has good service. I've never eaten here because the staff and customers are beyond annoying and aggressive. Staff is totally out to lunch. I was hungry. I waited 25 minutes in line for a customer to ask about every god damn item on the menu. I was only three back in line. Wasn't packed like normal. While multiple staff members just stood there and chatted with each other - not opening the other cash register to get other orders in. They did nothing. They could have opened another cash register. Then two tall guys walked in and stood in front of the counter and the staff did nothing to imply there was a line - but began to take their order before me - with the other cash register. I flipped my lid. I had enough. And walked out with a bang of a menu on the counter. The staff guy knew he messed up. But he didn't do anything to rectify the situation. So, this place is not even a one star. It's overrated. And frankly filled with a bunch of customers and staff that are in their own world. I'm a New Yorker. My friends that have been here say it's not worth the wait - and certainly not worth going out of your way to eat here. Maybe if, and only if, the line has zero people waiting AND you aren't in a rush for some mediocre food. I realized that I didn't have time for this Shish !!",Miznon,4.0 star rating,$$,Mediterranean
46,jomIag1CrMui_4wsyfNdig,David Z.,5.0 star rating,"What a great place, great music.The pita was so soft and fresh and the menu prices very low cost for what you getHighly recommend",Miznon,4.0 star rating,$$,Mediterranean
47,ZydAidWGKbHBmNLgr0PEzg,Ashley S.,3.0 star rating,"Ok I've been to the Miznon in Paris and legit, this place can't compare to the French location, but by itself, this place is still pretty good. Between me and a friend, we shared a cauliflower and I got the avo/egg salad pita. The cauliflower is a hugeeee beautiful burnt, salty cauliflower and it has the perfect taste of singed saltiness/juiciness. I loveeeeee the cauliflower and always get it. The avo/egg salad howeverrrrrrr I didn't like much... it was literally 75% tart, tasteless avocado with a lotttttt of egg. It just wasn't unique and didn't get me excited. It felt like random flavors smushed together... I was not into it. I would definitely recommend trying the meat options over the vegetarian options if you're not a veggie. Would be down to give it another chance though....",Miznon,4.0 star rating,$$,Mediterranean
48,b0x4HrjoB6Mo47G5bJN0rw,Irina D.,4.0 star rating,"I've read about Miznon in an article about new places opening in NYC. Considering that I: A) am Israeli and try to check out Israeli places whenever I can B) Love Chelsea Market and will make any excuse to come here and C) consider Mediterranean food to be my favorite cuisine and eat Hoomoos pretty much every day, I've decided to give this place a try.Just like mentioned in previous reviews, there was a line but it really wasn't bad in our case and moved just quickly enough for us to make up our minds on what we wanted to get.I got Lavan C.Flowers in a Pita (cauliflower, tahini, scallions) while my cousin got Wild Mushrooms (a whole forest burned on a hot steel, scallions, sour cream). With each order you get a number which you place wherever you are sitting, and they bring your order to you. There are a decent amount of tables here, as opposed to most stands in Chelsea Market, yet most were occupied. We took the one available table and waited. Since I was told I could use any name for my order, I used my Israeli one (Irit) and the waiter who brought out my order spoke in Hebrew to me. It was a nice touch and from a quick assessment I'd say maybe close to half the employees spoke Hebrew.As to the food itself, my dish was quite delicious. In  general I think cauliflower is alright but the combination of flavors together with a soft and fluffy pita (the way it is supposed to be in my opinion) worked very well. My cousin liked her dish but didn't seem to be as impressed as I was.It is a bit on the pricey side and I felt like a pita wouldn't fill you up if you wanted a full meal. yet this place is definitely worth checking out. Bonus points given to seeing Eyal Shani work his magic in the kitchen.",Miznon,4.0 star rating,$$,Mediterranean
49,I1xg9UHO62ZhR9oluvRy5g,John C.,4.0 star rating,"Pitas are delicious and the vibe is fast casual chic which seems right for the Chelsea Market crowd. Like others have said, one pita most likely wont' fill up a hungry guy and pitas are quite pricey at $10-13 a pita. We had the minute steak and intimate hereford stew pitas and both have incredible flavor.This place reminds me of Taboonette in Union Square. They have the exact same style of pitas but are bigger and cheaper.",Miznon,4.0 star rating,$$,Mediterranean
50,0bdl7BZb2Chb2x72RovvAg,Sasha M.,5.0 star rating,Amazingly good. Factoring in the price - ridiculously great. New York hasn't seen anything like this. Ingredients are clearly superb. I've never had anything even close to this good stuffing a pita - and there's plenty of choice in this city. And the whole roasted cauliflower... is just heavenly.,Miznon,4.0 star rating,$$,Mediterranean
51,m5UVCxpvGFpBNdoDOLBMJA,Adam M.,5.0 star rating,One of the best food I had in ny it's like you hugging the pitta and making love with the food the place very authentic can see the kitchen very clean the service it's very good it is best food is delicious fresh ingredients and lovely energy..,Miznon,4.0 star rating,$$,Mediterranean
52,-CND_pAGp1-OpYznC8uuiQ,Omer R.,5.0 star rating,"Great food, great atmosphere, wow wow wow. don't miss the burger! Probably the best I had in my life. AMAZING",Miznon,4.0 star rating,$$,Mediterranean
53,0ktSbUmXbeBPs42WHOZgNg,Yarin D.,5.0 star rating,"Visited during the first week the Miznon branch opened in Chelsea Market in NYC. Definitely a good place to go to sample high quality fast food in a pita. The cauliflower met our expectations was fresh, tasty high quality fast food, so does the wild mushroom. Nonetheless is worth the visit and the ambiance with Mediterranean music is vibrant. Wait was not too long on that day as well.",Miznon,4.0 star rating,$$,Mediterranean
54,3V-FO9HsvG9DtFYNjaYnog,Shanny L.,4.0 star rating,The rib eye minute steak pita sandwich was delicious - juicy and very flavorful. I could probably made the steak at home by buying those really thin steak slices from Japanese groceries (those used to cook sukiyaki dish) but I won't be able to replicate the pita at home. The pita was warm and tender with some great sauces inside - I tasted some oil and tahini with tomatoes and pickles. Would love to come back try other pitas and side dishes! A bit of a wait but not bad - a good place for grab and go kinda meal.,Miznon,4.0 star rating,$$,Mediterranean
55,Z0PwubGpI-6zrpB05L5e9g,Tsvika K.,5.0 star rating,"Wow !As published and expected .Wow !The cauliflower growers in the USA going to work hard ,this dish is real and tasty and fun to eat .Add some great rib eye roast beef in pita with tchina and you got yourself a party in your mouth - so good .Lets just add the unf***ingbelivable chrayme (don't try to pronounce ) in pitta .its just melt in your mouth with the right spicyness , ridiculous ......",Miznon,4.0 star rating,$$,Mediterranean
56,ePOBLwelWjndrz4mG-xBLg,Guy K.,5.0 star rating,"This is probebly one of the best fast food restaurants in New York.Fresh good tasting food, all in pita. Love it.",Miznon,4.0 star rating,$$,Mediterranean
57,VqzDX4d76SxbPTdARoqeSg,Sarah C.,3.0 star rating,"I came to miznon excitedly After dining at Eyal Shanis other miznon locations (Paris+ Tel aviv), as well as North Abraxis in tel aviv- One of his more upscale restaurants.Atmosphere: fantastic. Like walking into a secret portal that takes you straight to tel aviv. Bombarded with delicious smells and trays of beautiful food being served to excited happy customers all around. Middle eastern musical favorites boom over the speakers! Service: spot on. Fast, friendly and on the dot.Food: ingredients were AMAZING. Composition was FANTASTIC (no surprises there- eyal shani can really do alot with a little!). Only reason i gave 3 stars:The portion was lacking in size. For 14$, you expect to get a pita jam packed with meat etc. It was about half full. As well- sandwich on menu said ""served with a tomato ""burger""""- a big ass slice of tomato- mine came with chopped up tomato. Small detail- but still. Lastly- we ordered sweet potato- 6$- the order apparently comes with ONE (perfectly roasted DELICIOUS) sweet potato. Sort of ridiculous even by NYC standards.Lastly- at his other locations world wide- tahini and hot sauce are readily available to customers in larger vats to self serve. Not the case here as I'm sure it's against NYC health code. You have to request it upon ordering. Not a big deal. Hopefully next time the portions willBe a bit more generous, and maybe they throw in an extra tater for your 6$... and seeing its their first week open- they're doing a great job. Either way- GO EAT HERE- and experience DELICIOUS israeli cuisine!!!",Miznon,4.0 star rating,$$,Mediterranean
58,epPL09GyZ1zdoecOcXb7vw,Madison B.,1.0 star rating,"We got to Miznon very excited to try the food. We arrived around 7:05pm for dinner. As we were trying to walk in, we were rudely approached by a guy bussing tables and were told that they were closed.  I couldn't quit understand the reason but I think he said it was because they were running out of food. My husband went in anyway to read the menu and the same guy was giving my husband dirty looks and tailing him. The restaurant was supposed to open until 9 PM. This is just bad business, rude and ridiculous.  Order the right amount of food. Stay open until your published time. Sell your food. It's not that hard. Wish I could give this place zero stars for total incompetence.",Miznon,4.0 star rating,$$,Mediterranean
59,Y8rlDwHeLQAzqvtXoy-lDg,Jessica D.,4.0 star rating,"Scrawled on the wrap-around chalkboard that decorates the restaurant are the words, ""Dreams do come true.""  Based on the buoyant, sexy vibe that emanates from the staff behind the counter, this must be the case for the newly opened Chelsea Miznon.  The excitement is palpable.    But did the lamb pita make my dreams come true?  For the most part, yes.  My favorite thing about the sandwich was the way the fat fluffiness of the pita absorbed all the juices from the lamb, tomatoes and onions.  The ground lamb was well seasoned and juicy, though it really needed a sprinkling of salt.  All of the ingredients tasted really fresh, like someone prepared them for you at their home.  Though I doubt I will crave this particular sandwich again, it was good enough to warrant me coming back to try the minute steak and roast beef.",Miznon,4.0 star rating,$$,Mediterranean
60,mlQfCJAmy_cTaIR_rrvtOg,Jonathan P.,5.0 star rating,Feels like home. Great service and the best food I've had in New York. As a vegetarian I suggest trying the Lavan and the Ratatouille - they are amazing! Before I was vegetarian I used to take the minute stake which is amazing too.,Miznon,4.0 star rating,$$,Mediterranean
61,S8TrytdRsF-6ovqGQEWnpQ,Xiyin T.,2.0 star rating,"Came here this past Saturday night and had the minute steak pita and the beef stew pita. Hands down best pita I've ever had, better than Dizengoff next door(ish). It was fluffy and pillowy with a chewy exterior but none of the bitterness associated with a more charred pita (like Dizengoff, which also makes a fine pita). The minute steak especially was incredible -- it was tender and flavorful, served with an amazing green hot sauce and a massive charred pepper to boot. I'm already salivating thinking about it. Music was good; ample seating. It would have easily been a 5 star experience if not for the insanely surly service. The way these servers were acting made it seem like they were paying me to be there, versus me paying them 13/14 bucks for a small pita sandwich (you really can't make a dinner out of one), plus tip. What I'm about to retell is the most bizarre experience I've ever had involving a soft drink and should be read with the Beyoncé album Lemonade playing in the background.At the cash wrap I was specifically asked if I wanted a drink. I asked if they had lemonade and the cashier said Yes, it's fresh squeezed, but off menu, but amazing, and I'll charge you for a Stella. So with tip, two pita sandwiches and a soft drink totaled 44 bucks. Ok. Sandwiches are brought to my table after about 10 min and I ask about the drink and she says I have to go pick it up at the bar and she can't bring it to me. I go to the bar and a female bartender with short blonde hair glares at me and says, 'We don't have lemonade, I have to make it by hand' and then walks away. Ok? First of all, your cashier sold me a lemonade--in fact, UPSOLD me one, because I would have been happy with my 30 dollar fast casual meal minus the extra 14 bucks for your amazing off menu hand squeezed lemonade that rivals the price of a cocktail at Paul's Casablanca--did I somehow accidentally bring ill upon your entire family? Secondly, you're a bartender at a full service bar. Presumably you have simple syrup and a handheld juicer for mixed drinks and if you don't have the latter why don't you sell one more 15 dollar sandwich to invest in one. Third of all, if your job description as a bartender isn't to squeeze and mix stuff, what is it? Did I miss the memo and when you woke up this morning did you intend to come to work thinking it would be a day of prancing in the sun while eating bon bons? Finally, if you don't intend to make my 14 dollar lemonade of which 3 bucks was your tip for slicing open a few lemons and diluting with water and sugar, how about a refund instead of glaring and walking away? I'm happy to spend 5 bucks next door for the same exact thing.But I swallow my complaints and I wait. I waited 15 more minutes at which point we'd eaten both sandwiches and at which point 25-30 min had passed with no lemonade. Now we are leaving and now despite the amazing sandwich I have an awful taste in my mouth. We see same blonde bartender angrily making two lemonades (I mean it, never before have I seen more vitriol from a woman plucking lemons with her bare hands out of a cocktail shaker...and I once hand squeezed 40 lemons for my best friend's birthday lemonade punch, gratis) and those lemonades sailing past us on a tray (wait, what's this about not being able to bring the lemonade to my table?!). We ask if it's ours and server just smirks and says, Uh, no, and keeps walking. Blonde girl sees me waiting and passively aggressively within earshot of me declares to seemingly no one but her very own unhappy self, No more lemonades!! And then stalks away. I wait around another 5 min (ignored) before finally asking for a refund for this 14 dollar white elephant. Took another 10 min to get a refund on just the lemonade. Walked around the corner and got a FRESH SQUEEZED MINT one at Dizengoff for 5 bucks and the server smiled at me and I didn't feel like s for no reason anymore, after all.",Miznon,4.0 star rating,$$,Mediterranean
62,1gLL2seNRkmmfMX7nWlfLQ,Nir Z.,5.0 star rating,Wow cauliflower was tasty so much Thank you Eyal Shani for coming to NYCI'll definitely go back again,Miznon,4.0 star rating,$$,Mediterranean
63,NHDLD6jMuugJkS0TUZGfRA,Sylwia K.,5.0 star rating,Rib eye minute steak pita is to die for! The pita is soft and fluffy and the meat melts in your mouth. The pepper on the side is also a very nice addition.,Miznon,4.0 star rating,$$,Mediterranean
64,E0BNxGiJlKSlESi5DV7LtA,VK I.,5.0 star rating,We stopped in for a quick bite. Ordered the lavan cauliflower and ratatouille pitas and asked for spicy. Both came out topped with a spicy green sauce and were delicious. Under $20 for lunch. Highly recommend.,Miznon,4.0 star rating,$$,Mediterranean
65,7vn50WJGsaanF3tRxqysnA,Mark S.,3.0 star rating,"Don't get the hype. Mushroom pita sandwich was bland. Friend got the steak and wasn't impressed. Cauliflower was good, nothing special. Didn't have enough forks so they gave us spoons. Expensive for what it is.",Miznon,4.0 star rating,$$,Mediterranean
66,cV1lVARs9daC6H4v2-zmyg,Uriel B.,2.0 star rating,"After seeing a documentary on YouTube about this restaurant in Tel Aviv and in Paris I was very excited to discover that there was going to be one in New York. Unfortunately it did not live up to expectations and I left so disappointed. The baked cauliflower arrived cold, which I don't understand how it could be possible when we're sitting at the bar with the kitchen right in front of us. The pita sandwich was so chewy and doughy, it was absolutely disgusting. The pita filling whi ch was described as a ratatouille but can't really be considered as one since there was no zucchini, was so greasy it tasted like fat. So disappointing.",Miznon,4.0 star rating,$$,Mediterranean
67,Am1980RFOpgTdhRRtMvpWA,G D.,5.0 star rating,Amazing food and atmosphere! Can't wait to come back! Loved the stew pita and the vegetarian options. I wish there were more places like this one!,Miznon,4.0 star rating,$$,Mediterranean
68,8Wo1pIiPNoBYpB_kndADcg,Marlon F.,2.0 star rating,"I've visited Miznon in Paris and Tel Aviv and this one doesn't compare. The pitas are not filled up enough, the service was very slow and the staff didn't seem to understand what they were selling. I hope it gets better with time. Very disappointed.",Miznon,4.0 star rating,$$,Mediterranean
69,EBcM_c5ysRYLluwpB39zJQ,Karen J.,5.0 star rating,"Loved it will definitely definitely be back. Good vibes ,people and good food. Love the all in pita thing",Miznon,4.0 star rating,$$,Mediterranean
70,Il5rRALWBeqNBeYRVRLYcA,King K.,3.0 star rating,"I tend to rate based more on food more so than experience. My experience here wasn't that great, but I'm letting it slide since it is a relatively new establishment. Went on a Friday night, and they were extremely busy, almost in over their own heads. Taking orders at a brisk pace, which is fine when it is that busy. Once my order was taken, the food took 50 minutes to come out. When my order came out, they made it a point to tell me that the other thing we ordered was no longer available. Strange to wait 50 minutes to tell me that, but you can tell they haven't really gotten a handle on how to handle certain things yet. They accommodated us nicely with another choice off the menu no extra charge, which was brought out right away. The food was very good, but was kind of lukewarm, expecting fresh food after almost an hour wait is a fair expectation. Food was good, the pita itself was delicious, will definitely try again after the hype dies down and the service gets a handle on the overwhelming setting of Chelsea Market.",Miznon,4.0 star rating,$$,Mediterranean
71,kSYhku2SU0MLTjzLTx-CfQ,Mika K.,5.0 star rating,"We had a great experience and we will definitely come back!! We had the rib eye steak pita and the cauliflower and they were delicious. Everyone was nice, kind and helpful. Try the Israeli beer they serve there-goldstar. It's amazing",Miznon,4.0 star rating,$$,Mediterranean
72,261vedWNxQ9F1ejH-cz-4g,Isabella W.,3.0 star rating,"Found myself near Chelsea market at lunch today so stopped in to try this hot new place. Great service, delicious pita, yummy filling but it's 2 hrs later and I need to eat again. Small portions for price.",Miznon,4.0 star rating,$$,Mediterranean
