,user_id,user_name,user_rating,user_text,restaurant_name,restaurant_rating,restaurant_price,restaurant_type
30,uTPVZxJ0fTVKl6GcXv4JMw,Suzie C.,1.0 star rating,"Update: I've been back three times since I wrote my first review and this place has lost a star each time. The service has gone down hill and the place has seating issues. It's become less of a nice place to eat (especially inside in winter) and more of a crusty bar.  North Soul's focus on healthy and sustainable food, makes it a ""feel good, taste good"" place to eat. The fig jam and apple grilled cheese sandwich on raisin bread was mind blowing! It's great that they have healthy sides like steamed broccoli and sautéed spinach to balance out more decadent meal choices. This restaurant is ahead of the curve in its offer of fresh vegetable-centric dishes, vegan, and gluten free options, in addition to classic meat and fish dishes like hamburgers, chicken, steak and salmon. I'm looking forward to going back for brunch and trying the gluten free waffle with another frosé cocktail. Everyone I ate with enjoyed their dinner and the service. Although off the beaten path, this is one of the better, more evolved restaurants in Hoboken.",Northern Soul,4.0 star rating,$$,"Bars,, Music, Venues,, American, (New)"
31,_pAUtwPNzcdv-fAbBEggmQ,Elisa M.,5.0 star rating,"My husband and I moved to Hoboken 4 years ago, our first night out was at the original Northern Soul! We went to the new location last night. The people, atmosphere, food, did not disappoint. Great food options, great staff, all around good place.",Northern Soul,4.0 star rating,$$,"Bars,, Music, Venues,, American, (New)"
32,ExUPLg8VycM0pNzMR2yGaQ,Alexandra Z.,1.0 star rating,"Don't believe everything you read..The place is super boring, dead vibe, the one pool table is hawked by a crowed of kids. No live musicSuper slow serviceVery limited menuWe couldn't finish our one drink fast enough. By the way. This 'amazing service' everyone talks about is non existent. We weren't many people sitting at the bar, and it took them a while to take our order. Once they did tho the drinks came out fast. In shot, super boring place, tiny menu (unless ur a vegan), no live music and slow service. Two thumbs down.",Northern Soul,4.0 star rating,$$,"Bars,, Music, Venues,, American, (New)"
33,qNXaNGVthaVfmEceNGMcQA,Winston S.,1.0 star rating,Wings were blackened / severely burnt and wings were way over cooked (added a photo). Didn't include any sauce for the wings.,Northern Soul,4.0 star rating,$$,"Bars,, Music, Venues,, American, (New)"
34,s37vAAT56e_ozrXA8G_SUQ,Kathryn E.,3.0 star rating,"I really wanted to love this place. Staff was friendly, lighting was on the darker side, great music. We order the skirt steak sandwich with fries and the chicken cutlet sandwich with sweet potato fries. The chicken sandwiches advertised and either grilled chicken or chicken cutlet with roasted tomatoes and basil oil. I was given an over cooked cutlet between two pieces of tough bread with motz  cheese.  My side salad was tossed lightly with a delicious vinaigrette. My favorite part of the meal by far. My sweet potato fries were burnt and had no flavor. Unimpressed unfortunately. Great bar. Not great for food.",Northern Soul,4.0 star rating,$$,"Bars,, Music, Venues,, American, (New)"
35,WGK5YR8cSr8omlrgXMoH0w,Bonnie B.,5.0 star rating,So I ordered from this lovely place off uber eats I purchased the Salmon with garlicky kale and citrus quinoa  and all I can say is WOW this was by far the best salmon I've had around town listen the whole dish was amazing and I guarantee if you like kale quinoa and salmon this is going to be your fav I'm in love the flavors are amazing the salmon has this thin layer of crisp with a juicy flavorful inside breath taking I can't even seriously !!!,Northern Soul,4.0 star rating,$$,"Bars,, Music, Venues,, American, (New)"
36,coRkzl6oqJxbYhvl8PBS2Q,Nicole G.,5.0 star rating,The service and atmosphere are great. It has a pool table. bar..music and for those who love sports they have 3 screens. Chicken sandwich and burger both delish! The soul sauce is everything!,Northern Soul,4.0 star rating,$$,"Bars,, Music, Venues,, American, (New)"
37,Pxm8Qi5yCA5SsjtxXS6qng,Lucia M.,3.0 star rating,"Oh how I miss my Northern Soul of old. Today we turned up for brunch to find at least 10 strollers parked outside. Parked.  Strollers. I loved Northern Soul for its adult atmosphere, even at midday on a Sunday. Pool Table (without kiddies running about). Good food.  Good booze. No kiddie menu. An adult bar. At night it's still good, but during the weekends during the day, you will think you are in Park Slope. Sigh.",Northern Soul,4.0 star rating,$$,"Bars,, Music, Venues,, American, (New)"
38,IRcGM-kFbDOSZPa27BJuOA,Lydia M.,5.0 star rating,"Just had my daughter's birthday party there for 15 people and they were super accommodating with everything from the menu, drinks to the seating arrangement.  We sat outside and they gave us our own little corner.  The food was great too!  They have validated parking which was perfect for family that didn't live in the area.  My guests loved the experience and we all agreed we'd be coming back.",Northern Soul,4.0 star rating,$$,"Bars,, Music, Venues,, American, (New)"
39,fodOgtRg9Tt1EKhaC13Glw,J M.,4.0 star rating,"The neighborhood needs this place. Very chill atmosphere, with a patio that allows dogs. I've only had snack foods like the fries here but definitely plan to come again. Staff is very nice and friendly.",Northern Soul,4.0 star rating,$$,"Bars,, Music, Venues,, American, (New)"
