,user_id,user_name,user_rating,user_text,restaurant_name,restaurant_rating,restaurant_price,restaurant_type
128,yxGRJ68dkMwY7fRvJai9jQ,Nicole V.,4.0 star rating,"All these 2 star reviews bother me...this place is LEGIT. It's small, yes. Loud, yes. But in Hoboken, it's perfect for an intimate meal in an area that's not overpopulated with the usual Friday crowd. My roommate suggested it for an impromptu girls night. BYOB, AWESOME. We DID have to wait 40 minutes for a table, so off to Finnegan's we went for a glass of wine (right around the corner) and it was painless. We started with the cheese plate on the specials menu, which was phenomenal. My roommate and I love cheeses - the stinkier the better - so it was an no-brainer, and for $20 it was well worth it for a hefty piece and a half of bleu cheese with Gorgonzola crumbled on top (cheese on cheese on cheese!), fresh mozzarella & tomato, parmigiana reggiano drizzled in balsamic, and some stinky slab of unidentifiable cheese that was ridiculously good. We also pigged out on the buratta crostini, as I'm a sucker for a good buratta. And boy, was it good. Fresh and light, drizzled in honey and absolutely perfect. We went with pastas for our main dishes, she the gnocchi and me and orrechette with sausage and broccoli rabbe, my go-to. The gnocchi was great. Dense, but not paste-y in your mouth or belly. She was disappointed in the red sauce, just because there was SO much of it and she's not a huge red sauce person, and the menu promised saffron in the gnocchi (which I did taste a hint of). My pasta was cooked perfectly al dente. A light olive oil and mild hint of heat in the sausage, mmmmmmm! Awesome. I really hope this place gets better reviews soon, because I fully endorse it. Keep doin your thang, Otto Strada.",Otto Strada,3.5 star rating,$$,"Italian,, Pizza"
129,g4fEUd_F8NsOviDUOh3Hlg,Riley D.,1.0 star rating,Food looked fantastic but sadly I wasn't able to enjoy a meal here. 4 tables available at 9:30PM on a Friday night and they refused to sit my party for over 20 minutes. Poor customer service and care.,Otto Strada,3.5 star rating,$$,"Italian,, Pizza"
130,x_g3EBEy0J3lBc599gwXBA,Laura A.,2.0 star rating,"In line with the majority of reviews, the restaurant is loud, service is inconsistent and food is OK.I had their short rib and brussel sprout ravioli special. Both things I enjoy separately, but an odd combination together. The dish would have probably been much better sans sprouts. My friend had the fig and prosciutto pizza and he also seemed underwhelmed.  Overall, this restaurant is on par with many of the other Italian places in Hoboken- OK food, but nothing worth going out of your way for.",Otto Strada,3.5 star rating,$$,"Italian,, Pizza"
131,mzGgk_y_3juq-aY08vmp6w,Bjorn P.,4.0 star rating,"Ordered off of seamless on a Wednesday night and was overall impressed. The delivery took 70-80 minutes which is long and I paid 43 dollars for a pasta and an appetizer and there bread that was provided was not interesting nor did they provide butter or olive oil or cutlery / napkins...those are the negatives which made this place three stars instead of four. However the main dishes were very good and interesting. For 18 dollars I had a and olive oil and burrata sampler with four types of olive oil and four dollops of fresh burrata. They were excellent especially the chili which was outstanding for its kick. The crostini provided was also very good. Although expensive it is a large appetizer and could easily be shared by 3 to 4 people although more crostini would be needed. I also ordered bucatin carbonara. This was more like a cacio e pepe but it was very well done. The pancetta and pasta and sauce were very tasty. I don't love bucatini because it's a thicker noodle so would have preferred spaghetti or even penne but this was still a good dish. Because of the way they prepare these dishes I will definitely try other parts of their menu including the pizzas or secondis. I ordered their Porco Picante (san marzano tomatoes, homemade mozzarella, pepperoni, hot sausage, hot Italian peppers, chili oil, ricotta salata, fresh basil and evoo) - it was delicious and spicy! It's expensive but the ingredients are stellar and the delivery was on time from seamless. Notched an additional star because this place is becoming a favorite.",Otto Strada,3.5 star rating,$$,"Italian,, Pizza"
132,tVD87WRbkdNdHmU3tdsVyw,Jay B.,4.0 star rating,"Otto Strada has become our new Italian go-to in Hoboken.  The mussels appetizers (both types) are our favorite. We have been there about 5 times now, and the experience has been good consistently. It's also BYOB with a nice outdoor seating area for the warmer weather. Definitely recommend Ottos",Otto Strada,3.5 star rating,$$,"Italian,, Pizza"
133,KZaNjCloXcl98Xe60NWXNw,Josie D.,4.0 star rating,"A great little ""find"" in Hoboken!  The pizzas are divine!  The bruschetta is the best I've ever had and the caponata bruschetta ... delicious!  Love this place!",Otto Strada,3.5 star rating,$$,"Italian,, Pizza"
134,hBMUTEaihcbbIQX3WsXsiQ,Gary W.,5.0 star rating,Happened to discover Otto Strada this weekend where I went with my son &  his friends for dinner Saturday night. The boys live in Hoboken and didn't know of this place. They all had the pizza and said it was amazing and were so glad to find a new place that is good & off the beaten path to go to. Great and huge kale salad was spectacular as well. The atmosphere was perfect and the grilled octopus was to die for. I can't say enough good about this place. The staff was more then accommodating. I've been to quite a few places for dinner in Hoboken and this by far was my favorite. I'm not a fan of Washington street and love that this little gem is away from all the hustle & bustle. Can't wait to go back and try the meatball.  Thanks for surpassing my expectations!!! :),Otto Strada,3.5 star rating,$$,"Italian,, Pizza"
135,DJRI0RMJYKyr66mFKjpuBQ,Joshua S.,2.0 star rating,"The food was good.  Nothing worth writing home about, but still good.  I would give this place 3.5 to 4 stars on the food alone, but the service was TERRIBLE.  It took over an hour for us to get our food.  The waiter told us the kitchen was backed up with delivery and take out orders, but come on.  Are you going to prioritize delivery over people that actually came to your restaurant?  I would love to recommend this place, but don't come here expecting a quick dinner.",Otto Strada,3.5 star rating,$$,"Italian,, Pizza"
136,qul6AeKlc5a_V5EWVPxrCA,Rona G.,1.0 star rating,"I can honestly say I have never experienced baby discrimination like this before. I went to this restaurant tonight with the best intentions with my husband and toddler for dinner, and I was told my toddler's stroller, even folded was a fire hazard and denied entry. Needless to say we left because I knew this was a lie as most restaurants in the area are beyond accommodating. When I researched this being a fire hazard upon returning home and realized it was a lie, I called to discuss with the manager, hoping he would just admit he doesn't want kids in the restaurant and he HUNG UP ON ME! This place is in a prime area with kids, and was half empty at 6pm but even at that hour to display this behavior I surely hope they are closed within the year.",Otto Strada,3.5 star rating,$$,"Italian,, Pizza"
137,vtp4B7HGBZwY7bA7qmK10g,Melissa D.,2.0 star rating,"The service at this place isn't the best, the waitress wasn't very accommodating toward my friend who has a gluten allergy and we went there because they had ""g free options""We ordered the caprese and took a few bites and we both said the mozzarella tasted strange - like cleaning product. We sent it back and it turns out they messed up while making it and put sugar in it instead of salt. How does that happen? It's a lackluster Italian place in Hoboken and I won't be going back.",Otto Strada,3.5 star rating,$$,"Italian,, Pizza"
138,6H1CjBF2Q1-d7m-H3Ykbyw,Drew T.,5.0 star rating,"I'm surprised and almost mad at a lot of the reviews here.I've been here many times, and have never been disappointed. I've come with a group of 10 and had a great time, and i've come on dates and had an equally good experience. First of all it's BYOB and the prices are totally reasonable. The food is pretty traditional, and very good. Stop comparing it to Anthony David's which is literally twice the price. It's kind of loud....like most restaurants that are filled with people enjoying themselves. Go sit at home with your boring girlfriend if you want to eat in silence. Staff is always friendly. The restaurant is beautiful with a lot of exposed brick and cool tables. In summary: don't come here if you want to hear yourself chew and you like bad food.",Otto Strada,3.5 star rating,$$,"Italian,, Pizza"
139,vruTFIVpHunarkR_v3tcaw,Renee F.,1.0 star rating,"I called at 615pm to let the restaurant know I had a party of 8 arriving at 730pm to see if they could take a reservation. I was informed they did not take reservations but was reassured multiple times that we could arrive at 7pm to ""put our names down"" and have no issues getting table. The party of 8 walked across town to the restaurant only to be told there was a two hour wait and when I mentioned what the person on the phone said all I received was a shrug of the shoulders. That is one of the most unprofessional ways for a restaurant to handle an issue. Needless to say I will never go to Otto Strada and neither will the 7 other friends (including 2 people who say they love this place) that walked across town only to be lied too and turned away.",Otto Strada,3.5 star rating,$$,"Italian,, Pizza"
140,gUZm3Dt8EL7Flua6tLthOw,Tom C.,2.0 star rating,"Very disappointed. Heard great things about this place but from food to service the whole experience was mediocre. For appetizers, we ordered the kale salad and a sausage and peppers plate. The sausage and peppers were good, but it was presented In deconstructed way with three separate piles of sausage, peppers and broccoli rabe. Weird. Tasty, but weird - it needed some starch, like crostinis or something.  The kale salad was terrible. Completely over dressed and it included almost half a bulb of garlic in it. I accidentally ate an entire piece of garlic because I mistook it for a crouton. The salad was basically inedible. On to mains....The gnocchi was overcooked and also pretty inedible; like glutinous bricks.  The tomato sauce tasted canned. The tortolacci was rubbery and under seasoned. The cream sauce for the tortolacci was sweet and didn't really match the flavor profile of the rest of the dish. There was also way too much of it on the plate, that dish probably has about 1,000 calories of heavy cream in it. Service is what you typically get in Hoboken (e.g terrible). Had to pour our own water and wine thought the meal and flag down the waitress to get some Parmesan and a new fork and knife when the busser took our flatware away with the appetizers, which took forever since she was also busy answering phones and emptying the coffee maker.  She was tipped accordingly. I probably won't be back. I've come to expect mediocre food in Hoboken and was hoping this would be something on par with the better spots in town, like Anthony David, but it's not. It's just another hyped up place filled with 23 year olds glad to have another BYOB joint who wouldn't know how good food is supposed to taste.Maybe the pizzas are better but I'm not going out of my way to try. Not with hour long waits when Grimaldi's is right down the street.",Otto Strada,3.5 star rating,$$,"Italian,, Pizza"
141,eovbRAe5rekamkAQt5ofaQ,J C.,3.0 star rating,"Really? What's the fuss all about? Maybe we went on an off night but...Otto Strada was very very average for us :(Octopus appetizer was not great...a little fishy and definitely confirmed that I prefer much smaller grilled octopus. The crostini with burrata and roasted tomatoes app was quite good. The giant meatball was really delicious, but not so earth-shattering that we'd go back when everything else was so average. The eggplant parm was lukewarm and soggy...I hardly ate any of it, ugh. My guy had the chicken milanese and while I normally always try his dishes, I took his word for it when he said it was just ok. Again nothing to write home about. We had went in excited about the dessert menu and planning to order at least one, but decided against it after our sampling of dishes. Just really not jazzed about this place and won't be back, especially not with all of the great Italian places in Hobo.",Otto Strada,3.5 star rating,$$,"Italian,, Pizza"
142,rknIL0hFy4yAvQlKMEYq8Q,Kenneth B.,4.0 star rating,"One of the best dinners I've had whilst living in Hoboken. My girlfriend and I went here over the summer. We sat outside and enjoyed the summer evening. The appetizer was hit or miss. A combo platter of different roasted peppers, olives and cheeses. But the chicken prosciutto [PROSCIUTTO E ARUGULA] with tomato, arugula and shaved parmesan entree was far and away the best dinner I've had. My girlfriend had it this time and ate every last bite [which she never does]. Recently we took my mother there for her birthday. Once again it lived up to the hype. We did cured meats and cheeses for the app. I had the seafood stew. Unbelievable. The other two entrees were, again, PROSCIUTTO E ARUGULA and BRACIOLA DI MAIALE ""PORK CHOP"" ALLA PARMIGIANA. Winners all around. Yes it is loud inside. But that isn't a huge drawback. Plus, being a byob, you can drink enough to drown out the other tables. Service needs work. But I couldn't recommend Otto Strada any more.",Otto Strada,3.5 star rating,$$,"Italian,, Pizza"
143,P_m_I4JLzRmx-0quCkvvEg,Marley L.,4.0 star rating,New and right around the corner from me! Mix of indoor/outdoor - but be warned: indoor seating is tight & they take only reservations for half the restaurant.It's BYOB so that's awesome. We ordered gnocchi with tomato/sweet sausage and the fettuccine pesto pasta w/ goat cheese (special). Gnocchi itself was perfect texture. Fettuccine was great - but pretty sure that was vodka sauce...not pesto.Anyway...whatever. We'll likely be back!,Otto Strada,3.5 star rating,$$,"Italian,, Pizza"
144,zABxEmwojATteRqcnZW0yA,m f.,2.0 star rating,"I live in the neighborhood and  excitingly waited forever for it to open. I've been three and half times hoping it would be a favorite. The half time was because I walked out finally after the extremely rude black curly hair women gave us an attitude about not having a reservation yet half the place was empty. When I did eat there - over priced for what you get, poor service, and just not worth the hassle to be honest. Much better places in Hoboken with nicer staff to spend your money. Wish it was better and I would be there a few times a week. Oh - s",Otto Strada,3.5 star rating,$$,"Italian,, Pizza"
145,FWfl2MDJDJlMs8JeCig3xQ,Cristina A.,5.0 star rating,"Italian restaurants are a dime a dozen in Hoboken and this part of NJ, but Otto Strada stands out amongst them. Their ingredients are fresh, none of the food is greasy or too oily, and the food is tasty and perfectly spiced. This is a perfect date night spot or a fun place to go with your girlfriends.",Otto Strada,3.5 star rating,$$,"Italian,, Pizza"
146,zMZemOY4NHt8Db2AI66H9A,Greg D.,4.0 star rating,"Great little BYOB spot on the corner of 8th & Park...just off the beaten path.  I really liked the design.  Small and rustic looking.  The menu was impressive...and a nice variation from the ""typical"" Hoboken Italian restaurant.  I would call this more Tuscan style cuisine.  Everything we tried was great.  My girlfriend is a vegetarian, and really wanted the gnocchi.  Unfortunately the gnocci alla malloreddus already has meat in the sauce, so they were nice enough to prepare her pesto gnocci instead (which is not on the menu).  It was off the charts.  The table next to us actually saw her dish and asked for the same thing.  I would definitely recommend trying out this hidden gem.  Make sure you have reservations!  There are only about 12 tables in the whole place and I saw them turning people away at the door.",Otto Strada,3.5 star rating,$$,"Italian,, Pizza"
147,6W93jhnokEn8vj4WpulWmw,Kelsey M.,5.0 star rating,Solid dinner all around- would highly recommend the pizza (got the 4 cheese) and pasta. Also really liked the atmosphere,Otto Strada,3.5 star rating,$$,"Italian,, Pizza"
148,qwThIs1W4NyUWrXoDeF3dw,Molly B.,1.0 star rating,"Wow. I've been to this restaurant many times and have always been frustrated with the management of the wait times, however this experience was beyond ridiculous. We waited for a table for way longer than expected, after receiving extremely rude service from the hostess. Then, a very nice waiter came out and let us know that a table would be ready soon and he would come get us. He returned within a minute or so and took us right to a nice table inside. However, two minutes later he came back and very apologetically says that he sat us by mistake and that another party of 5 was ahead of us. We were very confused. Then the manager came up and basically told us to get up, extremely unapologetically... I've worked in the restaurant industry and understand the stress. However, when you seat a party after they've been waiting for longer than advised in the ridiculous humidity, you keep them there. So your waiter made a mistake, he's busy and was trying to provide nice service. Your horrible hostess (who made rude comments to everyone in reach of hearing) should have done her job and been managing the seating. Next time something like this happens you a.) Offer the party you sat mistakenly your sincerest apologies and perhaps a comped appetizer (considering its BYOB) or b.) Don't say anything to the party you say mistakenly and let the other party know that you're extremely sorry for the longer than expected wait and offer them a comped appetizer. Both options will most likely leave you with happy customers in the end. Instead, your chosen approach has left you with previously loyal customers that will never come back.",Otto Strada,3.5 star rating,$$,"Italian,, Pizza"
149,P6tehb918FtL77EOogPGgA,jason c.,4.0 star rating,"I went there with a friend on a Tuesday night. We had made reservations but I dont think we really needed them, we were seated right away. It is small inside and with only exposed brick and tile making up the interior, I noticed it gets quite loud in there. I felt I had to almost yell at my friend to keep the convo going. I suggest they put some tapestries or decorative sound deadening panels on the walls to kill the echo.Ok now on to the important stuff - the food!! It was really really delicious. I had the breaded chicken and it hit the spot. My friend had the eggplant and she loved her dish as well. After dinner we had dessert - the strawberry cheesecake. That was good also, except I had one small issue: the strawberries were still kinda frozen when I bit into them. Fresh strawberries would have been better. A minor issue. Maybe it was just an isolated thing. I didnt even bother the waitress over it. So all things considered, I would go back in a heartbeat.",Otto Strada,3.5 star rating,$$,"Italian,, Pizza"
150,Jp6ZIrld23FcI2ukMOIMKg,Emily F.,5.0 star rating,Definitely a go to in Hoboken. Great appetizers and awesome place to come with people visiting Hoboken. The atmosphere is casual chic. They don't take reservations which is annoying- but typically the wait is 30-45 minutes with a group of 4 or less. Outside seating in the summer/ fall/ spring.,Otto Strada,3.5 star rating,$$,"Italian,, Pizza"
151,9PMNPcnaO5uywlmHZa0KyQ,Olga F.,3.0 star rating,"I'm being generous giving 3 starts to this newly established Italian bistro/restaurant because I think it has some potential and I am willing to give it another chance before throwing in the towel. Here's my experience from Thursday night's dinner:The place is small and crowded so reservations are a must in my book.Since we made reservations, we were seated right away and given menus.However, the waiter didn't take our order until we frantically waved him over. This pattern repeated throughout the night and in a place that's 500 sq. ft at best, that's not an excuse. The gnocchi that I ordered were not worth the $18 and were overpowered by heavy meat sauce and some spices I could not figure out. We saved some room for dessert because when dining Italian, dessert is a necessity. We opted for a chocolate fondant ganache cake because it was one of the only items on the menu under $10. Most dessert menu items ranged from $12-$16 like the nutella pizza, which sounded tempting even at $16.",Otto Strada,3.5 star rating,$$,"Italian,, Pizza"
152,TLdKK-uYQbAIcti1smsn3A,Jay B.,2.0 star rating,"Was excited to try something new in Hoboken. Boy was that a mistake to go here! Went on a Wednesday night, and aside from one other table of two, the entire restaurant was dominated by a party of about 15 people (friends of the owner??). The BF and I are not picky eaters at all, and enjoy all types of food, especially Italian.  My complaint with this place was not so much the food as it was the terrible service!!! There was ONE WAITER for the entire place, including the table of 15. They were constantly at him to bring this or that, and he basically ignored our table for the entire time we were there- to the point where we had cold, eaten food waiting to be cleared from the table for over 15 minutes, drinks that needed filling, and I'm basically staring what looked like a manager down, and again, they did nothing but ignore us. We aren't needy customers- I don't need you to come over 5000 times and ask how things are- we really need the minimum of attention. But please, when we order appetizers, mains, etc...bring them in a reasonable amount of time, and clear them as well! The sad part is, I think the owner was at the party of 15 and he couldn't have cared less when we looked clearly annoyed- he was too busy demanding wine for him and his friends- glad they got good service! We didn't.For this reason alone, I wouldn't go back, no matter how good the food is. There are better places in Hoboken for sure.",Otto Strada,3.5 star rating,$$,"Italian,, Pizza"
153,iPHZWOwcMtpSakilbfrVbA,Mr. J.,4.0 star rating,"Great food and service and I would give 4.5 stars if I could . The atmosphere could be a little better (hence 4.5 stars) but that aside , a very good Italian place with 5 star food. The shrimp app and the mozzarella bruschetta is too die for - exceptional. I would love to have tried the pizza but we were too full . Oh and BYOB as well!!!",Otto Strada,3.5 star rating,$$,"Italian,, Pizza"
154,NWLqOKl0Vxi7qK-6EoBLbg,Brandon E.,3.0 star rating,"New Italian place in town, I'm all in! The wife and I went  on a Friday night to check out the new kid on the block. The place is small and kinda your typical new Hoboken restaurant, exposed brick, reclaimed wood and subway tile. Not a negative just an observation. The place is small only about 10-12 tables mostly 2 tops they push together for larger parties. Like many restaurants in town you are sitting on top of other guests and having to move your table so people can get in. No biggie, it's the norm.For whatever reason this place is obscenely loud for a small place. I mean it has the acoustics of you singing in your shower.  This is a perfect place for 25 year old girls to drink wine and yell so be ready for that. We could barely hear over everyone else trying to talk over each other. So don't come here for a nice calm and romantic evening.On to the food. I will say everything on the menu sounds pretty good. We started with the crostini and it was delicious, actually my favorite part of the meal. There were 5 solid pieces that were just absolutely fantastic and full of flavor so after that we waited for entrees in excitement, alas not to be. I ordered the giant meatball with ricotta cheese and wife got carbonara. The meatball is literally just that a giant meat ball served on a cast iron skillet in red sauce with a few pieces of bread around it.  Add some pasta or something. The meatball itself was really just kinda ""meh"". To be honest it was disappointing it was kind of bland and in reality I've had a lot better. I watched the lasagna and some other dishes come out and I wish I would have gotten those. The sauce was good, it was the star of the dish which it shouldn't be. The ""ball"" just lacked true flavor.  The lady's was kinda bland for a carbonara, it definitely needed more seasoning or something it was also ""meh"" she didn't like it that much. None of it was the point of sending back we ate it all but neither of us would order those dishes again. For desert we got the chocolate cake, this was also just average, it tasted no different than a chocolate cake from shop rite. Tasty but just nothing that was over the top exciting. We should have gotten cheesecake or a cannoli.Overall the service was ok and food came out in a pretty reasonably time frame. It's also BYOB, which is a plus. Probably the most disappointing thing for us were the kale chips. It's an Italian restaurant, give me some bread, butter and olive oil! I'm half Sicilian and these are staples at every other joint and family table I guess maybe it's trendy or healthy. But let's be real, Italian food isn't health food. It's carbs, straight up lots of carbs. The kale chips were just so boring and I was so excited that there was bread on my meatball. If you're into rabbit food then you'll be thrilled.Overall, a straight average Italian place. Will I be back? Eh maybe after a while but it won't be my first choice for Italian in town.",Otto Strada,3.5 star rating,$$,"Italian,, Pizza"
