,user_id,user_name,user_rating,user_text,restaurant_name,restaurant_rating,restaurant_price,restaurant_type
206,J4PcXfK2nLeR7oapRvn6Rg,Ariel P.,5.0 star rating,"Absolutely amazing experience at Sugar Factory. My wife and I have had this place on our list for over a year and have never made it in. I booked a reservation for our anniversary and had a blast!! The signature Goblet drinks are worth the hype! They are huge!!! And Strong!! It took me 2 hrs to finish one. They have great flavor options with delicious pieces of candy inside of each drink. My wife had the Watermelon Mojito which came garnished with an amazing watermelon Gunmy candy. I had the ""Drake"" aka the drink that was a proved by Drake lol. STRONG and delicious. Pretty much a peach Bourbon Iced Tea. The liquid nitrogen is of course the wow factor, and it really makes the experience more exciting. We did not eat much, but the fees were perfectly crispy, and the mac and cheese pops were great!! The service staff is sensational. Head gentlemen know how to get the party started, and keep it going. Our server King was very professional and attentive. He surprised us with a candle and a unique anniversary song. Class A service.Thank you Sugar Factory for making it happen!!Ps. Music selection was perfect.",Sugar Factory,3.5 star rating,$$$,"Bars,, Candy, Stores,, American, (Traditional)"
207,9k0hKjqL0bM40APYaNjNyw,Penny M.,4.0 star rating,"This is a great place for kids and teens. If you're wanting a gourmet meal, prob not your place. If you're wanting an iconic experience and some fun desserts/sweets, this is totally your place. My whole family had fun. I def recommend reservations tho.",Sugar Factory,3.5 star rating,$$$,"Bars,, Candy, Stores,, American, (Traditional)"
208,kAZxs4MqskD5pROjbdBPZQ,Jan J.,4.0 star rating,"The drink are amazing, looks & taste.. The food is fun & i would say 3 stars.  We ordered the mini multi burger, wasn't the best tasting burger I ever had but the kids thought it was fun to eat.  The service was great & very accommodating.. The decor was cute.  The kids had lot of fun and it was a great experience.",Sugar Factory,3.5 star rating,$$$,"Bars,, Candy, Stores,, American, (Traditional)"
209,bpuQ0QNMs_PY93Jgnm3nZg,Brian K.,5.0 star rating,"Had such a fun visit at the Sugar Factory.  I've been to a couple locations, but I think this was my favorite.  The atmosphere screams, ""FUN!"" Although it can be loud at times, you still have a great time.  With a reservation we only waited about 10 minutes, which in NYC is NOTHING!  The Fish Bowls were amazing! They are worth the visit alone! I plan on going back before the new year for some fish bowls with friends! Keep up the good work Sugar Factory Staff!",Sugar Factory,3.5 star rating,$$$,"Bars,, Candy, Stores,, American, (Traditional)"
210,_BKEZO7n-YMaOAwH9nzFsQ,Ryan R.,3.0 star rating,"I really wish I could give this place more than 3 stars because the staff and manager were amazing! They were so friendly and helpful. Unfortunately, the food was extremely sub-par. It all looked great and impressive, but all of our dishes were very greasy and overcooked.   My recommendation is to come here for the crazy, party atmosphere and cocktails/milkshakes. Do it for the gram, if nothing else.",Sugar Factory,3.5 star rating,$$$,"Bars,, Candy, Stores,, American, (Traditional)"
211,nrqFRMssIrUuyifXImc_YQ,Shay F.,4.0 star rating,It is a wonderful place for celebrations. So lively and fun but minor issues. There was traffic being it was the weekend and they wouldn't allow half of our party to get a table until the full party was present. So many guest left. And things I had asked the event planner for this location to have for us was not ready and it was quite a mess considering I emailed them easy request. Aside from that our server was great and very lovely.,Sugar Factory,3.5 star rating,$$$,"Bars,, Candy, Stores,, American, (Traditional)"
212,j2LTAPrnNbgLQ2a3wwjlHg,Elena P.,4.0 star rating,"Overall I had a great experience at this location. My food, drinks, service, and dessert were all good, but not flawless. One of our desserts - the peanut butter cup ice cream sandwich, the cookies were baked too long and very hard. My brownie ice cream sandwich was phenomenal. My goblet was very strong and tasted great. I got the big cheesy burger as my meal - which was also very good but not amazing. The burger patty itself wasn't the highest quality but it was well prepared. The fries were crispy and fresh, certainly tasty. Service was very good and checked in on our party often, water glasses were always full. A couple of things I want to note - our party of 6 had automatic gratuity added. Which I'm not a fan of, I'm typically a high tipper anyways, and would tip higher than what they pre charge. I did add additional tip to the bill. Not sure if that's the standard for parties of 6 in nyc, but that did annoy me slightly. Also, we realized one person from our party left her bag under the table after we left, and when we called to see if they had it, were hung up on 3 different times. We did make it back to the restaurant and get the bag back, however the phone service needs to be fixed because that's just unacceptable. Sugar Factory is overpriced and gimmicky, but a fun experience overall. Personally to spend the same amount on a meal I'd go elsewhere with a higher quality of food.. but it was a fun experience and worth going at least once.",Sugar Factory,3.5 star rating,$$$,"Bars,, Candy, Stores,, American, (Traditional)"
213,Lv-MRvAdqvNrr-9cnpzdqg,Mack D.,5.0 star rating,"Wow! Great drinks, awesome milk shakes and good food! Drinks are pricey! Wow this place was wow wow. My wife and I have been there 4 times.",Sugar Factory,3.5 star rating,$$$,"Bars,, Candy, Stores,, American, (Traditional)"
214,CmyL9PcvxB93Lk7jwOBPfg,Jen L.,1.0 star rating,"Wonder if any of the celebrities plastered on the walls had any of these issues :  1. We were seating without menus. We kindly asked our sever. No menus. We asked again, nothing. We had to fetch them ourselves.   2. Food took 45mins-1 hour to arrive.  Server was MIA and attended to tables ordering big ticket drink items. Guess we were meaningless to her. #Allfoodielivesmatter3. Had to ask for refills on water, glasses were NEVER refilled. Food is far from great.4. Our bill was added on to the WRONG table--talk about two pissed off table groups!! Bottom line: Don't believe the hype! Save your money and dine elsewhere. Cause these milkshakes won't bring the boys to your yard...They'll bring a headache and disappointment instead.",Sugar Factory,3.5 star rating,$$$,"Bars,, Candy, Stores,, American, (Traditional)"
215,-DYDMmTu4_XzdlV8J5enVg,Tiffany L.,3.0 star rating,"Like most cliche girls who want a nice Instagram photo, I came here for my 21st birthday. As the name suggests, this place will absolutely satisfy your sweet tooth and leave you in a diabetic coma (in a good way, if possible). I went with a couple of girlfriends and my boyfriend. For drinks, we ordered the lollipop passion goblet, German chocolate cake martini, and cranberry and vodka. They were all delicious because they were based on a specific candy. However, they were definitely more overpriced than upscale bars. We spent more money on drinks than food...As far as the food goes, we ordered the apple pie crepe, signature sugar factory burger, fettuccini Alfredo, and NY strip. The apple pie crepe was overly sweet and didn't taste like any sort of development of flavor besides cream and sugar. The burger was perfectly cooked and just greasy enough to hold down the alcohol. The fries were nicely salted. The fettuccini Alfredo was a bit overcooked and therefore, lacked the mouthfeel of good pasta. The NY strip was cooked shockingly well, for a place that primarily concentrates on drinks; the seasoning was great. The potatoes were mashed well and the flavors were spot on. Overall, I'd come back for a splurge on drinks on payday but not any other time.",Sugar Factory,3.5 star rating,$$$,"Bars,, Candy, Stores,, American, (Traditional)"
216,nCsPA3ehhv0vrpQCDuAiAg,Kathryn S.,2.0 star rating,"Ehhh....not a fan, this place is like the Chuck E Cheese for adults but atleast Chuck E Cheese has good pizza lol, it's everyone's birthday & the AC wasn't working, it was so HOT.  The goblet is like drinking an expensive 4 locos or Cisco or Boones Farms (#ididitforthegram) their red velvet was honestly the worst I've ever had, their whip cream tasted better then the actual cake & if you plan on getting the awesome sparkling candle to celebrate your bday like everyone else, get ready to pay $5 that they don't tell you about.  Our waitress was the sweetest person, ambiance is cool I like their chandeliers.  Trying to give both the pros and cons.",Sugar Factory,3.5 star rating,$$$,"Bars,, Candy, Stores,, American, (Traditional)"
217,MhkmiTsX639c-X4rdbPszg,Janelle T.,5.0 star rating,"I was invited back to Sugar factory so they get 5 stars for customer service alone! My waiter Raphael was great. He was attentive and personable. I went on New Year's Eve, the atmosphere was exciting- every guest received complimentary champagne to toast with at 12:00am. I ordered the white gummi (peach juice, with vodka)- very strong. My boyfriend had the energy bear (it's great if you like the taste of red bull). We had the sliders (they tasted like they were fresh off the grill) and the fries (average) for appetizers. To eat I had the pacific salmon and mashed potatoes, both were well seasoned. My boyfriend had the ribeye steak- that was great as well and covered in a yummy sauce. To finish it off we tried the key lime pie and New York cheesecake, my key lime pie was very sweet, not tart at all and the New York cheesecake lived up to its name.",Sugar Factory,3.5 star rating,$$$,"Bars,, Candy, Stores,, American, (Traditional)"
218,c-M19QsfTPfqAUftQOsN1w,Maria D.,1.0 star rating,"I'm extremely disappointed with choosing to come here for my birthday. I made a 7:30pm reservation for a table of 8 one month ago. While I was paying for the cab, my other group of friends checked in for us. We waited ONE hour before we were seated. I understand how busy this place is, but the fact that urgency for people wasn't taken after a reservation has been made, blows my mind. Also, the waiter kept walking away mid order to help other tables. As someone who used to waitress, I'm not sure where he learned that's alright. BUT ITS NOT. The vibe here is cool but definitely not the best place to go.",Sugar Factory,3.5 star rating,$$$,"Bars,, Candy, Stores,, American, (Traditional)"
219,BYmsizmGccEaCcQVQf3swg,Dena N.,5.0 star rating,"I gave the Sugar factory another try and this time I was impressed. Everything was amazing. My drink, my food, the service was all on point. If you are looking to have a quite dinner this isnt the place. They had good music, lots of birthdays and singing for each one. I personally enjoyed it. It is pricey but worth it for a special occasion. I'll definitely be recommending Sugar factory to my Friends and family.",Sugar Factory,3.5 star rating,$$$,"Bars,, Candy, Stores,, American, (Traditional)"
220,1eh0Z3C2q6cwE78R5q2L9g,Janet N.,4.0 star rating,"I LOVE THE SUGAR FACTORY!I so wish we had a sugar factory in Texas. It's not fair. This place is so much fun! Great for a date, families and kids LOVE it. The drink menu was full of unique options from alcoholic drinks to milkshakes! Drinks: I had the lollipop passion! And ahhhhh it was amazing. I loved the dry ice affect! The server even asks if you're wanting to take pics or snaps before she pours in the liquor. My boyfriend had the watermelon mojito which was great as well. The only sucky part about it is that it's mainly full of ice. I will say that it had me pretty buzz though which is a good thing. All of these drinks come and in an alcoholic and a nonalcoholic version. So it's basically fun for everyone. We didn't eat any food there because it seemed overpriced and I read reviews that it's not worth it but if you're in town you should definitely come for the drinks!!",Sugar Factory,3.5 star rating,$$$,"Bars,, Candy, Stores,, American, (Traditional)"
221,vaOFpvPOJ7ajecGVADZQCA,Ruth T.,1.0 star rating,"I would not come here again for a few reasons.  I went to go celebrate with my friend for her birthday.  I told the waiter that its her birthday and that it would be cool for the birthday song sang to her, didn't happen.  I was so hungry and didn't get my food until an hour and a half later until they finally told the waiter that they didn't have the ingredients for the artichoke dip.  everyone else got their order super fast and we waited an hour and a half.  My friend never got acknowledged for her birthday and service was very very hard to get.  The waiter did try his best and told me that I can get anything from the menu but that took another half hour.  I was hungry and disappointed that my friend did not have a nice birthday experience.  To me they were understaffed because the waiter rarely came to us and when he did it was only when we got his attention.  Wasn't his fault he was really busy.  But everyone else got their orders so fast and we did not.",Sugar Factory,3.5 star rating,$$$,"Bars,, Candy, Stores,, American, (Traditional)"
222,5lRlJp885K_l0uvY008pyw,Sallei B.,5.0 star rating,Awesome place!!! I don't know what was cooler the drinks or the candy. Best combo EVER! Thank you King (our server) for helping me celebrate my birthday with the cooler sparkler candle!,Sugar Factory,3.5 star rating,$$$,"Bars,, Candy, Stores,, American, (Traditional)"
223,GwIaNea_R4jKAR10nI4Jyg,Yohvanni K.,5.0 star rating,"We all had a blast with the girls,  food was good best part was the Apple Pie Waffles, a little vanilla sauce would if been the ultimate dessert.Place certainly has an unmatchable ambiance as far as celebrating BD's.Service was very good. Thank you Samantha.",Sugar Factory,3.5 star rating,$$$,"Bars,, Candy, Stores,, American, (Traditional)"
224,MFwYrqfMhBraPsPnSIaHkw,Toni P.,1.0 star rating,"I had a birthday get together for my best friend.  There was a party of 9. I made reservations a month prior.  We waited 45 mins to be seated, and when they did seat us, they attempted to squeeze all of us into 2 round tables.  If I would have known that they allowed the kids to scream at the top of their lungs as though we were in Chunky Cheese, I wouldn't have gone there for dinner.  I'm all about a fun atmosphere, but having teenage girls scream like their at a Justin Bieber concert is not my idea of fun.  Not only were we sticking to the floors, the service was so slow,  I understand this is a trendy spot for celebrities to come and have a good time, but if you aren't a celebrity, you get the minimum service possible. They had a cool selection of drinks and the way they celebrate birthdays, I can give an A for. But I still won't do that again.",Sugar Factory,3.5 star rating,$$$,"Bars,, Candy, Stores,, American, (Traditional)"
225,3NHOqEg8AMDEWiIaTpnTQA,Christina S.,4.0 star rating,"I'm giving this place 4 stars mainly bc of the lavish, over-the top environment & food presentations. and while the food and desserts are perfectly fine (in flavor), that is all they are: fine. i had a chicken salad and split some appetizers and dessert and throughout the whole dinner, my eyes were more impressed than my taste buds.nonetheless, ill probably come back on a night i feel like spoiling myself, getting dressed up, and overpaying for some dinner.my recommendation: just go for dessert",Sugar Factory,3.5 star rating,$$$,"Bars,, Candy, Stores,, American, (Traditional)"
226,igumWjfoDTVWsnWzTKCrsw,Kim Y.,4.0 star rating,"We went to New York for my daughter's 13th birthday, and I'm so glad my niece suggested the Sugar Factory as the place to have her birthday dinner celebration! It was a great atmosphere, fun, noisy, cool, fabulous! My daughter had fun celebrating her 13th birthday here! The food was yum, too! The chicken asian salad is so fantastic. The steak for the philly sandwich was sliced very thick, not your typical thin slices, a little awkward. The drinks are so cool! Very expensive, $32 nonalcohol, for basically juice with candy thrown in a large goblet. None of the kids drank more than a 1/3 of their drinks, because they were so sweet. Each goblet would be enough for 2-3 people! Of course, our kids wanted their own drinks. Overall, I was extremely happy with the Sugar Factory as our choice to celebrate my daughter's 13th birthday!",Sugar Factory,3.5 star rating,$$$,"Bars,, Candy, Stores,, American, (Traditional)"
227,KuM42FZtW0btiQAuG6jZMA,J F.,5.0 star rating,I went to sugar factory to celebrate my best friends birthday and had the greatest time. We had four people and four goblets (one shown in picture) and they tasted amazing! Our food was great and our server Darlene was super sweet and attentive. This is our first time in New York and will definitely make it a tradition when we come back!,Sugar Factory,3.5 star rating,$$$,"Bars,, Candy, Stores,, American, (Traditional)"
228,C_KiVVDQhAPtAugBH-SCUg,Zadia A.,3.0 star rating,"I'll start off by saying this place is definitely trendy and chic. Cute to look at. We came here for a bday celebration. The staff members are kind and professional. The ambiance is fun and club like. The loud Birthday cheering from the staff is definitely memorable and exciting.   In my opinion though, the music was so loud I was screaming to speak to my friends. I couldn't hear anyone, even the Server. Of course the food was pretty pricy but I didn't find it worthy. It was good tho. Just not great. Although the drinks are awesome.",Sugar Factory,3.5 star rating,$$$,"Bars,, Candy, Stores,, American, (Traditional)"
229,9cElTTKSSSRy422opJrghQ,Carl M.,4.0 star rating,"Lots of sweet options here, of course, but savory options abound at the Sugar Factory.  We enjoyed chocolate chip waffles and grilled chicken on brioche with Swiss cheese, bacon and avocado. Bubbly, foggy non-alcoholic drinks for kids along with a selection of candies for sale.  Full bar for the adults... Close to the High Line and Whitney Museum too!",Sugar Factory,3.5 star rating,$$$,"Bars,, Candy, Stores,, American, (Traditional)"
230,3d1EJ9KZe9LUJ3E1nVPulQ,Michelle F.,1.0 star rating,"This is probably the worst place to eat in the meat packing district! I paid for the 2 hour parking outside thinking that would be enough time, after waiting a few minutes to be seated over 20 mins went by and not even a single ""hi I'll be serving you tonight"" or ""we'll start you off with some water"" ....legit had no waiter/waitress!! I had to get up and speak w the hostess in order to just get someone to take our order. Finally without an apology this girl takes our simple orders and brings us our drink. After waiting 45 mins, to the point that our waiters shift changed, we still received nothing. Every few mins we would get our server to say ""5 more mins""..finally they brought out ""our"" food ...only for it to not be anything we ordered. We decided to just leave rather than wait another 2 hours for absolutely nothing besides a drink.",Sugar Factory,3.5 star rating,$$$,"Bars,, Candy, Stores,, American, (Traditional)"
231,dm0nIsZdBb6NTFqCJqkSww,Rema B.,5.0 star rating,"This sugar factory experience had made up for my bad experience with the Miami Beach location. The server by far was wonderful, the food was great and so was the drinks. I am very glad that this experience for my birthday was great because this time around was totally worth it!",Sugar Factory,3.5 star rating,$$$,"Bars,, Candy, Stores,, American, (Traditional)"
232,lyUg7WxyG3qiY3SD7hc82w,Tifany M.,4.0 star rating,The ocean blue drink is amazing and it's huge. It's a 60 oz bowl. I recommend going here if it's your bday or something special and want to make a huge deal out of it since they come out singing to you and it's pretty great. It's expensive but I loved everything,Sugar Factory,3.5 star rating,$$$,"Bars,, Candy, Stores,, American, (Traditional)"
233,2zrSSVeBkubeSnxrzHH6uA,Nicole R.,1.0 star rating,I will never spend my hard earned money or time at this place. Sugar Factory is not worth the hype. The service is horrific and food is mediocre. If I could give this restaurant a zero I would. The food is overpriced and tasteless. If that's what your looking for by all means enjoy.,Sugar Factory,3.5 star rating,$$$,"Bars,, Candy, Stores,, American, (Traditional)"
234,Tlcqg7YfQ2zGLIHRU4R9LA,Mary L.,1.0 star rating,"Where do I even begin.. I went here with my friend last week and the staff didn't even acknowledge us it felt like we were invisible. The two girls in front were VERY rude and didn't try to help us at all when we got there. She just said we had to wait and stay at the bar for the meantime. When we finally got to our table, again, the waiters didn't acknowledge us. We had to call them ourselves and he finally took our order down. Food took too long to serve. The manager asked us to move WHILE we were eating because apparently there's a bigger party sitting next to us and they need the other table but they came and didn't even use it, which was VERY inconvenient for us and rude. I understand that it was busy but the waiters weren't giving us the same attention they did to other tables. So disappointing, it was also my first time there and it already left a bad impression on me. Overall experience, I wish I could give this place 0 review. It was so bad I wish I could get my money back. Not to mention the drinks and prices were insanely expensive with such little portion.",Sugar Factory,3.5 star rating,$$$,"Bars,, Candy, Stores,, American, (Traditional)"
235,cHMT_qpOmJCBbkHg1VQlmA,Allie C.,5.0 star rating,"I returned to Sugar Factory for dinner and was give true VIP treatment..we received little take out boxes of candy as gifts and the service and food was wonderful! So glad we came back to give the place another try..we had the burger, grilled chicken sandwich, white gummi goblet, and chocolate blackout sundae...all delicious and freshly made! Great, attentive service...thank you Sugar Factory!",Sugar Factory,3.5 star rating,$$$,"Bars,, Candy, Stores,, American, (Traditional)"
236,oZZ9SuTOY4hA8moqmZ39mg,M J.,3.0 star rating,"Went there for my daughter's b'day!  She had been wanting to go there and figured there is no better time than her b'day.  We visited the Soho location.  We were a party of 8 and had made reservations a month in advance, which I def. recommend as it was filled with tourists on standby. Although very crowded, we were seated within 5 minutes of arriving. The environment was fun, we had a funny waiter, who was attentive and made our experience enjoyable.  We ordered the typical huge drinks that they are known for.  Our meal was typical, nothing to brag about, hamburgers, chicken fingers, etc.  We ended our meal by ordering the sundae for 10 people, def. an experience!  However would I go back, no, it was one of those places, been there, done that, now on to the next.  If you have never been, def. try it.  It's one of those places that you have to try at least once.  My girls loved it but for typical food, the prices should have been typical as well but I guess you are paying for the ""experience"".   If you have money left over to spend, there is a Christian Loubutin store located across the street, which was my highlight of the evening!!",Sugar Factory,3.5 star rating,$$$,"Bars,, Candy, Stores,, American, (Traditional)"
237,uDTrM_Q1sixea9py6pO5dw,Veronica B.,3.0 star rating,"Came here for my sisters 14th birthday with our family. The food wasn't as good as I anticipated considering the prices and the desserts were not worth the price. My brother ordered the ice cream sandwich thing that has a ""warm brownie"" as the bread but the brownie was cold and the restaurant is also small and is full of people so it's kind of hard to enjoy the stay but it wasn't that bad",Sugar Factory,3.5 star rating,$$$,"Bars,, Candy, Stores,, American, (Traditional)"
238,tUQo-BWvcOpC4QTpvxmjKw,Galen R.,3.0 star rating,"Honestly I don't even know if they let you in here without being a part of someone's birthday party (no less than 15 celebration dishes were brought out over the 3-hour period I was there). Most of the staff were very kind and helpful, which was appreciated since they were clearly swamped even on a Tuesday night. Although they have food, don't come here expecting to be blown away by the grub. I had the grilled chicken sandwich with fries (both of which were good but nothing to write Yelp about). The main attraction is unabashedly the drinks. I went with the lollipop (ask the bartenders for a description of the drink and/or price since the menu is conspicuously mum on either) which was good and....uh, cool to look at?A friend of mine tried to argue that the bar was not clearly ""female-oriented."" To counter that point, I submit this: despite advertising itself as a bar it featured a single, 30"" television, located in the lobby area, which only streamed old episodes of Keeping Up with the Kardashians all night. That is all.",Sugar Factory,3.5 star rating,$$$,"Bars,, Candy, Stores,, American, (Traditional)"
