,user_id,user_name,user_rating,user_text,restaurant_name,restaurant_rating,restaurant_price,restaurant_type
678,_eR3Pil2bayQYjQZuFrEHg,Charlene D.,5.0 star rating,"I decided to return to the Sugar Factory with a friend who's never been and wanted to go. I'm SUPER glad I did! It seems as though they made HUGE improvements since I visited back in April. Our server, Greg, was VERY attentive (not only to our table but to the other tables he was taking care of). He knew the menu very well and made great recommendations. Of course we each started with the signature goblet drinks which were mixed to perfection! To eat, we ordered the mac and cheese pops, popcorn shrimp, the blue cheese burger, fettuccini alfredo with shrimp, and for dessert we had the chocolate cake. The portions were very generous, especially the pasta, and everything came out in a timely manner, hot and fresh.The vibe was very lively and everyone there seemed to be having a great time, including the staff! There were several birthday celebrations and everyone joined in with the singing.For anyone who has left a negative review or didn't have an enjoyable experience their first time around, I definitely recommend visiting again!!! It seems as though they've paid close attention to the reviews and made the necessary changes to make the guest experience special and memorable!",Sugar Factory,3.5 star rating,$$$,"Bars,, Candy, Stores,, American, (Traditional)"
679,mZoNfG90jGv68pYGsTGrPg,Ann K.,5.0 star rating,OMG!My daughter had her breakfast birthday there. The food was delicious and light. I thought my stomach would hurt from all the sugar but it's not too sweet. The service is wonderful. There are 3 floors and the management is always walking around and checking on you. The girls were so happy and so was I with my cotton candy martini!!!!,Sugar Factory,3.5 star rating,$$$,"Bars,, Candy, Stores,, American, (Traditional)"
680,PNXPa4g0_LXbFoH81FdS8Q,Asha G.,4.0 star rating,I decided to give Sugar Factory another try. My boyfriend and I were pleasantly surprised with the friendly service provided. A total 360 from the first time I visited. Our sever was extremely attentive and gave some good recommendations. The drinks were amazing and popcorn shrimp was delish. I would recommend skipping rush hour and dinning at an earlier time. Overall a good experience and we will be back.,Sugar Factory,3.5 star rating,$$$,"Bars,, Candy, Stores,, American, (Traditional)"
681,XRAsOx-DzJvbhya7_UpejQ,Jason L.,2.0 star rating,"The service was friendly and polite. We were greeted and seated on a timely manor with a reservation. Unfortunately that's about as good as it got. After waiting 40 minutes to get our food, everything was under cooked. For a place that has outlandish prices, I expected above par food. It was mediocre at best. The milk shakes was like drinking a glass of cool milk on the verge of being luke warm. I give 2 stars for strictly atmosphere and the very polite staff, but I believe that is being very generous. I have had better street cart food.",Sugar Factory,3.5 star rating,$$$,"Bars,, Candy, Stores,, American, (Traditional)"
682,rlHY2DrnUm-KC7BLi7h54w,Grace W.,5.0 star rating,The managers were amazing and super helpful the general manager was incredibly nice to us and checked up on us and Tracy helped us locate a lost phone!,Sugar Factory,3.5 star rating,$$$,"Bars,, Candy, Stores,, American, (Traditional)"
683,ILJ2IpJCR9L9APjvVEnnTQ,Aliat B.,4.0 star rating,"I revisited The Sugar Factory on a Saturday, reservations for 10:30 I was seated by 10:15, ordered drinks and an appetizer they came faster then the last time. The food was great and I enjoyed my smoking drink!! The turkey burger was cooked perfectly and the fries were so good I couldn't stop eating them. We skipped dessert because of all the sweets but overall fun environment, food was great and the drinks are cool. Went with my boyfriend, next time I'll make it a girls night out.",Sugar Factory,3.5 star rating,$$$,"Bars,, Candy, Stores,, American, (Traditional)"
684,Y7iCaXYpwp6ul86ml4ySRg,Jill G.,1.0 star rating,"Waste of time and money!!!!! They should be embarrassed to serve this type of food In NYC!  While I know this place is all about sweet, sugar goblets that pride themselves on dry ice, shakes and sugar, they should at least try a bit to get regular food out in under an hour and the way they asked for it. Overall, never coming here again. Over an hour to have dinner (no apps!) come out (incorrectly), overpriced, milkshakes....etc....best of luck with your scheme of raking people in for overpriced, gross food. It will only last for so long......",Sugar Factory,3.5 star rating,$$$,"Bars,, Candy, Stores,, American, (Traditional)"
685,Hn-wkyvaAu4h9-EnX118Fw,Samantha L.,4.0 star rating,Came for lunch with my niece right after they opened around 11. Space was quiet and service was decent. I ordered the chicken and waffles which was tasty and my niece got a chicken sandwhich. We ordered the mojito with no alcohol which was $35....for no alcohol. It tasted like 7UP and grenadine with mint. Not that it wasn't good...I just think that's kinda crazy. It's really more about how much value you want to give some dry ice and instagram likes. I guess I should have suspected the food and drink would be overpriced.,Sugar Factory,3.5 star rating,$$$,"Bars,, Candy, Stores,, American, (Traditional)"
686,uQSu4t1Ox1wlmrgw3a9bSQ,Rashi S.,1.0 star rating,"Wow. I just received the most horrible treatment I have ever received from a manager in my life. We ordered a milkshake and food. I said repeatedly that the milkshake was for my 10 year old and it was to be given to with her meal. After asking 4 servers nicely for the milkshake, I finally got it after 1 hour. Of course, it was a vanilla milkshake instead of the banana Nutella one we ordered! The waitress herself offered to bring the manager over. Everyone else around me got food and drink on time. I asked the waitress if our milkshake was unusually hard to make, and she said no and was visibly upset. When I told the manager I was upset, and that I understand I am not the usual celebrity that comes there, but I should receive the treatment any patron does, he told me I was being dramatic. He said, let's not talk about all your drama, I will just fix it.. 10 more minutes went by before he ""fixed it"" and brought my daughter a shake. I didn't even raise my voice at him. It is very regular not dramatic to be angry after waiting an hour for something when everyone around you is getting their food on time. And after the wrong shake came over. He eventually came back over, gave my daughter her milkshake, she had a few sips, and then he came back with the check. And proceeded to smash her milkshake on the ground, glass flying everywhere. He did not apologize, he walked away. I have never met such a jerk in my life who lets glass and milkshake fly all over his customers! My daughter could have been hurt, as well as the woman it spilled on. He clearly did that on purpose. And again, did not apologize to my 10 year old who was crying because she was treated that way by an adult, and was scared, but also because the milkshake she waited for an hour was all over the ground. Another patron had milkshake on her. Owners of sugar factory, teach your manager to just apologize. If he had just apologized and been gracious, this all could have been avoided. Teach him some manners. Teach him how to respect patrons. Teach him how to be an example to kids. Teach him not to get angry and try to hurt children. Better yet, get rid of him. Celebrity endorsers should be aware how children are treated at this supposedly kid friendly place. It was scary. Don't believe me? Ask the waitress that served me because she was equally as appalled. Ask the customer who had milkshake on her. I could do nothing but laugh as I left.. wow a grown man in the hospitality business would rather smash a 10 year olds milkshake on the ground and make her cry rather than apologize. I didn't raise my voice once at him.. what would he have done if I did?",Sugar Factory,3.5 star rating,$$$,"Bars,, Candy, Stores,, American, (Traditional)"
687,50KY2kiLOW9xUIpyd_R8tA,Joe P.,5.0 star rating,"Lunch with my little one after returning from Fleet Intrepid. Good experience for the family. Drinks on the large side but don't be fooled by the menu saying 60oz. It's more ice than drink. Service was great , food was great and my 13 year old had a blast. Will return.",Sugar Factory,3.5 star rating,$$$,"Bars,, Candy, Stores,, American, (Traditional)"
688,hSczq94iUU7Fhis8RK2u4A,Justin K.,5.0 star rating,"In short, this place deserves 5 stars across the board. Cleanliness, customer service, food and ambience was on point.   Ok, now for the details. First off, my four year old spilled juice all over the table and the floor and the staff quickly cleaned up with patience and a smile. Our server's name was Ali and we could not have asked for more patience from someone. We took forever to order, not on purpose, but there was so much options we could not decide and not once did we feel rushed.   I had the Angels in Heaven waffles? and my wife had the country fried chicken with mac and cheese and we had the sampler. I was not expecting much because I know that it's known for dessert but everything was perfect. The mac and cheese can rival the best in NY. Fried chicken fried to perfection. Also, there was so much it could be shared. My wife was feeling good after one cocktail .",Sugar Factory,3.5 star rating,$$$,"Bars,, Candy, Stores,, American, (Traditional)"
689,r81-IOKtlxKeUgFiWUMIHA,Genesis R.,3.0 star rating,I came here last night for my boyfriends 22nd birthday! I had booked my reservation on OpenTable like two weeks in advance. I had confused my reservation time and was seated an hour earlier with no problem at all which was nice! I had the sugar factory burger it was alright I've had better burgers but they obviously are not known for the food! The burger was a little to dry. I had a watermelon rancher martini (i was driving) it was incredibly sweet and it was $14! My boyfriend had the 60ounce raspberry watermelon mojito which was recommended by our fabulous waiter corinthian! He was awesome very attentive :) my boyfriend loved the drink I mean for $36 he better! I will definitely come again maybe for brunch next time,Sugar Factory,3.5 star rating,$$$,"Bars,, Candy, Stores,, American, (Traditional)"
690,NTI7gRdNiFQYY-DoUtQESg,Julie T.,5.0 star rating,"My party of arrived an hour early and I prayed they'd be able to seat is early. It was rainy and cold and mehhhh. After hanging out by the bar, the hostess made it happen!! We opted for chocolate martinis instead of the goblets because, to be honest, fear. Those things are huge. But next time! The girls next to us had some dry ice action and it looked awesome. My coconut chocolate martini was delicious. Our waitress was super nice. I'm coming back for you, goblet!",Sugar Factory,3.5 star rating,$$$,"Bars,, Candy, Stores,, American, (Traditional)"
691,PInUdJSkaiuA9xl9ORhv2Q,Shareen B.,5.0 star rating,"I had dinner with my sister this evening. What an excellent experience we had with our server Lemar. His attention to detail, politeness and table-side etiquette was exceptional. You don't come across that kind of service often. Thanks again Lemar! Running a top notch establishment Michael keep it up.",Sugar Factory,3.5 star rating,$$$,"Bars,, Candy, Stores,, American, (Traditional)"
692,6EVt9nnDiIIEvnecR3RniQ,Katie P.,5.0 star rating,"Last week I went back to Sugar Factory while I was on a long weekend in the city and my experience this time around was so much better than in 2015.Michael and his staff were very attentive to me and my friend the moment we walked in. Our table was ready for us as soon as we checked in and our server was hospitable and great at helping us decide what to get on the lengthy menu. For cocktails I went with the Grape Crush, which tasted like grape Gatorade rather than Grape Soda. It was tasty! But also I knew it would be dangerous by how tasty it was!I decided on getting the White Chocolate Burger for my entree, I have never seen anything like that on any menu and so I decided to go with it for that reason. I was nervous, but It was probably one of the best burgers I've ever had. The white chocolate and the perfectly grilled burger was one of the greatest sweet and salty combinations. I don't know why no one else does this! I'd highly recommend it to anyone!For dessert, since it was my friend's birthday they brought out a boat of ice cream with sparklers and sang. It was the perfect way to end our long weekend trip to the city for her birthday!Thank you, Sugar Factory for making our night so great!",Sugar Factory,3.5 star rating,$$$,"Bars,, Candy, Stores,, American, (Traditional)"
693,d16N09s_0XZWSy1rk4WypA,Eleni A.,4.0 star rating,"Sometimes the wait can be super long, but the fish bowl drinks are really good and so is the food. However, the space is tiny, so you basically are having a conversation with the people to your left and right.",Sugar Factory,3.5 star rating,$$$,"Bars,, Candy, Stores,, American, (Traditional)"
694,H4rfXemXxa77oBoaM5pLIA,KT S.,2.0 star rating,"We were there for my daughter's 13th birthday, and I can't imagine going there for any other reason. I just read online that the alcoholic ""goblets"" (the main attraction) are $27+ but we had a non-alcoholic watermelon thing and it cost THIRTY-TWO DOLLARS. 60 oz of sparkling watermelon juice and dry ice. Why is the virgin version the same price as the alcohol version?The food is totally beside the point, so I regret coming for lunch/brunch. Our food came an hour after we sat down (we had our beverages), and my classic waffles were not as described in the menu - not melted butter, no sprinkled powdered sugar, and the whipped cream was a melted puddle. I asked about the butter and was brought a couple of cold pats in a little cup. My iced coffee arrived without a single ice cube.The desert was good, tho charging extra for the sparklers seems a little grabby. Based on our experience I wouldn't come again, and would never recommend it for anything than a tween's birthday for the goblets and dessert. SO LOUD. And the bathroom attendant actually squirting liquid soap in your hand is bizarre.",Sugar Factory,3.5 star rating,$$$,"Bars,, Candy, Stores,, American, (Traditional)"
695,K1cX_rNhtdq3ZfIWjLWOwg,Swati T.,4.0 star rating,The location and ambience is good. The egg dishes were average but the milkshakes were great though heavy. The pancakes with maple syrup were the best Burgers were good too,Sugar Factory,3.5 star rating,$$$,"Bars,, Candy, Stores,, American, (Traditional)"
696,Wg-wc6R891w0VDkSIRBiEA,Washington Z.,5.0 star rating,"First time here, will be my last had the rib eye, stake was too cold very pricy for the quality of food, wouldn't come back here if you payed me in my opinion it's a waste of money. Ok today is Wednesday the 14th of June and I returned because my wife talked me into it. I ordered the cheese platter it was amazing, my wife had the meat balls which she enjoyed. For the main dish she ordered the salmon which she loved, I had the fried chicken platter and it was delicious and hot, which was great. The best part of our dinner was the service our waiter was Olajuwon he by far made our night one of the better waiters I have had. This experience was 20 times better than my last and we will return with our kids. Thank you for giving us and enjoyable experience.",Sugar Factory,3.5 star rating,$$$,"Bars,, Candy, Stores,, American, (Traditional)"
697,p8V9qNfD9KdebX0p_MjVrA,Barbara S.,2.0 star rating,"I guess people come here because of all the celebrities who come and hype it up, but our experience was nothing worth raving about. We were a party of 2 and were sat upstairs in the back room which was freezing cold, and had about 3 different groups of 8 people celebrating things. We asked our server if we could move to a different table since we were cold and had air blowing right on our heads. She went to find a manager. In the meantime the parties around us were so loud and obnoxious I couldn't even hear my sister talking to me a foot away. A manager comes over and says he's looking for another table downstairs and if we wait about 15 minutes there should be one opening. Well, about 20 minutes goes by and no word from the manager. Our server never came back over to us since first introducing herself since ""if we leave we'll no longer be in her station,"" which is obvious..but some water in the meantime would have been appreciated. I finally chase down the manager who says he misread the tables and that none are getting up anytime soon, and we can try our luck at the bar. We decided to just stay and freeze since already 30 minutes had passed since we first sat down.We ordered the Lollipop passion goblet... the presentation was great but it tasted disgusting, totally undrinkable, all artificial and sugary. At least we got some good instagram pictures. The menu was not impressive at all... chicken wings, mozzarella sticks, burgers, I guess anything that can be fried and put in a basket, so we decided to pass. Instead we ordered the chocolate fondue which was very good, and we liked all the different things it came with.$70 for 2 people that got one drink and one dessert. The place is so loud, overcrowded, and overpriced. We definitely won't be coming back when I can get better tasting food at my town diner.",Sugar Factory,3.5 star rating,$$$,"Bars,, Candy, Stores,, American, (Traditional)"
698,EPelNMor0aqsjb6GuUZjLw,Diane D.,3.0 star rating,"Left feeling underwhelmed. Although the goblet drinks are a fun novelty, they are pricey & the food is mediocre at best. The service was also incredibly slow & the music/ noise level prohibits any conversation. While one of my guests was charged a $6 up charge for adding chicken to his pasta dish, my daughter was charged full price for her pasta dish, even though she asked that the chicken be omitted! I found this ""nickel & diming"" particularly bad form, given that our bill for 8 people was $444!!! I would not recommend this restaurant, as I do not feel that the experience is worth the hefty price & the management does not appear to be customer oriented.",Sugar Factory,3.5 star rating,$$$,"Bars,, Candy, Stores,, American, (Traditional)"
699,hukcHTI1WTTb-GBGF61rSg,Amanda S.,5.0 star rating,"SO PLEASANTLY SURPRISED. Came here last night on a date, we were a little worried because people had told us to come here for the drinks, not the food. Every aspect of this restaurant had me amazed. All of the employees were so friendly and attentive, you could tell they loved their job. We ordered the red bull goblet which was delicious. The goblets are $30 but you get your moneys worth. We also ordered the Dulce de Leche insane milkshake, SO GOOD. Skip the line at Black Tap and make a reservation here if you're looking to get one of those crazy milkshakes. As for food I got the Farmers Burger and my date got the Down South Burger and each was delicious and cooked to perfection. They are huge burgers though, I had to use a fork and knife. Also, best fries ever. The service was great, the staff was great, the food was great, the ambiance was great. I think this may be my new favorite restaurant.",Sugar Factory,3.5 star rating,$$$,"Bars,, Candy, Stores,, American, (Traditional)"
700,koYrUz1aOjCnc9XaPLCz0w,Melissa S.,1.0 star rating,"We came to the Sugar Factory to celebrate my daughters birthday.  We were so excited and it was one of the worst experiences ever.  Upon arrival we were escorted to our table fairly quickly, but that is where our luck stopped.  We placed our food order with two glasses of wine.  The wine took fairly long to come.  Once it did come the waiter spilled my red wine and did not come back to clean it up.  After waiting over an hour for our food to come I approached several different staff members and got less than sympathetic responses.  There were several tables who came after us and got there food and had left before we even had a crumb.  The one waiter said well there is only one kitchen to serve three floors.  It wasn't even crowded with many empty tables.  I finally got up and went back downstairs to find a manager.  Only then did our 4 appetizers appear with no entree.  Back down again and the steak appeared completely opposite of the way we ordered it.  Only finally did a manager come to the table.  We had two children under 5 who at this point were starving and given a few gummy worms from the waiter to hold them over.  In the end they did comp us a few items, but not enough to ever make me want to return or not enough for me to write this review.  I would have given them no stars if possible.  Horrible experience!!!",Sugar Factory,3.5 star rating,$$$,"Bars,, Candy, Stores,, American, (Traditional)"
701,INVApP-yvQcJkGP4bjLs-A,Elisa N.,4.0 star rating,"I've been here a couple of times. The hostesses seem to all need an attitude adjustment, they're dismissive, both on the phone and in person. But they make up for it by having awesome bartenders! I've only checked out the bar downstairs since the main level is always super packed. Everytime I've gone, I've had the spanish bartender, he's the best! I think I've tried most of their drink bowls, can't go wrong with any of them! My favorite is the lollipop passion, SO so good.",Sugar Factory,3.5 star rating,$$$,"Bars,, Candy, Stores,, American, (Traditional)"
702,gnrnGb1oNXY7PeR78Ynqrg,Sophie P.,4.0 star rating,"I wanted to give 3.5 but there is no option for that so they get 4. This place is very overpriced, especially their goblets. I came here with a friend for her birthday. We are tiny Asian girls who look young but it was mad rude how the waiter just assumed that we were under aged and said ""no alcohol for you guys"". Like bruh, why would you think that 2 under aged kids are at sugar factory at like 4pm during weekdays. Anyways, we ordered wings and sugar factory club sandwich. Not gonna lie the portion was huuuuge. It was massive and we couldn't not finish both of them. Both of them were decent, no wow factor about it. I was excited for fries cus ppl on Yelp were like ""OMG FRIES ARE SO GOOD"" ... Chill it was just regular very thin sliced fries. So for what you pay, you get what you deserve. We ordered white gummies goblet and by the end of the drink, half of liquid on the bottom just froze and became slushy. It was not drinkable and tasted straight up like liquor. I thought the whole point of sugar factory is to put sugar or candy in drinks to mask nasty alcohol taste. Idk maybe I'm being childish but I expected it to be sweeter than what we got. Last time I got green goblet drink and it was way better than this one. At the end I wanted to throw in a little surprise and ordered cheesecake with flaming candle. Cheesecake was really good and flaming candle only lasted about 15 sec, boo. I couldn't even get a decent picture with her when the flame was on. Would I come here again? Probably, yes bc this is a good place to make someone feel special on their birthday. Instead of getting boring shots or cocktail, it is more memorable to have gummy/candy filled birthday drink.",Sugar Factory,3.5 star rating,$$$,"Bars,, Candy, Stores,, American, (Traditional)"
703,Mi62YTnJmO7WgPyU_37cGg,Timayo W.,4.0 star rating,I was really busy. It's a place u need to bring a great group of friends to share drinks. Fried mac and cheese is really good.,Sugar Factory,3.5 star rating,$$$,"Bars,, Candy, Stores,, American, (Traditional)"
704,BSb-hLo52w-WKrbSVFQiRw,Danielle K.,5.0 star rating,"Great experience, the food, service and the Goblets were great! Hope to return soon!",Sugar Factory,3.5 star rating,$$$,"Bars,, Candy, Stores,, American, (Traditional)"
705,52B2YebUIvnzuJ8JZA7OYA,Vonnie G.,1.0 star rating,"My last review was reported and took down. I assure you it was detailed enough and the sugar factor reported it. This place is all hype. Over priced drinks and horrible service. I asked for a spoon 5 times and I finally had to get one myself. We had reservations, ordered our food and then waited over an hour and a half. At this point my family was done. I asked several waiter for my bill, so we could just leave, and go get food elsewhere.  This too was too hard for them. I finally told the hostess, we couldn't wait any longer and were leaving. We ordered simple things pancakes, waffles and chicken, crapes, so not sure why it was taking so long. I even asked a manager where our food was and he replied were backed up, and was unsure. This place was a hot mess. I will never again try to eat there.",Sugar Factory,3.5 star rating,$$$,"Bars,, Candy, Stores,, American, (Traditional)"
706,j4zIsUq1tipcrMJ-eoA-Xg,Ibb T.,5.0 star rating,I love this places. I went for the first time and fell in love the drinks are so good. Can't wait for my next visit.,Sugar Factory,3.5 star rating,$$$,"Bars,, Candy, Stores,, American, (Traditional)"
707,QFpg20s1wr21u7wHhW7KuA,Ruth T.,4.0 star rating,"It was cool, one time deal for me. The cool looking goblets were hella of expensive $36 each and they were okay. Nothing crazy spectacular except the dry ice effect. We had appetizer buffalo wings and mac and cheese balls. The mac and cheese balls were really delicious.",Sugar Factory,3.5 star rating,$$$,"Bars,, Candy, Stores,, American, (Traditional)"
