,user_id,user_name,user_rating,user_text,restaurant_name,restaurant_rating,restaurant_price,restaurant_type
452,q0PL6qVzMtmpqxX38oQLyQ,Grace M.,5.0 star rating,Great service by DJ! Mary is a great GM- drinks are good and pretty- great experience!,Sugar Factory,3.5 star rating,$$$,"Bars,, Candy, Stores,, American, (Traditional)"
453,qn3AaCjY3Ec_NRLzTRjtJg,Claudia C.,4.0 star rating,"I can't say I had high hopes for this place, after reading all the negative reviews and basically hearing that it was a tourist trap, so maybe that's why I'm giving it 4 stars instead of 3 but I was actually fairly satisfied with my experience there tonight. The service was not nearly as bad as I had expected, as a matter of fact, it was pretty good (with the exception that our drinks sat out for wayyyyy too long and as a result we did not have very much of a dry ice effect which was a little disappointing). As for the ambiance though I wasn't a huge fan, the decor and all was really nice but it was a little too packed inside and pretty loud- between the music and all the people it was very difficult for any conversation. However, on the flip side, the drinks had exceeded my expectations (at least the Maui Thai did) which I highly recommend. I'm really not a big fan of sweets and I was expecting the drink to be sickeningly sweet but it really wasn't at all. One weird thing though was that when you start to get the end of the drink it starts to hurt to drink it, probably something to do with the dry ice. As for the food I ordered the brie puffs which were really good and surprisingly pretty filling when combined with the massive goblet. However, the food, like the goblets was all super expensive. The Brie puffs which were technically an appetizer were $14 and the drink without any alcohol was $30. There is also an automatic 18% gratuity included in the bill. All in all, the six of us each only got an appetizer and a total of 3 drinks for the table yet somehow ended up spending $200+. As upset with the prices that I was, I would probably come back. When you come to the sugar factory, you have to keep in mind that you're not just paying for food, you're paying for presentation and experience. Overall it was also a pretty fun place to visit with a few friends for a birthday or other celebration, but not the kind of place to casually dine at.",Sugar Factory,3.5 star rating,$$$,"Bars,, Candy, Stores,, American, (Traditional)"
454,0hr6u6m4AWfB-CzxzKxntg,Wafiyah N.,4.0 star rating,"I finally made it to Sugar Factory. It was a weekday so it wasn't too busy. The drink was delicious, I ordered the watermelon mojito. It tasted exactly like a watermelon sour patch. I needed something salty right after we left. Good overall experience.",Sugar Factory,3.5 star rating,$$$,"Bars,, Candy, Stores,, American, (Traditional)"
455,amqjYziOEPKmmzvBeQbbBQ,Eddie C.,3.0 star rating,"Went to Sugar Factory with wife, kids and a friend.  It was fun and pretty interesting place.  Good was good but not OMG, drinks were plentiful and creative around every type of sweet drink you could imagine.  Cocktails all had a virgin option for kids and many came with a dry ice effect and lots of fog.The good:   Food was good not great but not bad.  Solid.   Pasta burgers and waffles were all had by our table.  Appetizer platter was small for the price and would not recommend.  Drinks were tasty and creative.The bad:  Servers were nice and very good BUT extremely slow.  We came at 4:30pm on a Tues so not busy and we got our appetizer, ate it and cleared it before our drinks came.  They could sell more drinks of the service was faster.  The big drinks even with no alcohol are like $30 which for a virgin drink is nuts.  They sell unique candy at the front of the store.  However if you look some of it up- giant Darth Vader pez is much cheaper in Amazon. Note the people are great and pleasant but service for drinks was poor which is a big draw to the place.The So-So:   The atmosphere was casual and dance music playing, fun decor but place is pretty small.  Smaller than I thought.  Parking can be had in street with pay meter if you get lucky!  I'd take out of town friends here, see the wall of celebs who came here and have drinks.  However would not go here otherwise.  3.5 stars.",Sugar Factory,3.5 star rating,$$$,"Bars,, Candy, Stores,, American, (Traditional)"
456,vZxImSlF93Bz6msxjNR4zw,Doris S.,1.0 star rating,I have been to the downtown location two times and my experiences there were fine.  I have only gone for my kids sake and I go into it knowing its not about great food or anything it's about the fun drinks and party atmosphere.  My daughter (age 12) and I went to the Broadway location yesterday and it was awful from start to finish.  We had a 430 reservation and were not called until 450.  We waited 20 minutes for drinks and over 30 minutes for food so after being there for 90 minutes we still had no dinner and all we ordered was a turkey burger and a waffle.  The manager made an attempt at making it right by offering her dessert free of charge but by that time we were going to be late for our show.  He then said he would comp 50% which of course never showed up on our credit card.  The waiter never apologized but just avoided us the whole time since he knew we were waiting so long for everything.  Two women who were seated after us were served and had finished their dinner before ours even arrived.  I get this place is a total gimmick and was willing to suck it up for my daughter but never again.  It is NYC and I expect at least an attempt at good customer service.  Don't go here unless your kids won't leave you alone.  There are so many better and fun places where you are treated well.,Sugar Factory,3.5 star rating,$$$,"Bars,, Candy, Stores,, American, (Traditional)"
457,QXq6wxr14cgAdXjoVDf3ew,Marlene M.,4.0 star rating,"Yesterday was my first time at this place. My boyfriend took me to celebrate my birthday, it was lunch time. This place well known for their goblets so it was only right to get one. I got the fuzzy peach and my boyfriend got the watermelon patch. I would highly recommend the fuzzy peach one as the watermelon was a bit too sweet. As for food, we got the Chinese chicken salad and the buffalo chicken sandwich and for dessert we got the signature fondue. Everything was really good, the only reason I have them 4 instead of 5, is that they only have one bathroom in the establishment. You had to wait if you wanted to use the bathroom, considering it's such a popular place, they should have more than one bathroom.",Sugar Factory,3.5 star rating,$$$,"Bars,, Candy, Stores,, American, (Traditional)"
458,6SLEehK8HwVYAdJObb0K_Q,Terri M.,4.0 star rating,"Be prepared to splurge. Cute place, lots of noise filled with kids & young adults. Food was very good. The drinks are a novelty for your first time. Overall a cute place to stop while visiting NY.",Sugar Factory,3.5 star rating,$$$,"Bars,, Candy, Stores,, American, (Traditional)"
459,W_Uj6m0w3rsmCzZ7KRmxqA,Ashley V.,1.0 star rating,"Absolutely terrible.  One of the worst restaurant experiences I've ever had.  Atmosphere:  Trendy and fun, enjoyed the view of the high-line.  Blaring music that was louder than a club.  Everyone was screaming to talk over the music.  Was not a relaxing experience to dine with friends, actually made me anxious and want to get out into the streets.  The upstairs bathroom was very odd.  Where we sat I could see others washing their hands.  When I went to the restroom it felt like it was smack in the middle of the restaurant, not to mention the dirty wet mop in the stall with me.  Service- Another terrible point.  The server didn't speak more than 10 words to us.  Had to flag her down for a to go box and to pick up our card to run.  For what seemed to be a fun restaurant she lacked a lot of personality and actually didn't even smile. Food- Horrible.  Two of us ordered the chicken and waffles and it was very dry.  We actually asked for syrup to go with it since it came with a mornay sauce.  Chicken fry batter had a nice texture but was lacking in flavor.  Co-worker ordered the steak frites- it was average and flat.  We had high hopes for the desert and ordered two-  biggest disappointment of the night!!  Nothing special and would have been happier with grocery store ice cream! The sauces and cookie crumbles had no flavor.  The cookies were so hard that we had to bang on the plate to break them, were not fresh.   Overall- Horrible and waste of money.  Tourist Trap for birthdays and bachelorette parties.  Left us gazing across the street at other restaurant options, completely regretting our decision to dine here.",Sugar Factory,3.5 star rating,$$$,"Bars,, Candy, Stores,, American, (Traditional)"
460,pEnEmQeWwh9ktZsAz12ZBw,Lucas C.,4.0 star rating,"Walking into Sugar Factory you are immediately hit with the cool, clean, and modern American bar and grill type restaurant. The music played throughout the restaurant was a good mix of modern music, which helped add to the already solid feel of the restaurant. We were able to get a table a good half hour before our reservation which was definitely a plus. When the waitress came over to the table, she gave off the vibe that she really didn't want to be there, which kinda killed the mood, but I was able to look past that, since the rest of the staff were very helpful and there always seemed to be someone around. The menu has a huge variety of food and drink option, but the thing that caught my eye was the Sugar Factory Specialty Sliders. The service was surprisingly fast. The first thing to come our were our three cups that were soon to be filled with their funky drinks. They messed up one of our drinks, but lucky we caught it before they poured in the actual liquid, so it was a quick and easy fix. The drinks were difficult to drink because of the abundance of ice, but it gave you the extra time to enjoy it. After finishing the drinks, it wasn't long before my sliders came out. I was very impressed with the presentation, but it almost seemed like you were paying for the food coloring in the buns and the complimentary rubber duck, because the sliders themselves weren't all that. But, in the end we had an enjoyable visit to Sugar Factory, and we will most likely be back for another visit in the future!",Sugar Factory,3.5 star rating,$$$,"Bars,, Candy, Stores,, American, (Traditional)"
461,9LnIKV-AsaxU7kMMMGZ6iQ,Wendrich J. M.,4.0 star rating,"Went there for the first time, I had a burger. It was pretty good and even though I didn't ask for fries they brought me fries. The place is chic, cool decor, always crowded, nice music and friendly staff. I'm giving them 4 stars because even when I didn't pay for my meal because my family treated me, I think it was over priced. The menu is tricky and the prices are way up.I know is a tourist area, but they should consider the people who lives in NYC and know that the prices are unbelievable. The only normal prices seem to be for the brunch menu. But I haven't been there for brunch, gotta go and try.Good for kids because if they love candy they will feel in heaven.",Sugar Factory,3.5 star rating,$$$,"Bars,, Candy, Stores,, American, (Traditional)"
462,f3s7UXC-vZhwpD7bWL-DIQ,Stephanie M.,4.0 star rating,"I happen to love this place, and love any reason I have to come here. Be prepared to spend a lot of money, especially if you are a big party. The famous goblets are $36 alone, and then the meals range. I love the atmosphere and experience. Also I am a diehard fan of the Meatpacking District! I highly recommend making reservations about 3 months in advance, they book FAST. My favorite is the club sandwich!",Sugar Factory,3.5 star rating,$$$,"Bars,, Candy, Stores,, American, (Traditional)"
463,mPRecFR3yVCPY2YlogkuKQ,Dacia K.,1.0 star rating,"the sugar factory on washington st should gets nooooooo starts....this place sucks ... its not our first time at a sugar factory!!! celebrated my daughter birthday at 72 restaurant and it was amazing ...this one needs help in customer service , good help and dealing with guest...guest that are paying crazy money for bullshit food...i am a manager for a company anf the way my friends and i were served was crazy...no knife and fork half our order came ...waiter was the only one working downstairs... were buying shots  top shelf henny , bartender is made cause we are not tipping him...we got charged for items we didn't have...let me explain customer service to u if u know the weekend meaning friday, saturday, sunday and check your weather and school closing u get more fucken help in your restaurant......u are only pissing off your guest , making them come on social media and blast your company...and noooo one wants bad publicity....u guys suck , food sucks,service sucks",Sugar Factory,3.5 star rating,$$$,"Bars,, Candy, Stores,, American, (Traditional)"
464,T_cvucrf6DncTtFT7V7Cdg,J I.,5.0 star rating,Ernest the great made me and my best friends birthday so Awesome. He was so cool and the service from him was great. The food was okay and my drinks took a little long but they were WELL WORTH THE WAIT because we all almost died on the way home lmao. They were nice and strong. Not overwhelmingly sweet or watered down at all. If you're getting a goblet you don't need another drink. Like at all lmao. But overall we had an amazing night. Thank you Sugar Factory for an amazing birthday dinner! We will definitely be back :),Sugar Factory,3.5 star rating,$$$,"Bars,, Candy, Stores,, American, (Traditional)"
465,10K9OaCLl9qTb7E_B5DI7w,Kimberly P.,3.0 star rating,"Went today upon the wishes of a friend. 3 kids and 2 adults. Our server, I didn't get his name, was super pleasant and friendly.It was very busy in a small holding area where the hostess station was. We had a reservation and were seated upstairs promptly.We both had the S'mores martini and it was delicious. The kids had frozen hot chocolates and I wanted to treat them, so we got a lollipop goblet (mind you, there are no prices on the menu for how much they cost, $30.00$We got banana split waffles and they were delicious, the kids got chocolate, chocolate, chocolate crepes and liked it a lot.It was a cute place to go with kids, but was quite surprised when we got the bill of $200.00. It had an added $28.00 tip added to the bill... Ouch! Nearly $100 on beverages alone.Again, it was fun for the kids and our food and drinks were good. However, I don't think it will be a place I rush back to.",Sugar Factory,3.5 star rating,$$$,"Bars,, Candy, Stores,, American, (Traditional)"
466,ax0IAVoOTa3JF0MWjvc6qg,April P.,2.0 star rating,"So overrated. I got to get a photo with a fancy looking goblet, but at what price (figuratively AND literally)?.The goblets are $38 with or without alcohol (just letting y'all know since its NOT posted on the menu -___-). They are literally just giant bowls of sugar, barely any alcohol, but I guess the dry ice smoke effect is cool?We also got some fondue which was just a bowl of melted chocolate (we thought we would have a flame or a fountain or something). We got the gluten-free option since one of us has celiac's, and it said online that that would include cheesecake but the server said it would only be fruit. The chocolate wasn't even good - reminded me of hershey's, yuck. We left feeling sick.In addition, this place is PACKED",Sugar Factory,3.5 star rating,$$$,"Bars,, Candy, Stores,, American, (Traditional)"
467,-jNxEJzXNWtbCy5VEyS3Lw,Mark A.,5.0 star rating,"Finally found my way here, first impressions being banded and walking in, candy shop in the front lol...hmmmm...menu wise everything is pricey but who cares, you do what you want when you're poppin! Haha...place is not that huge so tables are really crunched togeather but no biggy, also it's pretty dark inside..as for my fatness I had the sampler, ate some pasta Alfredo, and had a goblet drink of blue ocean with gummy bear sharks...ayyyyyyy lol...I even asked for another shot to add to drink to make it stronger because it just needed it ...awesome ambiance with plenty of chandeliers, and not to mention good music lol..awesome to go in groups, it's really a nice spot",Sugar Factory,3.5 star rating,$$$,"Bars,, Candy, Stores,, American, (Traditional)"
468,lxAFSaoVYVGdRooqUek-CQ,Lisa B.,3.0 star rating,"I came here today with my dad. I had seen soooo many cool photos on Instagram and this was highly anticipated. Unfortunately it is does not really live up to the hype. When you walk in the lobby is super cute with all the candies and photos of people who have been there like Lindsey Lohan and Britney Spears. We made a reservation but the seats are soooo close together and the music is soooo loud too it really kind of takes away from the experience. As for the food I would say it is below average. Fries were just ok and the sandwiches taste kind of like low quality hospital food. Of course people dont really come here for the amazing food but the super cool drinks! As for the drinks we got the watermelon mojito one. (I will insert a picture below). It looked super cool with the dry ice and the candies, however it was not too great in taste. All you could taste was rum (im not even sure why they would put rum in a watermelon drink i think it would have been better with vodka or even tequila.) The drink tasted super over poured and you could not get a real fruity taste at all. The service its self was great. They have a very nice staff and they even have a bathroom attendant. Even though the food wasnt great it did come out realllly fast even though it was super busy. If it is like your 21st birthday or something than this is a fun place to go. They will sing you happy birthday and really act excited about it!",Sugar Factory,3.5 star rating,$$$,"Bars,, Candy, Stores,, American, (Traditional)"
469,oxJctTUTcJY1Nf0OZoskWg,Sophia F.,4.0 star rating,"Crafty drinks and American fare! Love their drinks, and music played. Unfortunately this location has become birthday party central for tweens!!! Must come here after 10 PM!",Sugar Factory,3.5 star rating,$$$,"Bars,, Candy, Stores,, American, (Traditional)"
470,nuebqbdzgmN6Um41_uO6wA,Maria F.,4.0 star rating,"Went to Sugar Factory with my 11 year old daughter and two of her friends. The atmosphere is very cool and the kids enjoyed the fancy drink. The food prices are a bit steep and the service is a bit lax. The restaurant is located near HighLine park, which is a great perk, if you want to take a stroll before or after your meal.",Sugar Factory,3.5 star rating,$$$,"Bars,, Candy, Stores,, American, (Traditional)"
471,Fzjn_bZM-XpKyfwx4Hfu5w,Mrs. T.,5.0 star rating,"What can I say but their service & consistency was definitely on point. Not once did my Server Max forget to ask me and my husband if we are ok and do we need anything else. His spirit was very up beat and lifting. He was a natural at his job, definitely made my husband & I content. Food came out on time, drinks we're sizzling and the vibe was lovely. Will definitely recommend ;-)",Sugar Factory,3.5 star rating,$$$,"Bars,, Candy, Stores,, American, (Traditional)"
472,6VgShinUXhRZNeW_DpdSQg,Food C.,3.0 star rating,Cool concept and fun vibe. Food isn't that great but the funky cocktails and milk shakes are excellent!,Sugar Factory,3.5 star rating,$$$,"Bars,, Candy, Stores,, American, (Traditional)"
473,LOHWYDRSg0At5AVTaAArZQ,Jenna S.,4.0 star rating,"Came here to celebrate my birthday. The drinks are pricey but out of this world. Definitely recommend trying their goblet drinks if you come here. They are literally to die for! Also, all drinks can be made virgin for children or people that don't like alcohol. So don't let that stop you from coming here. A friend of mine doesn't drink and she ordered a virgin candy goblet and it tasted really delicious. The food is also pretty good here. The chocolate fondue and frozen hot chocolate is absolutely delicious. I recommend the S'mores martini - was great! The burgers are also good if you aren't coming just for drinks. They even make fried mac and cheese balls - they are yummy. The only reason I didn't give this place five stars was because it is extremely tiny. I don't think people realize how small it is before they come here because I know I didn't. You are literally table to table with other guests and it can be a little overwhelming. The music is loud it's like a night club in there which is good since it puts you in a dancing (drinking) mood - but it can be annoying being so close to other people when you are trying to enjoy yourself and your company. Luckily, when I went - I was next to another group of young people and we actually ended up talking a lot. It was pretty nice. But overall I just wish there was more space in there.",Sugar Factory,3.5 star rating,$$$,"Bars,, Candy, Stores,, American, (Traditional)"
474,G2_ZZZltqpGdQSUXEnFNkg,Raina R.,5.0 star rating,"I am a regular at the one in the meatpacking district. I have told all my friends about this place and gave them a bucket list for place to visit. My favorite drinks are the martinis, as for the food i always do the shrimp rigatoni or turkey burger. Waiters, and waitress are always pleasant and welcoming. I'm not sure how some people can leave a bad review but this place is so amazing. The best time to go is weekday mornings to early noon as it's not crowded. Ambience and decor is amazing I'm glad they moved since this venue space is much bigger. I look forward to visiting the location on the upper West side as well as the one in Vegas in two months for my birthday. You guys never disappoint me, keep up the amazing service",Sugar Factory,3.5 star rating,$$$,"Bars,, Candy, Stores,, American, (Traditional)"
475,JJcY3h3K1ZNqUCMCYi2SKw,Cynthia R.,3.0 star rating,"The place is nice and cute the food is mediocre and the drinks are ok this place is more for taking pictures and showing off than anything else but if you do have to, go with the Watermelon Raspberry Mojito Goblet and the mac and Cheese Balls was the most decent thing I had.",Sugar Factory,3.5 star rating,$$$,"Bars,, Candy, Stores,, American, (Traditional)"
476,rj_0KgikmBYFK-BDkftM9Q,Abha J.,3.0 star rating,"As soon as you walk into the seating area of the Sugar Factory, you'll realize that everyone is either here for a birthday or bachelorette party, as they all pose for pictures with their brightly-colored giant goblets of drink for an Instagram photo. I, too, was a member of such a party, for my best friend's birthday. We didn't make a reservation beforehand (not a good idea - definitely look into it) and were told we were gonna have to wait for 2 hours. Well, we slipped the waiter a $5 and he gave us a small table for about 20 minutes, which was nice, but I would hate to think of waiting for so long if it didn't work out.  As we soon realized, when people come to the Sugar Factory, they definitely aren't coming for a 5 star meal.  As implied in the name, it's all about the sugar! My friend ordered the typical giant green drink called ""lollipop passion,"" and while it was very aesthetically pleasing, it did not taste as good. I guess next time I would try the blue one, as a devout lover of all things blue raspberry. But with the price range, it's hard to see myself coming back. We also got the giant ice cream sundae that was $100, which looked super awesome. The sparklers were a nice touch, and I, someone with a major sweet tooth, was ready to dive in but I soon realized that I could barely make it through one tiny mug that the server put small amounts of the mountain of diabetes into. Also, since we only had a quick 30 min before our server whisked us away, we definitely did not make very much progress. If you're going for your birthday, unless you have a party of 20, do not order this, no matter how cool it looks. The price and sheer quantity is not worth it. Overall, it's a cool novelty place to go for the whimsical desserts, cute decor, and pictures of the Kardashians on the wall, but don't expect great food.",Sugar Factory,3.5 star rating,$$$,"Bars,, Candy, Stores,, American, (Traditional)"
477,EUQyRSXDYMosWRC0aWehrQ,Katherine G.,3.0 star rating,The wait is pretty long even if you have reservations but that is pretty much expected when going to a pretty much commercialized restaurant. The drinks are cute and entertaining but can run a hefty price even without alcohol. Great for celebrating a child's birthday but that is about it. Would not be returning as this is just a one time experience. Not much to boost about. Food quality is about average. Servers were pleasant.,Sugar Factory,3.5 star rating,$$$,"Bars,, Candy, Stores,, American, (Traditional)"
478,TlV3-UHFNrvOC0ItsnveUg,Jordan T.,1.0 star rating,"We thought we would make this place a birthday go to. The server never seem to care about us. There was about 8 of us celebrating a birthday and she (our server) would stand about 7 feet away from us texting or talking to other employees while someone at our table would try to get her attention. At the end I found out why she didn't give too much of a damn about our table. Automatic 20% gratuity! Regardless of what she does, or how she does it she's getting paid. When we tried to split the payments into 4 people and 4 people she said we were not allowed to (because that would break her auto gratuity) I understand the automatic gratuity rule, and I think it's fair, but not when the server knowingly cares less and treats us like garbage. Lesson learned.",Sugar Factory,3.5 star rating,$$$,"Bars,, Candy, Stores,, American, (Traditional)"
