,user_id,user_name,user_rating,user_text,restaurant_name,restaurant_rating,restaurant_price,restaurant_type
44,RNwOU73VEzZYEJ89HfAjCw,D. I.,5.0 star rating,"I ordered the lemon ricotta hot cakes with a side of bacon and green juice. Bacon was extra extra crispy, a bit too crispy for me. Nonetheless food was delicious and presented really well. Lots of space. Laid back. Clean. Friendly service.",Sunnyside Cafe & Eatery,4.0 star rating,$$,"Coffee, &, Tea,, Breakfast, &, Brunch,, Sandwiches"
45,6CqQkARaty3Rtwr73a3Qxg,Azy B.,5.0 star rating,"I am so happy Sunnyside opened up! From a logistical standpoint, I've been looking for a coffee shop on my way home from the PATH so I could do freelance work. I was bummed when Cafe Benne closed, but delighted that Sunnyside opened! It's very comfortable; the wi-fi is strong; and its relatively quiet in the evenings.From a flavorful standpoint, i've been very happy with their drinks and food thus far! Since I come at night, I try to get decaffeinated drinks--and their raspberry iced tea is excellent. I get it unsweetened. When I need a snack, I'll order their Smashed Avocado sandwich. They also serve breakfast all day if that's what you're in the mood for!The owner introduced himself to me, and he's a really nice guy who is involved in Hoboken's local community. I hope this place sticks around - it's a great, quiet space with delicious food and drinks!",Sunnyside Cafe & Eatery,4.0 star rating,$$,"Coffee, &, Tea,, Breakfast, &, Brunch,, Sandwiches"
46,LRsy2IqJw65IwXuu-e6MJg,Simon B.,5.0 star rating,"Filled multiple loyalty cards already. Great food, served by friendly, considerate staff in a laid back atmosphere. Get the 'turkey sausage' breakfast sandwich, you won't regret it.",Sunnyside Cafe & Eatery,4.0 star rating,$$,"Coffee, &, Tea,, Breakfast, &, Brunch,, Sandwiches"
47,UyahPFdg1CqOILMDf_LDQw,Kristen P.,5.0 star rating,"So good. I've had the golden latte, the avo toast, the green goddess salad and the lemon ricotta pancakes. It was all delicious. I'm so happy this place is here because before it arrived, hoboken brunch sucked. (Except for bluestone lane...but that has very limited options.) the only thing is it's very pricey.",Sunnyside Cafe & Eatery,4.0 star rating,$$,"Coffee, &, Tea,, Breakfast, &, Brunch,, Sandwiches"
48,8Z8EkxEqHj2_ECySiMwOjA,Yuchen A.,5.0 star rating,It is a nice environment to have a meal. Hotcake is really delicious this is the best that I have ever had.,Sunnyside Cafe & Eatery,4.0 star rating,$$,"Coffee, &, Tea,, Breakfast, &, Brunch,, Sandwiches"
49,DuuN5sE7rf7-Xmna1lwK8w,Manini M.,5.0 star rating,Great place to chill with a coffee and some avocado toast. Spacious place too... Ample seating space for large groups,Sunnyside Cafe & Eatery,4.0 star rating,$$,"Coffee, &, Tea,, Breakfast, &, Brunch,, Sandwiches"
50,lDDqzlZQL0vK0lANyWv0-A,Rhonda B.,3.0 star rating,"This place has a very modern, spacious aesthetic...lots of seating and everything is very clean and well kept. I got the drip coffee which was average, and the turkey sausage breakfast sandwich which was okay, but a little bland. A little more seasoning would've done it some good. The roll they use for the breakfast sandwich, however, was flaky and delicious. The staff was pleasant and the service was actually really fast. The prices also seem a bit high for what you're getting. I would probably try one of the other cute little coffee shops in the area before returning here.",Sunnyside Cafe & Eatery,4.0 star rating,$$,"Coffee, &, Tea,, Breakfast, &, Brunch,, Sandwiches"
51,X0-t3qVMW2PPByrRLAIkew,Madeleine A.,3.0 star rating,"This place has promise; it's cute and has good cold brew. Unfortunately there's still some work to be done before it's great - food took 30min and was incorrect when it arrived, and the menu has zero options which are gluten and dairy free. They were friendly and apologetic about the wait so I'll try again soon!",Sunnyside Cafe & Eatery,4.0 star rating,$$,"Coffee, &, Tea,, Breakfast, &, Brunch,, Sandwiches"
52,VrJJp7h54MwF-VNtORi48g,Casey R.,4.0 star rating,Went to this cafe about a month ago.. the place is super cute and modern. Love the decor. Our group ordered a bunch of breakfast sandwiches that everyone loved. I had the egg salad sandwich which was AMAZING. Will definitely be back!!,Sunnyside Cafe & Eatery,4.0 star rating,$$,"Coffee, &, Tea,, Breakfast, &, Brunch,, Sandwiches"
53,3kQ_5aPESsysO_J0OygjZg,B C.,5.0 star rating,Perfect spot for a quick breakfast without missing out on quality. Husband said breakfast sandwich was the best he has ever had.,Sunnyside Cafe & Eatery,4.0 star rating,$$,"Coffee, &, Tea,, Breakfast, &, Brunch,, Sandwiches"
54,8EI0551YAESsuVff2rS7Kw,Josephine L.,5.0 star rating,It is a good place to sit for a while and enjoy your time. There hot cake is really delicious and also their avocado toast. I really recommend this place.,Sunnyside Cafe & Eatery,4.0 star rating,$$,"Coffee, &, Tea,, Breakfast, &, Brunch,, Sandwiches"
55,iPK-oNgefWVfAttbMLAvMg,Alecia H.,5.0 star rating,"Heavenly.  Next best thing to breakfast in Oaxaca.  I know its not Mexican, but the food is a work of art.  To the eyes and pallet.  That picture of pancakes actually arrives at your table.  Dont  insult by asking for syrup.  The tuxture, sweetness of berries, slight crunch of pumpkin seeds... and dab coffee butter makes near January on the Hoboken shore a warm and beautiful world.  Added turkey sausage and matcha tea and... Im in heaven.",Sunnyside Cafe & Eatery,4.0 star rating,$$,"Coffee, &, Tea,, Breakfast, &, Brunch,, Sandwiches"
56,ohYh43-Y18KLCrsQu-ywbg,William R.,5.0 star rating,"Easily our new favorite coffee and breakfast spot. The Brekkie roll is quite possibly the best egg sandwich I've ever had. Super simple but super delicious. Iced coffee and lattes compete with Bluestone for best in Hoboken. Vibe is chill. Can't help but think they'd do even better if more centrally located in Hoboken. No matter, def worth the walk.",Sunnyside Cafe & Eatery,4.0 star rating,$$,"Coffee, &, Tea,, Breakfast, &, Brunch,, Sandwiches"
57,1020BgXH7of3FdFMEGN57w,Gil S.,5.0 star rating,"Cool place very good food and nice atmosphere. You should try the Benedict with the smoked salmon, comes with green salad. We will come back again. A nice refresh to Hoboken,",Sunnyside Cafe & Eatery,4.0 star rating,$$,"Coffee, &, Tea,, Breakfast, &, Brunch,, Sandwiches"
58,nJTrj88gqVHotVKEOdRCpQ,Gregory D.,5.0 star rating,"Great space to post up and get some work done. The service I received was top notch. They were helpful when I was working through the menu as well as attentive, providing me the WiFi password when they noticed I took my laptop out. The breakfast sandwich I got was simple enough but was made fresh and much better then I expected. Gotta love when places get the simple things right. I'll be back.",Sunnyside Cafe & Eatery,4.0 star rating,$$,"Coffee, &, Tea,, Breakfast, &, Brunch,, Sandwiches"
59,5giKxX4Z9CSNltsv5wr8KQ,John S.,2.0 star rating,"The food is okay and the coffee is not bad, but the price...outrageous. ive been here a few times and feel ripped off after every purchase. This place emplifies the worst of gentrification...bland, unoriginal, $4.50 for an 8 oz latte in a paper cup, 12 bucks for a meager salad with a few slices of kale and 1/4 a hardboiled egg.",Sunnyside Cafe & Eatery,4.0 star rating,$$,"Coffee, &, Tea,, Breakfast, &, Brunch,, Sandwiches"
