,user_id,user_name,user_rating,user_text,restaurant_name,restaurant_rating,restaurant_price,restaurant_type
65,lbgXluUQsGSReFTknVeDPg,Al H.,4.0 star rating,Been to the EAR a few times in the evening and the afternoon. Have never dined there. Sat at the bar and had a beer. Great history and character. You will meet some interesting bar patrons at the EAR.The $30 credit card limit is probably due to the Merchant Fees that business' have to pay the credit companies to allow charges. The $30 minimum probably helps defray the Merchant Fees the business must pay. No mind to me as I carry both hard currency cash and plastic. Many people today only carry plastic and sometimes have trouble paying their bills as a result. The EAR is a bar is a bar. It might be a little rough with the old time bartenders. You could be yelled at by the bartender for some infraction. This place may not be right for you if you are timid and easily offended. The EAR is just an old bar with old bar ways. I am fine with that. I will be back when on Spring Street again.,The Ear Inn,4.0 star rating,$$,"Bars,, American, (Traditional)"
66,nSgUrgp5RMndeBkd1cgcOg,Mohamed Salah B.,5.0 star rating,"Best neighborhood bar ever. Everyone is so nice, live this place ! And the food is insane too. Get the fried dumplings and the mac and cheese!!",The Ear Inn,4.0 star rating,$$,"Bars,, American, (Traditional)"
67,2I7WMciUPdAhkolSDS0Jeg,Ruwan J.,3.0 star rating,"the ear inn. listen to me, err this review!PRO TIP: bring cash. there seems to be some strange rule or minimums or something with using credit cards. my guess is like most businesses, they just prefer cash. anys/w/ayit's a divey neighborhood bar restaurant with eclectic character, decent beer prices, comfort food, and very Irish staff (which i luvz). wicked old: 2nd oldest bar in Manhattan, i think.layout very old bar area in front with a bunch of two-top and four-top tables arranged in front of the bar. the bar itself is a standard layout with a good number of seats. mostly regulars and solo diners are at the bar chatting with the bartender and/or chowing down.the back area has more seating. pretty tight area, so you can't really stand, just sit. decor: lots of old bar advertising signs; random collectibles; etc. reminds me a lot of the old bars in the suburbs that have not been touched by renovation, so basically everything is sorta stitched together without any pretentiousness. the tables are covered with white paper cloths, so you and the kids can doodle away. i would not draw giant penises or boobs tho...that might be frowned upon unless it's ""artistic."" lolclientele? lots of regulars and families with kids. the bar seems to have a regular flow of customers. then random groups like the posse i rolled in with come in to crowd the joint up.didn't partake of the food--looked like comfort bar food. pretty standard selection of beer and booze. i drank a few perfectly poured pints of Guinness and wuz happy! other folks in the group went with the Blue Moon and were content. PRO TIP 2: you will get yelled at if you take a phone call in the bar. texting etc. is fine. just don't be  douche about it. the staff is friendly-ish, but to the point blunt. i appreciate honesty, so to me...i find them refreshing and super likable. to tourists and the entitled probably not so much.  staff is typically one bartender and a waitress taking food and drink orders from the tables. they are hardworking folks, so be patient when the bar is slammed. service is good and done with a smile and clever comments!the bathrooms? divey. old. femmes have to deal with one stall. so for girl groups this place is a struggle. the dudes room have two urinals and a toilet that are WAY TOO CLOSE TOGETHER! i mean close enough that you're definitely getting backspray from the guy next to you who's pissing at the adjoining urinal. seriously, wtf! lol. i know this is an old school joint, but i feel like while i was taking a piss that the guy next to me was my shadow. ugh. this place opens at noon. serves booze soaking food. is close to PIER 40 which is where my posse and i were heading for a boat event. and sell beer at a reasonable price. i wouldn't say it's cheap though. i've had way cheaper in nyc. actually it should be cheaper. 1 star off for the weird credit card policy and 1 star off for the urinal situation. drops the mic no where near the men's bathroom!i out.",The Ear Inn,4.0 star rating,$$,"Bars,, American, (Traditional)"
68,Tw3VKS4y5OdDyXxPQkmoyw,Bryanna P.,4.0 star rating,"Review is for he Bar Only!We only came in here for beers, wish we would have ordered something to eat.  This was the first bar that was on our list to go to since it is a Historical Landmark & one of the oldest (If not the oldest) Bars in New York (Yes even alcoholics can enjoy American History).  We had a great time sitting up at the bar talking with one of the locals & the bartender who was really nice.  You can actually take your beer outside of this bar and sit at the outdoor chairs though there is no official patio, the bartender said they are the only bar allowed to do it.  It is nothing really all that fancy but just really really cool place to go and everyone was nice.",The Ear Inn,4.0 star rating,$$,"Bars,, American, (Traditional)"
69,Ih19iJISAZT_LNBmQkJLag,Simone H.,5.0 star rating,"Great old neighborhood dive bar in the big city.Stumbled across this bar on a cold, rainy, windy day. It immediately reminded me of back in Pittsburgh with a friendly bar tender that knew their regulars who were friendly and great to even visiting outsiders like me stumbling in from the rain.The food was good and filling [had the pasta carbonara] and there's a good selection of other Bar foods. Had a great engaging conversation with a very tall blond regular in the Marketing field, [whom I should have asked for a job or job advice] just relationship bonding was great too.A definite recommendation for locals and visitors alike!!!",The Ear Inn,4.0 star rating,$$,"Bars,, American, (Traditional)"
70,O1lmb7y_g319u--xt8FsSQ,Fred S.,5.0 star rating,"I just moved to the neighborhood and made this my local watering hole on day 1.Nice variety of beers, excellent food, pleasant service, decent prices.I recommend the pork chops, and I appreciated the recommendation I got on my first visit: have the server bring you mashed potatoes instead of rice!This place has a lot of character, and I'm a sucker for live jazz, which I got to see by chance on a Sunday night. Fun spot for locals, I just wish there were some drinks specials!",The Ear Inn,4.0 star rating,$$,"Bars,, American, (Traditional)"
71,iv4Ybf5W3AfLuCKb8PEhoQ,Tyrone J.,5.0 star rating,"This place is amazing. Great atmosphere, great food, music, sports, and the bartenders rock. Probably a top 5 bar in the city.",The Ear Inn,4.0 star rating,$$,"Bars,, American, (Traditional)"
72,iW8-s_D6Mzo5JV_pcIStWQ,Christopher C.,4.0 star rating,"Had a great time here the other, I love old school bars that remind me oh things used to be, and should be. The bartenders were awesome, and they had Leffe and they made me a wonderful Manhatten, the best part of the night was when they handed out musical for everyone to sing along with the live band.",The Ear Inn,4.0 star rating,$$,"Bars,, American, (Traditional)"
73,fNIu_d2jgzZErhhob0v8TA,Eric G.,4.0 star rating,"Got a nice message from one of the operators of the Ear, who informed me that motorcyclists still gather there weekly, years after I moved away.",The Ear Inn,4.0 star rating,$$,"Bars,, American, (Traditional)"
74,Zg_34LVwh8YrrBftnn7L9w,Seetal P.,1.0 star rating,"What seemed like the owner served us at the, bald head white beard. An absolute awful guy. I'm British and I was excited to see a European place but this guy was a complete wanker. Would not recommend for an American nor European.",The Ear Inn,4.0 star rating,$$,"Bars,, American, (Traditional)"
75,rE4IuHt2Gwiy3IGpEEo-tQ,Kyle C.,3.0 star rating,"Service was good in the beginning. After we got our check on our table for 6, she refused to come back after being hailed down for a simple request of water. Their menu clearly states 3 credit card max on orders up to $100. A bill of over $200 was refused 3+ cards because apparently calculators don't exist anymore. The portions of food were pretty big and tasted good but their menu isn't really to date with their restaurant procedures and after an auto grat, our waitress literally disappeared. After getting our cards back and signing an auto gratuity receipt, the ONE water request needed to be asked TWICE. I thought water was a standard procedure at restaurants. Very disappointed by the end of our night here. *lamb burger was really good though.",The Ear Inn,4.0 star rating,$$,"Bars,, American, (Traditional)"
76,4dU3tUbqXBh6tukm8hUaLQ,Peter C.,5.0 star rating,At the far end of Spring Street sits the Ear Inn exuding old pub-style charm and attitude. Great place for a few beers and outstanding burgers. The wife had turkey burger and I had the beef which came out perfectly medium rare.,The Ear Inn,4.0 star rating,$$,"Bars,, American, (Traditional)"
77,oJxDMyVK5sAZODvZBt-QSg,Ryan F.,5.0 star rating,"I came here with a crew including fellow Yelper (and H.S. friend Brad K).  After a night of music, dancing, and pricier drinks nearby, we were so happy with our nightcap here that a few of us returned a week later for a try at their food, and of course some more Boggingtons mustaches!Both recent times here, our server was Angela.  Friendly, but funny and witty, she could crack some good jokes like the best of them, but Angela was well versed on the food and drink menu when it came time for business.My buddy ordered the reasonably-priced salmon entree (pic: yelp.com/biz_photos/ear-…) and I had a lighter appetizer of fried pork and veggie dumplings (yelp.com/biz_photos/ear-…).  I usually stick to steamed, and although they offer both, I took Angela's recommendation and was pleased with the fried variant.  The Ear Inn has a rustic charm that's a rare find in this neck of the woods.  This is a historic place with a good back story, so get on over here and hear it yourself.",The Ear Inn,4.0 star rating,$$,"Bars,, American, (Traditional)"
78,ZrAJoQ8-g3Lcnh4Wm4XRMg,Christa S.,5.0 star rating,"Mick is by far the greatest bartender on the planet, but the rest of the staff at the Ear aren't too far behind. Drinks are great, food is pretty good, too. Do yourself a favor, check it out and tell Mick that the awesome couple from Denver say hello.",The Ear Inn,4.0 star rating,$$,"Bars,, American, (Traditional)"
79,FsHcGJgKFh17lm8Jc3ocFQ,Maria A.,4.0 star rating,What an awesome little dive bar! If the walls could talk I would stay here just to listen to all its stories! The staff are very pleasant and the food is good! I just had mac and cheese but it was the best mac and cheese I've ever had!,The Ear Inn,4.0 star rating,$$,"Bars,, American, (Traditional)"
80,Sxq5atee1s04Nttcvbm-sA,Melissa P.,5.0 star rating,"Randomly ended up at Ear the other night on the reco of 2 awesome ladies we were seated with at a John Waters show at city winery. I absolutely love this place! One of the oldest bars in the city, so eclectic and a really great vibe. There was a live jazz quartet tucked in the corner, playing amazing music, and some stranger sat at our table and let us share his burger (don't worry he cut it in half first;), and I can honestly say it was the best burger I have ever had. I mean I can't stop thinking about it (and I rarely ever eat burgers). There are some tables in the front near the bar and a section of tables in the back if you're there for more of a dinner with a group. Overall just a really chill place with a warm inviting vibe. Great place to just stop for a beer and listen to some music. If I had a bar stool, it's the type of place you could sit at all day!",The Ear Inn,4.0 star rating,$$,"Bars,, American, (Traditional)"
81,GTtoDv4S-Lv54WeziVjXig,Brooks T.,1.0 star rating,"Have gone for years. Won't go back, because the place lives on its history, which is over. The angry old bald bartender, 2nd in charge, been there 20 years, has had too many drinks from the trough it seems. And he feels a little too protective and entitled to his crumpled, smelly, sweaty dollar bill tips.",The Ear Inn,4.0 star rating,$$,"Bars,, American, (Traditional)"
82,r7ToEqMJl_I5MeupdEkZew,J J.,5.0 star rating,Great local bar with good food. The Burger and the mussels are the standouts. Decent beer selection,The Ear Inn,4.0 star rating,$$,"Bars,, American, (Traditional)"
83,xiF3I73lKgpSKpKfbw9cKQ,Steve K.,1.0 star rating,"Went for drinks after a birthday dinner last night. The bar itself is fine and I can look past the fact that a server will forget a drink or two once in a while, but there is absolutely no excuse for angrily yelling at a group of 10 people for asking if we can push a couple tables together. You probably also didn't need to sprint across the room and slam your hands down to desperately clutch the table that got rotated a couple inches, either. I promise, we weren't going to steal it.Incompetence aside, this was without a doubt the rudest, least respectful level of service I've ever received outside of a Dick's Last Resort. I might suggest a career with less client-facing responsibility if you hate hospitality this much. The history is cool, but sell this joint to Danny Meyer and put an end to it.",The Ear Inn,4.0 star rating,$$,"Bars,, American, (Traditional)"
84,t2B0b0JggFUlitvXw-hzvA,Laura W.,5.0 star rating,"Mick is a phenomenal bartender. I am fairly particular about how my drinks are prepared and he knocked it out of the park each time. We went on a Thursday night as we are staying around the corner, and we were so glad we stumbled upon this place. Great people, great food (we ordered some late night pot stickers), and fabulous people watching. Would absolutely go back again!",The Ear Inn,4.0 star rating,$$,"Bars,, American, (Traditional)"
85,zgKL4AGp6CPMqhufjQXleQ,Peer T.,1.0 star rating,"Although the music was great it was one of my worst bar experiences in NYC so far. The bartenders, yes plural, where very rude! The whole atmosphere at the bar was dominated by it. So for great music, please go and see it somewhere else!!!It's not worth the annoyance...",The Ear Inn,4.0 star rating,$$,"Bars,, American, (Traditional)"
86,sRA8LO8koHbzN5uLe4rVRA,Sam F.,2.0 star rating,"Came here for a quiet drink after work with a colleague. Pub itself fine if small - great music, beer fine. But 1) 30 dollar card min seems v.high2) I had to provide card + ID which was odd3) when we went to sit at table with drinks in hand waitress indicated where we could sit. Bald bartender (mentioned in other reviews), then started shouting at us incoherently.Apparently to sit at table had to close current tab and then reopen. But wouldn't take card as first round was under 30 bucks. Got shouted at being asked what I would do back home. Again not making much sense and when I politely asked him what he meant he just started shouting again. Luckily friend and I squeezed our change together to pay round.Been in NYC for a year and that was the rudest service I've had for anything. Though music was great, service means won't be going back.",The Ear Inn,4.0 star rating,$$,"Bars,, American, (Traditional)"
87,D49xVarKZlcFsRJDYtCnBA,Yuri S.,5.0 star rating,"I have been coming to this place for half a decade and have never been disappointed. The food is always top notch and the staff is great. The fried dumplings are a must try. The Mussel are also really good. The burgers are tasty. The duck legs are amazing. The steak isn't half bad either. Really generous portions. Also they have an area outside where you can drink on the street! (The only bar in NYC i'm aware that has this) This place has been around for nearly a hundred years, and if you're in the area you can't go wrong with a visit to The EAR.",The Ear Inn,4.0 star rating,$$,"Bars,, American, (Traditional)"
88,PIQWsnbir7VGcoMhy8DNDg,Ed L.,4.0 star rating,"When in New York City, you hit up the Ear Inn in SoHo.At least that's where I went after dropping off my stuff in Jersey City upon arrival. First things first upon my short stay in New York City, is to hang out and enjoy the nightlife.  I didn't do a mobile check in since my iPhone ran out of juice in transit, so I just made a mental note that I was here. I came here with my friend, who lives in Jersey City and arrived here around 7:30pm on Thursday, May 9. This place was already packed to begin with. I guess people find any excuse to party and drink at any time of the day. With that said, a group of marathoner friends had already camped out here waiting for us to arrive. We were basically fashionably late and got a table pretty close to the door. It was okay, since my legs were already kind of tired from the travel and running at least one marathon on this trip. The overall experience was pretty good. We stayed here till about 9pm and left thereafter to another bar before making our way back to the PATH. My Jersey City friend was drunk, so I had to be the sober one to make the decisions. LolThe Ear Inn is located at 326 Spring Street in the South Village district of Manhattan. Since this place does get crowded on any given night, it was interesting to catch myself at a bar, but when in NYC, it's bound to happen I suppose. The noise level of this place can be classified as loud enough, since you can hear people talk, but that's about it. The lights were low enough to be sort of romantic in nature, but I guess that's how bars are. Cant say enough about driving in New York City, so save yourself the car keys and take the subway or walk it.  They have street parking up front or nearby, but its usually a hassle anyway, so public transport or walking is your best bet.  Ear Inn takes credit cards, so that's always a plus for me. As it turns out, since it was my 1st time in NYC, a friend of mine actually took the check after we ate and paid for both our meals. I didn't realize it till he gave our server his credit card without seeing the bill. That's pretty awesome, I think! I thanked him, of course. It was a nice night to hang out with friends with a couple of beers and dinner in New York City, that's for sure!I ultimately found solace with the angus burger, which was okay. It was tasty and delicious, but the price was well over $10, which came with French fries on the side. I ordered it medium.  I also had a couple of guinesses and a corona, which all hit the spot as well.  The beer, while familiar, was excellent as always. The company here was rather good, especially when most of them had run multiple marathons over the course of several years. The Ear Inn seemed too small for the patrons it was serving, but at least it had a bathroom in the rear of the establishment. Not sure if you can call this place a bar or a restaurant, since it does do both. We did sit next to the photo of Abraham Lincoln that had a sign that said something about Republicans. Probably too stoned to remember it though, but I remember that photo.  The company was great and the service was good. I enjoyed myself here before bar hopping around later that night. Recommend it if you are in the area and need to unwind from a tough challenging day. A few beers will help numb it all down. Support local!B",The Ear Inn,4.0 star rating,$$,"Bars,, American, (Traditional)"
89,glqFGM1RtOk3DKqfnUAS6A,Candace F.,2.0 star rating,"my friends found the food okay, there was enough space for everyone but the waitress seemed to be the only person on the floor for hours. the bar selection is lacking, especially for the area. its cash only.not coming back but not awful for what it was.",The Ear Inn,4.0 star rating,$$,"Bars,, American, (Traditional)"
90,AI1rYT1Hu-sIvKxGL0jW_A,Emily J.,4.0 star rating,"Came in for lunch yesterday with a friend and absolutely loved my food!Notes: 1. Service was a bit slow 2. Food was well seasoned minus the appetizer mac and cheese. I had to add a few dashes of salt and pepper. 3. We shared a cheesesteak and crabcake. We were told that the shrimp crab cake would be filling for one person but my friend didn't think so.4. I also wish it was a bit more clear that the shrimp crab cake was a crab cake with shrimp inside, not on the side.5. The white bread wasn't as good as the other bread that was served.I'll be back to try other options but I'm not sure how I feel about the service here.",The Ear Inn,4.0 star rating,$$,"Bars,, American, (Traditional)"
91,hA5GkOGBBQqc45TQI9cNEQ,Jonah K.,4.0 star rating,"Cool oldschool spot with outdoor drinking and hanging out before 11pm. The staff is very nice, and the beer selection is excellent. The food looks good, but I didn't have any during my evening visit. This place is worth seeking out!",The Ear Inn,4.0 star rating,$$,"Bars,, American, (Traditional)"
92,b4_-hcNV6MX53AFu_iHFTQ,Maria P.,4.0 star rating,"Cute bar on the West side. Loved that the menus tell the history of it (oldest bar in NYC), which was very interesting. I had dinner there and the food was surprisingly good. I also found the prices to be very fair. I didn't have alcohol so I can't comment on that. But a friend of mine did ask for a margarita & she hated it. So next time I'll probably go with one of their signature cocktails. Service was good & I liked the decoration of the place. It has that old townhouse feel. I would come back if I'm in the area.",The Ear Inn,4.0 star rating,$$,"Bars,, American, (Traditional)"
93,dTsSlE1_ZZytLesNmLGrWg,Nel A.,3.0 star rating,Nice chill place to be. Out of the way from most things so it seems like lots of the neighborhood folks are here. Bartender is very sarcastic so takes a bit to warm up to him. My friend wasn't having it and he changed it up for her. Cuz he could tell she was turned off overall we had a good time. I would go here again when someone wants to go check out Jazz in city.They have food. So I may eat there next time I go.,The Ear Inn,4.0 star rating,$$,"Bars,, American, (Traditional)"
94,dl4ENy4Bk6-lCu59A8vxbg,Bloss C.,3.0 star rating,"Great service here, the staff are friendly and do a good job of getting you in and out for lunch.  Lunch gets crowded, especially around 1PM when you may have to wait for a table. Had the blacked cat fish special which was served with a small portion of potatoes and side salad.  Everything was tasty for around $12, but the portions are a little on the small side.  I'm not sure if this is true at other times, but for lunch the noise level was intense; I could barely hear what the person across from me was saying.",The Ear Inn,4.0 star rating,$$,"Bars,, American, (Traditional)"
95,JohqyNYmZlaXNqHsmeJvVg,Jen M.,5.0 star rating,"Great pub! Burger was cooked perfectly -- add sautéed onions and cheddar, lather it up with Grey Poupon - done! Home fries might need a little pepper but they were crispy and delicious. Crayons on the table is bonus! Throw in a couple Guinness and it's a perfect meal in a cool location -- the historical building just adds to the ambiance of this loud, crowded, local eatery. You really can't go wrong when you eat where the locals do...",The Ear Inn,4.0 star rating,$$,"Bars,, American, (Traditional)"
96,L-N_leezqEwnWyCPFN9ZOA,Melissa A.,5.0 star rating,"Unexpected Surprise. Just about a block from the Hudson we stumbled upon this quietly hidden yet vibrantly packed bar. It had speakeasy feel and a wildly decorated interior.  It was instantaneous love. The band was just finishing a set, laughter, clapping, & greetings by smiling faces all around. The space is tight, but no one seemed bothered by the accidental swipe of an elbow or hand when reaching for your draft Boddingtons the bartender set in front of you. Conversations with strangers and a feeling of family, this bar is a must visit!",The Ear Inn,4.0 star rating,$$,"Bars,, American, (Traditional)"
97,fbMWlL_jzqNSzmioQiA8lg,Brian K.,4.0 star rating,"A great, kind of dive-y bar, with awesome history. The lamb burger was recommended by friends and did not disappoint. Even though I ordered it cooked medium, they got cooked it with a nice sear - a juicy inside with a bit of seared crust on the outside. Wonderful.The decor is historical and fun at the same time. Good prompt service.",The Ear Inn,4.0 star rating,$$,"Bars,, American, (Traditional)"
98,CM0wlUXwjXjri-ccwaDKBw,Sarah S.,4.0 star rating,"My first experience was good.... A great little place, lots of character, great music, good food. It's a space with a place in history, too. I love old historical places. My second experience, which was March 2016, was a little less good. The music was incredible and I love everything about the place itself even more this time. However, the folks were aggressively shushy. I don't mind if someone wants to shush me, I can appreciate the need for no talking in order to appreciate the music. Truly, I get it. Go ahead and shush me. That's fine to shush me - I didn't realize my whisper wasn't quiet enough. (And it WAS a quiet whisper) But your shushing doesn't have to be accompanied by a paternalistic disapproving face....Sheesh. But this isn't a problem of the venue itself, this is just the patrons.",The Ear Inn,4.0 star rating,$$,"Bars,, American, (Traditional)"
99,0mspNgSiri3PeAqRW6ptXQ,Syberen V.,1.0 star rating,"The one star given goes completely to the musicians, because the band was great. But as some reviews below already indicated, the service at this place is extremely rude. The bartender (bald guy with a grey goatee), couldn't quite understand my Brazilian friend's order due to the loud music, but then started berating him for not speaking English properly. That was after he berated a girl in our group for ordering a non-alcoholic drink. Needless to say the night quickly turned sour for us.",The Ear Inn,4.0 star rating,$$,"Bars,, American, (Traditional)"
