,user_id,user_name,user_rating,user_text,restaurant_name,restaurant_rating,restaurant_price,restaurant_type
146,GpXc0wGf9q4i1Hwg475c4g,Kait M.,3.0 star rating,"Our waitress was so friendly and on top of things. If I could give her 5 stars, I would. Our food was brought out very quickly and so were our drinks. Dinner was served with bread and olive oil which was a nice touch. I ordered the crab cakes, which were average except they seemed like they were a little soggy from the liquid they sit in. Also the Cuban steak sandwich was good, but a little dry. The dress code says casual but everyone around us seemed a little more dressed up. The tables are crammed too close together in regards to private dinners but overall a decent experience.",The Madison Bar & Grill,3.5 star rating,$$,"Bars,, American, (New)"
147,7PuqbEI6GsS4nIeU9t8dpw,Bennett S.,3.0 star rating,Had an exceptional bartender today.  She was extremely attentive and despite being completely slammed and overwhelmed was very attentive with food served fast and drinks out almost as quickly as we could order them.  She was going strong the entire morning.   Quite impressed! In spite of her efforts the food is still just okay...,The Madison Bar & Grill,3.5 star rating,$$,"Bars,, American, (New)"
148,A5dqSwriUs8cV4DEzS_V9A,George B.,4.0 star rating,"I'm still a little prickly when it comes to the Madison.  They have had an off and on policy over the years of only letting in people 25 or above.  I do not like that one bit.  However I have dropped in a few times and I can say it is a great bar.Beer prices a a buck or two higher than other Hoboken bars but fit in with the uptown scene.  I recommend just sticking with a $6 Guinness.  The bartenders here work quickly to boot.  In fact I have nothing but nice things to say about all the staff here.No matter what day I came to the Madison it was never too crowded.  They have enough TVs to show the important games and the noise level is quiet enough that I can hear the person next to me.  All pluses in my book.I have came here for brunch which honestly was not memorable, good or bad.  I do recommend the edamame which I ate on a different occasion.All in all a solid establishment but not my go-to bar.",The Madison Bar & Grill,3.5 star rating,$$,"Bars,, American, (New)"
149,YTRUG3axXg5MoCflgE3IAQ,Alyssa H.,4.0 star rating,"Review for Sunday brunch...or should I say brunches because I certainly ate more than my fair share at this scrumptious buffet!The buffet consisted of fruit, bagel, lox, capers, pancakes, croque Monsieur, eggs, sausage, bacon, Benedict, OYSTERS, shrimp cocktail, and to top it all off, a chocolate fountain! Now I know that that sounded like a lot, but I guarantee you I forgot to mention half of it! So get on over there and find out for yourself!",The Madison Bar & Grill,3.5 star rating,$$,"Bars,, American, (New)"
150,GRDzegM4F0UZKv7192Juag,Yesha P.,3.0 star rating,"I just had dinner here for the first time after driving and running past here for years. The food was sub par at most. It's a Monday night so we did the e course sample for $18 and some change. I ordered the mussels which were okay, the lobster ravioli and canolies. I got 4 raviolis. I was shocked that my plate looked so empty and it didn't come with any sides. Okay fine, I get it, lobster is high quality good so the raviolis must be delicious. They were not. The outside was so tough and I've had ravioli from Trader Joes that was so much better and $3. I also wasn't impressed with the service. Our server was indeed very nice however not efficient, I was given incorrect happy hour info (Martinis were excluded when I was told that they were a part of the HH special) so I changed my drink order to a margarita which wasn't even on the menu I received. We finished our drinks right after our app and weren't asked for another drink until we finished our dinner. I'd get it if they were busy but at 545pm on a Monday it was dead. We paid our bill with a credit card and didn't get a pen. Okay, tracked down a gentlemen (a busser) who tried really hard to find us one. Not really a deal braker but just frustrating. I may be back to give them another chance but I doubt I would get anything more than appetizers. Also it is not cheap by any means so my expectations were higher.",The Madison Bar & Grill,3.5 star rating,$$,"Bars,, American, (New)"
151,H2zAFiDvAklmGMqVt2ewgA,Masha R.,1.0 star rating,"The food is horrible: Super fatty corn beef sandwiches , crab cakes were deep fried... Very unhealthy meal and you will get a stomach ache afterwards. The Price not cheap either.",The Madison Bar & Grill,3.5 star rating,$$,"Bars,, American, (New)"
152,sQ9bUmokWLp3ELiBXPub0A,Nikki V.,5.0 star rating,Favorite spot in Hoboken. After work drinks with the warm goat cheese salad with salmon is a weekly staple for me and my girlfriends.,The Madison Bar & Grill,3.5 star rating,$$,"Bars,, American, (New)"
153,muBah4jcOya_6yw1la-MPg,Aashish P.,3.0 star rating,"I had the chickpea and mushroom burger.  It was good and interesting.  I would go again, but being vegetarian I'm limited.",The Madison Bar & Grill,3.5 star rating,$$,"Bars,, American, (New)"
154,Y6Sx49M_nU83bJXkI5K9dA,Anthony J.,3.0 star rating,"One of the most consistent restaurants in town.  Maybe that's why this is the place my father-in-law makes us go every time he visits Hoboken.  The entrees are good, and the gaucho steak and hanger steak are some of my favorites.  They usually have a good seafood dish or two as well.  They also usually have some good wines up on the blackboard.The bar food is ok.....sliders, sandwiches, etc that sound good on the menu but are just ok when it comes to taste.  Sometimes we just hang out in the bar and get some oysters and beers.  It's a good time.  They always have a few interesting beers on tap.  I love scotch, and one time they clearly gave me the wrong kind of scotch....maybe they thought I wouldn't notice?It turns a bit clubby at night on weekends, which is kind of surprising given the decor, but it can be fun.While it's not my favorite restaurant in town, we always know what to expect with the food here, and there are no surprises.",The Madison Bar & Grill,3.5 star rating,$$,"Bars,, American, (New)"
155,LvZzqkETMF1PWOU-I0pDXA,Kevin T.,3.0 star rating,"Decent food at happy hour, still a little pricey.   Thursday night and weekends atmosphere is pretty good but sometimes can draw rowdy crowd.  Staff is nice and friendly.  Food just ok",The Madison Bar & Grill,3.5 star rating,$$,"Bars,, American, (New)"
156,UGZvBCe3d5Q3xDcqtJGt2g,Peter T.,1.0 star rating,I placed an order on seamless.  2 hours later nothing so I called the restaurant: generic voicemail.  After calling seamless it turns out that they decided to close early and not inform me they cancelled the order by phone or email (or seamless).  They sure took my money though; now I have to jump thru hoops w/seamless to get my money back.Automatic F.It makes the owner & managing staff look like a bunch of dum-dums.,The Madison Bar & Grill,3.5 star rating,$$,"Bars,, American, (New)"
157,Ckh1ZmTSMIvzMeSKCf-aIQ,Christine A.,4.0 star rating,The brunch is delicious and so civilized with jazz music.  Also you don't have to take up valuable street parking since they validate parking for those out of town people who can't walk or bike.,The Madison Bar & Grill,3.5 star rating,$$,"Bars,, American, (New)"
158,OXxWVBY5Kx6DQHZBmHAZzg,Beth S.,1.0 star rating,Male came into the women's bathroom during operating hours. Ken (door guy) told me it was unlikely they would ever hire a woman to do this job and that there was nothing they could do... and that women should expect this.,The Madison Bar & Grill,3.5 star rating,$$,"Bars,, American, (New)"
159,cH0IpW1Y_0g0cq66n3iOCA,Stephanie F.,3.0 star rating,"Came here for restaurant week, it's definitely work the money for all the food you get, 3 courses for $15 pretty amazing for my first course I got the mac and cheese, pretty good portion it was really good, very cheesy the sauce was a little runny but full of flavor, for second course I got the grilled veg white pizza, the pizza was hugeeee I couldn't finish it I had to take some home, & as for dessert I wanted the maple cheesecake, and the waitress told me that they have that today, which I found weird because today is the first day of restaurant week, how do you not have that, but whatever I got cookie dough gelato instead which was very good. As for drinks I ordered the all my Exs drink which I found to be very strong my sister got the honey Mojito which she said was very strong also the first time I never finished a drink but other than that the food was pretty good",The Madison Bar & Grill,3.5 star rating,$$,"Bars,, American, (New)"
160,O3BGOmCHLV0zq4lSfaB3VA,Tyler L.,4.0 star rating,"Quaint upscale tavern atmosphere with a good beer menu. Stopped in here for a quick pint and really liked the tap selection. Not your standard Guinness and Yuengling selection, they had Brooklyn reserve and troeggs. Food looked very tasty, especially the burgers which many of the regulars opted for. Staff was friendly and prompt. Definitely coming back for brunch.",The Madison Bar & Grill,3.5 star rating,$$,"Bars,, American, (New)"
161,Lu60GaKNGWfZKhN6NTn_mA,Judy R.,2.0 star rating,"I was excited when I saw the LivingSocial deal for a Hoboken restaurant so I bought two coupons. The first time, we order the hanger steak and the jambalaya. We thought the food was okay... More like a 3-star restaurant. However, the food is way over-priced which we didn't think was a big deal since this is Hoboken and the service was not bad. Today, my birthday marked the 2nd and the very last day that my husband and I will ever eat at Madison. Right off the bat, the waitress told us that we cannot order from the prix fixe menu because we have a LivingSocial coupon. Okay... My father-in-law ordered the ravioli $18, I ordered the steak frites $32, and my husband ordered the salmon $23.  We ordered wine and apps (crab cakes $12 and mussels $10 which were both good) with our dinners. SERVICE:After taking our order, the waitress did not check on us until we were half way through our entrees. Well, except for when I had to flag her down to get another seafood fork and more bread. When she did finally come back to check on us she  only asked my father-in-law if he wanted more wine. She didn't ask if our dinner was okay so far and/or if we needed anything else. Second time she stopped, same thing. She asked my husband if he wanted another glass of wine. And of course, the last two times was to give us our bill and run the credit card.FOOD:The appetizers were good. The mussels were especially delicious.  But sad to say, the apps were the best part of the meal. Crab cakes were good.Ravioli: when it arrived, I thought we were in a Mexican restaurant because the cheese raviolis were completely covered in the green sauce (artichoke puree) with shredded cheese on top. You can imagine what that looks like! After FIVE (5) bites my father-in-law politely said ""Meh, it was okay"". Believe me, he's a simple man and not a food credit so for him to say that, it must have been a pretty GROSS dish.Steak Frites: My meal, the most expensive thing on the menu (I think), arrived with JUST a monster of a steak plopped on a plate. The truffle fries came separately. That's it! Would it have killed them to put a smidgen of parsley on the steak? Really? I didn't know that I was in a dinner. Obvs, if you're charging fine dining prices, I'd expect a restaurant to present it with something. Nope. Though, I would have to admit, the steak was good. However, the ""truffle fries"" were pathetic. They were overcooked and dry.Salmon: My husband's dish was overall ""alright"". The fish was done properly but the risotto was gross! I tasted it. Trader Joes' frozen risottos are way better!Okay, I'm sick of writing about this place. I'm over it. In summary, the restaurant overcharges for mediocre food. The service today was terrible. We will NOT be going back here and would not recommend this to anyone.Good luck.",The Madison Bar & Grill,3.5 star rating,$$,"Bars,, American, (New)"
162,hM5Osku9elaKeaOQtLbrZQ,Tom A.,2.0 star rating,"Service was inconsistent. One minute they're ""up your ass"" the next minute they're nowhere to be found.  Food was mediocre and small portioned.  Wings were decent however.  Seems like a better bar crowd than restaurant *side note: we were seated in the bar section which could be reason for service",The Madison Bar & Grill,3.5 star rating,$$,"Bars,, American, (New)"
163,JqjtdewQEbvVUsB-6hSVQw,Tyler R.,4.0 star rating,"After several somewhat anti-tantalizing seamlessweb delivery orders from Madison, I had almost given up on the place.  That was, until I went in and sat down for a meal.  They brought the food to my face, I put it in my mouth, and I was substantially more impressed.Madison's two sides are both equally excellent.  The dining side offers a brighter, quieter dinner food experience with talking, laughing, date eyeball gazing...while the bar side has enough TVs so that you need not shift your date gazing eyes more than a few feet either way before you hit another screen.  Thus - there is no bad seat to watch (insert sport here depending on the season.)Food:  Truffle Fries in a Cone - Regardless of how they are served (cone, box, trough) they are truffle fries and they are very good.  Tip: dip a little white, a little red, and bite for maximum truffleish garlicyketchupness.Steamed Mussels - So good.  Use some bread to soak up the white wine sauce.  If you dislike garlic and/or onions, do not consume this.Melon Heirloom Salad - Hands down, my favorite.  When I get this I usually get a piece of ahi on top and call it a day.  Something about watermelon in a salad....so good.Fusilli Bolognese - Biggest pieces of pasta you'll ever have.  Meat is super tender and the dish as a whole isn't as heavy as it leads on.Roasted Free-Range Chicken- I'm big on the greens, so I recommend you sub double Kale for the mashed potatoes, which are just okay.  Roasted chicken is tasty and very juicy.Other Favorites: Polynesian Club, Bar Pie, Quesadilla of the Day (aim for a shrimp or chicken day.)I highly recommend going on a Monday, where a three-course (smaller number of choices) dinner is only $18.12 per person.  I managed to get the mussels, the free-range chicken, and lemon sorbet and my girlfriend got a caesar salad, the bolognese, and raspberry sorbet that rounded our a nicely portioned $40 dollar dinner for two that could have easily set us back $65.Pow, eat here.",The Madison Bar & Grill,3.5 star rating,$$,"Bars,, American, (New)"
164,CMR6sOisWAp8rmTWZicCbg,Jennifer C.,4.0 star rating,"Great food, great environment, and even better drinks. We sat in the dinning room which was crowded but we didn't even notice the other dinners. The bread provided was delicious bits of heaven and the accompanying dips were even better. Our meals were both cooked to prefect. I recommend the Madison Cappuccino for a dessert. Service could have been a little better but the food made up for it!",The Madison Bar & Grill,3.5 star rating,$$,"Bars,, American, (New)"
165,4vhnAjmzH1Di42f9lM5nMQ,Shawn P.,4.0 star rating,"WOWFrench Onion Soup Dumplings... One word ""Perfect"".Shrimp and Scallop Ravioli was OK too, not the best though. Would surely go back.",The Madison Bar & Grill,3.5 star rating,$$,"Bars,, American, (New)"
166,vWZALi82AOF-_FN-LdU82A,Heather P.,3.0 star rating,"Went here for the prix fix tonight. Great atmosphere. We sat outside. It's $18 for three courses which is really good. Quality of the food is OK - not bad, not amazing. BUT - I don't understand one thing. This place makes all of their money off drinks. So if someone, like myself, orders a martini and it takes at least half an hour to get the drink... that just doesn't make sense. I would have drank at least two more martinis yet I was begging for a drink all night. Hoboken is known for horrible service but why not prove that reputation wrong? A martini has two ingredients... Just sayin",The Madison Bar & Grill,3.5 star rating,$$,"Bars,, American, (New)"
167,Cy9TzV-CqF_2Krnu0VWFOg,Deanna M.,5.0 star rating,My favorite place for brunch because it has so much to offer. The buffet has fresh food brought out every half hour. The French toast is my personal favorite. It's creamy and melts in your mouth and the syrup really adds a light sweet mix into it. The also offer the lunch menu which has a wide range of selections. The brunch buffet comes with a free Bloody Mary or mimosa too! The service is also great. The salmon on the dinner menu is impeccable as well.,The Madison Bar & Grill,3.5 star rating,$$,"Bars,, American, (New)"
168,8v5jbuBGgNSVV1uYkjx2Ig,Meghan M.,4.0 star rating,"Impressed.  The food here killer...not cheap, but killer.  The following appetizers were sampled:- Tuna tartar - Beef sliders- French onion soup dumplingsAll three kicked serious butt.I was stuffed so I just ordered half a dozen oysters for my ""main course."" They were okay...not fantastic. Two others I was with ordered and shared the seared ahi tuna and t-bone steak, both of which they raved about.  The wine by the class list is impressive, with a very nice Cote de Rhone for just $10.  We had a 7pm reservation and walked out after 10:30. The waitstaff was clearly super attentive by keeping our glasses full, and super patient for letting us sit there for close to 4 hours.  Not only is a great spot to grab a drink, Madison's EASILY makes the top ten Hoboken restaurants list.  Good stuff.",The Madison Bar & Grill,3.5 star rating,$$,"Bars,, American, (New)"
169,8d40rjZxFTpNtQpiy5OxXw,Patty A.,5.0 star rating,The drinks were done to perfection! I had the filet mignon sliders. They had to be the most delicious sliders I have ever had. We also had the French onion soup dumplings. They also were delectable.  I cannot wait to come back and have the sliders again!,The Madison Bar & Grill,3.5 star rating,$$,"Bars,, American, (New)"
170,oiiOZ3om6Kgd3DNdNNzhFg,Danielle C.,3.0 star rating,"This place seemed like it would have awesome food but I was left underwhelmed.  The ambiance is nice and chill, though, and the servers are nice, but...This place left much to be desired in its food.  My friend and I started out with some drinks and the french onion soup dumplings appetizer.  They make the dumplings in escargot trays, so the dumplings are REALLY tiny.  They are filled with french onion soup and smothered in cheese.  The hard thing about eating these kinds of dumplings is making sure your plate isn't full of soup when you bite into one, so I guess you should just pop them in whole.  I thought it was pretty good, but I remember the price being like $10.00 or so for like 8 really tiny dumplings.I got a strawberry frozen daquiri.  Definitely really sweet mix they use here.  But it works on a nice hot spring day.I got the grilled chicken panini as my main entree.  Boy was I disappointed by this entree... the chicken did not really have much sauce on it and chicken was a tad dry.  I left most of it untouched (I should have complained)... my friend did like her Polynesian Club but unfortunately I don't really eat seafood...Meh? I guess I chose the wrong dish that day.",The Madison Bar & Grill,3.5 star rating,$$,"Bars,, American, (New)"
171,a4vVCOazxElYKYHVZ5VNMA,Ward B.,5.0 star rating,This has been a great spot for years.  Always a good crowd on Thursdays.  Martini night is a must.  Ally behind the bar slings a mean drink or two.,The Madison Bar & Grill,3.5 star rating,$$,"Bars,, American, (New)"
172,83PIcVmeJa3yFKfqsrK86Q,Sally f.,5.0 star rating,"Love the buffet, which includes a mimosa or a Bloody Mary! Buffet price seems steep but it is worth it if you are hungry because the buffet includes some real top notch items, most notably the oysters, the Jew heaven lox and cream cheese bagel section complete with capers, the chocolate fountain, the creme brûlée French toast.... YEAHHHHHHHHH.",The Madison Bar & Grill,3.5 star rating,$$,"Bars,, American, (New)"
173,-zDrB1iNUARBR-DamaTzeg,Maggie O.,1.0 star rating,"As a long time Hoboken resident, I've come to regard Madison as a bit of an institution in Hoboken. However my last trip to the Madison will be my last. After waiting an hour an a half  we left, never receiving our food or a single apology or acknowledgement from our server or the Manager. I can't speak to the quality of the food since I never received any. It was a real bummer to what was supposed to have been a fun girls night out! Bummer.",The Madison Bar & Grill,3.5 star rating,$$,"Bars,, American, (New)"
174,sIym_pXIZNPNe5r3UGRCOQ,Phil W.,2.0 star rating,"Don't think I have ever wrote a review before, but this place is so hit or miss.  First time would have gave it 5 stars, but this last time was down right awful.  Got a drink, app came quick, meals came while just finishing the apps (absolutely fine and should be said we did the early sitting/3 course meal) and then did not see our waitress for another hour.  Sat with an empty glass of sangria (good) from the end of the meal and then for another hour until my girlfriend went to the hostess stand to ask where she was.  Finally she came back and said, ""you never got your dessert?"" We said no and then she walked away.No I'm sorry for being gone for an hour, no would you like another glass of sangria? That one looks like even the ice has melted over the last hour.. Just walked away.Came back with dessert and I asked for the check.That's it.Food wasn't as good tonight as it has been, but service was absolutely awful. Waitress ZERO stars, bus boys 5 stars, food 3 stars tonight (normally 4 or 5)",The Madison Bar & Grill,3.5 star rating,$$,"Bars,, American, (New)"
175,c29Gr7hlU5EVHN7_6hzs2Q,Lorenzo T.,4.0 star rating,"The Madison successfully operates as both a bar and a great restaurant.A popular happy hour place with good drink specials.Happy Hour:Mon-Fri: 4-8pm: 1/2 Price House Wine, Bottled and Draft Beer,and Well DrinksFeature Nights/Drink Specials:Tues: Famous Tues Nights with 1/2 price MartinisThurs: Endless Happy Hour 4pm-close (House Wine, Bottled and Draft Beer, Well Drinks, Sauza Margaritas, Sangria).What I really like here is the early bird special which runs all night on Monday and from 5-7pm Tuesday thru Friday. At just $16.13 a person you have a contender for the best priced first seating / prefix menu in Hoboken. Wines from the first seating menu are all $15.The portions have been called perfect by other diners. At first site of the appetizer I thought it was on the small side, but I must say that the 3 courses really do add up. I've enjoyed the crab cake alot, crispy and good not alot of breading. Will probably remember to ask for the sauce on the side next time since it started to make the bottom of the crab cake soggy. Otherwise it was top notch. Also liked the six choices for the entrees. Ended up falling in love with the creamy polenta and the tender free-range chicken. As close to what Mama Tattoli used to make me growing up.The two mini cannoli's come with a great chocolate dipping sauce for dessert.I really try to come here anytime I get out of work early enough for the first seating. Super easy to get to if your coming in from the city via Bus. Always great for happy hour!",The Madison Bar & Grill,3.5 star rating,$$,"Bars,, American, (New)"
176,iL7ikwAsnwGBDpOvJvLw-Q,Cynthia V.,5.0 star rating,"We decided to try this place out finally, and we are glad we did. Everything was great, especially the service! My husband ordered the pork chops with grits and broccolini, and wiped his plate clean! Can't wait to come back for brunch, since the menu looked delicious.",The Madison Bar & Grill,3.5 star rating,$$,"Bars,, American, (New)"
177,Y59HQNazSLR1EUMUmMOaFg,Greg W.,2.0 star rating,"Not sure why this place gets a good rap.  I've heard from a few people that the food is good here... though maybe they were all talking about brunch?Anyway, dinner here, while not a disaster, did not warrant a comeback.Cesar salad was amazingly bland.  skirt steak was ok, ordered rare and came out rare - but was uninspiring.  Lobster risotto was a big disappointment.Service was below average to average.Wine list had some decent bottles in the 30-40 dollar range though, that was a surprise.",The Madison Bar & Grill,3.5 star rating,$$,"Bars,, American, (New)"
178,mjG_dF9-gXSEv4ZA9oA2Bg,Brittany L.,4.0 star rating,"Sat outside with my small-town Mom and Grandpop and enjoyed the Brunch Buffet.  $25 didn't seem like that much to me, but my grandpop had a small heart attack.  Buffet portions are lost on me but I appreciate the variety.  I've had better oysters, but the frittata was good and this maple nut cream cheese was delicious.  The salad they put out was great too.  The bar we passed inside was really long and seemed optimal for football-watching.  It was a perfect place to meet my family and hang out for 2 and a half hours outside while picking at good food.",The Madison Bar & Grill,3.5 star rating,$$,"Bars,, American, (New)"
179,lQpqKeNKlF_DElOckfRkxg,Cindy M.,5.0 star rating,Five stars for the bar but beware the young crowd in their 20s.,The Madison Bar & Grill,3.5 star rating,$$,"Bars,, American, (New)"
180,p2jbWwRVmbLPSSvu4uxbkg,Kat K.,5.0 star rating,On Sunday night my friends and I had a dinner here. The place looks really nice and classy. Our waitress was very welcoming and helpful.,The Madison Bar & Grill,3.5 star rating,$$,"Bars,, American, (New)"
