,user_id,user_name,user_rating,user_text,restaurant_name,restaurant_rating,restaurant_price,restaurant_type
246,27BhvByhRC_obwsewJxOeg,Krzysztof W.,4.0 star rating,"Great food and late night music! Good spot to hit lounge scene with friends, margaritas are strong but not good on taste side, crowded at Saturdays night but everyone should find something what he/ she like at Madison",The Madison Bar & Grill,3.5 star rating,$$,"Bars,, American, (New)"
247,OXsv09QamVJfBFKf2NJPgQ,Clarissa H.,4.0 star rating,"Good food, especially the seafood!! Visited with my family for brunch! No wait and we were able to draw on the tables with my nephew! Portions were larger than expected with price.",The Madison Bar & Grill,3.5 star rating,$$,"Bars,, American, (New)"
248,X3ma5UrrA3dHfnKaq9wQXg,Alex C.,2.0 star rating,"Couldn't wear a baseball cap. You are a bar, not a 5 star restaurant. I appreciate what you are trying to do, but that is a little over the top. I can understand no jerseys, baggy clothing, etc but it is a baseball cap. One and done.",The Madison Bar & Grill,3.5 star rating,$$,"Bars,, American, (New)"
249,OSgGLGjVPS8B-BEfPwh10A,Marne C.,4.0 star rating,"I like this spot for happy hour, although some servers don't mention the deals so educate yourself before you go.  The French Onion dumplings and meatball sliders are awesome.  I think the best way to eat here is go with a friend, order 3 small things and then 1 more if you're still hungry (you won't be).  I think their appetizers and small bites are better than their actual dinner.",The Madison Bar & Grill,3.5 star rating,$$,"Bars,, American, (New)"
250,Tvoi-tiOiCg429kMoueysg,James M.,1.0 star rating,"Went to Madison's last friday as my GF(Hi Annie) bought the living social deal. Decent meal. I ordered the hanger steak. Decent sized skirt steak with chopped plantains and basmati rice. The steak had  a different taste to it- would not have surprised me if was grass fed. My GF got a salad, with Tuna in it. It cost 19 dollars. Ordered a mango mojito. Lots of syrup with some mint.Here's the problem I have with the place. We got the living social deal, 50 dollars worth of food for 25 dollars, then proceeded to spend 11 dollars over the 50 on drinks and such.  61 dollars total. Although there is a sign up that says any dinner over 60 dollars will be comp'd parking, they refused to comp the parking because we bought the deal at living social. Instead, they offered to ""sell"" us a parking pass for a dollar off the garage price. When we bought the living social deal, we did so because they was a parking lot nearby and we heard they comp'd parking-important in congested hoboken. So, dining here cost us an additional 6 dollars.My problem isn't the money. This place, is NOTHING special. Its virtually the same menu of a dozen other faux trendy Hoboken places (Teak, Trinity, 10th and Willow, etc). Its even in a crappy part of town, far away from the path. There is NOTHING unique about the place.  Offering us parking, like the sign said, while yes, would have cost them a couple of dollars , would have left us feeling good about the place. Instead, it felt like we got nickel and dimed. Why would I come back here again? To have food I can have everywhere else while giving money to an establishment that clearly doesn't give a f*ck? This is why these restaurants fail. There are far better choices in Hoboken.",The Madison Bar & Grill,3.5 star rating,$$,"Bars,, American, (New)"
251,F5FRZpHLymbwFyPxmMfARA,Jillian N.,5.0 star rating,"This place is fantastic -- whether you want a bar scene, or a quiet dinner -- they have a room for each. I have never had a bad meal here, and everything I or one of my guests have ever ordered has been fantastic.My favorite -- the truffle fries.  These are great (especially for visitors around the holidays) from our 90 year old grandma to our friends from Europe the truffle fries are definitely a favorite! Pair with a malbec and enjoy catching up for as long as you like!",The Madison Bar & Grill,3.5 star rating,$$,"Bars,, American, (New)"
252,YV8sJsr3OWTwGzVYAW8FuQ,Sam C.,4.0 star rating,"Came here with family and friends.  It was a great place to hang out and my first experience of Hoboken.  Drinks were strong and delicious (something hard to find), the music was decent and the crowed was fun (but kept to themselves).",The Madison Bar & Grill,3.5 star rating,$$,"Bars,, American, (New)"
253,1CtsDRsiO3gqjh342klYBQ,Courtney M.,1.0 star rating,"My husband and I used to be big fans of Madisons, going once a week for dinner and dropping over $100 on every bill, but after today, I don't think we'll ever go back.  We went for Sunday brunch, which they say opens at 10am.  Yes the doors open at 10am, but they're still adding things to complete the buffet until 10:45am.  Which means that you can't eat the buffet foods in the order you would like, because even basic things like bagels and pastries were some of the last things to be put out.  On top of the late food, the quality was just awful.  The coffee is bitter.  The breakfast potatoes were undercooked, to the point where they were still hard in the middle.  The poached eggs on the eggs benedict were rock solid on the inside, aka overcooked, the creme brûlée french toast was undercooked, but all of this was still better than the dessert.  While I understand that most places do not make dessert in house, I expect that when you're charging me $25 for brunch that you're at least purchasing fresh dessert.  The dessert at Madison's is frozen, how do I know you ask?  Because it was put out still frozen!  If you're going to serve subpar frozen cakes, at least have the decency to de-frost them properly before putting them out for your customers to taste!  I did mention to our waitress that the desserts were frozen and the potatoes severely undercooked.  She brought this up with the kitchen, who did nothing about the potatoes, but brought the desserts into the back and then returned with them a few minutes later.  My only guess would be they threw them in the microwave and then placed them back on the buffet.  While our waitress was extremely apologetic, which was very nice, since it was not her fault, a manager never came over to apologize and we were still charged the full $25 and not even offered an extra drink or anything as compensation.    And that will be the end of our visits to the Madison, there are way too many other restaurants that offer a great product and a courteous management staff to bother with a restaurant, who clearly just doesn't care about their food quality or their customers.",The Madison Bar & Grill,3.5 star rating,$$,"Bars,, American, (New)"
254,TipKnuXCGrMhIIeV574rRQ,Samantha S.,4.0 star rating,The truffle fries are amazing and the sliders are good combo with them. The bloody Mary is a must have!,The Madison Bar & Grill,3.5 star rating,$$,"Bars,, American, (New)"
255,bhNt7D0dxRcC6AqsW150Ig,Samantha A.,5.0 star rating,"Sat outside, great weather cute outdoor tables! Great service very quick for apps! amazing fries! Great shrimp sandwich and cocktails! Overall great vibe",The Madison Bar & Grill,3.5 star rating,$$,"Bars,, American, (New)"
256,qCX9wl-fikzTWjNV7GJHdw,Andrew N.,4.0 star rating,Great local bar & restaurant. Friendly staff who are attentive and welcoming. Food is good. The bar has a historic feel but plenty of plasmas to watch too.,The Madison Bar & Grill,3.5 star rating,$$,"Bars,, American, (New)"
257,q0-qBO38cOFOxm3ZEn_wbQ,Nicole K.,1.0 star rating,Thanks for the food poisoning. Ordered the lobster roll and immediately felt sick afterwards. Wish I read the reviews of this place before going. All the one star reviews basically state how people found hair in their food or got food poisoning. I had the pleasure of getting food poisoning....this place is NOT worth it!,The Madison Bar & Grill,3.5 star rating,$$,"Bars,, American, (New)"
258,rjltfPoiPhW-mMakFlUObA,Bevin M.,5.0 star rating,Always loved this place when I lived up here and just came back for brunch!! Still awesome.. Prepare to wait a little for a table  as they are really popular for Sunday brunch.,The Madison Bar & Grill,3.5 star rating,$$,"Bars,, American, (New)"
259,2_cVgJs9jBjagyw1-cwFrg,Zulu Q.,3.0 star rating,"If I went for food, I would probably like this place better.The drinks are weak. If someone living in a Blue Law state complains about that, that's pretty bad.The bouncers were jerks. I understand that you need to clear the furniture at some point in the evening so that you can make this place an exhaustively douchey meet market. But you know what's effective? Manners. Why don't you POLITELY ask for my chair and preface with, ""May I have your chair so that we can make more room?"" I was quite rudely, in my opinion anyway, asked for my chair and ignored the guy for some time because I just thought he was some random asshole making me move. If I were drunker (see weak drinks), I might have thrown some attitude that would, of course, gotten me kicked out.But I redeemed them for their bathrooms. The bathrooms are clean. Some stalls even had toilet seat covers. This is a rarity on the East Coast and someone from California always giggles with delight at their sight. Additionally, they had something I'd never seen before. Their bathroom doors have a weird handle that requires threading your arm through it in order to pull. Isn't that cool? You don't need to physically touch door knobs with your (hopefully) freshly-washed hands to exit the bathroom! That was sweet.",The Madison Bar & Grill,3.5 star rating,$$,"Bars,, American, (New)"
260,yEiRBGtMKYLHbJ1SkydWnw,Jamie M.,4.0 star rating,You must try the French Onion soup dumplings! Sooo yummy. Though the Heineken was not as cold as I would have liked but not too bad either. ;) The dumplings are a must!,The Madison Bar & Grill,3.5 star rating,$$,"Bars,, American, (New)"
261,05iD1PMV7Ua2a1gtzcPBGQ,Farhan A.,2.0 star rating,"An entire experience that is basically summed up by the word ""Meh.""  I will start with the good and get to the reasons why I will probably not eat here again. The location is fine and they do have free parking within a reasonable walking distance.  The layout of the place is nice, although there is a bit of spillover noise from the bar area.  Given that it was Friday night, there was loud music and a number of people at the bar, although I will say that it was not so bad that it affected out meal/dinnertime conversations.The service was fine, albeit a bit slow.  The waiter forgot my friend's tea and they fumbled a great deal in removing our appetizers.  Which leads me to my next point: They had a really neat French Onion Soup Dumpling appetizer.  Basically, you get six dumplings filled with french onion soup and covered in Asiago cheese.  It was tasty, although a bit hard to eat since the shells were ready to explode from all the liquid and onions.  Unfortunately for my wife and my two friends, they ordered the classic Ceasar salad.  It was extremely plain, and tasted like wet lettuce covered in croutons and Parmesan.  My friend, fellow yelper and Ceasar salad aficionado, was not amused.  The entrees were also a let down.  The lobster risotto lacked flavor and was overall poorly done.  The hangar steak was bland and slightly over cooked.  I ordered the pan fried free range chicken.  The chicken was salty, the mashed potatoes came from a box and needed salt and pepper, and the spinach was fine.My wife got the ravioli of the week, which turned out to be a wild mushroom ravioli in a marinara sauce under mozzarella and basil.  This was delicious.  The marinara was complemented perfectly by the fresh basil and mozzarella.  The dish was surprisingly spicy, however my wife and I love spicy food so that was great.  The dessert was 50/50.  We had the molten chocolate cake, which I thought was very well done.  My friends shared the banana split, which had too many walnuts and mediocre ice cream.  All in all, if I found myself here again, I would try the ravioli of the week, and have that delicious molten chocolate cake.  I would definitely avoid the Ceasar .",The Madison Bar & Grill,3.5 star rating,$$,"Bars,, American, (New)"
262,1-vov-NZWUFbE3PTcGLYLA,Brian S.,2.0 star rating,Visited on three occasions (lunch) and regularly disappointed by this place.  Food is below average as it consistently came out cold.  Service is friendly but slow.,The Madison Bar & Grill,3.5 star rating,$$,"Bars,, American, (New)"
263,lmBcL6YTfLkzUzLNc5Ep9A,Phil C.,4.0 star rating,We used to order delivery religiously from Madison Bar & Grill while we were living in Hoboken.  The steak frites hit the spot every time and was my personal favorite.  Dined in once and had a pretty good experience also.  On the pricy side for the type of restaurant it is (hense the 4 stars) but I thought it was acceptable.  Probably because I couldn't get enough of that steak!,The Madison Bar & Grill,3.5 star rating,$$,"Bars,, American, (New)"
264,-FbeEpgf01NyTDdBcXtgVg,Dan H.,4.0 star rating,"This is another of my old haunts from when I lived in this part of Hoboken.  A friend of mine and I used to come here all the time because they had what I remember to be a pretty damn good happy hour.  I can't recall what that happy hour is at this point in time, but I'm sure one of the other reviewers has mentioned it in their review.I liked that the crowd here seemed to be older and more mature than the crowds further downtown closer to the PATH train.  That was another big reason to frequent this place.Anyway, on this visit, my friend and I just came for a few beers so we grabbed a table out on the street as the weather was perfect.  Their beer selection is decent.  They don't have anything that will blow your mind, but they have a few like Long Trail Ale and a Flying Fish beer on tap and that is fine.  There are certainly places in Hoboken that you go specifically for their beer selection.  This place stands somewhere in the middle.I'm not used to paying $5 for a pint anymore.  When I lived here, it was just something you did.  Now that I'm across the country, it is a rare occasion that I pay that much for a pint.  I guess I shouldn't knock a star off for that as it just is the way it is in the NY/NJ area, but since I've had different experiences these days, it had to be done.",The Madison Bar & Grill,3.5 star rating,$$,"Bars,, American, (New)"
265,JS0C7mwLtqNHcAULHRhu7g,R C.,5.0 star rating,"They have an updated menu. It has  good food and a fun Atmosphere. We went there recently and had a great meal. They have a app, entree and dessert meal for $18 a good package. There have a good assortment of wine and a great dating location. Nice romantic atmosphere.The cookie dough gelato was awesome!The bar was clean and open good for mingling. The dining room had a warm inviting atmosphere.",The Madison Bar & Grill,3.5 star rating,$$,"Bars,, American, (New)"
266,v7C6Kz3eZW0I_V7JzbDk5g,Brad M.,1.0 star rating,"I used to love The Madison and ate here at least once a month over the last decade I've lived in Hoboken... But after my mother got food poisoning last week, I don't think I'll ever be going back.",The Madison Bar & Grill,3.5 star rating,$$,"Bars,, American, (New)"
267,Oq1PVIuFaHvjrCPb1FCImA,Dan B.,3.0 star rating,Make sure you get seated closest to the bar if you're doing the brunch buffet.  Its awkward to keep walking in between rooms every time you want food.  The food was great - especially the creme brûlée french toast but the service is horrible.,The Madison Bar & Grill,3.5 star rating,$$,"Bars,, American, (New)"
268,KcqK_rhOgJihEYOVyQinCQ,Lauren S.,5.0 star rating,"Love this place! Had a Amazon Local deal and thought I would check it out, so glad I did. The service was great, food was delicious. We ate early (6:30pm) and didn't need reservations.",The Madison Bar & Grill,3.5 star rating,$$,"Bars,, American, (New)"
269,U3jXj7qnCbZx4BvUnhmeag,Damaris P.,5.0 star rating,"This place is small and cramped because the tables and chairs of the restaurant are literally taken out to create a dance floor. It has been over a year since I have been there but when the music is right, it's out of sight. Dancing is synonymous to a religious experience and when Ralph is at the DJ booth you will see the face of God. I have learned that Ralph has since transcended to Room 84.",The Madison Bar & Grill,3.5 star rating,$$,"Bars,, American, (New)"
270,NyNimg4GRu6M1Sw1RaxjIQ,Dina R.,5.0 star rating,I love The Madison! The food and service has always been great. Allison is an amazing bartender with a great personality- ask for her!,The Madison Bar & Grill,3.5 star rating,$$,"Bars,, American, (New)"
271,-P51DxGgxcv3pfoALuP41A,Jim T.,4.0 star rating,The brunch here is one of the best in Hoboken. $25 for all you can eat from a full range of foods. Plus a free drink. They also make one of the best bloody Mary's in town. Recommended!,The Madison Bar & Grill,3.5 star rating,$$,"Bars,, American, (New)"
272,acT2MM69DJ7azVhx8hTG-g,Geraldine C.,5.0 star rating,"The Madison ROCKS! I eat their on average once a week and I'm never disappointed. The food tastes a lot like a home cooked meal. And the customer service is impeccable. I had a filet mignon that wasn't cooked right and they ended up giving me a new steak and comping the meal. They didn't even hesitate. I felt funny, but accepted and appreciated the gesture.",The Madison Bar & Grill,3.5 star rating,$$,"Bars,, American, (New)"
273,gAm8CvAejEMaGi4XpRjLBw,KC G.,2.0 star rating,"We went to the Madison Bar & Grill for lunch on a Saturday afternoon and it looked very promising. The menu was decent at reasonable prices; however, the service was terrible and the wait was ridiculously long. Once we ordered, we waited 45min to get our food. We didn't order apps and our orders were right off the menu (no substitutions) so there shouldn't have been a reason for the delay. The restaurant was also not packed. The server never came to our table while we were waiting or when we got our food--not until the check. The only part of the meal that was beyond average was the sweet potato fries with lime sauce. Otherwise, the tuna sandwich actually bothered my stomach later on in the day. I would not recommend this place.",The Madison Bar & Grill,3.5 star rating,$$,"Bars,, American, (New)"
274,DlgLQ1m1tkT9DE1Lj98hMg,Colleen K.,4.0 star rating,"I went here for dinner recently with my uncle, and was a little hesitant when we walked in and the lighting was dim, just a tad romantic. But it ended up being a great dinner and great night. Our waitress was quick and attentive (granted we went on a Monday night and it was a pretty slow crowd). I'm also currently on a sugar detox, so eating out is very hard for me, but our waitress was very accommodating and I was able to get a full green salad with fresh veggies and grilled chicken, olive oil and fresh lemon. Would definitely recommend this to others and it looks like a great place to enjoy in the warmer weather, too!",The Madison Bar & Grill,3.5 star rating,$$,"Bars,, American, (New)"
275,pUIVEVr2FUhnUR6WBy9dWg,Allison M.,4.0 star rating,"Nice place to sit, have a drink and a salad, and take in the nice weather.  Good location, nice menu.  Definitely a great place for brunch too.",The Madison Bar & Grill,3.5 star rating,$$,"Bars,, American, (New)"
276,6sISw3VSpOpMRIVB7cVHFQ,Rob C.,1.0 star rating,"I've never written a review before - but after this Friday, I needed to. Friday nights are quite possibly one of the most difficult nights to attempt to go out to eat in Hoboken. Regardless, four of my friends and I tried to get a table at a popular Mexican restaurant. After waiting for 45 minutes for a table and no possibility of one becoming available, we became annoyed and left. We called ahead to Madison to see if there was a table available for five and luckily they said they had one free and would hold it for us. Upon entering, we were told that we wouldn't be allowed to eat in the dining room because my friend had a beanie hat on (mind you, it's January.) We could eat if he took it off, but having not done anything with his hair, he didn't feel comfortable. Now the problem here is that in the dining room a woman was sitting in her sweat pants and enjoying her meal, while my friend was dressed quite nicely and had a beanie on (in winter!) So Madison Bar & Grill would rather make the business decision (in this economy) to lose out on five hungry and paying customers because one person had a beanie on. Certainly, my friend could have taken it off and we could've eaten. But the principle of the matter is unacceptable. If a hungry cancer patient appears in your restaurant with a hat on, will you turn them away? This is not 1950 and this is Hoboken, N.J. This is not well-to-do bar and grill, not in a well-to-do area and it is not serving up a fine dining, five-star experience. So, Madison Bar & Grill, because of your outdated, ignorant policy, you lost out on a check for five customers who've been to your establishment multiple times since moving to Hoboken. Not only did you lose out on that one sale, but we've all vowed to never go back. Congrats.",The Madison Bar & Grill,3.5 star rating,$$,"Bars,, American, (New)"
277,8YVll9IEozSVgwZyGYKLdA,Kel S.,3.0 star rating,Fun bar. Decent food. Much like all the places on Washington in Hoboken...,The Madison Bar & Grill,3.5 star rating,$$,"Bars,, American, (New)"
278,C8tRuJ_KNAjL2QDbCNqhoQ,Tara B.,4.0 star rating,"Good go to place to take out of town guests or meet up with friends. The food, atmosphere and service is good. The prices are reasonable too. For an appetizer, you have to get the French Onion soup dumplings. So yummy!",The Madison Bar & Grill,3.5 star rating,$$,"Bars,, American, (New)"
279,bOpcrSXRQivA4pDSWzWPlA,Dayna A.,3.0 star rating,"Came here twice I believe. As far as I can recollect once for an early dinner with a friend and then again for happy hour followed by dinner with another couple.  I guess if the food was more memorable, I would have taken note.  Stick to the bar.  Bartenders are friendly.  Happy hour is a pretty good deal.",The Madison Bar & Grill,3.5 star rating,$$,"Bars,, American, (New)"
280,OFYWsVK3oaomKiBaSz4kpw,Kelsey L.,4.0 star rating,"Great food, great atmosphere but the wait time for the food is EXTREMELY long. I have been here for dinner a few times and every time it has been ""a bit backed up in the kitchen"". Would recommend this place if your not in any sort of rush!",The Madison Bar & Grill,3.5 star rating,$$,"Bars,, American, (New)"
281,5aZX8bTiD0k9vR60SG588Q,Alison C.,4.0 star rating,"Madison is a great place, both for food and drinks.  When you enter the restaurant you arrive in a large, spacious pub with a huge bar and a few tables.  The tables are moved out of the way to accommodate their late night bar scene and weekend live musical performances.  After passing through the bar, you walk through a thick curtain and arrive in a romantic, candlelit dining room with white table cloths and interesting decor.  They also have outdoor seating available.  The service is always friendly and attentive, the menu varied, and the prices affordable.  My first trip to Madison was for brunch.  They have a $25 buffet, which looked amazing, but I opted for their Asian chicken salad, which was good but I didn't love the dressing.  They also had a terrific live band playing cover songs.The second time I was there was just for drinks on a Friday night and the place was packed.  The crowd tends to be older than the typical just-out-of-college scene at the downtown bars.  It's definitely a hot spot.Lastly, I went there for dinner the other evening, and it was delicious.  I had the Mediterranean salad, which contained cherry tomato halves, olives, grilled chicken, and large amounts of feta cheese and onions.  It was very good, though I could have done without all of the onions.  Their warm chocolate cake is out of this world.  It's rich, warm, and soft.  It's served with creamy vanilla ice cream.   It's a definite must.An important note--they validate parking in the garage on 15th and Bloomfield!",The Madison Bar & Grill,3.5 star rating,$$,"Bars,, American, (New)"
282,-jSoPBQ9YutZ5eGD7y2Xkw,Dana B.,1.0 star rating,"This place has gone downhill in the recent months. We ordered our drinks and appetizer (the crabcakes) at the same time, and magically our crabcakes were able to come out to our table within 2 or 3 minutes of being ordered--even before our drinks! They were burnt on the outside and a mushy, cold mess on the inside that barely had any flavor. About 5 minutes after our appetizer came out, our entrees arrived (oddly fast as well). My fiance had the Chicken Rafael and I had the Shrimp and Angel Hair Pasta. The pasta had a funny taste, mushy noodles and looked as if it had been microwaved, and I felt the same way about the chicken as well. I cook stuffed chicken breasts myself and it's not possible to properly cook a piece a chicken that quickly, so it had to have been pre-prepared or microwaved as well. For dessert, we had the chocolate molten lava cake--and there was no chocolate lava at all. It was just a piece of chocolate cake warmed up in the microwave. Won't be going back.",The Madison Bar & Grill,3.5 star rating,$$,"Bars,, American, (New)"
