,user_id,user_name,user_rating,user_text,restaurant_name,restaurant_rating,restaurant_price,restaurant_type
137,sNU15adCyHh7RvNDMF_ezQ,Sean S.,4.0 star rating,"Headed over here Monday night when I should have really headed home, it was definitely not disappointing.  Randomly I went here with a friend after Rusty Knot, which as I mentioned was also fun.  Rode my bike down, and when we walked up to the door, another friend just happened to be hanging out there!!  An old friend that I hadn't seen in perhaps a year!  This was serendipitous indeed, so we joined forces to make a party of five, and ordered more rounds of margaritas! Shortly thereafter a live band setup, and started playing, and we ended up getting kicked out for rowdiness and drunken trouble.  LOL",The Ear Inn,4.0 star rating,$$,"Bars,, American, (Traditional)"
138,EMedE5_oUP9sb48C8V-Sdw,Joel T.,2.0 star rating,fun atmosphere but the absolute rudest bartenders in the world. we left due to the incredibly poor service and attitude.,The Ear Inn,4.0 star rating,$$,"Bars,, American, (Traditional)"
139,SbyKtR2MnSOi1nX2aI2mKA,Hoyman L.,5.0 star rating,"My office is just steps away from this restaurant. They are by far the best lunch place in the area. It's just a neighborhood place, unlike all the chain restaurants popping up all over this area.  I'm guessing it's supposed to be like an Irish pub. But it has Great burgers, great salads, great specials. Girls that work there are always friendly, and attractive.  CELL PHONES NOT PERMITTED!! How cool is that? A place that encourages drinking and eating and conversations without distraction!  Excellent beer selection. There is a sign right outside indicating where the waters of the Hudson River used to be. Most interesting thing about this place, there are three Chinese guys I don't speak much English working in the kitchen.  But they make some of the best American food I have ever tasted. Something huh??",The Ear Inn,4.0 star rating,$$,"Bars,, American, (Traditional)"
140,SzhM25jcadG0azvLqTUijg,Jackson G.,4.0 star rating,"Saw the sign for this bar when I was in the area last weekend. It's a huge neon sign that once said ""Bar"", but the 'B' is messed up, so it reads ""Ear"", hence the name. Incredible old building was  built before 1812 and was originally the home of James Brown, an African-American United States Revolutionary War veteran, who was the proprietor of a tobacco store on the ground floor of the house. It is rumored that Brown is one of the soldiers near the front of the boat in Emanuel Leutze's painting ""Washington Crossing the Delaware.""In 1817, a tavern opened in the space, making it one of the oldest bars in New York City. Its proximity to the water made it popular with sailors and longshoremen. It had a brewery that was later turned into a restaurant.Today, the Ear Inn is no longer on the shores of the Hudson, as subsequent development saw landfill push the riverbank further west. The Ear now sits between Washington Street and Greenwich street, just east of the West SIde Highway. Ok! All that history is making me hungry. The Ear has one of the BEST burgers in NYC. let me repeat that. One of THE BEST burgers in NYC. I don't know what they do to make them so delicious, but they are huge and amazing. They come with a side of roasted potatoes and a small salad. Although I've only had the burger here, I did sample the New England Clam chowder, which was money, and the dumblings, which were also delicious. Straightforward, simple pub food done really, really well. Will definitely be back to check out their happy hour. Cool place!",The Ear Inn,4.0 star rating,$$,"Bars,, American, (Traditional)"
141,2neoLyX1LGNur43hQXwczw,Adam H.,4.0 star rating,"Whenever I think of this place, I immediately think of the scene in Pee Wee's Big Adventure when Pee Wee is looking trying out products at Amazing Larry's.  Pee Wee puts on the big ear  and goes ""WHAAAA!!!???/  WHHAAAA???  WHAT DID YOU SAY?  Haha!""  What does this have to do with Ear Inn?  Probably nothing.  Both this bar and Pee Wee's Big Adventure are classics and cultural institutions in their own right.  Ear Inn is one of the oldest bars in the city, with a dispute exactly how old it is.  The first time I went inside I didn't know what to expect.  There were a lot of motorcycles outside, and thinking of Pee Wee I thought maybe a dance to Tequila was in order to placate angry bikers.  Instead it looked like a rustic mom and pop bed and breakfast meets a New England Bar where bearded fisherman meet before setting out into the perfect storm.This place definitely has character.  With kitchy wallpaper and ship paintings that cover the wall.  Also character can mean coazy, or cramped, but never crowded.  It being an off night, it still felt a little claustrophobic with the place a quarter filled.  And the bathroom was snug.  So snug, I think it was originally built for smurfs.  But it was well worth it.We only stayed for a couple of beers- their selection was pretty standard with domestics and Brooklyn Lager.  They also had food that looked pretty good.  Would be willing to come back again hear what all the buzz is about... womp, womp. Ok, no more ear jokes ever.",The Ear Inn,4.0 star rating,$$,"Bars,, American, (Traditional)"
142,ZB4oMBJ_xvelXmloPj_ghw,Andrew W.,1.0 star rating,"This could be the worst bar I have ever been to. The hostess/waitress was the rudest person I've ever encountered.  Told us we couldn't touch the tables in front of us and had to wait for a table in the back for the 8 of us (it took 25 minutes), took a round of drinks and brought half of them.  She ran off to go do who knows what, 10 minutes later brought more beers and totally excluded my drink until we had managed to sit down at our table and ask for it.DO NOT EVER GO HERE!",The Ear Inn,4.0 star rating,$$,"Bars,, American, (Traditional)"
143,l_knAbnkCktlo2cc2t1_Uw,Masa K.,4.0 star rating,"Oh, NY. You guys are serious about your daydrinking. I tip my hat to you, sirs and madams. I started at 4:30 PM in SoHo, made a stop in TriBeCa, and was experiencing memory loss around 10:30 PM here. Personal shortcomings aside, I must sing praises about Ear Inn. This place is probably as good as it gets when it comes to comfort and carousing. The garlic and wine mussels are divine, especially when washed down with an icy pint of Yuengling. I can't really ask for more. The Irish bartender is amazingly cheeky and quick-witted. I want to be her. I really wish we had something like this place in LA. Not sad, though, because it's just fuel for another visit. I love NY!",The Ear Inn,4.0 star rating,$$,"Bars,, American, (Traditional)"
144,zqLQtCxT1lBNB3HKIog8kg,Peter F.,4.0 star rating,"We came to The Ear to eat and drink before attending a show at City Winery. I have long been a fan of this funky, old dive but in reading the reviews here I saw a few complaints of rudeness. Since we only dealt with the waitresses I can't speak about the bartender. The wait staff, however, was wonderful. These ladies were sharp, engaging and fun to deal with. Our main waitress hailed from Cork, Ireland and she was a delight. Our table had everything from burgers and chili to a rack of lamb. The entrees were all exceptional (as were the fried dumpling appetizers) and the drinks were replenished with merely a look at our waitress. We got to talk a bit with the chef; he concocts some great dishes in the tiny kitchen and it is always fun to watch him work from the tables. The vibe was happy and upbeat like it usually is at the tables in back. I had their burger, and it was delicious. 82% lean with 18% fat, they are hand-made on the flat top and are so delicious and juicy. Owner Martin Sheridan suggests a martini with your burger, but I had some Jamesons. My cheeseburger was great and the whiskey couldn't dim the flavor..I always enjoy coming to The Ear and this visit confirmed my affections for this bar. Good job, Ear Inn.",The Ear Inn,4.0 star rating,$$,"Bars,, American, (Traditional)"
145,1BEF77VJcyC-EoLxxh_Afg,Heather J.,4.0 star rating,"A very cool place, short on space but an overall great experience. The burger and beer transported me to a time when  I was in London sitting in a pub. That memory faded until I had to use the bathroom, not so much fun. The food is really pretty good here, decor is cool and prices were okay. Ruwan J's review of Ear Inn broke it down pretty much how it is. But come here and enjoy it, it is a fun place!",The Ear Inn,4.0 star rating,$$,"Bars,, American, (Traditional)"
146,l1by1NKfwVI16uyTPDIQ4g,Ryan B.,4.0 star rating,"Let me set the stage...Five best friends meet up in TriBeCa for an impromptu night out in the city. While parking, one notices the ""Ear"" sign and throws out the suggestion that we check it out after dinner. Great. Suggestion. Two things I did not like? The waitresses were a bit frazzled when we walked in and seemed annoyed with our ""large"" party. Kinda off putting. They also messed up one of our beers in the first round.Let me walk you through the highlights...1) The bouncer was very cordial and warned us that the place was cash only at the door instead of letting us find out the hard way. He suggested two ATMs we could use. Great first impression.2) The waitresses referenced above turned out to be awesome. They were cracking up at us playing ""Heads Up"" with my iPhone and even came over to play a round. They ended up buying us a round of shots just because we were awesome. 3) Mac n' Cheese was awesome! 4) Cool atmosphere. It just did not feel like we were in NYC. It felt more like a lighthouse. There were a bunch of older regulars dressed in fisherman sweaters and stuff. Everyone has happy. It felt cozy.Oh and it is the second oldest bar in NYC! Very cool!!!!",The Ear Inn,4.0 star rating,$$,"Bars,, American, (Traditional)"
147,3vIAJePSwBoZ4no_yF1kEQ,Zook G.,4.0 star rating,"Classic decor, seems like it hasn't been touched in the longest time. Food was good, not great. Worth going into for a beer, burger and a look into the past.",The Ear Inn,4.0 star rating,$$,"Bars,, American, (Traditional)"
148,POlKzj3HGHQKjGgXMgdRXA,Tiffany L.,4.0 star rating,"been here for lunch a couple times. i love the laid back atmosphere and old furnishing; old articles, knick knacks, etc. i'd love to steal the poster hanging on the ceiling about what happens when you drink to oblivion. the food is decent. not great but its good for lunch at a reasonable price. i've had their turkey club, their steak, burger and shrimp salad. i wish they had a fryer so they can serve up some real fries, but they only have home fries. overall a good place for a beer and food to unwind before finishing the 2nd half of the day.",The Ear Inn,4.0 star rating,$$,"Bars,, American, (Traditional)"
149,llfUZ9TLz6vJwVWT1UqVqw,Gabriela S.,5.0 star rating,"Simply the best!I loved this place. Very comfy and unassuming. The music on Sunday is simply amazing.  Great staff. I was in a table and the waitress asked me what I was having for dinner. As I said I wouldn't have dinner, she explained me the tables are only for dinner but that it was ok, I could stay there, since I wasn't aware of it. I decided then to eat something and I don't regret it!It was an amazing experience!",The Ear Inn,4.0 star rating,$$,"Bars,, American, (Traditional)"
150,wE6XsspJTr-XX3nxf8DAIA,Rach K.,4.0 star rating,"Yum!I came here with a friend to eat lunch on a Friday afternoon and it was relatively packed, but we were able to get a seat. The bar was full of afternoon drinkers and there were a few people outside drinking on the benches.We asked for water to drink and the waitress promptly gave us some bread, pretzel sticks, and butter.For my entree, I ordered the shrimp and crab cakes which came with roasted potatoes and a salad. My friend tried to order the chicken pot pie, but was denied because the last one had gone to a nearby patron. The waitress recommended shepherd's pie so he took that instead. His entree came with a salad as well. I thought my food was pretty good. The salad dressing was creamy (looked like Russian) so I scraped most of it off since I prefer vinegary dressings, but it was still good and a refreshing accompaniment to my shrimp and crab cakes. The portions were generous for the price and I couldn't finish my food. I thought the shrimp and crab cakes were well seasoned and fresh and delicious. I didn't try my friend's food, but he finished all of it, so I assume it was good.There are crayons on the table so we entertained ourselves by drawing on the paper tablecloth.I liked the old-timey ambiance of the pub and definitely enjoyed myself. I'd recommend this place if you're in Soho and looking for a no-nonsense place to get a meal or a drink.",The Ear Inn,4.0 star rating,$$,"Bars,, American, (Traditional)"
151,e_RbYAa_w8fAXaCjxadJLw,Kristine W.,4.0 star rating,"Another great, chill NYC bar.  Came here after a night of dancing and it was fairly empty (it was close to 3am), but nevertheless it was nice just to have a seat, grab a drink and some food. MY friend and I were hungry so we ordered some mussels and potatoes. I also ordered a Brooklyn Lager. The mussels weren't that expensive and it was a generous helping.  They were good, but not the best.  The potatoes were good - they were like rosemary potatoes. The decor is cute and simple, actually reminded of me a bar I've been to Nice, France. There are crayons on the table to color and draw on the paper tablecloth. Cool little place either to start or in our case end the night.",The Ear Inn,4.0 star rating,$$,"Bars,, American, (Traditional)"
152,lFVE5HBG3sMznUmoWmRf9g,Allie V.,4.0 star rating,Little gem of a bar/restaurant. Divey but comfortable and homey atmosphere. Wait staff was mostly attentive and kind. Waitress forgot about us in the beginning but apologized and was there after very good. My food was excellent. Best piece of salmon I have eaten in a long time. Also the kitchen is open late on weekdays. I would definitely go back!,The Ear Inn,4.0 star rating,$$,"Bars,, American, (Traditional)"
153,RToHHpQzV3bZtlK5_O3ppA,Geoffroy B.,1.0 star rating,"This restaurant is a very unwelcoming place and the service is terrible. We were very badly treated and we were not able to pay by more than 2 credit cards. I don't know if the owner is aware of the technological progress, however yelling at us was not the best way to address the problem. The food was not even good to offset the very bad service.",The Ear Inn,4.0 star rating,$$,"Bars,, American, (Traditional)"
154,LMOllDhgQm1q23Ql4owjGw,Skojo B.,4.0 star rating,"So, we were looking for a place to grab a bite to eat before seeing a show at City Winery and the Ear Inn was exactly what we were looking for. Friend 1 ordered the mussels and said they were awesome - they looked and smelled great and there were lots of em. Friend 2 ordered the salmon salad over greens and said it was great. Friend 3 had the cobb salad and said it was tasty. I ordered a burger with blue cheese and mushrooms, side of fries and some salad and it was great. The burger was about $13, salads were like $13, mussels were $10, I don't remember what the wines and Guinness cost. Overall, thought the bill was reasonable. Additionally, I liked the simplicity of the menu and the place itself. Felt like my neighborhood restaurant/bar and had a touch of history. By the way, check out Google Maps and use the StreetView tool. You can actually ""walk"" inside the Ear Inn and get an idea of the layout. Highly recommended place. Cheers!",The Ear Inn,4.0 star rating,$$,"Bars,, American, (Traditional)"
155,WuG6NPDxwWksLxHMIrwDtw,Alec E.,1.0 star rating,The service here is terrible. The bartender is incredibly rude and the food is mediocre at best. The main bartender yelled at us and was very rude to us because we wanted to pay a check between three credit cards.,The Ear Inn,4.0 star rating,$$,"Bars,, American, (Traditional)"
156,3G-e5SV225T8olvnet8nKg,Robert F.,5.0 star rating,"The. Greatest. Ever.  I live nearby and am so grateful to have The Ear here, which is truly the soul of the neighborhood. First off, the food is excellent, fresh, and reasonably priced.  Looking at it (ancient & ""pubby"" feeling) you wouldn't think this would be a spot for great fresh fish for example, but it is.  Staff are invariably warm & authentic (unless you're a jerk in which case you shouldn't be here anyway). In a word, this place has authenticity - no BS to be found (and no cell phones).  It's a treasure.",The Ear Inn,4.0 star rating,$$,"Bars,, American, (Traditional)"
157,anvpHor28XdjscGcoFaZmA,Bartmann V.,4.0 star rating,"My out of town friends had intended to go to McSorleys.  On Friday afternoon I got a text from my out of town friend:  ""Change of venue, we are not going to McSorley's.  New place: Ear Inn""I get to Ear Inn and I said what happened to McSorley''s?""  My friend's passionate response:  ""They are fu@king assh@les!  I called them up and some guy, he sounded Russian, answers the phone with a very gruff tone.  He says: 'We don't take reservations mothafu$ker!' and slammed down the phone. Man what assh@oles!""So we were very, very pleased with Ear Inn.  We were seated in the back and took up two tables.  The waiters were courteous and friendly.  They have a nice selection of beers.  We had already made dinner plans:  Lombardi's Pizza back at the hotel, but as plate after plate of food passed us to to to the other tables, people universally agreed that the food looked very good.I would certainly go back, this is a wonderful neighborhood place with a relaxed and pleasant vibe.   And in the summer, while walking along the bike path, it would be a great place to stop in for a brew and food.",The Ear Inn,4.0 star rating,$$,"Bars,, American, (Traditional)"
158,vcBqo-Y2pAwEaFOuK5Sntg,Chris R.,4.0 star rating,"Like they need another good review. I just find this place very cozy. The food is good. The cooks are Chinese which is a throwback kinda thing. And here's a shout out to Barbara, the day barmaid. She's cool. Dumplings, lamb burger, chicken pot pie, shepherds pie, Mississippi mud cake (it'll be right out, they're whipping the cream! Sweet love.).",The Ear Inn,4.0 star rating,$$,"Bars,, American, (Traditional)"
159,twgwqvzkGccARI0DRsDCjw,Jared W.,5.0 star rating,"Ear Inn will probably be a fro-yo place one day, so take advantage of it while you can. To call it ""old school"" would be a massive understatement. This is cozy, vintage New York, complete with authentic seen-it-all staff, humble--yet delicious--pub food (I'm not talking about nachos and chicken fingers), and clientele who know and value the real NYC.",The Ear Inn,4.0 star rating,$$,"Bars,, American, (Traditional)"
160,3ZayJsUjU8omVGZpaZksbQ,Nasty L.,1.0 star rating,"Remember when you were young and was forced to go visit a relative's house that never had no place to sit and you had to settle for a small piece of armrest to park your behind?  That's the Ear Inn. Jeezus it's so cluttered and claustrophobic in there. No happy hour prices, at least none advertised. Bartender tells you to keep it down while you're conversing.... That's enough for me to give them one star.",The Ear Inn,4.0 star rating,$$,"Bars,, American, (Traditional)"
161,LSQdaUQmuBTLTET85jAEJg,Louis W.,1.0 star rating,"I really don't like to give bad reviews, but this was in all honesty one of the worst place I have ever been in NYC. Staff was rude and unwelcoming. Food was beyond average. And the place, although somewhat picturesque, was not well looked after. Bear in mind that if you get a table in the main dining area, you will be seating so close to the old dirty bathrooms that you will have a hard time finishing your plate. This was the first time ever in my life that I didn't leave a tip in a restaurant. Please avoid this place by all means.",The Ear Inn,4.0 star rating,$$,"Bars,, American, (Traditional)"
162,PK8r4WcHNgL12CvlOLfZog,Mark A.,1.0 star rating,"Maybe I went in with high expectations (as the Ear Inn was on my bar bucket list), thinking it would be a hybrid of Fraunces Tavern and McSorley's, but wow, was I mistaken.  Both of those bars have a clear aura of cool about them and awesome staff -- hell, Fraunces even sports a museum, and McSorley's is so kickass that it only needs to serve 2 kinds of beer.  The Ear Inn on the other hand has...a cool story about how landfill took away its Hudson River shore space?  Maybe some dedicated neighborhood folks who swear by it?  Who knows.The decor looked like an Irish pub merged with your grandma's small living room.  There is hardly any room to stand near the bar due to the management's decision to pack a bazillion tables in the front area -- as a result, there were a lot of awkward exchanges of ""excuse me"" between patrons and wait staff trying to walk by.  Strike one.  The tap was out of the beer I wanted, and the bartender nearly growled at my wife for ordering a gin & tonic, which returned almost undrinkable (9 parts gin, 1 part tonic, 0 limes).  Strike two.  Once finally seated, our waiter had run out of menus and took 10 minutes to return.  I decided to opt for the burger, which I had read was touted by some as being one of the best in the city.  What I received was an overcooked, thick lump on a bun.  My friend barely touched his shrimp pasta, and my wife commented that the mac 'n cheese had clearly come from powder.  Strike three.I mean, I know it's a bar, and food should be more of a filler than a feature there, but this is NYC, which has a higher standard to be met.   Also, it couldn't even offer what a good Irish bar should: good booze and fun.  Needless to say, we chose not to order a second round of drinks (not that the waiter was around to get one) and left as soon as possible.  We had better bars to hit that night.",The Ear Inn,4.0 star rating,$$,"Bars,, American, (Traditional)"
163,cpcF75vIQb2DiQlcHVet-A,George G.,4.0 star rating,"This is a great bar with a good beer selection (served in 20oz pints!) and food. Ended up drinking the house beer which is made by Brooklyn Brewing with a close approximation of the recipe used to make Fidelio Beer originally made onsite at the Ear Inn. The bartender was really nice as well as the patrons!Being a bit hungry, we tried 2 different items before making our way to a Holiday party nearby:- Spicy Shrimp: About 5 shrimp in a shallow dish with a really tasty spicy sauce based on Sriracha. A bit of a small dish, but the dipping bread provided made it worth it I think. The bartender was nice enough to bring us out some more bread w/o being prompted so that we could finish up the sauce.- Pork Dumplings: Hand-made and served maybe 5 or 6 to the plate with a soy sauce based dip. These were not bad.In addition to the above, sampled the NYC Hot Sauce they stock made by Belcestro's locally. This was phenomenal and based on habanero. No preservatives, guar gums, or any other rubbish - all natural.Before I mentioned the people here are nice. We started talking with a nearby couple and they ended up buying us a highball of Woodford Reserve Distiller Select. That was some strong Kentucky Straight Bourbon Whiskey but I think it definitely tasted a bit better than Jack Daniels from Tennessee.I could definitely see why a lot of friends from Arup used to go here after work (and some of them still do!).",The Ear Inn,4.0 star rating,$$,"Bars,, American, (Traditional)"
164,UA9VVAchAdct3hmFFz7q-Q,Bruce T.,4.0 star rating,"We went here after wedding and had a great time.  It is a 30-40 yo something crowd with excellent food, drink and ambiance. It is a bar with lots of tables and good food.  Very casual.  Great decorations and lots of history.  The wait staff is very friendly.  We had steamed mussels and a spicy shrimp dish to start.   I had a burger which was excellent.  Others at our table had linguini with shrimp in a lobster sauce, and steaks.  The linguini dish was exceptional.  The steaks ok, but needed seasoning.  The prices are excellent with most dishes $12 or less!!!!! I know I should know this but I think it is an English pub.   It is a great place to take a group of friends.  We will go back.",The Ear Inn,4.0 star rating,$$,"Bars,, American, (Traditional)"
165,vTIOcuMcc72kjItbhNI8aA,E W.,2.0 star rating,"Just ok... Well, not even really that ok. Flat hoegaarden... They forgot my entree... Then I was being agreeable, I said ""Ok forget the salmon, just get me some dumplings"" and then they charged me for the dumplings - WTF? I was dining with like, eight friends and everyone else had food and I was merely trying to appease the comfort of the wait staff for forgetting to put in an entire order. Then the waitress was RUDE about it all - she forced me to get another beer instead of just taking the $8 dumplings off. Oh and. The dumplings are great, but they are nothing more than the delicious dumplings you get in chinatown 5/$1 - except they charge $8... for 6.... so this place is lame. Terrible cocktails - no discernible bite. No alcohol? Cool art on the ceiling outlining what happens to your liver when you're an alcoholic. I like to imagine the dude I most recently dated (the one who gave me an std) DYING A HORRIBLE SLOW DEATH due to liver disease. And voila! I'm happy. Plus one star for the Tibetan prayer flags hanging in the tree outside.",The Ear Inn,4.0 star rating,$$,"Bars,, American, (Traditional)"
166,kMyfcyuSz8nMFi52a0Y-Zw,Glyn C.,5.0 star rating,"Best bar I have ever been to. The bartender, Mickey, is the best. Nicest guy I ever met and down to earth, funny. I love this place. An NYC classic.",The Ear Inn,4.0 star rating,$$,"Bars,, American, (Traditional)"
