,user_id,user_name,user_rating,user_text,restaurant_name,restaurant_rating,restaurant_price,restaurant_type
56,MTN00QZZnc2Gn7QCfB-2xg,Nikki H.,2.0 star rating,"Pretty mediocre experience at Union Hall. Stopped in for brunch on a Sunday - we were seated right away and the place is very aesthetically pleasing. They open the front windows, you get a view of the water, and they had Sunday football on. We were drawn in by the $2 mimosa and $3 Bloody Mary. Drinks were okay, worth the $2 and $3 bucks. Food was meh. Small plates and prices were what you'd expect. Lobster bun was dry and didn't taste fresh, bread was a little stale. Breakfast taco was decent. Eggs Benedict were actually over seasoned for such a small plate. Worst of all was the avocado toast - didn't even finish it. Bread was so stale and soggy it couldn't be cut with the knife on the table. Not only was the toast stale but the avocado was bland and topped with like 6 tomatoes minimal salt and pepper. Seemingly easy dishes they failed miserably at getting right. Our service was okay in the beginning - waiter actually did a very good job of explaining the menu, prices and sizes. After that he was scarce. Maybe this would be more of a place to stop in for a drink but deff would not come here for food again.",Union Hall,3.5 star rating,$$,Gastropubs
57,6hWIDpiEHUnhZ1wgWuF2aw,John C.,4.0 star rating,"They must have the best Happy Hour in Hoboken!  They have an interesting selection of draft beer for only $3! If you go for the house beer, it's only $2!!! Also, $1 Oysters!I haven't tried the food yet, but I'm told they're owned by the same people as The Stewed Cow. If that's the case, they probably have a great menu and delicious food. There's no doubt that I will be venturing in there again!",Union Hall,3.5 star rating,$$,Gastropubs
58,e4XFtoRLlYSq34hH2Jrx0w,Amanda K.,4.0 star rating,"All the kinks have been worked out. Sat at the bar for lunch and had Vanessa as my bartender.  I appreciated her food and drink recommendations.  Very helpful. I love smaller portion sizes like they have so I can try different things.  The cauliflower ""fried"" rice is so good.  And the burger was cooked to our liking.  I'll be back with friends.",Union Hall,3.5 star rating,$$,Gastropubs
59,76z7Ks7-IxqxQ00Y5TWlbg,Sarah B.,5.0 star rating,Literally one of the best burgers  I've ever had! There is a great selection of small plates to share. The cocktails are also strong and delicious! I was thrilled to go during their soft opening to try various items from the menu and am looking forward to returning frequently.,Union Hall,3.5 star rating,$$,Gastropubs
60,QJHXtk_-oMZ415Vge2TTtA,Genasun G.,1.0 star rating,"Was excited to check this place out but to our surprise was rudely treated for just grabbing a menu and reviewing it.    Yelp said it opened at 11 am.  We walked in and they were still setting up by 11:05 am.  No one greeted us so we thought we would review their menu as we waited to be greeted.    We sat down at one of their outside tables and a not so gentleman came out and with an angry tone asked if we just grabbed a menu as if  we took his son's candy or something.   He then continues to lecture us on how we cannot sit there because they are not open and we cannot just grab a menu.    We just left church, truly enjoying our Sunday and looking forward to this new establishment.    This guy clearly was not having a great morning to talk to potentially new customers as he did.     I hope he treats others better if he wants his business to be successful.  Why can't people just be nice?",Union Hall,3.5 star rating,$$,Gastropubs
61,sdkWib964Wug9eWWQb6byg,Jeff D.,3.0 star rating,"A new addition to the revolving door of restaurants on this block.  Good concept - small plates - and nice open feel inside.  Service was very slow.  Food was mostly good.  Some great, some average.  Not particularly kid friendly.  Has potential, will give it another go.",Union Hall,3.5 star rating,$$,Gastropubs
62,4fa26WCzhqL-e3_pjjL0Kw,Andrea N.,5.0 star rating,This is my favorite spot for brunch - $2 Mimosas and $3 Bloody Mary's.  I've run through most of their menu and the only thing I am not crazy about are their flat breads (too heavy and not soft enough).  I always receive great service while I'm there and fulfills my brunch needs!,Union Hall,3.5 star rating,$$,Gastropubs
63,RwZKPirWfFQ6WLM6OTcpQQ,Alexander W.,3.0 star rating,"I understand it's new but definitely not ready to open and service customers. Took 45 minutes to get hummus, unacceptable. We saw our drinks ready at the bar but our waitress didn't pick them up for 15 minutes. The food was okay, nothing to rave home about. The hummus was the best part, which I would hope if it took 45 minutes ....They need to figure out the issues with their service and then I might consider going back for food. Otherwise I'll go back for drinks because they were the reason I would give 3 stars. Get the Italian punch.",Union Hall,3.5 star rating,$$,Gastropubs
64,-vcrKQuzLDnCNzZqJ0BT2g,Stephen H.,4.0 star rating,"2nd Time here, first time for dinner. Did learn that their chef has won a TV Chef competition for what that is worth. Lover Roll last time was exquisite; this time bread was a bit dry. Also had oysters, then Gnocchi and Muttz pasta. Both excellent. No Internet !!  What pricey restaurant doesn't offer internet ???Gnocchi is made in house and is scrumptious. 4 points; Would be 5 if Lovster Roll Bread was better; it is pricey for what you get. And no Internet for what you are paying.Follow-Up:Recommend you don't come after kitchen closes. Late night Bartender spent time flirting with young guys; despite yelling from where I sat had to walk over to get service and later to get the bill. Also when in bathroom kitchen staff ran in to use and ran out without washing hands. NOT COOL.",Union Hall,3.5 star rating,$$,Gastropubs
65,vHRakVBLWhl__6_r6w4AqA,Emily A.,4.0 star rating,"This is a great addition to the waterfront options in Hoboken. Two of us shared a half a dozen oysters (fresh from Maine), the truffled scallop toast, the pig and peach flatbread, and french onion mac and cheese balls, all of which were incredibly delicious!We had half priced house wine and beer which were great, and nice size pours.The only thing we didn't love was the oreo cheesecake pop. I love the fact that they have bite size desserts though, for only a couple of bucks each, so we'll try a different one next time!",Union Hall,3.5 star rating,$$,Gastropubs
66,nUIpIQZms4fJJeEohlMp3w,Nisha S.,4.0 star rating,Cute place right on the water and not too expensive! Most of the menu is small plates which you order several of and share with the table but I just got my own. I ordered the mushroom and goat cheese flat bread which was amazing. I also had a piece of the tomato and cheese flatbread which was good but a lot crispier than mine. I also ordered the mini churro sundae for dessert which was one of the best desserts that I ever had! It was vanilla ice cream in a small churro cup with chocolate drizzle SO GOOD I could definitely see myself returning,Union Hall,3.5 star rating,$$,Gastropubs
67,jVn1ys3cncRPMd-A58F_DA,Allen B.,5.0 star rating,"Have eaten dinner here with a large group twice, had drinks here many times and now ordered delivery a few times and have nothing but great things to say. I've lived in Hoboken for over 10 years and have always had trouble finding good spots for delivery that are solid food and quick turn around and this is it. Food is great, delivery time was speedy and everything came hot. The actual space is beautiful as well and a good place for early to mid 30s to get a drink in a non crowded bar. Staff is all super friendly as well!",Union Hall,3.5 star rating,$$,Gastropubs
68,0wUbj9yQ90xfiu29vRuXnA,Lauren S.,1.0 star rating,"I genuinely do not understand how anyone can taste this food and like it. I feel bad since the staff was nice, but this meal was literally dog food.",Union Hall,3.5 star rating,$$,Gastropubs
69,ng3Y4a4T5WjwASs-HGC3Qg,Viktoriya N.,5.0 star rating,Great place with an amazing menu and a very fun atmosphere. I have tried 50% of the menu and nothing disappointed me and their beef tartar I can eat every time I'm there. Staff is friendly and helpful. Prices are lower than in most of the places in Hoboken. Totally recommend.,Union Hall,3.5 star rating,$$,Gastropubs
70,wU2F2bbl3GDxHx1rS2lSpA,Edwin C.,4.0 star rating,"Good food. Service is slow but friendly. Oh, btw, here's the menu that isn't anywhere else on the web.",Union Hall,3.5 star rating,$$,Gastropubs
71,3t_HpyfQZZ-7k3pc6KELTg,Jessica O.,5.0 star rating,"Went here on Monday night for dinner and loved it! They have an awesome happy hour special on Oysters and their ""Union Brew"" is only $2 all day everyday. As mentioned the menu is mainly comprised of small plates. There were 2 of us and we ordered 5 plates which was more than enough! The only piece of advice that I would offer is to use less salt in the calamari batter. Other than that, everything including the service was wonderful and the prices are great considering the quality!  We will definitely be back!",Union Hall,3.5 star rating,$$,Gastropubs
72,PtoQH-HMKZF2UZ7Sd7eERQ,Karl R.,5.0 star rating,Went for dinner the other night and enjoyed everything. You can not beat the location with views of NYC from the outdoor tables. Food was great and a welcomed change from the typical hoboken sports bar. They specialize in small plates which makes it the perfect spot to bring a date. You can spend hours going through several courses all while enjoying a good selection of seasonal drinks.,Union Hall,3.5 star rating,$$,Gastropubs
73,uB-a2EDB7kXXde8aBbVmSg,Jan W.,1.0 star rating,This place is the worst. I've been waiting half my life for my food. I may die here. Goodbye cruel world.,Union Hall,3.5 star rating,$$,Gastropubs
74,tASit63avdiFN_eI1HquAQ,Annmarie M.,2.0 star rating,"Note: I am a professional in the hospitality industry working with renown chefs and restaurants. I also primarily handle PR for restaurant openings in the city. I finally made it into Union Hall, excited to check out the newest spot on the waterfront. My initial thought was disappointment. The restaurant was empty for a Wednesday, but they were so short-staffed it was still a 15-20 minute way for one of the many seats available. I understand that they can't sit you 'just anywhere' because you need to be waited on and lack of staff will make that difficult -- so we sat at the bar for quicker service.Ordered a 902, excited to see a local beer on tap, but it took another 15 minutes to get a pint that wasn't mostly foam. The bartender was kind enough to offer me the drink for free, knowing the long wait, but when I finally received the beer it was flat. We ordered the below and my notes are next to each:- Veggie Gyro Sliders - lacked flavor and the patty was so small it was only in the last bite. - Lobster slider - where was the lobster? It was mostly celery with a hint of lobster, and actually tasted more like a tuna sandwich than lobster. Also the bun wasn't seasoned at all... maybe a quick brush of butter would have helped? - Grilled Octopus - the only good thing we ate, but not enough octopus for the price. It came with two pieces on a bed of cucumber salad. The dish itself needed more acid - maybe some lemon? But the two pieces were uneven so if sharing this with someone, one would get a nice large piece and another would get a toothpick sized piece. - Cauliflower Fried Rice - my guests enjoyed this dish, but all i tasted was soy sauce. It was one-note without any other flavors... just soy sauce. All soy sauce. I'd rather make something better at home.- French fries - for $6 you'd think you would get a nice big pile of french fries. What we received was a tiny basket filled with stick fries, similar to McDonald's small size fry. It was a bit upsetting to see such a tiny little serving of that style fry for so much money.Overall the staff was VERY kind and efficient, but the food itself was severely lacking flavor. I won't be returning.",Union Hall,3.5 star rating,$$,Gastropubs
75,C5z3ZVj8wAxxr7xsIO0rcA,Jessica M.,2.0 star rating,"I've visited Union Hall once before my dining experience tonight. My time spent previously at the bar was mediocre although the bartender was pleasant and friendly. My evening was spent with my brother and parents. We all ordered a variation of items from the menu including some of the waiter's suggestions, which frankly should have been kept to himself. The waiter may have been new and the service was terrible. We only received one refill of the water vase before having to track him down and ask for more. All of the waitstaff that night we're very cold and there was no greeting upon entry nor exit of our meal.While the menu read appetizing (I'm biased because it's very pork belly based) food was not worth the trip. Very overpriced for the quality of our meal. I would not return for food but the atmosphere is pleasant enough to return for drinks for a nice cool evening by the water.",Union Hall,3.5 star rating,$$,Gastropubs
76,PxCSXjAbU9vzD7XailqEww,Victoria P.,3.0 star rating,"I really wanted to love this place.... but it needs a lot of improvement. I don't think they were quite ready to open yet.1) could use more experienced waitstaff - waiter did not understand the beer we were trying to order2) had to wait 15 minutes for a table even though the inside was empty and there were open tables on the patio3) food could be improved. It wasn't bad but I'm not craving anything enough to come back On the positive though, the space looks amazing and the waitstaff was very friendly. If they want to survive in a trendy, fast paced city like Hoboken though, a lot of improvements need to be made.",Union Hall,3.5 star rating,$$,Gastropubs
77,Jvp9ULSCExfvpkJzdGerHw,R W.,5.0 star rating,"This place is a great addition to the waterfront. Amazing food and a wider selection of drinks than you usually see around Hoboken. Definitely try the French onion mac and cheese balls, shrimp and grits, or burger! See you again soon!",Union Hall,3.5 star rating,$$,Gastropubs
78,U5_dsyTUobIvlH-TdQ8ZAg,Denise V.,3.0 star rating,"We came here opening week and the place looks a little different from the old Trinity, but I feel like it's still pretty similar. The food was good, I Loved the mixed slider trio appetizer. But I have to say, the service was SLOW. So slow that it took 2 1/2 hours for our whole meal (apps, dinner & dessert). I think that's a bit too long, but I think it's because it was their opening week. Hope they work out the kinks by my next visit! This restaurant definitely has potential.",Union Hall,3.5 star rating,$$,Gastropubs
79,0BbAG_Sn2kTSTqTYt2tHpw,Sara F.,3.0 star rating,"We went this past Sunday and I have to say food was very bland. From the brussel sprouts salad, to the flat bread to the ice water without ice cubes I was let down by the quality of the food. The waiter was nice but things took a long while to show up. We also had to change tables because the AC air through the vents was so strong it was very uncomfortable to eat in those conditions. All and all not impressed.",Union Hall,3.5 star rating,$$,Gastropubs
80,Bxp1ylntaZCYhNqqGmB-fA,Gina G.,5.0 star rating,"My girlfriend and I were looking to grab a bite to eat, and since I am pregnant I saw a picture of their deserts online and was sold on giving it a try. We were pleasantly surprise in the quality of the dishes and the great service and staff. The prices match perfect with the quantity and quality of food! I love the fact that I can go get a personal (true sized) portion desert for only 3 dollars and be 100% satisfied. I took my family their the next night:)",Union Hall,3.5 star rating,$$,Gastropubs
81,ZQPmYnUND7Fzf09QMaNVDQ,Lucienne D.,5.0 star rating,"The KOBE BEEF BURGER will rock your world. Christa, the bar tender, is really nice.",Union Hall,3.5 star rating,$$,Gastropubs
82,Kh_NUfydqn73CCECp525PQ,Alicia M.,5.0 star rating,"This place was really great for Sunday brunch. The plates were delicious and well-priced. (We came in starving and shared 4 small plates and left happy and full). The $2 mimosas and $3 bloody Mary's are well-poured and tasty. To top it off, the staff--from the hostess to the manager to the servers--were attentive and friendly. Really happy we stumbled on this place instead of Halifax or the Ainstead (really grumpy hostesses).",Union Hall,3.5 star rating,$$,Gastropubs
83,JeXjryLtoiN7d_9YjKIkYQ,S M.,4.0 star rating,"Warm summer night on the patio w nice server, owner, bartenders and good food. Favorite of the night was the shaved Brussels sprouts salad that had some baby kale and delicious dressing. Grilled octopus perfectly cooked. Lobster bun tasty but skimpy. Amazing happy hour specials. Really enjoyed our $5 Moscow mules.",Union Hall,3.5 star rating,$$,Gastropubs
84,-Io18jmWPAZVZ8h6imPs7g,Alexis S.,4.0 star rating,Food and service was great! The chicken and waffle small plate was delish and can't go wrong with $2 mimosas and $3 bloody Mary's.,Union Hall,3.5 star rating,$$,Gastropubs
85,W7I94y9ur0Jd7NHqAji3Qw,Shannon C.,4.0 star rating,This place was amazing! GIA is the best waitress. She is prepared and knows her stuff. She's full of the best recommendations and she's quick. Everything you look for in a waitress.. she's got it! The food was great as well. Small plates so you can share :),Union Hall,3.5 star rating,$$,Gastropubs
86,1dEMJTz-7Flchp90ZZ7LjQ,Allison A.,5.0 star rating,"Great food, great service, great prices, great view - what more could you want? My two friends and I ordered the chicken meetballs, cauliflower rice, the kale Brussels Caesar salad, and a tomato flatbread . Everything was delicious and came out really quickly. It's tapas style so the portions were small and meant to be shared. We got all of that plus 3 cocktails for only $75. Our waiter was so friendly and helpful too, he could tell my friend didn't like her drink and immediately fetched another- no questions asked. Great place for girls and guys and the menu is atypical without being pretentious. Definitely give it a go!",Union Hall,3.5 star rating,$$,Gastropubs
87,fCZKSyCQ329p-ANbWHF4lA,Leslie V.,5.0 star rating,"Fantastic, airy space that breaks the Hoboken ""beers and wings"" mode. Drinks are strong and tasty. The small plates are delightful. Not to be missed!",Union Hall,3.5 star rating,$$,Gastropubs
88,mOrEgaq9cl-XKHUgCxDjTA,Jackie A.,5.0 star rating,"So impressed considering they are new! Fantastic food. Great taste, fun combinations, good portion size (for small plates). Lots of food options for all different palates. Service was fantastic too! As far as Hoboken restaurants go, it's a keeper!! We had the Brussels sprout salad, truffle bacon egg and cheese flat bread, hot chicken and waffles and the onion soup mac and cheese bites. For desert we had the churro sundae and milk shake of the day :) Everything was hot, fresh and great quality! I was skeptical about another bar type place in Hobo (b/c let's be honest that's the last thing that hoboken needs) but this was totally different! Great price too! Often with small plate type places you leave hungry and feel like you spent a ton. Will def go back!",Union Hall,3.5 star rating,$$,Gastropubs
89,hX1YcBy_P1Iot6wxUUlSsg,James L.,1.0 star rating,Very disappointed was looking forward to trying out the new spot in town but was greeting with poor service.,Union Hall,3.5 star rating,$$,Gastropubs
90,vM8eZ_bCZZeQCDMTrLnJvA,Lee M.,4.0 star rating,Delicious food creative and incredibly fairly priced. Vanessa was attentive and knowledgeable about the restaurant. Friendly service. Would be 5 starts but crostino were soft in the center.,Union Hall,3.5 star rating,$$,Gastropubs
91,Ls48S3bSZ9uedReIp397FA,Chris H.,4.0 star rating,"Joe was our server. Very attentive and helped to explain the menu to us as we were not expecting this to be a tapas restaurant. The food was great, atmosphere was very lively, and would definitely recommend this place to others. Also, can never complain about $2 all day beers.",Union Hall,3.5 star rating,$$,Gastropubs
92,JwITryHmGNW2vKbCzaHMcA,Brenda F.,4.0 star rating,"Very good came here for lunch and had the holy mole tamale gnocchi. It was a lot more food than what I was expecting and very stick to your ribs. The bartender told me the house beer is $2 a glass. I tried alittle sip and it was fine, not hoppy and inoffensive. That's just crazy...",Union Hall,3.5 star rating,$$,Gastropubs
93,92IdXavmDm4vIPrvk4bArw,Skylar R.,5.0 star rating,"Loved it! They have an innovative food and cocktail menu and their staff is very welcoming. Amazing atmosphere and a beautiful industrial interior design! It is definitely the nicest restaurant on the waterfront because of their delivery with their food and atmosphere alone...It's  authentic atmosphere, great service and limitless wine, beer and  spirt list is hard to find in hoboken but the union hall nailed it! They have themselves a regular.",Union Hall,3.5 star rating,$$,Gastropubs
94,WSJUNgybzTerOwGHJDP-7w,Elena C.,3.0 star rating,"The menu has a nice variety and they have really great drink specials. The service was pretty slow, especially for a Wednesday night. We also had to remind our waitress for food items and drinks several times. Even though we had a reservation for 7pm, we were still told that we would have to wait because there were people on the list ahead of us. It wasn't a problem since we were sitting at some bar stools, but I'd be hesitant to come on the weekend. Overall it's worth a try but I'm not sure how often I'd come back.",Union Hall,3.5 star rating,$$,Gastropubs
95,xmQy5BoRdUXXdOCzufGmpg,Jimmy Z.,5.0 star rating,Outstanding!  The menu is creative and the food is great.  With small plates you can try more than one thing and share too.  Cocktails are awesome.  Jay and Brendan are great!,Union Hall,3.5 star rating,$$,Gastropubs
96,EEoSH9jCEoyf4McuB9KePA,M. L.,4.0 star rating,"I definitely recommend this place. Good food, nice views, nice ambiance. Bacon, egg and cheese flat bread is a must. I think they could lose the doughnuts from the dessert menu, but the churro Sunday was great. Will definitely go back.",Union Hall,3.5 star rating,$$,Gastropubs
97,TUncyHbIm1l-22YP6M7B-g,Samantha G.,3.0 star rating,"Came in for small plates a few weeks ago. Nice makeover from the old Trinity spot.  Food and drinks were good to average. Service was a somewhat slow for such a quiet hour(seemed like an after dinner lull at least on the floor, bartenders/servers chatting with a specific group or customer for a good chunk of time, etc). I heard the owner/manager fools around w some of the female staff so maybe that's part of it but I figured that sort of thing happens in the food/bar industry all the time.  There's a good draft and wine list. Food wise we split octopus(mostly fine, a couple killed and rubbery pieces), French onion soup Mac and cheese bites(good, would be even better in the winter!), and a flatbread breakfast sort of pizza(decent).",Union Hall,3.5 star rating,$$,Gastropubs
98,-h9jBwfnp3tA8RF_CQulXg,K R.,3.0 star rating,"Had never been and tried for Restaurant Week. Was on the more crowded side for a Thursday but to be expected. Everyone was nice but it felt like they were missing some key processes. We ordered the complementary wine pairings (4 glasses - one for each course) plus a drink, initially, to have while waiting for food. The order came as follows (party of 4): 3 of us received pairings #1, 1 of us received initial drink #1, 1 of us received pairing #2, all of us received apps, 3 of us received pairing #2 and poor person receives initial drink and pairing #1, first course came out for all and one order was off, we started ordering drinks ad hoc because pairings were so unreliable and some of us had three in front of us while others were finishing off a single 3oz pour. One entre was wrong, one entre ordered medium well came rare, one dessert came out wrong, 3 meals they took our silverware while clearing so we couldn't eat next course. I came for the company, which was great, and it was such a sweet location with a view that I'd consider going again, but probably not for a while. Not the typical Restaurant Week experience you expect as I've been going for 6+ years to new spots and always feel like restaurants use the time to promote signature dishes and great service and this fell a bit flat. Regarding food, was OK. Not bad (once orders were straightened out), but definitely not so great its worth having botched orders show up out of order.",Union Hall,3.5 star rating,$$,Gastropubs
99,dqts5Iv5m9dJCHGAHslJnQ,Kristi P.,3.0 star rating,"Love the location. Sitting outside looking at the water on a summer day is lovely. The food was average and over priced. It's ""small plates"". $80+ for 3 glasses of rose, a small jar of hummus, a salad, 3 sliders, a cheese platter (3 tiny pieces of cheese, 6 pieces of bread w Apple slices) and a half a piece of toast w 1 scallop. There were three of us eating and I left hungry.",Union Hall,3.5 star rating,$$,Gastropubs
