,user_id,user_name,user_rating,user_text,restaurant_name,restaurant_rating,restaurant_price,restaurant_type
51,YJHuQwU9tyoaPH0l-fS9Bw,David R.,5.0 star rating,"We've twice dined at Untitled for special occasions attached to our visits to The Whitney, and both times, they've provided us with very memorable experiences.  Renzo Piano's newish home for the museum is one of its most defining works of art, and, though there's a slight IKEA café vibe to the room, it actually works quite well.  There are dramatic ceilings and windows, and people watching at the literal end of the High Line is fantastic.  Inside the restaurant, despite all the reflective surfaces, the conversational din is quite manageable.  The room is rectilinear, with an open kitchen along the long interior wall.  As befits such a modern space, the chairs and tables reflect that modernist vibe (though, unlike those of The Modern, at the MoMA, another Danny Meyer joint, they're a little more comfortable and stable).  Service is USHG standard, which is to say, marvelous.  The waitstaff is personable, charming, attentive, helpful, and clearly after ensuring a happy and satisfying visit.  On our first visit, for our anniversary, the sommelier stopped by and poured us a 30-year-old Beerenauslese of Pinot Noir (which he billed a weird but wonderful wine) with our dessert.  The wine was haunting and magnificent.  For my mom's birthday, on the second visit, we were comped a fantastic grilled asparagus dish (with beguiling smoked tomatoes).  They know how to make a few gestures of hospitality and generosity which elevates an already wonderful meal to new heights.The food:  On the first visit, Michael Anthony, from Gramercy Tavern, was overseeing the kitchen, and the meal was very much in the vein of his pristine farm to table cooking.  Our starters included nectarines, fresh ricotta, and almond pesto over sourdough toast (what a winner - I've since replicated it at home), and a bracingly fresh gazpacho including peaches, watermelon, cucumber, and tomato, with ethereal slices of raw scallop.  The meal concluded with an unlikely combination that just really sang:  apricot and coconut cream pie. Suzanne Cupps is now at the helm, and on our second visit, we all loved the pimento cheese and crackers, vegetable dishes that included roasted cauliflower with dates, almonds, and Romano, and a fluke crudo with cara cara oranges and watermelon radishes, a riot of colors on the plate.  Entrees included sea bass with a melange of Thai flavors, the much-admired plate of roasted and fried chicken, and a deeply flavored slice of rotisserie pork belly.  Strawberry cake with lemon verbena and delicious macerated berries on top (with five times as much flavor as grocery strawberries) was a wonderful coda.  Cocktails and wine are excellent, and our favorite way to drink at Untitled is to order the untitled wine selection, which is described only after you order it.  This past visit, it was an elegiac Chablis, the last effort of the winemaker Stéphane Moreau-Naudet, who died unexpectedly in September.  His legacy lives on in bottles of flinty, bright beauty, and this was definitely a glass for the ages.  I think the prices are reasonable, given the real estate, the service, and the high quality of the food.  There's fierce competition in the neighborhood, which just makes being a diner in the vicinity all that much better.  Museum cafés used to be such a drag, but with marvelous destinations at Met Breuer, The Whitney, and MoMA, the tide has turned.  What a treat!",Untitled,4.0 star rating,$$$,"American, (New),, Breakfast, &, Brunch,, Wine, Bars"
52,j01MH60a9WBVjovmyu29fQ,Jenna F.,4.0 star rating,"I came for lunch and ordered the kale and beet salad, charred cauliflower and the chocolate chip cookie. The food was well seasoned and enjoyable but I was hoping for it to be incredible and Danny Meyer is usually top notch. It's a really small menu but looking around it seems like everyone found the food enjoyable. Our waiter was good and the service was quick besides the cookie so they gave it to us on the house. I recommend you make a reservation and walk around the museum as the restaurant is attached.",Untitled,4.0 star rating,$$$,"American, (New),, Breakfast, &, Brunch,, Wine, Bars"
53,WTkBOPK1WR6_3V1gpJrsdQ,Wei P.,5.0 star rating,"Great food and atmosphere. The menu is split into small plates and big plates, so it's a good place to split everything with friends. Would highly recommend the squid and the shrimp dishes. The bread and butter they give for free is bomb! Would definitely return.",Untitled,4.0 star rating,$$$,"American, (New),, Breakfast, &, Brunch,, Wine, Bars"
54,vk3QnXfcao8VTb13AfZMWg,Sherry Z.,4.0 star rating,"Modern and trendy place next to the Whitney Museum. The menu in general is a bit too veggie heavy and healthy for me. There weren't much meat dishes. Apparently they update the menu pretty often. Some of the dishes I saw on Yelp were not there anymore.Good for gatherings. We had a 8 people and got a round table. service was impeccable.FoodWe decided to go healthy for the main dish and go big on dessert. I got the kale and beet salad, which was pretty good! Everything was fresh. I like the hint of mustard seed and the mix with mayo (or cream?). My friends are satisfied with their dishes too. But nothing life changing.There were only 5 different desserts on the menu. So we got everything and shared. Cheese cake. Very creamy cheese flavor and with fruit jam filling in the bottom. - favorite number 2Apple pie- it's a mini whole pie! The bread was so crispy. Love the fact that the bread is thicker than usual apple pie so that we are just not left with a plate of baked apples. -- maybe this is favorite! Triple chocolate cookie was nice! Real butter and real chocolate.Chocolate cake- standard.Olive oil cake - ok. Have never had one before. Didn't like the oily and wet texture.",Untitled,4.0 star rating,$$$,"American, (New),, Breakfast, &, Brunch,, Wine, Bars"
55,YjePujq75y8SsfAztphSyg,Ali M.,5.0 star rating,"I eat dinner here around twice a month and have done so since Untitlied opened. Virtually all items on the contemporary-American menu are spectacular. Physical space is also superb with views of the Highline, Whitney. Service is what one excepts of a Danny Meyer's hopsitality group. Here's the kicker, if you're a Whitney Member, you're entitled to a 10% discount--now that's a deal! If you're looking to eat in Meatpacking, suggest you stroll past The Standard Grill and Santina for a real culinary and cocktail experience at Untitled. [end]",Untitled,4.0 star rating,$$$,"American, (New),, Breakfast, &, Brunch,, Wine, Bars"
56,iOmiu3nmRxZwhCpx_lwhQQ,Connie N.,3.0 star rating,"They have an in-house sommelier, which is super cool and helpful if you want help on selecting a specific type of wine. They have quite the selection! But if you order a bottle of something that needs to be chilled, they'll keep the bottle off the table and will refill through the night. Never had that experience before, but it wasn't a downside for us.For appetizers, the four of us shared an order of duck rilletes and fried chicken (it's not officially on the menu but is available upon request). I guess I'm not a fan of duck served as a spread, but the fried chicken was pretty tasty. We also got complimentary cheese biscuits that came with raspberry jam--yum.For the main course, I ordered the rotisserie porchetta, which tasted nice but was 95% fat, which did a number on my digestive system. I was expecting a little bit more meat and less fat. Wouldn't recommend for anyone suffering from acid reflux.We shared the olive oil cake for dessert, and our waiter was wonderfully attentive enough to have a lit candle on top when he brought it out (at some point I briefly mentioned that we were celebrating our friend's birthday). A very nice touch!Overall, the experience was nice, the service was nice, but the food was only okay; it was a bit overpriced for what you got. Probably wouldn't come back unless a friend wanted to try it out.",Untitled,4.0 star rating,$$$,"American, (New),, Breakfast, &, Brunch,, Wine, Bars"
57,aW2saD_v-Jg19Or4wKar4A,Bing R.,4.0 star rating,Good food but a bit pricey.  Their drinks are reasonable and average price.The food is innovative.I only had 3 appetizers.  Next time I will try their main course.,Untitled,4.0 star rating,$$$,"American, (New),, Breakfast, &, Brunch,, Wine, Bars"
58,Qja6nEfX15YCxkVN4daNtA,Nick H.,4.0 star rating,"Overall, cleanly executed New American style. The chicken main does seem quite good, the beef tartare is worth getting, the spring onion can be skipped. I was a bit disappointed that in this season, the dessert menu doesn't have more fruit-centric options. Best dessert on the menu is the lemon meringueStarters:Spring Onion Dip: mild and creamy, with the allium coming in at the end. Wheat crackers were very thin but had an interesting nutty flavorTartare: bread was a little too hard, broccoli puree wasn't over powering, chinese five spice really bumped up the savoriness. I wasn't sure why the beef had a milky color but it tasted fresh. Beef had a nice chew and the garlic chips provided aroma .Main: Sea Bass: very tender and fresh, albeit not much browning. Probably a quick pan fry (low temp) followed by a hot oven. The curry was very lightly flavored with coconut, with some okra helping thicken it up. Corn and lentils, I believe. The bass was decent on the merit of its freshness but everything else was fairly boring.D esserts:Caramelized cheesecake: light, almost mousse like cheesecake with a cake base underneath. The custard blanketing the cheesecake on top was caramelized nicely. Honeycomb candy has a nice initial crunch followed by a sticky gummy chew. Cheesecake is nicely tart and balanced. The bottom cake layer may have been moistened with a bit of flower water? Perhaps orange blossom or rose waterPeanut Butter Blueberry Cake- really disappointing, despite the waitress telling us it was the dessert the restaurant opened with. I thought the cake was over beatened, leading to a very stiff cake crumb that felt somewhat dry. Buttercream was decent, not over sweetened. Blueberry sauce was pretty standardLemon meringue: nice light meringue, possibly hints of lemon zest in the meringue itself. The curd was whipped to more of a mousse like texture. Very bright and zingy. Good balance between tart and sweet. Great summer dessert. Also, the crust has some nuttiness thanks to oats and possible browned butter",Untitled,4.0 star rating,$$$,"American, (New),, Breakfast, &, Brunch,, Wine, Bars"
59,48YI3JNaW9lODvwEXsQAFA,Jaime S.,5.0 star rating,"After an exhausting day exploring the Whitney, there'sno better way of rewarding yourself over a drink and meal at Untitled. Grab a place at the outdoor patio when the weather's nice; the patio is adjacent to Santina's outdoor space. This place has got to be my second favorite museum restaurant in New York. I love beef tartare and these guys had by far the tastiest beef tartare in memory - all drizzled and made pretty by tiny flowerlets. The macaroni and sausage - appetizer size - rounded out the meal wonderfully. It wasn't as al dente as I usually like my pasta, but the delightful mix of meat, sauce and vegetables more than made up for that. I made a meal out of appetizers but I'd love to just come back (even outside of a museum day) to just dine at this terrific restaurant",Untitled,4.0 star rating,$$$,"American, (New),, Breakfast, &, Brunch,, Wine, Bars"
60,l5xSt340KQryfVnJcL6vHA,Jay K.,5.0 star rating,"Was here after Member's Night at The Whitney this past week. My thoughts:Bread that comes out before your orders food-not a fan. Came out with some spicy tomato sauce. Sweet potato from Part One of the menu(Apps)- amazingly delicious. So many flavors packed into what you would think would be a boring dish. This was one of my favvvv. Pork dish from Part Three(Entrée)- my friend got dish dish and was a fan. Bass dish from Part Three(Entrée)-loved. It was kind of small, but very ended up feeling so full after finishing. Excellent dish. Rosé- very nice. It's a little sweet, but very light. Muscadet- it had a body to it. It was a mixture of light, dry, earthy, and a tint of sweetness. Overall, great experience. The decor inside is very simplistic as well. I likes how everyone on the floor had the same uniform on. The white button down with this long blue jean colored apron. Pretty cool.",Untitled,4.0 star rating,$$$,"American, (New),, Breakfast, &, Brunch,, Wine, Bars"
61,-HXsQ7SBkwk2agJ1nBZ68w,Jolene H.,3.0 star rating,"Table for 6 without reservations on a Sunday We were seated fairly quickly Love the ambiance - high ceilings, lovely setting, great area.Service was good at the beginning but towards our mains - it was slow.Food-wise, I was enticed by the cookies since my friend gifted me one and I thought it was really good. But dining here for the second time, the food is just okay. Portions are just nice for one - sharing would be insufficient for normal appetites.Fried chicken was the highlight. Scone was too dry and unbearably flakyButterball Hash with egg, squash sides and french toast was not bad.Burger, for the competition that NYC has, it was underwhelming.",Untitled,4.0 star rating,$$$,"American, (New),, Breakfast, &, Brunch,, Wine, Bars"
62,V-uUm9Nr67vmXeLtu9iMGg,John B.,5.0 star rating,"Fine Dining. A phrase that almost has lost all meaning these days, in fact, the very mention of 'fine dining' can send me running for the hills....I have to say though this really was Fine Dining at a very high level, intricately crafted food, textures and flavours - the menu had been really thought out and was executed wonderfully.I'm not entirely convinced by the dining room, we were seated by the window, which is adjacent to the line for the gallery, not the greatest view and I felt somewhat like a goldfish. That's a minor gripe though, the food is really, really well thought out and is of a genuinely excellent quality.",Untitled,4.0 star rating,$$$,"American, (New),, Breakfast, &, Brunch,, Wine, Bars"
63,MEn5IVRhDranOeO2ZmsICA,Kella X.,5.0 star rating,I came here for brunch on Sunday and enjoyed every piece of the meal. The complimentary scone/biscuit on the house was incredibly flavorful.I ordered the fried chicken and my friend went fpr the pork they were both perfectly structured (for taking photos and for your taste buds). Everything on their dessert menu looked amazing and I went for my faborite olive oil cake.Please come and try this place the next tike you visit Whitney :),Untitled,4.0 star rating,$$$,"American, (New),, Breakfast, &, Brunch,, Wine, Bars"
64,JOj-YZZ28rIN4eKMj2iUSw,Goodvibes H.,4.0 star rating,"So I really wanted to fall in love with this place. The venue is gorgeous and the staff from the reception to the bread server and waiter were all warm and top notch! 5 stars for the service!!But the food, the food was sadly underwhelming. We ordered from the restaurant week menu..Highlight: tomato and melon gazpacho- I'd have ten servings of this if I could! The croutons were divine. I hope they add this to their menu. Squash main course- very flavorful could have used a pinch more of salt.Lowlight: halibut - I can't remember the last time I had fish cooked so poorly served with a thick orange sauce and okra. Avoid at all costs. My dinner companion agreed.Cookie- that chocolate cookie that everyone raves about is average. Honestly.",Untitled,4.0 star rating,$$$,"American, (New),, Breakfast, &, Brunch,, Wine, Bars"
65,CdTnsSPPFGrsIV86Bprmiw,Ksenja T.,4.0 star rating,"We had brunch at Untitled prior to visiting the Whitney museum and it was a great experience; the service was spot on for a busy Saturday afternoon and I was glad we could make resos in advance. The space is absolutely beautiful, with high ceilings and big lamps. The chef obviously has a good pedigree from Gramercy Tavern and so the food isn't your traditional brunch fare, but more of a refined lunch. If you're really hungry, I would suggest going for the dishes under the mains section as the first part of the menu consists of smaller plates/apps. My butternut squash mole with flatbread was pretty good, but the butternut squash got lost with all the beans and there wasn't much of it. The pork lettuce wraps were fantastic and so was the banana hazelnut cake. Perfect for sharing. Their OJ is on point so make sure to order a Mimosa.",Untitled,4.0 star rating,$$$,"American, (New),, Breakfast, &, Brunch,, Wine, Bars"
66,ddjIpHxmg6MJHJUMiHE9Cw,Hope H.,4.0 star rating,"Got the roasted cauliflower and iced tea for lunch.  Was expecting the colorful purple and green cauliflower dish shown on the website.  The dish had white cauliflower only.  However, the dish was very tasty - there were pieces of dates, almonds, and cheese.  Sauce was very creamy.  Came with a small slice of bread.Restaurant opens for lunch at noon and gets crowded around 12:30pm.  Service was good and prices were reasonable ($9 for cauliflower and $5 for tea).   The restaurant, like the museum, is surrounded in glass and has a nice view of the surrounding area.",Untitled,4.0 star rating,$$$,"American, (New),, Breakfast, &, Brunch,, Wine, Bars"
67,9-GdebEPZnfyF-LaAehPcg,Paul F H.,4.0 star rating,"After walking the High Line from 30th Street to the end at Gansevoort and in need of a bit of mid-afternoon nourishment, we decided to stop at Untitled at the Whitney for a quick beverage and bite of food. Since we were not looking for a full meal, their small plates were perfect. As I looked over the menu I couldn't resist the beef tartare with mushroom, sesame & scallions, especially since we were in the ""Meatpacking District.""The plate was beautiful and tasty. The beef was tender and well seasoned with a rich sauce, earthy mushrooms and some crunchy puffed rice for textural variation. The bread for the table was just right for sopping up the extra sauce.Everyone else at the table enjoyed their plates as well. I can't comment on the rest of the menu, but it looked great and I would have tried something else if the circumstances of our visit were different. Maybe next time. ""Untitled"" is definitely a tasty stop when you reach the end of the ""High Line.""",Untitled,4.0 star rating,$$$,"American, (New),, Breakfast, &, Brunch,, Wine, Bars"
68,LI6FMvj7RhwEE9l-1jPv0A,Christina T.,3.0 star rating,"I wish there was a 1/2 star because I would give Untitled a 3.5 star rating.Food:The Beets were my least favorite item that we tried due to the lack of flavor. Goat cheese and corn salad was good, nothing special.Grilled and fried chicken was really good and seasoned well, but came out cold.The Untitled Burger was good, especially the patty. I didn't love the bun. The milk and cookie was awesome. The reason I wanted to have lunch here!The atmosphere was very nice. I loved the floor to ceiling windows. The service was spotty at times, but not to distracting. I will stop back in to grab a cookie if I'm in the area.",Untitled,4.0 star rating,$$$,"American, (New),, Breakfast, &, Brunch,, Wine, Bars"
69,jFMl6BuGZaGnQbmow56S7w,Bee G.,5.0 star rating,"Love their baby lettice salad with pickled ramps, and their romano beans (seared green and yellow long beans), their bread and butter, and their melon basil soda - all made onsite. Gorgeous presentation and lovely people - thank you, Untitled!",Untitled,4.0 star rating,$$$,"American, (New),, Breakfast, &, Brunch,, Wine, Bars"
70,fvYT9mVkkMBV7lz7ScPi3g,Elaine H.,5.0 star rating,"I actually don't recall which one came to me first, the museum or untitled - but definitely a fantastic experience that I could visit both in a single trip! Make sure to call and make reservation before coming, otherwise you probably will end up with eating at the studio cafe on top level (not bad either, but...)Untitled is a fancy new American type of cuisine managed by Michael Anthony, who is also the manager of Gramercy Tavern, one of my favorite dining spots. Unfortunately many of the dishes are seasonal (including my favorite crab toast! Oh no!) so had to accommodate that...Opted for the fried and roasted chicken salad (with kale, cabbage and walnut), very juicy. Another highlight was the chocolate cookie with vanilla milk - while cookie was at the sweet end, the milk was refreshing and I would strongly recommend.Overall ambience was amid. Liked their window view with glass all the way towards the ceiling!",Untitled,4.0 star rating,$$$,"American, (New),, Breakfast, &, Brunch,, Wine, Bars"
71,Jfn08iBR3uZnFx1rqz0qTQ,Melissa W.,4.0 star rating,"Located on the first floor of the Whitney, Untitled has a chic atmosphere.  Let's talk about food:- Ricotta, heirloom tomatoes, aged balsamic, grilled bread - really good but small portion- Grilled white shrimp, green beans, cornbread pancake - sounds a lot better than it tastes.  The base is literally a pancake and would have been better if it was crunchy like tostones or tortilla.  Not worth it at $5 per piece.- Sea bass, corn, sweet peppers, coconut curry - fresh with good flavors- Roasted and fried chicken, new potatoes, salsa verde - by far the best dish of the night (the fried chicken reminds me of Taiwanese chicken)Overall a good meal but not mind-blowing.  At this price point, there are many more options in the city.",Untitled,4.0 star rating,$$$,"American, (New),, Breakfast, &, Brunch,, Wine, Bars"
72,foWZ9iqpzkOaE_av9n3hXA,G M.,3.0 star rating,Its a cool interior - like a futuristic Denny's. Staff if always first rate. We felt the food was over priced and not all that great this time.,Untitled,4.0 star rating,$$$,"American, (New),, Breakfast, &, Brunch,, Wine, Bars"
73,JWqFnrWJEUbgygIxfqqtSw,Charles L.,5.0 star rating,"We finally made it to Untitled for brunch. The space is all glass enclosed with an open kitchen. Before I get to the food, the servers were attentive and very knowledgable. They answered all of our questions and made suggestions. We had the cheese fondue with scrambled eggs. They serve buttered, grilled toast that is dipped into a bowl of heavenly gooey cheese and egg mixture. I had fettuccine with broccoli rabe and pickled mushrooms. The pasta was perfectly done with intense flavor. Julie had the roasted and fried chicken salad. Truly supreme with a variety of flavorsand textures.  The bill came to about $80.00 without tip including our 10% discount because we are Whitney members. This place is out of this world great we can't wait to come back for dinner.",Untitled,4.0 star rating,$$$,"American, (New),, Breakfast, &, Brunch,, Wine, Bars"
74,yMm2SiC6QQiXANbAHuycbw,Samantha S.,4.0 star rating,"Chic place to have a meal after visiting the Whitney. Located right inside the museum, Unlimited has a fantastic modern decor. Fantastic chicken dish and burger, my highlights. Overall, would recommend to anyone coming in town who wants to explore the Whitney.",Untitled,4.0 star rating,$$$,"American, (New),, Breakfast, &, Brunch,, Wine, Bars"
75,dM_7H0xRE0a4rvokaC161A,Jodie B.,5.0 star rating,"Dropped in today for coffee and cake after walking the Highline on my way to the Whitney, and it was great! The pear cake was moist, nicely spiced, and had a lovely fresh pear ting to it - and - I don't know what they did to give it a slight caramelized crisp to the top of the cake, but it was SO good! Oh and, in addition to the food being great, the staff were friendly, and that always makes for a lovely experience. Would definitely visit again should I find myself @ the Whitney.",Untitled,4.0 star rating,$$$,"American, (New),, Breakfast, &, Brunch,, Wine, Bars"
76,En8UsBF0KKpU44QS4iY-1A,Lillian Y.,4.0 star rating,"Came back to try some new menu items and was happy to find the quality of service and food has not diminished. I really liked the flavors of the grilled white shrimp (snack) and would've liked it even more if I didn't have to go looking for the shrimp. We also ordered the caraflex cabbage dumpling (snack) which was fine but basically a Chinese dumpling made with extra care. I loved the summer squash (vegetables), served as a yellow zucchini boat topped with a mix of green zucchini and hazelnuts resting on a schmear of ricotta- this squash inception was delicious and fun. The beef tartare (raw) is not diced up as small as most others, so it has more chew; this was a tad salty from the green sauce and the dots of hoisin (my guess, don't quote me on that) but otherwise really nice. For the mains, we chose the sea bass and it was a perfect light summery dish. The flavors are quite mellow. We also tried the burger, which the waiter said was a brand new item. It's a very good burger, a juicy (if somewhat overcooked) patty topped with pimiento cheese (similar in texture to cottage cheese) and served with fingerlings. I wish they'd switch out the potatoes for fries though, since they weren't crispy and were confusing (is this finger food or fork food?). The bun was also on the bitter side, maybe because its whole grain or was left to char too long. Im being picky here though, it's a decent burger. My favorite was dessert - I do have a sweettooth and I only wish I ordered another. We had the caramelized custard cake, which seems to be composed of a layer of bruleed light cheesecake over a sponge cake, decorated with raspberries and honeycomb brittle. I couldn't have asked for a better way to end the meal, SUCH a good combination of flavors and textures! It feels like a lighter dessert but it is so satisfying. Service was friendly but slow at times, and the ambience is perfect for almost any occasion.",Untitled,4.0 star rating,$$$,"American, (New),, Breakfast, &, Brunch,, Wine, Bars"
