,user_id,user_name,user_rating,user_text,restaurant_name,restaurant_rating,restaurant_price,restaurant_type
98,_1OpvLEcZPM4rjYqOGl4gQ,Sargam M.,4.0 star rating,"Review is for brunch: food (flavor and presentation), service, and ambiance are all great...hence the 4 stars. A lot of thought has clearly gone in the menu and the food they put out on the plate...definitely worth a try.The food is very very beautifully plated (vibrant colors with each ingredient placed perfectly), the menu is not the run of the mill brunch fare, and flavors work well too. The portions are small though, so depending on what you order, you'll need 2-3 dishes per person.Beets, breakfast radish, pea shoots - fresh, perfectly dressed, nice way to start off the afternoonAsparagus, egg salad, olives - great dish, pretty again, but a really small portion (and hardly any egg salad at all, so if you crave eggs for breakfast don't bank on this dish to satisfy your craving)Soft scrambled eggs, ricotta, spring onion - decently sized, eggs were perfectI was not too impressed with the desserts though - beautiful to look at, but overly sweet...and not anything out of the ordinary eitherService was excellent - in line with the restaurant's fine dining image, yet not at all pretentious. The decor is kind of odd though, but when the food is bang on, the rest can be forgiven.",Untitled,4.0 star rating,$$$,"American, (New),, Breakfast, &, Brunch,, Wine, Bars"
99,OoQ4LipvJFJ3ng_Hsa16gg,Sophia W.,4.0 star rating,"As good as it gets - if you come at the right time and order the right dishes!  New American is always hard to impress, but I think Untitled has done it with a few dishes that have wowed my heart, not to mention its outstanding service! Dinner was at 10PM on a Monday. We were literally the last ones in and last ones out (11:30PM - they kept the restaurant running for us!)To start, the place is spacious and decor with a modern finish. The menus is quite simple with a good amount of fish and meats. Nothing really exotic or out of the box, which is usually the case with New American cuisine. There are some classic American dishes - Chicken (roasted and fried), Rib and Pasta but the star of the show was definitely the Grilled White Shrimp appetizer (it's the pancake). It was light but full of flavors. I really applaud the chef for using cornbread pancakes as a base (who would have thought).It was my first time there, but I hear that the menu is always changing, so I better go back before they take my fave appetizer off the list.",Untitled,4.0 star rating,$$$,"American, (New),, Breakfast, &, Brunch,, Wine, Bars"
100,-FL3-KW6RNl7qyJnksnpLg,Paul A.,4.0 star rating,"Untitled is an excellent new addition to Danny Meyer's restaurant empire, serving certainly the best food I have ever had inside a museum. The dishes, and especially the deserts, are inventive and very tasty. While perhaps not the best restaurant in the immediate area hands down, this is a great new spot.I went with the Lobster and Preserved Lemon Toast to start which was fresh, light, and amazingly delicious. It is served with shishito peppers which complement the dish really well. This was probably the best thing I ordered besides the cookie.I also had the Fried and Roasted Chicken Salad which was almost as good. It is a take on the thai style of a cold pulled chicken salad enlivened with big hunks of piping hot fried chicken. It is definitely unique and definitely extremely good.Dessert here though is completely bonkers. I came alone and still got both the Peanut Butter Blueberry Crunch Cake and the Triple Chocolate Chunk Cookie with Milk. The Chocolate Chunk Cookie was, in my opinion, the better of the two. The three different kinds of chocolate and the dense, buttery heft of the cookie are just really addicting.The cake, though, is probably one of the better cakes I've had recently, studded in sesame peanut brittle, striped with a peanut butter buttercream, and drizzled with a blueberry syrup. Honestly, it is isn't as sweet and overwhelming as you might expect and it did taste amazing, but the cookie definitely deserves the hype.BTW when I came here there was a family sitting next to me with two kids that looked like they were about 8 or 9 and both kids really enjoyed their meals (they ordered basically what I did) and kept saying aloud how the food reminded them of the cooking shows that they love .I think that this alone is a testament to Untitled. Any place that can appeal to jaded foodies and conscientious 8 year olds is one pretty amazing place.",Untitled,4.0 star rating,$$$,"American, (New),, Breakfast, &, Brunch,, Wine, Bars"
101,XHFMUntjJgdUrknIbTeRBg,Faaiz A.,1.0 star rating,"Man come on breh. This was a total let down. I came in because I kept hearing all of these incredible stories about how good the cookie and milk combo was. I ordered it, and felt nothing but shock and confusion when I looked down to see a walmart Bakery size cookie and a shot glass of milk...all for $9!!! Ridiculous my good chief, ridiculous...",Untitled,4.0 star rating,$$$,"American, (New),, Breakfast, &, Brunch,, Wine, Bars"
102,tWCEN1W8MLpuFUz3Q5vLIg,Selma S.,5.0 star rating,"The best fried chicken in ManhattanSmall portions of seasonal and delicious ingredients are lightly prepared,  flavorful, well seasoned and beautifully presented.  Untitled reminded me of dining well in California-the food is clean, fresh and leave you wanting more. We ordered almost everything on the menu and the highlights included beet salad, fresh and crispy fried fish lettuce wraps, cavatelli and pork sausage, delicious fluke ceviche, the best pimento cheese we'd ever eaten, perfectly dressed baby lettuce salad, and the fried chicken which should be, IMHO, written up as the best in NY.  Even the bread and butter was over the top special. The place is beautiful and the staff was attentive, helpful and friendly. Thanks for a wonderful meal!",Untitled,4.0 star rating,$$$,"American, (New),, Breakfast, &, Brunch,, Wine, Bars"
103,cfWogeHAAHGRH7040eRijA,Shing Yiing O.,5.0 star rating,"Love everything about this restaurant. The atmosphere, the service, the food.Came here with my lovely friend Celia Z. that recommended this place. Everything in the menu was listed without a title. They divide it based on section, Section 1 on the menu is most likely dip such as fondue, Section 2 is some small raw appetizer, Section 3 is vegetable appetizer, Section 4 is main entree (if I remember it correctly there are only 4 sections). We asked for recommendation and went ahead with these:Fluke: it is raw but it blend well with all the other ingredients such as ikura and carrots with some sauce.Roasted Cauliflower: from section 3, the cauliflower is roasted perfectly with their own special sauce. Surprisingly vegetable is my favorite dish here. The waiter told us that everything on Section 3 are his favorite and we can totally just do like a tasting menu and just order 5 of the items and it will fill us up.Monk Fish from the entree: we decided to share everything and they split it half for us. The way the waiter describe the sauce with it was really interesting. It was blend with Go Chu Jang sauce if you are familiar with Korean spices. I love it. It was also topped with some radish.Dessert: we went with their signature banana hazelnut with some cranberry sauce around. I like it without the sauce. It tasted like banana with nutela sauce just without the chocolate.. I loved it and I think I can have another piece.. They made it with REAL hazelnut!!!Bread: their bread with salted butter spread was  served warm.. WIN!!I will definitely return some time. It might be perfect in the summer as it is just located next to the Hudson River and the High Line. Perfect for a date spot.",Untitled,4.0 star rating,$$$,"American, (New),, Breakfast, &, Brunch,, Wine, Bars"
104,jgNmmT72aibWF1rC5BNjbQ,Helen H.,4.0 star rating,"This is how a museum cafe should be run. Good food, excellent service and a killer view. I will say that the host was a bit overwhelmed, maybe it was his first day. The only negative is that they only have one bathroom and there's always a line and they won't let you use the museum bathrooms without paying admission so either go before you get there or hold it. I would go there again and sit in the window and show my fashion to the world!!",Untitled,4.0 star rating,$$$,"American, (New),, Breakfast, &, Brunch,, Wine, Bars"
105,8wriStkPET5FikhNvtjY4Q,Maeve M.,5.0 star rating,"I took my mom here before visiting the Whitney and it was the perfect spot for a light, filling summer meal. I really enjoyed Michael Anthony's cooking at Gramercy Tavern and this was equally good but definitely lighter, more ""vegetable-forward"" fare. We split a few smaller plates so we could try more of the menu and ended up with the cabbage dumplings served with sesame vinaigrette, the grilled white shrimp on a corn pancake, the baby lettuce salad with corn, freekah and goat cheese and summer squash with chilis and hazlenut. Presentation was incredible - the dishes were so pretty it was hard to eat! In particular, the squash is sort of hollowed out like a boat and filled with ricotta and hazlenuts. The first two dishes were smaller with an unusual Asian flare, and then the salad was a great combination of flavors. Naturally we ordered wine to with our meal (acceptable on vacation/funemployement/really whenever) and our server was incredibly knowledgeable about the different whites they had available by the glass (because I ate here six weeks ago unfortunately I forget what we ended up with, but his recommendation was perfect). We ended up splitting the chocolate chip cookie with milk for dessert and it was pretty good but I would probably skip it in the future, it was just a bit crunchy for my taste. Still, a warm chocolate chip cookie is never a bad idea and getting to enjoy it all in the crisp, pristine white room with sun pouring in the windows made it a truly 5-star experience.",Untitled,4.0 star rating,$$$,"American, (New),, Breakfast, &, Brunch,, Wine, Bars"
106,G72Mb114W6bN0GzHr9ZSPg,David N.,4.0 star rating,"Ambiance is very casual and relaxed. High ceilings, lots of glass. Service was very good, tentative, and informative.Had the ""Untitled Cocktail"" which at the time was a very funky (in a good way) apple cider. Tasted dry but can't really explain much further. Just very unique for a cider and very mysterious.Mains and sides were great! Cauliflower side with cardamom had a very floral taste. Recommended for vegetable lovers. Spinach Fettuccine with Shitaki Mushrooms was very savory but not overpowering. Same with the Fried/Roast Chicken - nothing overpowering. However, the kale with the chicken dish was deliciously mushy - you wouldn't think something of that consistency would taste good but it does. Nothing too salty either as most American food tends to be.Dessert was a bit of disappointment though (although they have many other options than the two we had). The banana hazelnut praline cake was a giant slice of cake but was like a refrigerator cake. A bit too sweet. The milk-to-cookie ratio was laughably low on our other dish (I should've asked for more milk) but the cookie part was good.But overall, top-tier service, good ambiance, great food aside from the dessert. For a restaurant to compare in the same category, I'd say this is a step above ABC Kitchen. Lives up to the hype, would come here again!",Untitled,4.0 star rating,$$$,"American, (New),, Breakfast, &, Brunch,, Wine, Bars"
107,YeBu_GUhxz2dsWLmK0b5Ew,Jessica G.,4.0 star rating,"What an aesthetically pleasing dining experience! The restaurant itself is impeccably designed, and everything you order will arrive looking like a piece of art. This was fitting when I went, as my date and I were getting lunch before admiring art upstairs at The Whitney. We had the lobster salsa with chips, beef tartare on sourdough, and then shared the roasted and fried chicken. The lobster salsa was a bit underwhelming for me, but the other dishes both blew us away. We were amazed at how chicken can usually be so bland at restaurants, but this plate was particularly memorable. The contrasting textures mixed with the sweetness of the slaw made for a GREAT bite. Also worthy of note is the cheddar biscuits and red pepper jam they give you before the meal... They were to die for. I would definitely return to Untitled to try more beautiful, delicious creations.",Untitled,4.0 star rating,$$$,"American, (New),, Breakfast, &, Brunch,, Wine, Bars"
108,S4cN2hHDqUJrxP7DhgAfNQ,Nora F.,5.0 star rating,5 star everything. The service was silly good. Like Europe good. Food fresh and interesting and delicious. Eduardo the Somm knows his sh**. Amazing spot. Walk off the best chocolate chip cookie you ever ate on the High Line above after.,Untitled,4.0 star rating,$$$,"American, (New),, Breakfast, &, Brunch,, Wine, Bars"
109,3MZejuIlqNFplpEwcjwRnA,Eva H.,4.0 star rating,"Great dinner on a Wednesday. We made a reservation through Opentable and they accommodated our request to move the reservation back 30 minutes.All the dishes had really unique ingredient pairings and I loved my ""specialty drink of the day"" - it was very kombucha-like apple cider type of drink.We got a bunch of dishes to split:Cabot cheddar fondueBeef TartareCauliflower/Cardamom Custard/LemonRoasted and Fried Chicken Sunchokes/Bacon/Cloumage Key Lime PieEverything was yummy and there isn't a dish I wouldn't get again. I loved the veggie-heavy options that still tasted refreshing and different (nothing tasted like it was just drenched in butter and salt). Every dish's ingredients paired well together.",Untitled,4.0 star rating,$$$,"American, (New),, Breakfast, &, Brunch,, Wine, Bars"
110,01uMilbArDZmDwM_b2KqMQ,François G.,5.0 star rating,"Nice everything from the place to the staff, food, wine and cocktail. I'll definitely be back some day. Special highlight was the chicken, sooooo tasty, moist, roasted and fried.",Untitled,4.0 star rating,$$$,"American, (New),, Breakfast, &, Brunch,, Wine, Bars"
111,hNdVTGKuvlgP0_ydOlrnGQ,Rebecca H.,4.0 star rating,"You know when you're an adult when you're visiting the Whitney on a Friday night with the boy for date night. However, date night at the Whitney somehow ended up just being a quick 30 minute walk around the Whitney and date night at Untitled. Got the fluke and the cauliflower dishes. Fluke was not bad, but the cauliflower was the real hit. The fish lover in me is still incredulous that I would still order the vegetables over the fish. I blame that cardamon custard. So delicious. And light! After reading the Eater article on Untitled's layer cake, dessert was a must. I must admit, Chef Miro really knows how to make a solid banana cake, almost as good as my mother's and combined with the hazelnut buttercream frosting and the crunch, I almost wanted to lick the plate. However, the adult in me put the foot down. On the same note, the crunch is what really made the cake and if there was anything to really add to the cake, I would add more crunch, because it was just so unbelievably delicious, sweet, salty and then with that buttercream, perfect combo of sweet, salty, savory, fluffy, and crunch. Yummy...The meringue also is not bad and the lemon curd just kills it. Like I would order that lemon curd to go and just eat it with a spoon and maybe some meringue...However, the real star of the evening was the bartender, Rocky! He was so hilarious and provided exceptional service. He really should consider going into stand up comedy.",Untitled,4.0 star rating,$$$,"American, (New),, Breakfast, &, Brunch,, Wine, Bars"
112,a2yPIoHe-ZHz7WWDxSDA6Q,Thom D.,5.0 star rating,Wrapped in glass walls 25 feet high with street light from all directions. Neighboring restaurants are mostly low- ceilings dark joints that cannot compare. The food is good. Often great. But the light is sumptuous and nourishing and really a mood lifter. And no more expensive than any other place within blocks of the Whitney.,Untitled,4.0 star rating,$$$,"American, (New),, Breakfast, &, Brunch,, Wine, Bars"
113,78ANrrx6_5VDxdlFVdykHg,Lee H.,5.0 star rating,Amazing taste and presentation at dinner from a very talented chef! Great service and good recommendations from server. Highly recommended.,Untitled,4.0 star rating,$$$,"American, (New),, Breakfast, &, Brunch,, Wine, Bars"
114,Ud6rRtdP7DRwFHuw4IiRGQ,Kat V.,4.0 star rating,"Came here on a Thursday night with several of my girlfriends. This is one of the few restaurants that actually have decent lighting and super high ceilings - giving a really nice open and bright space (especially in NYC). Was actually able to see my friends while talking with them haha. It also wasn't overcrowded. Didn't like the drinks. Wouldn't order them again. Food was okay - favorites were the beef tartare, smoked fish cream, and the fried and roasted chicken dish. What made this place a four star place, and not a three star, was definitely the desserts. Love the banana and peanut butter cake with grape jam on the side (pbj!) and the delicious chocolate chip cookie with cute jar of milk.",Untitled,4.0 star rating,$$$,"American, (New),, Breakfast, &, Brunch,, Wine, Bars"
115,tGpMar7_fnO5fFbv7vWpMQ,Roy L.,5.0 star rating,"Deserves a better location that the (yet another) Renzo Piano hanging light showroom in the middle of (what seems destined to remain forever) the middle of trendy nowhere. As always, avoid the  Whitney unless you want to be put off your food.",Untitled,4.0 star rating,$$$,"American, (New),, Breakfast, &, Brunch,, Wine, Bars"
116,86Vnf5PTS7-jSt04AkSsVw,Kate M.,5.0 star rating,"I think, what better way to illuminate great art than with a great glass of wine? I loved my wine and gazpacho snack at Untitled... which made me love the art I saw right after all the more. Beautiful natural light within and sculptures just beyond.",Untitled,4.0 star rating,$$$,"American, (New),, Breakfast, &, Brunch,, Wine, Bars"
117,mPi22e-qOIxp0J1108YfMg,Ray S.,4.0 star rating,Great service. Servers are really on it. And delicious seafood. Sea bass can be sort of bland at some places but the sea bass I ordered here had wonderful flavor. Inventive menu too. Would recommend the fish lettuce wraps as a starter..,Untitled,4.0 star rating,$$$,"American, (New),, Breakfast, &, Brunch,, Wine, Bars"
118,bHDweNW1AN1khpw8HDSIpA,Katya H.,3.0 star rating,"Three stars, crawling into four. On New Years weekend the place was packed. The word got out. Watching around - the experience was of high end restaurants. A dozen or so waiters, tweezer presentation, sophisticated plating, interesting flavors. The prices followed, of course. Food was decent and tasty, not your regular brunch menu, twist in everything they served. But the price range left an after taste - one has to order two dishes not to leave hungry, and this quickly adds up. So perhaps reserve this place for a special occasion in mind - but for a regular brunch there are better options around.",Untitled,4.0 star rating,$$$,"American, (New),, Breakfast, &, Brunch,, Wine, Bars"
119,ufU54VUX_JeiIrfGucaRoQ,Dominique N.,4.0 star rating,"Came here for lunch with my mom one day before entering the Whitney. Since we came impromptu without a reservation, it took us nearly 45 minutes to be seated outside. I will not hold this against them, however, since the place is quite popular and it seems many people made reservations beforehand, but keep this in mind if you are planning to make a trip out here. We ordered the pole beans, calamari & hazelnuts ($16), the sea scallops, tomato & peach gazpacho ($14), and the ruby red shrimp, peppers, emmer, okra ($15). We also shared the strawberry ricotta pound cake, pistachios ($10). The gazpacho was my favorite hands-down, with the raw scallops being extremely flavorful, accompanied by the sweetness of the peach.The pole beans dish had a great sauce, but not so many pieces of calamari. If I were to come back just for a quick bite, the cake would be a great choice, since it's not too big, but very well-done.  Overall, the food was very good, and the ingredients tasted fresh. As a warning, don't expect the portions here to be very large, and if you're hungry you should be willing to dish out some cash.",Untitled,4.0 star rating,$$$,"American, (New),, Breakfast, &, Brunch,, Wine, Bars"
120,GSAkrK1dD5yOtb-E3bvQQQ,Lisa A.,5.0 star rating,Had a great meal. My husband and I shared 5 apps/small plates and it was plenty!  Also had a 500 ml carafe of wine. Flavors were spot on. Had a grilled calamari dish and the calamari was cooked perfectly. fish and vegetarian options. Nice biscuits with red pepper jelly were a nice added touch. Visited the museum after. They were very accommodating despite the fact we didn't have a reservation.,Untitled,4.0 star rating,$$$,"American, (New),, Breakfast, &, Brunch,, Wine, Bars"
121,2b_dtqrAPi7q1kCiTBDhtA,J M.,5.0 star rating,"Had a GREAT experience here. Must get the fried fish lettuce wraps, Einkorn pasta, and rice pudding!! Great food and service!",Untitled,4.0 star rating,$$$,"American, (New),, Breakfast, &, Brunch,, Wine, Bars"
122,kZSUZg512UIyGMatLRf7xQ,Irene H.,3.0 star rating,"I made a reservation on OpenTable. Prime time brunch was booked up, so we went with 11:30. They seat incomplete parties. You can also pay for your check on Opentable. The space is gorgeous. Prices are high. We got two apps and shared an entree.- Smoked arctic char, soft boiled egg, capers, potato pancake: Everything was good except for the pancake. It was cold and they said it was meant to be survived that way.- Cauliflower, cardamom custard, lemon: Very pretty and yummy. - Roasted and fried chicken salad, cashews: This was yummy and very large. We said we were splitting it and they graciously split it into two plates for us. I've seen so many photos of their dessert that I was disappointed that they weren't on the menu. I got the Sticky toffee cake, pears, chai and it was good but not as exciting as the photos of other desserts that are out of season...We went to the Whitney afterwards and was able to walk into the lobby directly from the restaurant and avoid the line outside.Along with two coffees, the check was $70+.Don't think I'll be back any time soon...",Untitled,4.0 star rating,$$$,"American, (New),, Breakfast, &, Brunch,, Wine, Bars"
123,Xmj7Okb8peDbsbaQyOwG0w,lou r.,5.0 star rating,"My partner and I met a friend for brunch, per her suggestion.  Wow!  Everything was fresh, thoughtfully prepared and graciously delivered.  We passed everything around and we enjoyed everything.  Well done.  Can't wait for next Saturday.",Untitled,4.0 star rating,$$$,"American, (New),, Breakfast, &, Brunch,, Wine, Bars"
124,5Rp59W-IX0hnCHTOgyCGDQ,Grace H.,3.0 star rating,"We went here for a quick brunch before walking through the museum. It was a miserably hot that day, so we were thankful for the zero wait and the cool AC.We had the squash pasta, soft scrambled eggs, and tomato & peach salad. The salad & pasta were very delicious, but the portions were very small! Especially the soft scrambled eggs. For $12, you got a small bowl of eggs and a few pieces of toast & the flavor wasn't anything spectacular. Definitely ended the meal still hungry. Also, the service was a little uneven: we never got the complimentary chive scones that other tables received, and the server forgot an iced coffee, which I asked for again at the end of the meal.",Untitled,4.0 star rating,$$$,"American, (New),, Breakfast, &, Brunch,, Wine, Bars"
