,user_id,user_name,user_rating,user_text,restaurant_name,restaurant_rating,restaurant_price,restaurant_type
32,Gxa7wI8_XtGBVRqSv_h1rw,Jade T.,3.0 star rating,"If I was able to just walk into Upholstery, have the Brook Trout waiting for me at the table, and leave... I'd definitely be giving them a 5+++.  Besides the trout, the food and drinks weren't anything special. And service was SO slow. It may have been the slowest service that I've ever experienced in NYC.The portions are pretty small. And the pricing is odd- the appetizers are overpriced, but the entrees aren't. I'd  recommend having drinks and light snacks elsewhere before going to Upholstery. Just stop in for an entree (the trout!!).  You can tell the kitchen pays attention to every little detail of their dishes, especially presentation, so we weren't too disappointed with how long the food took. But we were waiting forever for food menus, for the server to take our order, and for the server check on us. It looked like they had one server for the entire restaurant so I blame the poor service on them being understaffed. To start we had the grilled vegetables, sardines, and deviled eggs stuffed with avocado & lobster. The grilled vegetables were presented beautifully, but were a tad bland. The deviled eggs we're tasty. The sardines were my favorite of the three. I still would have preferred to skip the appetizers- just not worth the price.The brook trout was one of the best fish dishes I've ever had in my life!!! I'd 100% recommend you give that a try. Overall, I wasn't impressed by anything besides the trout. An easy fix would be to add some additional servers. And lower the appetizer prices a little, or at least make the portions bigger. If it wasn't for the amazing trout, I wouldn't return to Upholstery.",Upholstery Store: Food and Wine,4.0 star rating,$$,"American, (New),, Seafood,, Cocktail, Bars"
33,OZZ7NOPXjk2V8hoY-YrhYw,Brian B.,5.0 star rating,"Awesome, quiet west village find. Didn't try the food while we were there but the drinks were fantastic and unique, and they bring in a rhubarb dessert from the Michelin star restaurant next door that was great",Upholstery Store: Food and Wine,4.0 star rating,$$,"American, (New),, Seafood,, Cocktail, Bars"
34,9ydCIh7AbG4ni8Fzi-7ggQ,Samantha M.,5.0 star rating,"I am in love with this charming spot. Went with some girlfriends and we feasted on several perfectly seasoned dishes. Beautifully poached white asparagus, delectable tender wakame salad, braised lamb, lip smacking fresh pasta, and crispy langoustine. I am looking forward to taking my husband here for a date.",Upholstery Store: Food and Wine,4.0 star rating,$$,"American, (New),, Seafood,, Cocktail, Bars"
35,TpqdbcaRtbkZdiv-XGXu-Q,Meredith C.,1.0 star rating,The tequila cocktail on the menu was undrinkable and had to send it back. The octopus starts off decent then hits you with the saltiest kick ever. Waiter had a horrible attitude. Do not recommend!,Upholstery Store: Food and Wine,4.0 star rating,$$,"American, (New),, Seafood,, Cocktail, Bars"
36,2uCGm0m1xWDaAesBBoAEsw,Ioana H.,4.0 star rating,"Wonderful, wonderful place. Really cozy, romantic, great atmosphere. Has a private table in the back with a great garden view and couch sitting with an open kitchen. The food is so delicate and just lovely. The owner has a Michelin star, so he knows what he's doing. So, if you're up for a special dinner, a nice cozy date or just a dinner for one at the bar and a great drink, go visit these guys.",Upholstery Store: Food and Wine,4.0 star rating,$$,"American, (New),, Seafood,, Cocktail, Bars"
37,I_t26fMgE0BJYhQvP9QlOw,Launch S.,4.0 star rating,"Had a fantastic night and meal here. 3 of us got the very reasonably priced pasta entree and it was very tasty and filling. Wife loved the beets and scallops. The vibe is quirky in a good way; it feels a bit off the beaten path so it's not over-run by finance assholes even on a Saturday, but it was still lively and fun. Great music and the volume was perfect. You could hear it fine but it didn't interfere with the conversation.",Upholstery Store: Food and Wine,4.0 star rating,$$,"American, (New),, Seafood,, Cocktail, Bars"
38,kT70ZylFdVTQEXT4Kuhc7A,Elaine Z.,4.0 star rating,"The 'Food and Wine' distinction is important in Upholstery Store's name - even then, I was still skeptical when I saw the Yelp listing that it was an actual restaurant. However, upon seeing the photos, I was convinced and excited to try this place deep in the West Village. A smaller establishment, the bar was lively Friday night but there looked to be enough room for a walk in for two (we had made a reservation the night before). We ordered the octopus appetizer as well as the lobster avocado deviled eggs, and both were extremely tasty. We had a glass of chardonnay each which paired excellently with our mains, which were the sea bass and the squid ink pasta with chard and caviar. We didn't elect to have dessert, but the options looked just as good. The service was excellent and I was seated early - definitely recommend Upholstery Store for a charming date night if you're in the West Village.",Upholstery Store: Food and Wine,4.0 star rating,$$,"American, (New),, Seafood,, Cocktail, Bars"
39,oAgTVMwsz9w3sanYMEZgUg,Lauren M.,5.0 star rating,"Had a really great meal here. Came due to a recommendation and glad we did. Portions are reasonable sized meaning there was room for dessert and the price is really good for the quality of the food.I had the burrata to start which was good but the entree of arctic char (their speciality) was amazing. Really well cooked. Others tried the octopus, which was a big hit, as was the linguine with clams. We all shared the chocolate pot and apple strudel for dessert-the chocolate being the favourite! Would highly recommend.",Upholstery Store: Food and Wine,4.0 star rating,$$,"American, (New),, Seafood,, Cocktail, Bars"
40,94pbwLi5L-_Po_RqWAJHHQ,chuck w.,4.0 star rating,"Neat spot for drinks and food.  Small wine list. Although many of the wines were crossed off, leaving very little selection. Need to do a better job with the wine list.Food was outstanding.  Delicious oysters, octopus, deviled eggs and sardines.  Highly recommend each of these plates.Service was also very good.",Upholstery Store: Food and Wine,4.0 star rating,$$,"American, (New),, Seafood,, Cocktail, Bars"
41,xV-xUV3ebeJ3UL4Iu-n8Og,Zhou F.,4.0 star rating,"I'm surprised this place isn't more well-known. The ingredients are high-quality and the dishes are made with the technique of chefs at much stuffier, expensive places. For appetizers we had the lobster and avocado deviled eggs and the octopus. The deviled eggs were an interesting small plate but the octopus was exceptional. The grilled octopus was smoky and cooked to the right texture. For the entree I had the striped bass which was served in a tomato coriander sauce. The fish was cooked excellently with crispy skin on top. Prompt and friendly service helped the experience as well.",Upholstery Store: Food and Wine,4.0 star rating,$$,"American, (New),, Seafood,, Cocktail, Bars"
42,Z15zw-iZ5DxJpVnP4wA6Wg,Stefan H.,5.0 star rating,"We've been there for a ""more-than-average"" dinner and found the Upholstery Store on Tripadvisor. Big compliment to the chef, who managed to prepare some really delicious food and dessert. Highly recommendable!",Upholstery Store: Food and Wine,4.0 star rating,$$,"American, (New),, Seafood,, Cocktail, Bars"
43,-FtVX2Z_BNE9R4WsxgI_HA,Lois D.,4.0 star rating,We were lucky enough to have the very private table in the back so we could converse without ambient noise. Food was very flavorful. Perhaps the nouvelle cuisine of small portions was a little dated but overall was a very nice meal and nice staff.,Upholstery Store: Food and Wine,4.0 star rating,$$,"American, (New),, Seafood,, Cocktail, Bars"
44,Ppsg6xn34ultupSQoIdnYQ,John P.,3.0 star rating,"I went there on a year anniversary with my gf.  Started off nice enough, then it got crowded.  I wound eating half my meal next to three peoples behind only to be asked to get up because they needed the table for other people.  Really I don't think it's polite.  I had a 9pm reservation and getting asked to leave at 10:10 is a bit surprising.  Food was decent enough.  But not enough to bring me back after being treated like I did. $208 dollar bill so it wasn't as if I was sipping water at the table.",Upholstery Store: Food and Wine,4.0 star rating,$$,"American, (New),, Seafood,, Cocktail, Bars"
45,svFycHjXZYpNVutZ_0_gDQ,Jessica W.,5.0 star rating,"I love this place, I stumbled upon this place on a west village exploration day and have been coming back since. I've yet to eat here but that is next on my list. This place is unpretentious and fun.They have a rose cider beer that was amazing. I don't typically enjoy rose but this was a little bit of a mix. My friend had a glass of prosecco. She seemed to enjoy her bubbles as well.I think this would be a totally awesome intimate date place. The servers and bartender were awesome and accommodating, location is great and it's pretty affordable for the West Village. You are a block off of the west side highway, so you can walk along the water when you are finished having a couple drinks for a date night make out ;) or with your girlfriends to take some candids!",Upholstery Store: Food and Wine,4.0 star rating,$$,"American, (New),, Seafood,, Cocktail, Bars"
46,nf-Z7ugDXrAMwnyDyC_zgg,J. Karim A.,4.0 star rating,"My eye has been on this place for a while given how delicious Wallse is. I was walking through the village and decided to stop by for brunch. I was the only person there until some people came in later and sat at the bar. I had the Brussel sprouts cooked in a sweet vermouth with pistachios and the avocado and salmon toast. The Brussel sprouts had a sweet sauce and were quite good, though I wish the pistachios had a little more firmness to them. The avocado and salmon toast had a nice kick to it that I wasn't expecting and enjoyed. I'd definitely go back to try dinner. The carrot and orange juice was interesting as well but I'd probably not get it again.",Upholstery Store: Food and Wine,4.0 star rating,$$,"American, (New),, Seafood,, Cocktail, Bars"
47,vlxAwgERz60s0WZsheAtOQ,Anne C.,5.0 star rating,"Excellent excellent excellent!! Special oysters were delicious and special, indeed. Mignonette oysters were good, but less remarkable. Squid ink pasta was good in a way that made you ask 'this is so good. How is this possible? This is so good.' The striped bass was cooked to perfection; it is what all striped bass dreams of being. On the whole, almost every bite left us saying ""wow."" The service could've been a little more attentive, and the panna cotta was a little bit dense, but I'm really splitting hairs, here. The raspberry compote that accompanied the panna cotta was remarkably good.Highly recommend!!!",Upholstery Store: Food and Wine,4.0 star rating,$$,"American, (New),, Seafood,, Cocktail, Bars"
48,U7w4d5khmLV1XNTW1KkD1g,Michael K.,4.0 star rating,"A fantastic surprise. Staff was genuinely pleased to greet us. Bibb salad, shrimp dish and smoked mackerel appetizers were perfect blend of taste, ingredient and texture.  The Skate and lamb dishes were delicious. Our waiter's recommendations were spot on including the chocolate dessert and the peach tart....OMG...Definitely a new favorite. Quaint seating is the only star missing but that's what makes it so charming!",Upholstery Store: Food and Wine,4.0 star rating,$$,"American, (New),, Seafood,, Cocktail, Bars"
49,GJr7XhCAHcTVXw2nfS5Blw,Helena W.,3.0 star rating,"Ambience is really niceService is niceBut food is way too salty for me Wine selection is broad but not my cup of ""wine""Ordered oysters- pretty good, not the bestOctopus- I don't like mushy cooked octopus and it's very saltySquid ink pasta- again very salty and I don't like the coconut milk flavour If you want something different can check this place out",Upholstery Store: Food and Wine,4.0 star rating,$$,"American, (New),, Seafood,, Cocktail, Bars"
50,qf2eM0iRwhhpR_zgqtd-Qg,C S.,5.0 star rating,"Hidden neighborhood gem.  Good place for a drink with friends or date night.  Thoughtful seasonal menu selections and snack menu available.  Staff is friendly and space is charming, don't be fooled by the speak-easy entrance.  Go on in!",Upholstery Store: Food and Wine,4.0 star rating,$$,"American, (New),, Seafood,, Cocktail, Bars"
51,BDfdnMN58P-n6-omDtMZew,Matthew D.,5.0 star rating,"Last night was my second time dining at Upholstery Store. My first visit I knew it would be where I want to celebrate my birthday. I scheduled out the event for 13 people well in advance. The restaurant was extremely friendly and accommodating.  The food was prepared perfectly and each dish very interesting too! I must recommend the lobster deviled eggs and avocado deviled eggs. MMMMMM Particularly my favorite thing were the drinks! You can pick off a very cool and vast list of custom cocktails or let the bar tender provide the chefs choice - be adventurous. The ambiance is also something everyone in my party could not stop talking about. With separate areas you really felt like you were in your own private room, but still out on the town. Additionally the noise level was just right, not too loud and you can hear everyone across the table. Music choices were all fun. I highly recommend.",Upholstery Store: Food and Wine,4.0 star rating,$$,"American, (New),, Seafood,, Cocktail, Bars"
52,GMZp-fttB461FW21qEICuw,Danny L.,4.0 star rating,"Go for the intimate atmosphere, pretty people, and select a green with envy and the squid ink pasta.",Upholstery Store: Food and Wine,4.0 star rating,$$,"American, (New),, Seafood,, Cocktail, Bars"
53,Qzc9tg0nFE1R3SSC3raCmA,Vincenzo C.,5.0 star rating,"A gastronomic delight! The trout seemed to be the favorite of the night, and the lobster deviled eggs were delicious as well . I was enamored by the coziness of Upholstery. Think traditional Viennese cafe with an art deco twist. I just found the place to be very charming and unique, nothing like it in the west village. The service was impeccable and the craft cocktails were especially memorable  ""try the Yenta"". Nice touch with Leonard Cohen tunes as well. I will be returning.",Upholstery Store: Food and Wine,4.0 star rating,$$,"American, (New),, Seafood,, Cocktail, Bars"
54,Gp6UdyaHhnPVf2o0Vp7mzQ,Candie H.,5.0 star rating,Had an amazing experience....wonderful table and atmosphere .... great service and outstanding food!!! Highly recommend !!!!,Upholstery Store: Food and Wine,4.0 star rating,$$,"American, (New),, Seafood,, Cocktail, Bars"
55,7eLRoZc5AkWP9Bw4kR460g,Carl L.,5.0 star rating,"Excellent concept reasonable prices, interesting cocktails, nice wine selection, attentive staff, and the food is excellent, linguine and clams second to none  One of my new go to places",Upholstery Store: Food and Wine,4.0 star rating,$$,"American, (New),, Seafood,, Cocktail, Bars"
56,2wOhkZGUkaVCNB_ZkyWraw,Joann M.,5.0 star rating,"We were taking a stroll and stopped in for dinner. Delicious... oysters with sea urchin to start and entree was a squid ink pasta with scallops, caviar and coconut milk. It was amazing, light and filling. The dessert didn't catch me that well, but after a beautiful dinner and a wonderful waiter I will definitely come back to try other things. I must say, the price was great for the quality.",Upholstery Store: Food and Wine,4.0 star rating,$$,"American, (New),, Seafood,, Cocktail, Bars"
57,hMZeW1KWcD9bSzbFgesi1w,Alan C.,5.0 star rating,excellent venue and outstanding menueverything we ordered was great and Cody and staff were very attentive to all our needs.out of the way perfection!,Upholstery Store: Food and Wine,4.0 star rating,$$,"American, (New),, Seafood,, Cocktail, Bars"
58,VVJ3EKbgQQyhe-_yxG4dBA,Lynette C.,1.0 star rating,"Cute place, just not enough food for the money, sorry. A $19 lobster roll that's 2.5 bites at best? A salad that's more like a garnish? A $10 dessert the waiter described with his hands as being the size of a postage stamp? I worked in food - the material cost of a few extra bites is not a deal breaker. This is the West Village, America, not Austria (or wherever this place hails from) - give people a little more than they expect, charge a little more (which you are already doing so forget that), and they will come back again and again (and again). It's tomorrow's sale that pays the rent.",Upholstery Store: Food and Wine,4.0 star rating,$$,"American, (New),, Seafood,, Cocktail, Bars"
59,4ZKXtYxvJQ8o0OzM_ksgGw,Dan R.,3.0 star rating,"Service was super friendly and attentive. Octopus and shrimp appetizers were delicious. Arctic char was amazing but the linguine with clams and prosciutto  was very salty the clams were over cooked/tough. Really nice meal but disappointed with the linguine, two of us at the table had it and we both were disappointed. We'd definitely go back and just order something else.",Upholstery Store: Food and Wine,4.0 star rating,$$,"American, (New),, Seafood,, Cocktail, Bars"
60,2aadMcZrdF0jx96rVqNjZA,B F.,5.0 star rating,"Everything was Actually so delicious. We shared so many things and we truly loved everything we ate. We had the burrata, octopus, crab, carrots, and lobster deviled eggs to start. Each was amazing. For entrees we shared the scallops, hangar steak, trout, and lobster roll and literally loved therm all too. Definitely go here!!!",Upholstery Store: Food and Wine,4.0 star rating,$$,"American, (New),, Seafood,, Cocktail, Bars"
61,6GsFJQ6hGcAo8V6kiyycug,Ria J.,4.0 star rating,"The salads and vegetables are amazing... I loved the beet and carrot salad. The steak was made perfectly also. The service is attentive and patient. Wine selection is above average and the cocktails are inventive but I really didn't like ""the yenta"" ... Creamy whisky is just not tasty to me. which is why I didn't give this place 5stars. The cocktails are pricey.",Upholstery Store: Food and Wine,4.0 star rating,$$,"American, (New),, Seafood,, Cocktail, Bars"
62,A-2hEstnzLSHAfUUNs_s-A,F. A.,5.0 star rating,"To summarize all my previous visits in one word: AWESOME.The drinks are outstanding, Martin on the bar is doing an outstanding job. Ask him to craft something for you - it will blow you off your feet. The wine selection is pretty fine, too. Ask Tia in the kitchen for her octopus, cooked or marinated for several hours, it was the best octopus I ever had. Emanuel meanwhile takes good care of you while being the guest.",Upholstery Store: Food and Wine,4.0 star rating,$$,"American, (New),, Seafood,, Cocktail, Bars"
63,F7x90QkpeLsBm0LB1lurcQ,Zer R.,5.0 star rating,"The upholstery store is an amazing location! The ambience and crowd is very cool and sufisticated. Definitely my style! Even better was the food and the drinks! Let me start with the drinks... Be adventurous and order the owners manual!! I had 2 of those and one was better than the other. Amazing mixologist that can ""mix"" out of the box! The food is just like the entire style. Sufisticated pallet!",Upholstery Store: Food and Wine,4.0 star rating,$$,"American, (New),, Seafood,, Cocktail, Bars"
64,RQ19A09OVezZYiFTCZjNYw,Mark R.,5.0 star rating,"PRO: Romantic ambiance, intimate vibe, sexy decor, fantastic music playlist.CON: Not exactly the cheapest place in town.This is one of my fave new places in Manhattan. I'm all about the ambiance, and this place is hard to beat for cozy and intimate. But it's not the quiet, maybe-someone-will-propose-here-tonight vibe, it's more upbeat and sexy. Best for dates (save the drinks w/ your buddy for somewhere else). And the chef, Matthew, is truly one to watch. We had the tuna ceviche app, Squid Ink Pasta, Venison dish and side of brussels sprouts (plus some Chocolate Pot de la Creme dessert dish that slayed us) and all his plates were works of art. Plus: venison accompanied by pickled blackberries? You'd never imagine them going together, but it was heavenly. And Andrew the bartender took fantastic care of us. My only dig on the place was that I didn't love the wines by the glass, but wine is a pretty subjective matter, and their tastes are simply more dry & acidic than mine. In short: don't miss this one.",Upholstery Store: Food and Wine,4.0 star rating,$$,"American, (New),, Seafood,, Cocktail, Bars"
65,FrXXUK4PKBXtID-pKwq3Zw,Andrew G.,5.0 star rating,"I went to the Upholstery Store last night for dinner with a party of 4.  I was looking for a restaurant that was reasonably priced (comparatively speaking for NYC), quaint atmosphere with great food.  Without a doubt the boxes were all checked for this place.  My wife and I arrived early and had a drink at the bar.  It was fun to watch the bartender create a truly unique cocktail and they were delicious as well.Once we sat down we were seated in the main dining area which is cozy but you don't feel cramped at all.  The place wasn't overly crowded or loud.  The restaurant has an open kitchen which depending on your preference might be a positive or negative.  I wasn't a huge fan due to it smelling very strong of cooking food (it is a restaurant after all so not surprising) but I could see the appeal to some.  To summarize, the food here is incredibly delicious and utilizes what appears to be high quality ingredients.  That said, the portions are fairly small so you might want to order possibly 1 appetizer per person.  We ordered the cheese plate which had some amazing cheeses in it and came with honey and tart blueberries.  For my main course I had the squid ink pasta with calamari.  I was really blown away by how good it was.  The pasta was broad noodle and was perfectly cooked with it being right on the cusp of al dente.  The calamari was delicious and the whole dish was tossed in a very light cream sauce.  I'm not a huge fan of cream sauces but this was so delicately sauced that it complimented the dish without overshadowing it. All in all the ambiance, food, drinks and price were great and I would recommend this place to anyone looking for a nice and relaxing night out.",Upholstery Store: Food and Wine,4.0 star rating,$$,"American, (New),, Seafood,, Cocktail, Bars"
66,xFbBRRhzTiVKCPfiZ5l_7w,Colleen V.,4.0 star rating,"Warm, cozy ambiance.  Terrific service.  Delicious, clean and well seasoned food (split):   roasted vegetables and deviled eggs appetizer,  trout and flounder for mains and the chocolate pot dessert was outrageous.  I will return!",Upholstery Store: Food and Wine,4.0 star rating,$$,"American, (New),, Seafood,, Cocktail, Bars"
67,cAau-L4I_Ocaa83LV3ej6w,Doug R.,4.0 star rating,"Good service, friendly staff, very cozy atmosphere, good stirred Martini with great blue cheese stuffed olives, the flounder, sea bass and beet appetizer were all very good & the wine list was appropriate to the food and dinner costs. d",Upholstery Store: Food and Wine,4.0 star rating,$$,"American, (New),, Seafood,, Cocktail, Bars"
68,anfGJdWqQIJ6YY0TK9LqQQ,vicky g.,5.0 star rating,"Super nice cozy bar and restaurant in the West Village. I usually come`here for a drink at the bar and the bar staff are super nice, friendly and funny. Food is really good too and service is great. Overall a really good place to come for a quiet drink or a date! The barman Joey is great, always making new cocktails and making sure my glass of prosecco is never empty! Totally , totally recommend the upholstery store!!",Upholstery Store: Food and Wine,4.0 star rating,$$,"American, (New),, Seafood,, Cocktail, Bars"
69,NS-kV2FlSnurfmAez8IHBA,Sophia P.,5.0 star rating,"Wonderful place with an awesome atmosphere and good food. The wine selection is also on point and the knowledgable staff have great recommendations if you need assistance. I went there with some friends and we got a nice tucked away table in the back. Highly recommend for a romantic dinner or intimate gathering. Try the squid ink pasta, it was delicious!",Upholstery Store: Food and Wine,4.0 star rating,$$,"American, (New),, Seafood,, Cocktail, Bars"
