,user_id,user_name,user_rating,user_text,restaurant_name,restaurant_rating,restaurant_price,restaurant_type
70,tEFHf4m6BLybEHiBLoJytQ,Pat W.,2.0 star rating,"Well, let's just say that The Upholstery Store should stop serving food, and maybe actually sell upholstery instead .  I REALLY wanted to like this place, and I'm actually not that picky, but my gf & I were very disappointed with our meal.  I'm giving it 2 stars because the place has great ambiance, a nice selection of music playing, and the noise level was minimal  (I hate when a restaurant is so loud that I can't hear the person sitting next to me). Additionally, the waitstaff was very informative, attentive, & friendly (we tipped well because they of course bore no responsibility for the lackluster quality of the food). Now to the food...We started with the octopus & a radicchio salad. The octopus itself was the most flavorful part of the meal & the portion size was quite good; however, the accompanying elements (endive & grapefruit) seemed haphazard, and disparate providing no cohesion to the dish.  The endive salad had potential, but severely lacking in blue cheese (literally, I think I got 3 small pieces of blue cheese). Now I don't expect, nor want my salad drenched in blue cheese; however, if the dish is described as having blue cheese, then I do expect more than a tiny smattering of the cheese.  As for presentation ~ there was none. Basically it was chopped radicchio, with a few walnuts thrown in a  bowl. For our entrees...My gf tried the shrimp with spinach & mushroom dish. Again, no presentation. The ingredients were simply thrown in a bowl. The dish was quite bland. How hard is it to infuse some flavor into shrimp? My gf seems to be able to accomplish this whenever she makes us a shrimp dish at home (and she is far from a trained chef). I had the Arctic char. I LOVE Arctic char, but I truly couldn't love (nor even like) this dish. I'm not even entirely convinced that the piece of fish served to me was actually Arctic char. The fish was served atop a strange puddle of cream sauce that was wholly unpalatable. Thrown under the fish were a few soggy pieces of cauliflower. Sitting on top of the fish was an odd, puffed rice thing that was too salty to consume. Needless to say, neither my gf nor myself finished our dishes. Just SO disappointing, & SO expensive. Certainly I wouldn't have minded the expense had the food been enjoyable. This place had quite a few good reviews which, in hindsight, I now find baffling.",Upholstery Store: Food and Wine,4.0 star rating,$$,"American, (New),, Seafood,, Cocktail, Bars"
71,_hTZI6PKJvQzgBiW9o7PNA,Robert K.,4.0 star rating,"This is a really cool place.  Small place that you might just walk by without noticing.  Food and service were great.  Only complaint is their mediocre selection of wine.  I prefer dry red wine but they didn't have any.  Otherwise, it's a cozy place and a nice place for a date.",Upholstery Store: Food and Wine,4.0 star rating,$$,"American, (New),, Seafood,, Cocktail, Bars"
72,hcnJUBAYClA-zx9-g1w9Hw,Dan G.,5.0 star rating,"I ventured into Upholstery Store on a whim last Saturday night, and what a great decision it was.  The ambiance of the space was what I would call ""rustic trendy"" - very charming, intimate, romantic, and well spaced out given the unique, funky, fun layout.  The attention to detail was apparent, and was a theme carried out throughout the evening.The cocktails are speakeasy style, and by that I mean well thought out and fun to watch take shape behind the bar.  They are delicious, unique, and well worth the $12-$14 price tag.  The bartender, Nikolai (possibly my new best friend), was surgeon-like in his precision.  He clearly takes an immense amount of pride in his craft, and the product delivered to customers.The food is Austrian and Dutch inspired, very tasty, and attractively presented.  I ordered a few small bites and everything was delightful.  My mouth is already watering imaging tasting the bites I missed out on.I was able to speak to two of the owners, who both valued my opinion of the space, cocktails, and food.  They went out of their way to make sure my experience was favorable, and were invested in the outcome.I will certainly be going back in the very near future.",Upholstery Store: Food and Wine,4.0 star rating,$$,"American, (New),, Seafood,, Cocktail, Bars"
73,JLZbFkCe5YhnsDoTIbKBoQ,Javi K.,5.0 star rating,Really good date spot. Make sure you try the oysters and the squid ink pasta!,Upholstery Store: Food and Wine,4.0 star rating,$$,"American, (New),, Seafood,, Cocktail, Bars"
74,ubFVp4HcRyqVXO2a6xRBKw,Remington T.,4.0 star rating,"Very cute spot with great food. The squid ink pasta was surprisingly good--probably in the top 3 I've had in the city. It's well worth the trek west and conveniently close the still under-the-radar Orient Express. My only complaint is ventilation. The tight, intimate space--which adds ambiance--also means there isn't a lot of diffusion potential for the kitchen smoke.",Upholstery Store: Food and Wine,4.0 star rating,$$,"American, (New),, Seafood,, Cocktail, Bars"
75,SmbbZ581vQvYvrq4B5MVIg,Steven L.,5.0 star rating,"Couldn't have loved it more. Great ambiance, great food (and drinks), friendly staff... perfect choice. I had the octopus, it was delicious. If you're drinking ask for the ""Bartender's choice"" from the drink menu. Try it!",Upholstery Store: Food and Wine,4.0 star rating,$$,"American, (New),, Seafood,, Cocktail, Bars"
76,2TqFYJ9kgAUbbvhtMr2KrA,Minnie S.,5.0 star rating,"I was looking for a quiet spot to have a few drinks with friends on a Friday night.  I found Upholstery Store and OMG... I am in love. The space is small, dim lighting but not too dim, and it's quiet! The staff is super friendly, does not disturb - 2 different people took our orders instead of one - and I have tried 5 out of their 7 drinks on that list (not all by myself, fyi).  What do I recommend?  ALL of them! So you really can't go wrong :-PFood wise - I had the squid ink pasta - delish - and my friends enjoyed deviled eggs. I love this spot and cannot wait to go back. I just hope it remains quiet.",Upholstery Store: Food and Wine,4.0 star rating,$$,"American, (New),, Seafood,, Cocktail, Bars"
77,TfE-QiIdWmxHmAyMgmz2iw,Lauren B.,5.0 star rating,"Upholstery Store is the living room that I don't get in my itty bitty West Village apartment. It's my go-to place to meet friends after work, and we are always welcomed warmly. They have a great wine list, and the deviled eggs are addictive. All of the small plates are tasty - it's the type of place you can hang out at for a while.",Upholstery Store: Food and Wine,4.0 star rating,$$,"American, (New),, Seafood,, Cocktail, Bars"
78,z99jXmpNJmWS6-3LyLtrog,Luca K.,5.0 star rating,Comfortable and cozy atomosphere. Friendly and warm service. Food looked & tasted gorgeous. Oysters were really fresh and beautifully seasoned. Will definitely visit again.,Upholstery Store: Food and Wine,4.0 star rating,$$,"American, (New),, Seafood,, Cocktail, Bars"
79,eFgyizPj9VWOEGdzDIMdmQ,Ben H.,4.0 star rating,"Good food. Friendly staff. The bartender pushed me to try the Octopus, saying if I didn't like, he'd take care of it. But it was super delicious, so I paid for it. But worth it.",Upholstery Store: Food and Wine,4.0 star rating,$$,"American, (New),, Seafood,, Cocktail, Bars"
80,cQxiAHKd7RD4U90d7VPsSA,Stephanie Y.,3.0 star rating,"I echo Meg's sentiment this place is 2.5 stars but, I'm rounding up since this place isn't bad just not necessarily my cup of tea. This place is just too damn expensive and dark. Super cute wine bar/whole in the wall. I would imagine capacity would be 15 people. Great music playing (R&B slow jams), SUPER DARK, as in I need to put my hands out in front of me to see if my friend is still there (not really but, this place is dark).  I didn't see any beers on tap but they have a great selection of wines and champagne/wine concoctions. I went with the $13 champagne drink which was a full glass and was tasty but, I just get heartburn thinking about dropping that much money on an after dinner drink and I know that is the norm but, I just personally prefer to buy a bottle and get my money's worth. You definitely are all up on your neighbors and their conversations but, since the music is kind of loud not the biggest deal.Everyone else got nuts, we didn't get nuts. Sad.",Upholstery Store: Food and Wine,4.0 star rating,$$,"American, (New),, Seafood,, Cocktail, Bars"
81,I91PMBDIr1kHRNjrc-er8Q,William W.,5.0 star rating,My Boy is the bartender. DJ CodE!  So the place is great!,Upholstery Store: Food and Wine,4.0 star rating,$$,"American, (New),, Seafood,, Cocktail, Bars"
82,7ar_5VOf05EjRYV7AkxBXQ,Liz G.,5.0 star rating,"Ambiance was lovely. Our waitress, Tory, was the bee's knees! We'll be back to hang with her!",Upholstery Store: Food and Wine,4.0 star rating,$$,"American, (New),, Seafood,, Cocktail, Bars"
83,wOqJlL3V3y9eql6XSmRegQ,Janet H.,1.0 star rating,"We thought we had found a hidden gem. Despite having a really great first dinner there, my second visit was disappointing and uncomfortable to say the least. The air conditioning was malfunctioning, the waiter was incompetent, the bar tender had a horrid attitude, the plates were tiny (although Delicious) and the tension throughout the evening left us feeling hungry and resentful. No effort was made whatsoever to compensate for the fact that the place was stiflingly hot. This being said, I will  go back in a few months, to see if the staff, service and experience improves.",Upholstery Store: Food and Wine,4.0 star rating,$$,"American, (New),, Seafood,, Cocktail, Bars"
84,QkQJE2GtUAxMto86ASpy1g,Brandon B.,5.0 star rating,"This is the best kept secret in the West Village right now.  Their wines by the glass are interesting and well curated and the food is amazing.  The ambience is unique and perfect.  I think the name is probably a little confusing (and they should consider changing it so people know this is a wine bar and restaurant).  Anyway, just an amazing find in the deep west village",Upholstery Store: Food and Wine,4.0 star rating,$$,"American, (New),, Seafood,, Cocktail, Bars"
85,GUocnctZh65JFNBjrTVEIw,Michele M.,5.0 star rating,"We had an amazing time at Upholstery this evening! The cocktails, food and service were fantastic. The octopus exceeded our expectations. The atmosphere was welcoming and cozy. The staff was attentive and extremely friendly. Definitely returning!!",Upholstery Store: Food and Wine,4.0 star rating,$$,"American, (New),, Seafood,, Cocktail, Bars"
86,a1mZF9zFmg5VY9YOTFNzJw,Alexandra T.,4.0 star rating,"This wine bar/ restaurant/ cocktail bar is among the top spots in the West Village/ Upper Tribeca area to get appropriately-priced glasses of austrian and german wines, in conjunction with expertly-prepared small plates.  The dressed oysters are a bit of an indulgence at $7 for 2, but the accoutrements include caviar and uni, so you are definitely getting your money's worth.  The other food offerings include a cheese plate sourced from Murray's and some gorgeous sardines, grilled and plated with a vegetal puree.  The host, waiters and bartenders know their booze, and can easily recommend cocktails (anything with gin and creme de violette is good with me) or wines by the glass for any palette. If only there were more seats at the bar....  then again, there'd be too many people and the charm would be gone.  This is a spectacular neighborhood spot that just needs to be conscious of prices, and it will buy itself a local loyal crowd for life.",Upholstery Store: Food and Wine,4.0 star rating,$$,"American, (New),, Seafood,, Cocktail, Bars"
87,hYNK7jItyDZ8RgIcST8jeg,Kerthy F.,5.0 star rating,"This is a fantastic restaurant with delicious cocktails and exciting, modern food. I think the team might be Austrian which would explain the dry Liebfraumilch's by the glass and the raspberries in a spring salad. ""The hills are alive with the sound of music!""But really, this is a delightful, romantic place, perfect for a sexy date or cocktail. It's not too loud and the charming lighting makes everyone gorgeous. Plus you get to watch the chef and his team make spectacular (that squid pasta with coconut milk and bergamot!!!? Holy crap that's good) food.",Upholstery Store: Food and Wine,4.0 star rating,$$,"American, (New),, Seafood,, Cocktail, Bars"
88,WapgGIEjrkxKIyKaW6oPdg,Helena W.,4.0 star rating,"You would never know this place exists if you weren't walking home from work or running or shopping or taking a stroll with a date in the heart of West Village.  This isn't the type of place where there is a scene or you want to be seen....look elsewhere.  It's a place where you take your date and you want to have a meaningful convo or trying to get your groove on.  It's a place where you just need to take a break from all the noise in the world.Lights are dim, music plays, order your cocktail/wine...sit back and relax.",Upholstery Store: Food and Wine,4.0 star rating,$$,"American, (New),, Seafood,, Cocktail, Bars"
89,fCphGrJ1Ovx9d_NAbzMt9Q,Louis R.,5.0 star rating,"Sexy.  Dark.  Cozy.  Ideal for dates.Nice selection of wines and strong mixed drinks.  Hip, attentive and affable bartender.Manhattan drink prices...i.e., expensive but worth it.Baby-making tracks playing.  Hello Barry White.Its in the West Village and can't be easily found...although once you find it, its money.I'm moving in.",Upholstery Store: Food and Wine,4.0 star rating,$$,"American, (New),, Seafood,, Cocktail, Bars"
90,2yf7rIfvPNZ0TLxMhm301g,Vicky K.,5.0 star rating,"I came here for drinks with a couple of friends late in the evening around 930pm and this place was packed! The atmosphere was very relaxed and surprisingly not loud or noisy at all. We ordered a round of cocktails- I had a customized cocktail off (if you order ""The Owner's Manual"") and it was delicious! The bartender was wonderful- he was very attentive and even came over to apologize when the drinks too a little longer than usual to come out. My friend ordered the Fairy Godmother which was tasty and refreshing. The desserts are also amazing- the chocolate pot de creme with just the right amount of salted caramel peanuts and the elderberry panna cotta. Would totally come back here for more drinks and try out the actual food!",Upholstery Store: Food and Wine,4.0 star rating,$$,"American, (New),, Seafood,, Cocktail, Bars"
91,L_tiRILuKHwlDcc8hS7a0Q,Walter B.,4.0 star rating,"Nice cozy neighborhood atmosphere, excellent service, good wine selections and tasty food.",Upholstery Store: Food and Wine,4.0 star rating,$$,"American, (New),, Seafood,, Cocktail, Bars"
92,P5xZMzwAiMgGt6NP-XCP7w,Brigitte G.,5.0 star rating,Left perry st in a hot second and ran into this place. Amazing vibe. Even better cocktails. Def return.  Must check out neighborhood jaunt. How did they make such a tiny space look sooooo big? Cute outside back patio for lovers....,Upholstery Store: Food and Wine,4.0 star rating,$$,"American, (New),, Seafood,, Cocktail, Bars"
93,KHiB2hqo911M8sTPPd1shg,Megan C.,4.0 star rating,"Cozy Wine Bar - Same Owners as WalseLove the strudel here, and always a friendly bartender.  When you're tired of going to those obnoxious loud, trendy places this is a great little spot.  Located near the West Side Highway/park, it's a great place for a glass of wine before an evening stroll.  Though the wind picks up in the winter months (it's freeeeezing) would be a great spot to bring a group of friends, or a date any time of the year.  Rusty Knot is just around the corner (has pool table...), and Jean George's restaurant is within walking distance too (I highly recommend going there).  I've never had the food here, and usually have a glass of champagne.  Again, good cozy spot for conversation. Cute table in the back that looks out at a garden.Date Rating: 8Pick up Scale: 1 (definitely a neighborhoody/BYOF Bring your own friends kind of place)Strong Suggestion: have other plans nearby.  Try the chorizo tacos up at Automatic slims (they're tasty!) yelp.com/biz/automatic-s… (but slims isn't fancy just grab the tacos and go).",Upholstery Store: Food and Wine,4.0 star rating,$$,"American, (New),, Seafood,, Cocktail, Bars"
94,-NTBTeBoI92WPuGpC6AdgQ,Mr. Voracity I.,4.0 star rating,"The Upholstery Store is one odd bird, and should totally be down in two-star land.It was actually a former upholstery store, but they updated the interior which, though small, manages to have several pockets of intimacy and really nice dark-but-not-scary lighting.   The wines are mostly Germanic themed, and by no means the best specimens of each varietal, but still they hit the spot.  And cheese plate has only okay cheeses but manages to fit the bill too.Basically, for no logical reason, I kinda love this place.  It gets nothing perfect, but charms it's way to true wine bar goodness.The gentleman running the bar knew his stuff, and was super nice and genuine.  In addition to wine, I had a sangria-ish cocktail, which was tasty, and one of the several cocktails that he cleverly named after upholstery (no joke), and I was totally charmed.I would totally give it a 5 star (which is rare for me), but the wines were only okay-good and the cocktail was more interesting in theme that reality.  Still, this is an awesome place for a first date or meeting one or two friends.  It is truly intimate yet still fun.VoracoMeter=6 (out of 10)",Upholstery Store: Food and Wine,4.0 star rating,$$,"American, (New),, Seafood,, Cocktail, Bars"
95,odi_m2SsaDzSWF4LnNYwAA,Kathy H.,3.0 star rating,"This is a 3 only because of the bartender and the great ambiance.A little sliver of a place, quite lovely and enchanting.  Miguel, the bartender/former mixologist @ Apotheke, who kept me company while my friend was on his way, was also quite lovely.  Alas, the reds available by the glass were sorely lacking.  This would be the perfect neighborhood wine bar if 1) it was in my neighborhood and 2) the wine selection was tastier.   We would have stayed for another glass before our dinner but I couldn't do another glass of ""meh""!  If only they served better wines or other drinks, then I'd have a new favorite wine bar to take friends to.  Alas.... alas....",Upholstery Store: Food and Wine,4.0 star rating,$$,"American, (New),, Seafood,, Cocktail, Bars"
96,e2Qoe-N3KuVPvhEHJKQLqA,Elizabeth S.,5.0 star rating,"Food was delicious. Duck noodle dish was a flawless combination of flavors and textures. It was also beautifully plated. Our wine of choice was Austrian and perfect (they have a great wine list,but I have a soft spot for Blaufrankisch). Service was impeccable. We had an amazing time. We will definitely come back.",Upholstery Store: Food and Wine,4.0 star rating,$$,"American, (New),, Seafood,, Cocktail, Bars"
97,7jdI4xD01gZzWA2AX2e9yw,Cassie R.,3.0 star rating,"If you like that ""hole in the wall"" feel.. you'll really enjoy this place. Reminds a bit of the alley wine bars in SF.   We went late on a Sat. night and so it wasn't too many people but I can see the establishment getting loud quickly.  The bartender was great and the wine she suggested was right on for the evening.  The back get a bit loud with the music but the front is available for a pleasant conversation.  Dark and sultry.  A nice way to end the evening.",Upholstery Store: Food and Wine,4.0 star rating,$$,"American, (New),, Seafood,, Cocktail, Bars"
98,DUX6Qsjo-3ypvVJ9PPv9yw,Jerome Y.,3.0 star rating,Romantic seating for two in back. 13 bucks is the cheapest glass.,Upholstery Store: Food and Wine,4.0 star rating,$$,"American, (New),, Seafood,, Cocktail, Bars"
99,gIZu7tDQGvwIrpiEd3b8tg,Marin G.,3.0 star rating,This place is funny. Very cozy and the drinks are good albeit a bit pricey for walking so far west. I went on a weeknight for a drink and it was empty but I could see this place getting really crowded with many couples on a different night when it's not as cold.,Upholstery Store: Food and Wine,4.0 star rating,$$,"American, (New),, Seafood,, Cocktail, Bars"
