,user_id,user_name,user_rating,user_text,restaurant_name,restaurant_rating,restaurant_price,restaurant_type
160,-HXsQ7SBkwk2agJ1nBZ68w,Jolene H.,4.0 star rating,"So happy and thankful for this joint that is a great representation of what fresh, spicy Asian noodles should be! Worthy of the long line, the noodles are freshly made, thick width- wise and al dente. They remind me of ""mee hoon kueh"" in Singapore. Great generous portions of beef and veg with salted vegetables and spices to oomph up your day. The broth is rich and savory albeit a tad oily. This standing-only joint allows you to slurp the spicy noodles while watching how your bowl of savory goodness was made through the glass panels. The soy bean drink is not the traditional Chinese one - too sweet and taste like the kind from the supermarket. Glass jelly drink sends me right back to childhood in Singapore (yay Yeo's!) Definitely be back! (And with out of town friends/ parents no less!)",Very Fresh Noodles,4.0 star rating,$$,"Taiwanese,, Chinese,, Noodles"
161,_M4cWBaM86BFwQAjEqLSag,Amy C.,5.0 star rating,Super satisfied with my noodles today. We got 2 (lamb and beef) and were super happy with both. Noodles are clearly fresh and very q. Broth is super flavorful. The cucumbers are a must get - super yummy. I used to go to xian a ton but might have to switch over to very fresh. The guys at the front are also fantastic. Very friendly and engaging. They also work really quickly to ensure the wait time is reasonable. Two thumbs up!,Very Fresh Noodles,4.0 star rating,$$,"Taiwanese,, Chinese,, Noodles"
162,yyU9MewXfNq4F1r5VkO0FA,Paul V.,3.0 star rating,"Tucked away in the ever popular Chelsea Market, Very Fresh Noodles dishes up exactly that; and while I can appreciate the loyal following that they've built and enjoyed their freshly made thick and chewy noodles, the peripherals of my beef bowl turned me off a bit to the noodles themselves. Star 1: How were the service and atmosphere?If you can time your visit in such a way that you're not bogged down by a 45 minute line, the service and atmosphere at Very Fresh Noodles are great. Sure, there's no seating close by, but watching as noodles are crafted from dough to finished product is a great way to burn time before digging into your beef or lamb dish. Star Granted. Star 2: How were the portions relative to the cost?Very Fresh Noodles are also Very Expensive Noodles, and it'll run you $13.00 for a beef or lamb cumin bowl. That's not unreasonable given what ramen goes for these days, but it's worth pointing out. Star Granted. Stars 3 and 4: How was the food?So here's my dilemma. The noodles themselves at Very Fresh Noodles were excellent, with a great pillowy consistency and a chew that had me enjoying every bite. I would have loved these in virtually any other setting, but the beef and associated oils and greases that came with the brisket took away from the experience a bit. For starters, the brisket was on a next level of fattiness, and the pockets of fatty slime that made their way into my bowl were just a bit off-putting even for someone like me who typically eats that stuff right up. Additionally, while I ordered a dry bowl versus a soup, there was a full couple of centimeters of oil in the bottom of my bowl which, while flavorful, took away from the quality of the noodle and the flavor of the brisket. Single Star Granted. Star 5: Would you eat here every day if you could?I'll be back to Very Fresh Noodles, but with the hope that they can tone it down a bit with respect to the oils in their dishes. No Star Granted.",Very Fresh Noodles,4.0 star rating,$$,"Taiwanese,, Chinese,, Noodles"
163,Eu9W6g-zUHCf4VT5vqZwKg,Vivian D.,4.0 star rating,"When it's freezing in the dead of winter and you've been waiting outside for 2+ hours this is the place to warm you from the inside out! Just wish there was a place to sit! Very fast service, hand pulled noodles right in front of your face. I got the beef soup, yes super greasy and quite thick soup. I got mild and even that was a bit spicy, but really good. HUGE noodles, tender beef that falls apart.  No complaints!",Very Fresh Noodles,4.0 star rating,$$,"Taiwanese,, Chinese,, Noodles"
164,i0W2OcmsDxLbT_knEpPIjg,Moni D.,4.0 star rating,"Loved the super fresh creamy noodles! The broth is rich and layered with deep flavor. For someone who's not that into noodle soup, I'm definitely a fan. I Love that there's a vegan option too. I guess I'll have to use it as an excuse to come back to NYC!",Very Fresh Noodles,4.0 star rating,$$,"Taiwanese,, Chinese,, Noodles"
165,8IE2DM18VfQpO5Sq8JPjwQ,Ashley P.,5.0 star rating,"Very Fresh Noodle doesn't waste time beating around the bush. These noodles are fresh AF, but like all good things, they take time, so be prepared to wait. LA MEI TAIWANESE BEEF NOODLE SOUP. Delicious! Handcut beef chunks mixed into a savory broth allow the noodles to be the star of the show. I will definitely have to go back soon! I can't stop thinking about them.SEATING. Unfortunately like the rest of Chelsea Market, there is limited seating nearby, so I recommend getting there during the off hours if you want to sit down.",Very Fresh Noodles,4.0 star rating,$$,"Taiwanese,, Chinese,, Noodles"
166,KyWo-Z98vKeNBzdx5BB5nA,Ellen Y.,3.0 star rating,"Obviously, came here after seeing pictures on Facebook and Instagram of the hand pulled noodles. I wasn't that impressed. The noodles stuck together, and they were definitely too thick and did not cook all the way through. I did appreciate how there is a mild option though, because my meal would've been ruined if I couldn't handle the spice. Will have to say though, the beef in my beef noodle soup was great! Be prepared for a long line that doesn't move.",Very Fresh Noodles,4.0 star rating,$$,"Taiwanese,, Chinese,, Noodles"
167,ppcFkjQ-5JPSn7hIP9tajQ,Gabby U.,4.0 star rating,"Wow these noodles were amazing! They make them fresh right in front of your eyes. Someone takes the dough that was prepared earlier that day and stretches it out to create these long and yummy hand-pulled noodles. They then cook the noodles and add it to a soup or keep them dry (relatively dry since there's still a good amount of sauce on them). I got the traditional beef soup (can't remember the exact name) but it was so flavorful and aromatic. There were so many chunks of tender beef in my soup that two people could've eaten from it. I definitely want to go back to try the tingly lamb noodles dry since I've heard great reviews about it. The only issues you might run into is waiting in a super long line and finding seating. I passed by at around peak lunch time (anywhere from 12-1:30/2) and decided to come back later since there was no space. They don't actually have any seating since they're a stall inside of Chelsea Market. There are some small tables with chairs to the right of the stall (past the glass doors) , but there are only a few and they are definitely taken up by patrons from other food stalls (it's located in the most heavily congested food area in Chelsea Market). I would recommend going either before the lunch rush or after since it's a bit difficult to walk around with a hot bowl of soup and people swarming all around you trying to get their food for the day. The noodles also taste best when you eat them right after purchasing so keep that in mind when passing by if there are no seats available.",Very Fresh Noodles,4.0 star rating,$$,"Taiwanese,, Chinese,, Noodles"
168,AI1rYT1Hu-sIvKxGL0jW_A,Emily J.,4.0 star rating,"It's good just not the best. The noodles are definitely different here. They're sweeter and thicker. I opted for the Taiwanese Beef Noodle Soup and found while I thoroughly enjoyed my beef noodle soup, I wasn't a huge fan of the noodles. I'm letting Xi'an keep my heart.However, they did kill it with the broth and beef. Soft, melt-in-your-mouth worthy beef and soup that is slightly tangy and spicy. Great food for a low budget cost, $9.99.A secret spot for pretty okay beef noodle soup. Can ya find it? P.S : there is no dining area, y'all better have some g'luck and hope you can snag a table and a few chairs.",Very Fresh Noodles,4.0 star rating,$$,"Taiwanese,, Chinese,, Noodles"
169,S83z1fSXYCAUIXVJdTc8zw,Alice P.,5.0 star rating,"I saw a video for this noodle shop on Facebook. Very Fresh Noodles opened earlier this year, and I suspect it will become a big tourist attraction, if it isn't one already. Located at the main(? Not the entrance across from Google) entrance of the Chelsea market, it's a kiosk with a guy hand-making the noodles right in front of you. The freshest noodles possible! The whole kiosk is surrounded in an aura of aromatic spices. I ordered the Taiwanese beef noodles and am already craving more. It has flavors of Szechuan pepper and star anise, two of my favorite spices. The flavors are intense without being overwhelmingly salty or spicy. Just very flavorful. The noodles remind me of drunken noodles--wide and flat. Only, unlike drunken noodles, they're also very long. They also have vegan noodles. The noodles are flour, and are not gluten free. They have a third cumin-centric noodle that you can get with beef or lamb. The beef was so tender! For my fellow Korean food lovers, it reminded me of the beef you find in  (yukgaejang), but even more tender. I don't even really like vegetables but the bok Choy and small slices of celery really soaked up the broth well. I stood in line for maybe 5 minutes (went on a Sunday around 3) but it took a half hour for the noodles to actually come out. In the meantime, I explored the rest of the market. I really like the Baskets store, as well as spices & tease. There isn't any seating in the immediate vicinity, but venture further into the market and you'll come across a hallway with some tables and chairs. I can't wait to come back to New York and go here again!",Very Fresh Noodles,4.0 star rating,$$,"Taiwanese,, Chinese,, Noodles"
170,sjwfMqjmoByEgN5UUPXFMw,Vivian T.,5.0 star rating,"This is one of the most authentic Taiwanese beef noodles I have had outside of Taiwan. The brisket is succulent, soft and melt in your mouth delicious. The noodles are hand pulled and wonderfully al-dente and yummy. The soup is complex, tastefully spicy (can get it mild) and I really appreciated the pickled mustard greens that accompanied each amazing bite.  They also offer a vegetarian version of noodle soup with mock duck. Come and watch them make fresh hand pulled noodles (almost like Asian pappardelle) and stay for an delightful bowl of noodles.  This place is amazing and I cannot wait to come back.",Very Fresh Noodles,4.0 star rating,$$,"Taiwanese,, Chinese,, Noodles"
171,LGVFqv33uMroY1SyKbGm_Q,Nicky F.,3.0 star rating,"Found this place literally by following its smell (lol). The person taking my order was probably very tired as he got my order wrong even after I tried telling him what I wanted 2-3 times. He was scrambling to take my order and pack up other people's food at the same time. He was helpful though as he helped me choose the dish I should order. The lamb ran out the day I came, it was close to 9 PM (closing time) so I guess that's why. This probably means lamb is more popular than beef. The noodles are made right at the spot, you can see the dude slamming the dough on the table and pulling it into strings. I ordered the biang biang beef noodles and it was quite good. I don't know if the noodles were a little too soft and soggy because I left it in the bag for a while before I ate, or it was just like that. The noodles just lack the texture that authentic Chinese noodles have. The sauce compliments the dish well, they didn't give too much of it (or perhaps it was soaked up by the noodles). It's not too spicy, so don't be worried by it - and I am the type of person that can't take any spice at all. The beef was amazing, though. They were super soft and tender and very juicy. I would've given this place a 4 star if it wasn't too pricy and if the noodles were a bit better. Over all, a good place to check out - will update if I ever go back and try the lamb dish, maybe the noodles are better during the day.",Very Fresh Noodles,4.0 star rating,$$,"Taiwanese,, Chinese,, Noodles"
172,SeuqN43qamLr1aDiUj7s0g,Stella J.,5.0 star rating,"I had seen very fresh noodles on Instagram and I knew I had to try this place out! Who doesn't love fresh hand pulled noodles? I obviously do! It's tucked in a corner in Chelsea market right next to a dole whip station. The menu is small but they focus on the things they are great at, which is the noodles. I opted for the dry beef cumin noodles. There was a wait, the cashier said about 20 mins which sounds reasonable since the guy is making my noodles to order. The beef cumin noodles were definitely tasty, had a slightly spicy taste to it but the fresh noodles were the standout. So fresh, chewy and delicious! Some of the best noodles I've had. The beef was also amazingly tender and soaked up all the cumin flavor. I'm drooling just thinking about this bowl of noodles! I wish they were in sf otherwise i would be there all the time. Total for 1: $12",Very Fresh Noodles,4.0 star rating,$$,"Taiwanese,, Chinese,, Noodles"
173,QUpe3odf5fuTM3x-ZVrVwg,Ramesh D.,3.0 star rating,"Stopped by here the other day and had the tingly cumin lamb noodles in broth. It was late enough in the afternoon that there was no line and I didn't have to wait very long for my order. Service was great and I was satisfied and reasonably happy with the meal, but I was a little disappointed giving my high expectations from reading some of the other reviews. The noodles are definitely a little bit difficult to eat but that's simply the nature of hand-pulled noodles, plus you really need to eat them very quickly before they cool down and start to congeal. At any rate I'll probably be back again to give it another whirl, but if you are really looking for top tier hand-pulled noodles I think you're still better off making the trek down south to Chinatown/LES.",Very Fresh Noodles,4.0 star rating,$$,"Taiwanese,, Chinese,, Noodles"
174,b0x4HrjoB6Mo47G5bJN0rw,Irina D.,4.0 star rating,"I've seen a video of Very Fresh Noodles several months ago and made it a point to bookmark it to try at a later point. Fast forward six months and I suggest to my fiancé to come here and try a bowl of these noodles, he happily complied. We came here this past Tuesday night around 6:30 pm and Chelsea Market was quite empty at the time.  It was probably due to people heading out of town early for Thanksgiving, or working late so they could do the same the following day. Very Fresh Noodles is located closer to the 10th Avenue entrance and since we entered from 9th Avenue, it took us a bit to get there (although that resulted in us getting some delicious halva from another stand).There were several people eating by the stand when we got there and a few people looking at the menu. I got the the vegan noodles with mock duck, bok choy and shiitake mushrooms (dry and spicy), while the fiancé got the tingly cumin lamb in a soup (mild). Since there was almost no wait, both dishes were ready in about five minutes I definitely enjoyed my dish, the noodles were very fresh as promised and the sauce they were in was delicious. I've never had duck so can't compare the mock duck to anything, yet it tasted very meat-like, to the point where I was worrying that I was eating actual meat. It was very good nonetheless and the combination of celery and bok choy contributed to the flavor. The fiancé really enjoyed his dish and we were both quite full after finishing it.Perhaps it was because I came here with very high expectations or that I had noodles made in a very similar fashion from another place , which I happened to enjoy more, but I was not blown away by this place. It was still very good, and definitely worth a try. I am glad we were able to try it when it wasn't too crowded and I will probably be back again.",Very Fresh Noodles,4.0 star rating,$$,"Taiwanese,, Chinese,, Noodles"
175,OcnCozJO-V70heg0Aqn1WA,Edwin L.,2.0 star rating,"A bland version of Xi'an's Famous Foods. Came here for lunch one day and had the tingly lamb noodles in soup (spicy) and was pretty disappointed. First, the soup was bland, had no depth of flavors, and the only thing you really tasted was chili oil. The noodles were pretty good, nice and chewy, however they didn't adhere to the sauce/broth making the noodles flavorless as well. Finally the lamb tasted as if it was just slices of boiled lamb, with none of the cumin and other tingly spices advertised. Save your $14 and go to Xi'an's.",Very Fresh Noodles,4.0 star rating,$$,"Taiwanese,, Chinese,, Noodles"
176,IBxqPMup0VkASi6MT5KBrQ,Justin Y.,5.0 star rating,"Mac Dre on the playlist??? I felt like I wasn't even on vacation and back in the Bay Area. Very popular and well known noodle stand in Chelsea market. I feel like they should change their name to ""Very Long Noodles"" as that is what they are known for. The line wasn't too bad when we got there, but we still waited around 40 minutes. I like how you can see the chefs cooking and especially the ""Noodle Man"" with his moves when making the noodles. These guys all work hard and deserve all the success they've had. I ordered the beef soup and got it medium spicy. They don't have a no-spice option because it changes the flavor of their recipe. The noodles are one of my favorite and you can't find this offered at too many places in California. Their beef was very tender and just fell off with each bite. Next time I'm visiting NY I'll try one of their other dishes.",Very Fresh Noodles,4.0 star rating,$$,"Taiwanese,, Chinese,, Noodles"
177,U-GDQZ0m-Dj5iNdSIEDt-g,Justine S.,3.0 star rating,"You could literally smell the noodle soup from the outside corridor, and that is all I needed to try to find where this noodle stand was hiding. They seemed to have a pretty good number of fans hanging out and waiting for their food, even though there were no tables nearby. The noodles were definitely fresh made, and the final product was so hot that I wanted to find the first available table to set the bowl of tingly cumin lamb noodle soup down.The noodles, broth, everything was delicious and flavorful. The spiciness level was perfect, and the best part was that it wasn't there to try to burn your entire mouth. Noodles were nice and chewy. The only small problem that I have is that at $14 it seemed a bit pricey for the size but then again it's handmade lamb noodles in Chelsea Market.",Very Fresh Noodles,4.0 star rating,$$,"Taiwanese,, Chinese,, Noodles"
178,5ToOrOur3KNZeJZDQFHa7A,Valerie C.,5.0 star rating,"Worth all the hype!We essentially waited 40 mins for our noodles on a rainy MDW Monday, despite getting in line around 12:30 pm (an hour after they opened). The operation is super tight and only a few people strong, so I understood why it took so long to make these ""very fresh"" noodles ;)We ordered a bunch of beef noodle soups and spicy cucumbers and grabbed a table in the main hall. Every so often we would check up on them and they were pretty realistic with the time. We maaay have had a few tacos at Los Mariscos while we waited :PThe noodles are on point. The beef is super tender. The broth is probably the best part of the meal and you can literally smell it from halfway down Chelsea Market. This stuff is legit. The cucumbers are also redonks good and are more sweet than spicy. We are huge fans and can't wait to return!",Very Fresh Noodles,4.0 star rating,$$,"Taiwanese,, Chinese,, Noodles"
179,SJTrOg6DGHAC9y2LeW5XKg,Betty M.,5.0 star rating,"Randomly came across this place while my BF & I were visiting NY and Chelsea Market. There are so many options to choose from in the market that I wasn't able to choose one. First world problems: too many options haha. Finally decided I was in the mood for noodles, so we stood in a 5 minute line to get these noodles.Read some reviews online and saw that the beef noodle soup was popular, so that's what I ordered. My BF got the lamb noodles. After waiting for about 10 min, we got our food (quick, polite service). I wish there was a place to sit and eat them, but there aren't in that specific area. We walked out into Chelsea market and found a random table we could sit down at.My BF & I both remarked ""omygod"" when we took our first bite. I don't know if the low expectations of ordering noodles in a stand played into it (probably), but I was definitely not expecting the flavor that came with the noodles! The beef was tender, the soup was sooooo flavorful, and the noodles fat & chewy, my favorite kind of noodles. They actually give you a big portion for a pretty reasonable price - I was so full by the time I finished. Pretty quick, no frills shop, but great flavor. Would return!",Very Fresh Noodles,4.0 star rating,$$,"Taiwanese,, Chinese,, Noodles"
180,3e7jmLo5zjH6NmeMef5yrg,Juju L.,5.0 star rating,"I was so excited to come here and I was not disappointed. It was really cool to see the live action of how our noodles are prepared. I got the dry cumin beef noodle spicy and it was really good. It wasn't spicy at first but once you keep eating it you can definitely feel it. You may think that it is a bit pricey. However, the portion is actually really big. I would definitely recommend this place!",Very Fresh Noodles,4.0 star rating,$$,"Taiwanese,, Chinese,, Noodles"
181,WIYRnrwFiE4C8ubiXGt6LQ,Ben W.,3.0 star rating,"Very disappointing flavors and not reminiscent of Taiwan at all...My brother was in town and craving some soup noodles. The weather was absolutely gorgeous and Very Fresh Noodles had been on my list for a while, so I figured it'd be a great Chelsea Market / High Line outing. When we arrived, the line was a bit long, about 10 people in, and while the line moved very consistently, it took a bit of time before we placed our order.Given the wait, I'm not surprised it took a while for us to get our food, but over 20 minutes to pull and boil some noodles and put them into some broth? Way too long. Luckily it gave us enough time to scout out tables and secure a seat to slurp the goodies.We went with the beef noodle soup, dry cumin lamb noodles, and the cucumber salad. First off, the noodles were actually pretty good. The QQ texture and portion size were spot on. However, the flavors were just off. The beef noodle soup was unlike any beef noodle soup I've had. Star anise is in my opinion critical to beef noodle soup and theirs almost tasted like a mushroom broth versus anything with actual meat. The pieces of beef were also a bit dry for a stewed soup, and I think my disappointment in the flavor overwhelmed any other opinion. The dry cumin lamb noodles were just okay. The flavors weren't strong, and I'm comparing it to Xi'an Famous Foods and theirs just didn't compare. Lastly, the cucumber salad was not memorable. Maybe I'm just used to XFF, but again, the cucumber salad there is way superior.Given the location, lack of seating, wait, off flavors, and higher prices, I'm passing next time I find myself at Chelsea Market.",Very Fresh Noodles,4.0 star rating,$$,"Taiwanese,, Chinese,, Noodles"
182,5uJN1uj254r4Q7W5wWZOmw,Irene H.,5.0 star rating,"This is a little stand inside Chelsea Market, near the high line. I've only been here once and they were literally out of everything except then vegan noodles; I was a little disappointed since I really wanted to try their beef noodles but I was NOT disappointed with how delicious the noodles, the broth, the veggies in it were. So so so very good; I was craving a second bowl but thank god they were just sold out so I wouldn't over eat - again. You can watch them make the noodles and the texture is just perfect; it soaks up the flavors perfectly and I just can't do this any justification by attempting to describe the flavors - go try it! I'm definitely beading back to try their beef noodle soup!",Very Fresh Noodles,4.0 star rating,$$,"Taiwanese,, Chinese,, Noodles"
183,Q7ttPgG_pzdLbzoXLP9mvg,Quoc L.,3.0 star rating,"Biang biang! I shot it down. Biang biang! Noodles hit the ground. Biang biang! That delicious sound. Biang biang! My baby shot me down.As you may be unaware, ""biang"" is the onomatopoeia when in the process of hand-pulling noodles, they're smacked against a hard flat surface. I think it's a real honor and treat for anybody in their lifetime to have the chance at tasting a dish that gets better with craftsmanship. With that said, if a robot with hands pull the noodles, is it still authentic?""We have rights and emotions too!"" - Robot. SHUT UP ROBOT! *Robot tilts head down in sadness*Anywho, if you've never had the opportunity for hand-pulled, you're in for an experience. Despite the compact workspace, you'll catch a glimpse of the chef working his hand-pulling magic. Might as well, because you'll be waiting for your noodles for close to an hour... yeup. There's other stuff in the food hall, so grab a beer or something in the meanwhile.The host recommends getting the broth, but I suspect a lot of patrons are here for the ""endless noodles"". You won't be able to witness your food in it's infinite glory if you decide to take this recommendation, so follow your heart and/or stomach.As for taste... it's good. I wouldn't consider this anything spectacular outside the realm of hand-pulled noodles. It is very fresh, as the namesake goes, but I think this actually hurts the dish. I bought the cumin broth and all the flavors are there: spicy and more spicy, but the noodles haven't had time to mingle with the broth. Pulling out (hehe) the noodles aren't laced with soup. It's a two step process where I have to eat the noodles and sip the broth separately. It's a little disheartening.Biang! You're gonna carry that weight.",Very Fresh Noodles,4.0 star rating,$$,"Taiwanese,, Chinese,, Noodles"
