,user_id,user_name,user_rating,user_text,restaurant_name,restaurant_rating,restaurant_price,restaurant_type
72,wcnISSEOZPL-Z2S_WroXQA,Amy N.,5.0 star rating,"JUST TAKE MY MONEY!! I would not mind eating this 3 times a day. I'm not a fan of wide or thick noodles bc quite frankly I just don't like it and the extra starch/ flour makes soups thick. Their noodles are wide but it's not thick probably cuz they smack the crap out of it lolll. I ordered the Taiwanese beef noodle soup. The beef was so tender! It actually melted in my mouth! It's so tender that it breaks into several pieces when you pick it up too quickly with your chopsticks. The broth is everything I ever asked for! It's seasoned well and it's not greasy! They even add sour preserved cabbage in it (that's pretty authentic Taiwanese beef noodle bro), anyways it cuts the creaminess of the broth so you don't get sick of it. Another worthy mention is their cucumber salad! I ordered 4 to go lmfaooo. It's like candy; it's sweet yet sour and a slight kick from the hot oil! It's so crunchy too omg! Yeah just try it, the thing is like $4 or something.",Very Fresh Noodles,4.0 star rating,$$,"Taiwanese,, Chinese,, Noodles"
73,q9RdYH-tFiJsAL9yQpFlXA,Diane K.,5.0 star rating,"It is not a hidden gem anymore...and hands down it's one of the best place in Chelsea Market. It's located at a corner across from the seafood place towards the middle of the building, oh...IT'S A CORNER GEM! But everyone seems to know about it because there is ALWAYS a line. It is so popular among all nationalities which is interesting but awesome! The reason people love this place is probably because of the spices. Sichuan peppercorn and loads of cumin in the soup base. You can choose mild or spicy. Each bowl is just too satisfying. Although it is on the oily side due to the chili, it certainly would leave you so fulfilling - both the portion and the taste. They have what I would say is the CLOSEST authentic TAIWANESE beef noodle soup in town (Not comparing to Flushing in Queens). If you want to get a taste of the Taiwanese style noodle soup, GET IT HERE. It's got picked mustard, cilantro, scallions, and the braised beef that melts into your tongue. For Taiwan natives, just do know that they put more cumin and Sichuan peppercorn into this broth because it's their style.I have to credit the dude (owner) who always makes the ""biang biang"" noodles. From beginning when they opened the shop to now, it's still him! He has became the true master of making THE ART. I see that he tries to make it amusing and artsy...which makes the whole experience of ordering food from there great.",Very Fresh Noodles,4.0 star rating,$$,"Taiwanese,, Chinese,, Noodles"
74,05Zu0J-yOmbo6Bxb2UtBnw,George L.,5.0 star rating,"It's inside Chelsea Market.  They are known for their beef noodle soup.  The noodles are hand-pulled too.  The noodles have a good chew, but don't dawdle or your noodles will soften.  The beef is very tender (think all-day crock pot).  You can get the beef noodle soup either regular or spicy.  I went with spicy, and it wasn't too spicy.  It was a good amount of beef and noodle.  I did not get a chance to try lamb cumin noodles.  I didn't get a chance to get to Xi'an, so I can't compare it. As of fall 2017, it looks like they are remodeling/expanding, so for now they are in a small cart in the back.",Very Fresh Noodles,4.0 star rating,$$,"Taiwanese,, Chinese,, Noodles"
75,8bUXalC1bGBAnhugPePoKA,Elena T.,5.0 star rating,"Amazing noodle spot. Their name does not lie--you will get very fresh noodles and that's that. What more can I say? The beef noodle soup was extremely fresh tasting and light, despite all the hot chili oil floating at the top of the soup. Most places skimp on the meat topping but not here! They are very generous with the meat topping (spicy braised beef), you'll get a mouthful of meat in every bite, which I very much appreciate in a hot bowl of noodle soup.The lamb cumin soup was equally as tasty and satisfying. Next time I will have to try it dry (without soup), since I did find the broth a little heavier with all the flavors coming from the lamb. Definitely check this place out. You will leave overly satisfied, full, and entertained from watching the live noodle pulling!",Very Fresh Noodles,4.0 star rating,$$,"Taiwanese,, Chinese,, Noodles"
76,jPtpN2YSD1ABI7eM5kb-Nw,Carol D.,3.0 star rating,"Yes, this place is popular and hyped.My friends and I came here on a late Saturday afternoon and we were informed it would take a 45 minute wait to get our food due to them being backed up. We decided to stay because my friend insisted it'd be worth it.About an hour passed and we FINALLY got our food. We got the cumin lamb noodle, spicy beef noodle, and vegan noodle.Since we were hella hungry, the first few bites had us like OMGGGG SO GOOOD. After awhile though, we realized the noodles were too heavy with too much oil. The noodles itself were fresh and thick but a little hard to eat because it was extremely long. The lamb and beef pieces were good. Essentially my problem was with the broth LOL. Too heavy, too thick, and too oily that it sort of ruined the noodles for me. Also, prices were about $13-14 per bowl so it's not cheap. I probably won't be back here as there are other fresh noodle places to find in NY!",Very Fresh Noodles,4.0 star rating,$$,"Taiwanese,, Chinese,, Noodles"
77,TcFOcrSxp4pMZ1IyxTknWw,Andres S.,5.0 star rating,"Since I came to NY, I was craving noodles, like big time. Thankfully, here in the big Apple the choices are abundant! This little joint is located inside the Chelsea market and with all the food options available in there, this place always had a line. When I say little, I am being literal. I don't think the place has more that 200sqr feet and that's pretty much their kitchen. You must take your order to go and enjoy it at the outside comunal tables, standing or like me; just to go. The menu is very simple and straight forward; 3 different noodle options that can be dry or in a soup. They will take your order, name and that's it. You can see the magic happening as you wait for it. I went with the Vegan noodle option with ""fake"" duck meat. I got to the apartment and depend my order extremely excited and after the 1st taste I just went bananas! That broth was just delicious  full of flavor and most definitely fresh; The veggies, the ""fake"" meat which I would eat every day and of course the noodles . This was happiness inside a spon for over half and hour; yeah, I took my time and I'm very happy about it  My noodles crave was satisfied and my taste buds simply enlightened.",Very Fresh Noodles,4.0 star rating,$$,"Taiwanese,, Chinese,, Noodles"
78,mnmSQ2T4oSpX_BsiRXDb7w,Rita Y.,3.0 star rating,"Had to check this place out from all the hype on instagram. Honestly, there's nothing too special about these noodles, there wasn't much flavor and it's not comparable to the hand pulled noodles in flushing. You definitely need extra hot sauce, it'll add a kick to the dish. I would probably skip this stand.",Very Fresh Noodles,4.0 star rating,$$,"Taiwanese,, Chinese,, Noodles"
79,QoxBni9UIzEIvdjbgyaV7A,Christina G.,4.0 star rating,"The noodles are certainly fresh, and the spice is BALLER. Food: 3.75   Taste-4   Presentation- 3.5Atmosphere/Aesthetic: 4Service: 3.5Price/Value: 4Most dishes are between $10 and $15, and we got the Dan Dan Mian. Very fresh meat and noodles, decent portion size (we didn't finish it), and the spice is true to the dish. I gave the atmosphere a 4 just because it's located in Chelsea Market, which is a very posh eating place.Seating can be hard to come across though, as there's just a little bar area for Very Fresh Noodle. Line is really long but moved at a decent pace, and the food comes out really quickly. Price is about the same as you can find at other places, but the noodle dishes here are better! So def check this place out if you want noodles in Chelsea Market.",Very Fresh Noodles,4.0 star rating,$$,"Taiwanese,, Chinese,, Noodles"
80,ocfvTtqJ2XELdZ5fPR1g7g,Russ L.,4.0 star rating,"This is an amazing place for vegetarians. They have a vegan noodle option that comes loaded with seitan, veggies, and a vegan mushroom broth that is extremely rich and flavourful. The portions are enormous and can be split with another person if you are not a huge eater. Everything is seasoned well. The seitan (""mock duck"") is great. The food is fresh and made to order right in front of you. I found the broth to be a bit heavy and oily, but overall it was delicious. It is one of the best vegetarian soup broths I've had. This place is a great addition to the city and adds some competition to the other really good hand pulled noodle place in Manhattan.",Very Fresh Noodles,4.0 star rating,$$,"Taiwanese,, Chinese,, Noodles"
81,zU9nl4KHiW1MLIstL_8dXA,Emi B.,4.0 star rating,"The beef noodle soup is good I guess, but not really ""Taiwanese"" noodle soup.Very flavorful the soup base is almost a bit too think/heavy.Noodle is good, beef was very tender too, melted in my mouth!But $14 for a bowl of noodle soup? Not sure if it's worth it.This stand literally is the most popular one in Chelsea market (other than Lobster Place) on a Friday night all other stand was empty but this one has a long line!",Very Fresh Noodles,4.0 star rating,$$,"Taiwanese,, Chinese,, Noodles"
82,_VS04LGPYqDhmnjmn8wq-Q,Karen Q.,5.0 star rating,"The first thing that I did when I got to New York was frantically search for the best places to get hand pulled noodles. I came across Very Fresh Noodles inside Chelsea Market and lucky for me, there was no line. I've heard that this place can get very crowded during lunch hours so I would recommend either coming here earlier or later during the day (I went for dinner and there was no line).I ordered the Taiwanese Beef Noodle Soup and chose the ""spicy"" option. It definitely was not as spicy as I expected...Nevertheless, it was delicious! The noodles were perfectly firm and had a nice chew to them with every bite. The beef was also nicely cooked and fell apart in your mouth--so soft!I dreamed of these noodles days after I ate them. If I'm ever in the area again, I will definitely be returning to Very Fresh Noodles.",Very Fresh Noodles,4.0 star rating,$$,"Taiwanese,, Chinese,, Noodles"
83,cgj1zb8nOu3HNCI83r9CRQ,Laura O.,5.0 star rating,"I got the Tingly Cumin Beef soup (spicy) and it was so delicious! After each bite I was loving it more and more. The beef was so tender and juicy, and words can't describe how yummy the noodles were.They were out of chopsticks when I went so it was a bit hard to eat the way I would prefer, but they offered me a fork and it was fine. Not enough seating, was annoying to eat this standing up.",Very Fresh Noodles,4.0 star rating,$$,"Taiwanese,, Chinese,, Noodles"
84,eu9qv8NWdjDyqB6O4kbiVg,Queena T.,4.0 star rating,"Ordered the Taiwanese beef noodle soup - noodles had good chewy consistency, good portion of tender beef, lots of herbs and soup had a lot of good flavor without being too salty. A bit pricey at $14+ including tax. Super small set up in the back of Chelsea market. It's alway impressive how little space people need in NYC to run a food operation. There was no wait when I went on a Friday afternoon around 3pm but I've seen a long wait on the weekend before. It looks like they're building a bigger space right next door which will hopefully alleviate the wait time.",Very Fresh Noodles,4.0 star rating,$$,"Taiwanese,, Chinese,, Noodles"
85,MyZasQZ_Nx-MdCB4c5RdVA,Kristie L.,5.0 star rating,"So far this place might be one of my favorites for noodles. They are nice and chewy and are so consistent with every bite. The different flavors of the for the dry and soupy noodles are all so good. We usually always try a veggie dish assuming it will taste a little less flavorful, however even the vegetarian dishes are so good! It's a small place that doesn't have seating and it's located in Chelsea's market. There's usually a pretty long line for these guys! If you're in the area and looking for some flavorful noodles his is the place to go.",Very Fresh Noodles,4.0 star rating,$$,"Taiwanese,, Chinese,, Noodles"
86,Bvwk_FuVNicfUkxHTwou_Q,Richard J.,4.0 star rating,"Very Fresh NoodlesVery Very GoodVery Very Very Longgg LineJust as the place name says here literally (and fortunately), the noodle quality reflects just that. My tingly cumin beef noodle is really freshly made & cooked a la minute, topped with generous meat portions and served with lots of aromatic vegetables.  Perfectly chewy, meaty and savory - just how I liked my noodle cooked. Yet, unfortunately just like any other popular food place at NYC, great food will always translates to longgg lines. I probably waited around 45 mins+ at 1 PM Sunday just to get my own noodles and to finally appease my hunger for noodles.Worth the money? YesWorth the calory? YesWorth the wait? No..if you are in a rushNevertheless.. I will come back!",Very Fresh Noodles,4.0 star rating,$$,"Taiwanese,, Chinese,, Noodles"
87,ZLQJRznDctI8i2xG7h96Yw,Billy Z.,3.0 star rating,"Service was quick. Not too busy on a weekday afternoon.Food was good but nothing to write home about. It's fun to watch like how the Facebook videos set it up to look like. Soup was a little oily, and I didn't get a huge flavor profile from it. The noodles were fresh as the name goes. Probably better to eat it there rather than take it to go.",Very Fresh Noodles,4.0 star rating,$$,"Taiwanese,, Chinese,, Noodles"
88,2xmptvWC3U9tOV_J2m7Xjg,Sang P.,4.0 star rating,Inside Chelsea Market.Got the Spicy Taiwanese Beef Noodle Soup. The beef was extremely tender and the broth was good. Fresh noodles are always great and has that amazing chewy texture. Portion is decent for its price but it's not cheap by any means. The soup was overpowered by spice and not very BNS-y.,Very Fresh Noodles,4.0 star rating,$$,"Taiwanese,, Chinese,, Noodles"
89,MrfVXpzuld6yVg64B2LduA,Danielle O.,4.0 star rating,"I first learned about this place on through videos on social media, so it was pretty exciting getting to try this place out for myself! It's located within Chelsea Market, so it's very easy to find. I thought the line would be super long and out the door since we went during prime lunchtime (1pm) on a beautiful Saturday afternoon, but the boyfriend and I definitely waited less than 30 minutes.Atmosphere:It's fast and convenient with a chic storefront. You can watch them make the noodles, which is pretty cool. Because it's in Chelsea Market, the seating was pretty limited, but we were lucky enough to score a little spot to sit by the window.Food:We shared the mild La Mei Tawainese Beef Noodle soup. For $13, you could probably get a lot more elsewhere, but their shop basically went viral, so I understand the upcharge. The veggies were fresh, and the bok choy was crunchy. The soup was just okay to me, but my boyfriend liked it more. I wish there was a little more flavor to it, but I was afraid to get the spicy one. The beef was super tender and easily fell apart in our mouths. To me, the noodles were the star of the show. 12/10 would recommend those noodles in all my soups. Like the video, they were super long and slurpable. But the video doesn't capture the soft, chewiness of the noodles. They are indeed, very fresh noodles. Overall, we ate a warm, hearty, savory, and delicious bowl of soup perfect for a chilly day.",Very Fresh Noodles,4.0 star rating,$$,"Taiwanese,, Chinese,, Noodles"
90,kDVTxIOItvD5YqR2G2_gug,Shata Y.,5.0 star rating,"Worth the stop. Fresh wide thinly pulled noodles in beef broth soup filled with some green bok choy. Broth was savory with a vinegar like-tangy taste. Very tender beef. $14 for a bowl, a little on the pricey end and worth it.Quick service and had to find seating on the side to slurp down the noodle soup.",Very Fresh Noodles,4.0 star rating,$$,"Taiwanese,, Chinese,, Noodles"
91,fXtaMI7-r-twoaB4gcslgA,Alyson Y.,4.0 star rating,"Located in Chelsea's Market; super small stall in the corner. The line to order is by the ""kitchen"" and there's another longer line afterwards to wait for the food. It is basically packed all day. They take orders quickly and say it's a 15-20 minute wait. We ordered at 6pm on a Sunday and it took almost 40 minutes. Small menu and costs ~ $13 for a bowl of noodles. Ordered the lamb noodles in soup. Definitely recommend in soup, not dry! Much more flavorful. Beef noodle soup is also a popular choice. There is a moderate or spicy level. The noodles are handpulled in front of you with a glass wall so you can watch. Very fresh! The noodles itself were delicious, chewy and not soggy. The soup was spicy and just the right amount of flavor. People compare it to Xian Famous Foods - its definitely spicier, has more of a kick and flavor in my opinion. This one is there and doesn't overwhelm as much. This place is also a bit pricier than Xian Famous Foods. Overall good experience but knocked down a star because of the extremely long wait and the price.",Very Fresh Noodles,4.0 star rating,$$,"Taiwanese,, Chinese,, Noodles"
92,cIu48MXKeR-xNnFurU3UFg,Shirley K.,4.0 star rating,"Fresh chewy flavorful noodles! Quite filling too! The price is around $12 a bowl and you can get it with soup or dry. I tried the vegan option with soup and my BF had the Taiwanese beef noodles with soup.  Although mine was good but the BEEF in his bowl was AMAZINGLY TENDER!!! And so flavorful! Highly recommend trying that one for the first time!If you see a line, don't get discouraged. It'll move fast and you'll get your food quickly. They have a bar but no chairs so you can either eat standing or order your noodles to-go and find a table with chairs inside the Chelsea Market!",Very Fresh Noodles,4.0 star rating,$$,"Taiwanese,, Chinese,, Noodles"
93,vkYAovp9zlaR_6tfrT_5KA,Justine B.,4.0 star rating,"I had seen this place on Instagram a few times and had been interested ever since. I was in the city and since my bf and I had some time to kill in the city one Sunday, we decided to stop in Chelsea market for an afternoon lunch-- I made a bee-line to VFN. When I arrived, there were about 7-9 people in front of me in line, so I had plenty of time to look over their very modest menu. There are only a handful of options as they specialize in the fresh noodles (duh). The set up is very, very quaint-- one guy making and hand pulled the noodles, one girl assembling the bowls, another guy taking orders, and another girl cleaning dishes. With that said, the wait time was quite long. Though there weren't many ppl in front of me to order, there were a lot of ppl in front of me waiting on their food, so I wound up waiting about 20-25 mins for my food. I ordered the dry cumin noodles with beef. Nice size, definitely more expensive than it would be in somewhere like Chinatown, but hey, it's Chelsea. The noodles were chewy and the sauce was well developed. I asked for spicy and it wasn't but it wasn't a deal breaker. If you go here, be prepared to wait!",Very Fresh Noodles,4.0 star rating,$$,"Taiwanese,, Chinese,, Noodles"
94,KUNDwz2ma4rN5jca6QUfYg,Alan K.,3.0 star rating,"I went with the vegan duck biang biang soup, and while the noodles were definitely 5 stars, the broth was just way too salty and oily, so that brought down the average. It started out ok but about halfway through it was just too much to handle. I could have done without the fake duck too--it had a weird texture, more similar to wet cardboard than meat. Honestly I'd have been happier with some tofu, not sure what the deal is with the imitation meat. I would probably recommend the dry noodles, though I can't say for sure without actually trying them myself. The whole operation surely is a fun sight with the chef hand-pulling and tearing fat noodles way in the back, so the all glass kitchen definitely scores some style points. If they balanced out the broth, this place would be an easy 5 stars!",Very Fresh Noodles,4.0 star rating,$$,"Taiwanese,, Chinese,, Noodles"
95,X_AKIVX-GNcV28R2p_Uhpw,Lena J.,3.0 star rating,"-thick chewy-ish noodles-they were out of beef early on a Friday evening-tingly cumin lamb was barely spicy-lamb was a little dry (but no gamey odor)-almost no seating, like most places in Chelsea marketI came here with two friends, and we all got the tingly cumin lamb as they were out of beef and only had three noodle options on the menu. It was much less spicy than the noodles at Xian famous foods (the obvious comparison I guess, though those aren't exactly authentic - Xian's noodles are also thinner) but overall it was still fine. It was quite busy and we waited about ten minutes for our order. The guy taking orders was super personable and friendly - I was very impressed. The highlight of this experience was probably when someone asked if they had gluten free options and he responded ""no, we love our gluten here."" A close second was when a kid asked if they had just noodles with nothing else added and he replied ""no, that wouldn't taste very good.""Previously (well over a year) ago I'd been here once gotten the vegan duck one and I have a vague recollection of it being too salty and/or oily and not wanting to get it again, but I liked the noodles and remember them being better on my first visit. The menu also doesn't seem to have expanded since then, but their popularity definitely has!",Very Fresh Noodles,4.0 star rating,$$,"Taiwanese,, Chinese,, Noodles"
96,7Ky7OEMbY9oT6uXDRMv0mA,Kristen K.,5.0 star rating,"Who doesn't love a hearty bowl of Taiwanese beef noodle soup, especially when you get to watch your noodz get pulled and made right in front of you?! Amazing, I know. It's even better when it's in your belly. If you're in Chelsea Market, you should definitely come here. Even if you're not in Chelsea Market, you should come here anyways. If INSIDER food recommends it, that means it must be amazing. Very Fresh Noodles is a small stand tucked away on the side of Chelsea Market. It's a stand that's constantly buzzing with people around, trying to watch the noodz get stretched, smacked, pulled, and cooked before ending up perfectly QQ in your bowl of delicious soup. FOOD: Taiwanese Beef Noodle Soup - I personally love a good bowl of hearty beef noodle soup, but it's hard to find it done right. The noodles aren't QQ enough or the broth isn't thick and flavorful enough or the beef isn't tender and chewy. However, this bowl of beef noodle soup is made just about perfectly. The bowl will set you back $14, but it's actually way more filling and hearty than it seems. The long wide noodle is literally never ending as you start on your bowl of soup, which is good because it's so fresh and a good consistency. The spicy version of the soup definitely has a good kick to it, so be prepared with some water. It also has a rich flavor of beef and spice and everything good in the world. I was most surprised about the beef because it was so tender and juicy and there was a lot of it compared to many other bowls of beef noodle soup I've had.TLDR: come here for some delicious soup with amazing noodles and lots of super tender beef chunks. it's definitely worth the $14 because you'll be full for many many hours after.",Very Fresh Noodles,4.0 star rating,$$,"Taiwanese,, Chinese,, Noodles"
97,1z99B1LYeK0qWVx2RbbnBQ,Stacey T.,4.0 star rating,"Tucked inside the already crowded Chelsea Market was this Very Fresh Noodles kiosk serving freshly pulled noodles with the tangy smell of beef and lamb all smother together (don't get me wrong, it smelled awesome). I was already sweating like a dog trying to find this place so getting a soup noodle was not ideal for me, so instead we went and got the Tingly Cumin Beef (dry noodle). I did not regret it at all, the dry noodle was still very saucy with the beef just swimming in the noodle, and omgee the beef was so tender that it almost melts in my mouth! The flavors were powerful but not intense, the spice was kicky but also not too much that I'll need to drink water after every bite. Definitely something worth trying/coming back for if you're in the area or maybe even not in the area!Please note as I mentioned above that this is a kiosk restaurant, so there's no chairs or tables there for you to eat. But you are at Chelsea Market so just walk around and look for somewhere you can chow down your noodles in peace.",Very Fresh Noodles,4.0 star rating,$$,"Taiwanese,, Chinese,, Noodles"
98,bNQwUZwCaPEAZRNYy1muIw,Stella D.,3.0 star rating,"I had a lot of high hopes for this restaurant but it is just not that good... The wait at rush hours is like 20-30 mins which is a lot for Chelsea Market average. The way they hand made their noodles is more like the Xi-an type of noodles, but the way they cook it is more for regular noodles. So the end result is like a weird mix. The portion is super tiny for the price. Not worth it.",Very Fresh Noodles,4.0 star rating,$$,"Taiwanese,, Chinese,, Noodles"
99,KzcBCb-Wa1JzSlw25LXOcg,Erin S.,4.0 star rating,"Got the spicy tingly beef soup, noodles are pleasingly chewy although it's not very spicy. Little heavy on green onion but overall delicious. Will definitely be back for some of the other menu options. At $13 it's more expensive than Chinatown, but to be expected in Chelsea Market.",Very Fresh Noodles,4.0 star rating,$$,"Taiwanese,, Chinese,, Noodles"
