,user_id,user_name,user_rating,user_text,restaurant_name,restaurant_rating,restaurant_price,restaurant_type
506,JB7coorN1wXX5Ve5s1DYUA,Lena X.,5.0 star rating,"OH.MY.GOD.I've had literally every single fricken thing this truck serves. FOR FREE. Jealous? You should be.Anywho, they are all foodgasms. Let me share:Liege wafel:The ""soft, chewy one,"" they call it. True that, but its got just the slightest crunch sometimes at the edges or when you happen upon a particularly resilient sugar pearl in the batter. This wafel is dense enough to give some resistance when you bite--definitely not tough, but definitely not mushy either. I accidentally froze one this one time, and it was actually surprisingly delicious.Brussels wafel: Airy interior, a thin but decided crispness on the surfaces. Much closer to your traditional American waffle, but a zillion times better for a multitude of reasons that can only be summarized by stating that Belgians just trump Americans at food, period.Mini Wafelini: Basically a mini liege wafel on a skewer with banana and strawberry pieces. As the truckers say, ""for beaucoup cravings, petit hunger."" Tres mignon.BBQ Pulled Pork wafel:It's dericious, and it's exactly what it sounds like: pulled pork with bbq on your Brussels wafel. They actually keep the pulled pork separate from the bbq sauce in the truck, so you can actually adjust the flavor if you so wish. Comes with a side of coleslaw, best eaten on your wafel with the pork.Spekuloos: it's a spread the consistency of peanut butter. It tastes like buttery cookie crisps, except in spread form, with almost Christmasy spices like nutmeg and cinnamon and other spices contributing to the flavor. Spekuloos is originally a cookie anyway, but I digress. If you thought Nutella was sex in a jar (because there's a sizable Facebook group proclaiming such), then I guess this is just the longest mammal orgasm to ever be documented (oh and did you know that pigs have the longest orgasms of any mammal? Up to 15 minutes, kids). Wait, how did I start talking about pig orgasms in my review of a waffle truck?Verdekke Ice Cream Sandwich: Buttery wafel-y cookie crisps smeared with Nutella and whatever else you like, sandwiching ice cream. Quite delish, especially if you let the ice cream seep into the cookies just a little bit before you eat it! This also comes in cone form now, for ease of travel.And there's more but I think this covers the major. Favorite combo:Of course the WMD (Wafel of Massive Deliciousness--aka unlimited dinges, or toppings, $2) is wonderful because you can abuse your calorie limit all you want, but if I had to choose one flavor combo for a new friend who's only going to have this once in his/her life:Liege wafel with spekuloos, strawberries (I don't like bananas as toppings for anything), and tons of whipped cream. Topped with powdered sugar.Tips: I like my wafels crisp, crunchy, whatever they're supposed to be, so it kinda helps for me, especially when I get the Brussels to have my dinges on the side. That said, this is an annoying request so you should probably, as I usually end up doing, just eat it really fast (while remembering to savor) so it doesn't get mushy. Also, I always ask for extra whipped cream if I'm not getting ice cream with it--these are all very rich, rather dense flavors so it helps to have something more airy/cool to balance.Rauf and Azamat are my favs because I saw them the most this summer, but regardless, remember to drop a tip sometimes because these guys are insanely nice!",Wafels & Dinges,4.5 star rating,$,"Belgian,, Waffles,, Food, Trucks"
507,VPO-OjABU6xQONhdlCG1aw,Gary S.,5.0 star rating,Best Waffle I ever had!Walked over because I did not have 3 hours to wait at the Clinton Street Bakery.  I almost did not go in because it looked like a Fast food place.  Tried the Liege Waffle and could not believe this was a waffle.  No waffle has even compared.  You must try this thing.  Bravo!,Wafels & Dinges,4.5 star rating,$,"Belgian,, Waffles,, Food, Trucks"
508,FoPrwdeBWfdLuPYstFxFNg,Amy S.,5.0 star rating,"Used a tenka deal to get my first waffle from here.Well, I love waffles, I love the enormous variety of toppings they offer, and I loooove waffles. This is a great place to get waffles without having to go to an actual restaurant and sit down. It's good as a snack or a meal-on-the-go! Speculoos is GREAT. The ice cream is really good too. Also, I hear the Hoegaarden ice cream is really good so I'm really looking forward to that. Track the truck down and get it. Super worth it.",Wafels & Dinges,4.5 star rating,$,"Belgian,, Waffles,, Food, Trucks"
509,DP06upcNn2WTid3UShwwGg,Salma S.,1.0 star rating,It's not located at the Pier near Chelsea as shown on Yelp. Check out their website for your nearest one.,Wafels & Dinges,4.5 star rating,$,"Belgian,, Waffles,, Food, Trucks"
510,MykSJQ1ZDurYoaogmbTTIg,Olivia A.,1.0 star rating,"The food probably tastes fine, but as my husband was ordering I watched the guy in back pick his nose then begin to cook the food. Seriously? Ugh.",Wafels & Dinges,4.5 star rating,$,"Belgian,, Waffles,, Food, Trucks"
511,SH3LJ8nYGgPqU6YnyhG_QA,Brittny B.,5.0 star rating,"Everything here is soo delicious!! I take everyone here, they're so different and tasty, it's worth a trip! I crave them allll the time!",Wafels & Dinges,4.5 star rating,$,"Belgian,, Waffles,, Food, Trucks"
512,zGFOC31ZKrn0XjJXyd9Dkg,Angie C.,5.0 star rating,"Two words: Throwdown Waffle.Do not deviate from it. Everything else is not nearly as glorious but alas, if you must deviate make sure you at least try liege waffle.",Wafels & Dinges,4.5 star rating,$,"Belgian,, Waffles,, Food, Trucks"
513,zSh7flAmuKr9Zue9nLz1kQ,Helen W.,5.0 star rating,"Having lived in LA, I've eaten at my fair share of food trucks (40+). However, Wafels & Dinges takes the cake (er, wafel?) as the best dessert truck I've ever tried. Anytime I go to NYC, I have to get a Liege wafel with strawberries & chocolate sauce drizzled lovingly over. It's such a treat to enjoy a wafel here and hang out at Central Park. Plus, the guys working the truck are always super friendly and funny.",Wafels & Dinges,4.5 star rating,$,"Belgian,, Waffles,, Food, Trucks"
514,ryKpgRFQRn9hdIpuQGz2gA,Colleen D.,5.0 star rating,"Food: AwesomeCost Per Person: $510What we got: Brussels Wafel with spekuloos spread, whipped cream, strawberries and fudgeMeal: SnackGrab & Go or Pay & Stay at their brick & mortar location, 15 Ave BDress Code: CasualBring: AnyoneGood to Know: Brussels Wafels are light and crispy, while Liege Wafels are soft and chewy. Spekuloos is like a graham cracker spread.",Wafels & Dinges,4.5 star rating,$,"Belgian,, Waffles,, Food, Trucks"
515,dq_2nUIzut3s5INO9fQ4tQ,Alice L.,5.0 star rating,"Would it be wrong of me to say I'd trade my first kid for a Wafels & Dinges Truck? But... it's just so... *dreamy eyed look*A friend bought me one and I ate it cold (can't wait to try it fresh!). I've never had such an indulgent treat in my life! The Waffle Cabins at Ski Resorts are already good but W&D, they are in a class of their own! Spekuloos. Say it with me now... spekuloos. It's like crack! Just try it, you'll see.",Wafels & Dinges,4.5 star rating,$,"Belgian,, Waffles,, Food, Trucks"
516,0uo54KrhcS3gvBcovpMMvQ,Lydia N.,5.0 star rating,"I've refrained from reviewing this place because I didn't know how to put my love into words.. I still don't. But. I LOVE SPEKULOOS. It is like crack in a jar. Even better if you imagine all the Teddy Grahams that died to make it. (Ok, so they're made with Biscoff biscuits, not Teddy Grahams, but Teddy Grahams have faces)And those wafels? Life changing.",Wafels & Dinges,4.5 star rating,$,"Belgian,, Waffles,, Food, Trucks"
517,puE0D_zE3DL7qTEJvMw46g,Rayvynne R.,5.0 star rating,Super excellent service and even better liege wafel with ice cream.  I feel in love!,Wafels & Dinges,4.5 star rating,$,"Belgian,, Waffles,, Food, Trucks"
518,8AAmy6AVPBOYxyeeEGqh2A,Shelly M.,5.0 star rating,"FYI the spekulos they use is NOT the same as the one at Trader Joe's, it's better. If you're on vacation, buy a jar, or two, or three and take the amazingness home with you. DON'T get the miniwaffelini .. i mean, go big or go home!! They have a menu but you're also free to come up with your own creations and the employees will do it without a frown. The charm and smiles from the staff must be in result to all the spekulos they eat through out the day. I should have followed their lead, I could've been all about good vibes and high fives by now. Try and find the truck at the park, it's the perfect place to sit back and enjoy the scenery while your belly gets spoiled. Lay out a blanket and enjoy the belgian ice cream. If you get a little tipsy from the ice cream it's okay, after all it is New York - drunkness is acceptable at all hours of the day.",Wafels & Dinges,4.5 star rating,$,"Belgian,, Waffles,, Food, Trucks"
519,_RS9-qJMAl8BRRH4veBhgA,Joe Y.,4.0 star rating,They have multiple locations check their website. I found a one of their trucks on Wall St on a Wednesday. $7 for a Belgian waffle with enough sugar to initiate a heart attack.,Wafels & Dinges,4.5 star rating,$,"Belgian,, Waffles,, Food, Trucks"
520,liUNFOAe8gewm701Kwz9pQ,Michelle S.,5.0 star rating,SO INCREDIBLY DELICIOUS. The liege wafel with spekuloos and strawberries is the stuff of dreams (though you can also add a scoop of ice cream to your wafel). The wafels are chewy and almost have a caramelized flavor. Bring cash just in case - they're supposed to be able to accept credit cards but the last time I went their credit card system was down so it was cash only.,Wafels & Dinges,4.5 star rating,$,"Belgian,, Waffles,, Food, Trucks"
521,Hu8W47F63bp7Qd9HtetQ2g,Tiffany L.,2.0 star rating,"I'm kinda embarrassed to admit this, but I think I may be the only person who didn't enjoy my waffle. It was just alright. What is wrong with me?!?!I felt like my waffle was kinda stale even though I came during the early lunch hours. Even marinated with butter and the juices of the strawberries, it still felt weeks old in my mouth. The staff was very charming and upbeat though.",Wafels & Dinges,4.5 star rating,$,"Belgian,, Waffles,, Food, Trucks"
522,WQL1pwgPfxlhbcWYLIH4ZQ,Brenda H.,5.0 star rating,"Ever since my trip to Berlin, where I enjoyed delicious waffles with sugar baked in, I've been looking for places that make them in the states. This truck makes BOMB waffles! I enjoy that they have many ""dinges"" or topping options as well, including fresh fruit. I wish this truck could park by my house once a week. Friendly, fast service is a bonus!",Wafels & Dinges,4.5 star rating,$,"Belgian,, Waffles,, Food, Trucks"
523,Y8fPrQl-tAOPUiAcPEJ42A,Veronica C.,5.0 star rating,LOVE IT !!!Just go and experience it !! That's all I gotta say...OH and if your a Wafel virgin you get toppings for free!!! Hello!!!GO FOR IT!!!!!!,Wafels & Dinges,4.5 star rating,$,"Belgian,, Waffles,, Food, Trucks"
524,3XfD5FRmmZF9zEA_zlkcTg,Alysha R.,5.0 star rating,I need help....Seriously.....So I went and had another Liege wafel from the truck today for lunch.. *no heat wave today...so fear none.. I did not sweat profusely on anyone while eating..But today ---- I finally purchased a jar of Spekuloos.. you know.. the yummy gingerbread cookie spread .. that is ridiculously delicious and addictive?yeah.. that one..Why am I at my desk.. on a trading floor ..Eating this liquid crack straight out of the jar.. on a dirty..dusty plastic spoon..?Had it on a banana.. at first.. but went back for more..and now I cant stop....I think I've had 7 spoonfuls already....yeah..told you.. I need help...Gotta love Wafel & Dinges...,Wafels & Dinges,4.5 star rating,$,"Belgian,, Waffles,, Food, Trucks"
525,sf9onRwJn1lRFgAuXlktog,Raider J.,5.0 star rating,I finally got one today........I had the Throwdown with gingerbread spread and whipped cream.......damn it was good!Another great NY treat!!!!!,Wafels & Dinges,4.5 star rating,$,"Belgian,, Waffles,, Food, Trucks"
526,zZApAH1asUJMTpIEX-7Wzg,Natalie C.,4.0 star rating,"Delicious. Caught a truck and Queens and noshed on a wafel with nutella. crisp, chewy, sweet perfection.",Wafels & Dinges,4.5 star rating,$,"Belgian,, Waffles,, Food, Trucks"
527,pzmEqXuHmE8O1YI5WbXR7g,Paul R.,4.0 star rating,"Delicious savory waffles made from dough, not a batter. The bacon and syrup waffle was amazing. It's a bit pricey for street food, but it's worth it.",Wafels & Dinges,4.5 star rating,$,"Belgian,, Waffles,, Food, Trucks"
528,mXVyn0twpcLODQJA4yggtQ,Kenny W.,5.0 star rating,"BEST WAFELS EVER!!!The Belgian, the Liege, the pulled pork!  the Dinges!  Oh MY!!",Wafels & Dinges,4.5 star rating,$,"Belgian,, Waffles,, Food, Trucks"
529,K0S8ZOpPFWyBedpjA8RG9w,Beverly E.,5.0 star rating,"YUMMY YUMMY YUMMMMMMMMY! :DMy husband and I tried both the belgian waffle and the liege waffle, both very very good!  We were able to get a free dinges (aka topping) by rubbing out belly's and tapping our head at the same time (waffles come with 1 comp. dinges).  The guys working the cart were really cool - i got to sample the Spekuloos topping before deciding if I'd want it, and I ended up purchasing the jar to bring home.The hubs had bananas and nutella while i had walnuts and Spekulooos.  We paid, pulled over to the side of the block and ate both our waffles before getting back on the subway.  Both were delish!!  Wish we lived in the city so we could have Wafles & Dinges all the time!ps. they update their facebook pretty often so if you 'like' them, you'll be able to find out where they are throughout the day - week!",Wafels & Dinges,4.5 star rating,$,"Belgian,, Waffles,, Food, Trucks"
530,MKV4jibi14Wgs8e0XBSv6A,Nicole P.,5.0 star rating,"This was the year I first had a Wafel from Wafels & Dinges, also known as the Waffletruck. I had it a few months ago and from then on I was hooked. Once you try them, you will be hooked also and here is why.There are two main types of wafels: brussels & liege. I think the best way to describe each is to say brussels has more of a crunch and liege is more chewy. None the less, they are both quite delicious. There are quite an array of toppings, referred to as dinges, that you can have on your wafels. you can have fresh fruit, like strawberries & bananas. They even offer walnuts if you want a bit more crunch to your meal. But before we add the fruit and the nuts, there is one special topping we are missing. Some people prefer syrup on their wafels or powder sugar, which Wafels & Dinges does have. However when I was there, I discovered two alternatives. One was Nutella & the other Spekuloos. Nutella, that ""delicious hazelnut spread"". I have yet to try it with Nutella, but I plan to very soon. It looks quite tasty. Now the other spread I never heard of until visiting the truck. ""Spekuloos is a spread* that looks like peanut butter, but it tastes like traditional Belgian gingerbread-cinnamon cookies."" - Source: Wafels & Dinges siteSpekuloos is also delicious and addictive. Once you taste it, your taste buds will be in over drive. The flavor, is as some have said, ""orgasmic"". It gets better. You can buy a jar of Spekuloos to take home with you. I'm going to have to buy one the next time I stop by the Waffletruck.But you're wondering where do you find the Waffletruck, right? Well that's an easy answer. Follow them on Twitter @waffletruck or like their Facebook pages. Sometimes they even post a special promotion, where if you do some random act, you get a free dinges.Now I'm going to go back to eating my Liege  Wafel with spekuloos and strawberries. Mmmm. Yummy in my tummy!",Wafels & Dinges,4.5 star rating,$,"Belgian,, Waffles,, Food, Trucks"
531,wX5vaCj1GQnRYtpFg9fGxQ,Mariam A.,5.0 star rating,"I've been here twice now and both times I got the throw down (includes spekuloos spread, cookie crumble and whipped cream) and asked for a scoop of ice-cream with it. It tasted amazing! The waffle itself is the right balance of crispy on top and soft and chewy in the middle. The line here moves pretty quickly. The only thing is make sure you check their website before you go because they change their timings and locations daily. I tried to come here the other day but their timings were different then when I had come earlier in the week so they were closed and that's when I checked the website and realized they changed it.",Wafels & Dinges,4.5 star rating,$,"Belgian,, Waffles,, Food, Trucks"
532,UaVJmBu96uUJNJfe58Z0sg,Sandy C.,5.0 star rating,"Wafels and Dinges was at the Brooklyn Food Film Festival and so was my appetite and me. I never tried a waffle from this truck, but my tummy, tastebuds and I were really glad we did. My friend and I split a BBQ Pulled Pork Wafel yelp.com/biz_photos/xJSH…. This is like heaven! If heaven does not have a BBQ Pulled Pork Wafel, I am not going.The waffle was very crisp. The pulled pork was very tender and very very flavorful. The coleslaw was delicious too! Oh don't forget to check out the secret dinges drawer yelp.com/biz_photos/xJSH…, it's pretty neat!",Wafels & Dinges,4.5 star rating,$,"Belgian,, Waffles,, Food, Trucks"
533,W8WMRq-FpKSo1Jz_WMpEiw,J K.,1.0 star rating,"They burnt my wafel and tried to cover it up with sauce. Come on now. Good concept, poor execution.",Wafels & Dinges,4.5 star rating,$,"Belgian,, Waffles,, Food, Trucks"
534,JRHUDpn0IBOYpwbSJnxMCA,Sam B.,5.0 star rating,"Of course as everyone mentioned, I had to get the throwdown waffle when I found Wafels and Dinges at Madison Square Eats this week. They dont carrry mini waffles at madsq eats, so I had to get a full size and I was not disappointed. Although I probably ate about 2,000 grams of sugar in those 5 minutes and who knows how many calories...it was worth the taste and experience. It was extremely sweet though, so next time I'd probably go with something lighter for a topping like strawberries. Also 6 bucks is a heavy price o pay for dessert, but portion was a good size since Im still full and it's been about four hours!Also 5 stars for service, the guy who served me was really friendly and smiled and was very personable.",Wafels & Dinges,4.5 star rating,$,"Belgian,, Waffles,, Food, Trucks"
535,GLlQIPx0lazswUnAM_5SUQ,Rob Y.,5.0 star rating,"OMFG. I saw this on TV and I was amazed at the fact that someone had the balls to put all this unconventional things on top of an actual Belgian waffle! I tracked down this truck and decided to come to my own definitive conclusion. And that conclusion is this is the shit! This is really something special. The guy makes the waffles with precision. He is no joke. And the toppings are off the charts (literally). I went with the pulled pork and the one with the bacon built inside. Amazingly, the pulled pork one was awesome. Lots of flavor, super juicy, and the cole slaw actually made it all go together. The only down side to this escapade was that it is kind of messy. Oh well. You can take this for the team. Bring yourself some wet wipes or just use the fork! The bacon waffle was less messy because it was built into the waffle. That was the bomb also. I liked the pulled pork one better though.Who knew that a Belgian waffle can be this awesome??",Wafels & Dinges,4.5 star rating,$,"Belgian,, Waffles,, Food, Trucks"
536,4dXjE3TTuK34KAtN74_Yzg,Lils Y.,4.0 star rating,"I had ""DE BOM"" (waffle plus ice cream drizzled with chocolate fudge) for $7. And like the name, it really was DA BOMB. You get to choose either a scoop of vanilla ice cream or GINGERBREAD cookie ice cream and of course I chose the gingerbread and loved it. Waffle comes out hot, crispy, buttery, sweet. The icecream adds a nice creamy sensation. Perfect dessert anytime, anyday.",Wafels & Dinges,4.5 star rating,$,"Belgian,, Waffles,, Food, Trucks"
537,y2BdqSbuCYU9nXzPRnMYwQ,Jason D.,5.0 star rating,"Amazing! The Spekuloos spread is incredibly good on wafels or get a jar to take home and they make a great ice cream. If they have them, the cornbread wafel with veggie chili is great - I waited months for their return and it was worth it! The hot chocolate is beyond good and you get a spekuloos cookie!",Wafels & Dinges,4.5 star rating,$,"Belgian,, Waffles,, Food, Trucks"
538,GukXa0uVU9fxtXFYvFy4Ow,Katie C.,4.0 star rating,"My first year at NYU I did not bother to try this place. I would always see it Wednesday nights in Union Square, but I never tried it. Mainly because I was always heading to the gym when I spotted it and also because it was a bit pricey for a waffle. A small waffle in fact. So I never really noticed it. My friends mentioned it to me a couple times. Told me i HAD to try it. I never really did until recently. Me and my boyfriend were strolling through the Union Square holiday market and they had a booth. We were going to go to Max Brenners for dessert, but we couldn't help ourselves to the delicious smell of the waffles. We stared at the menu for a while, confused on what dinges were and how much everything costs and what we would be getting. So we just decided to fork up 7 dollars and get one waffle with everything on it. It's called WMD or weapons of mass destruction. As the guys were making it for us, they were explaining their ""special"" spread. Spekuloos. That spread is the most delicious thing in the world. Absolutely the best thing i ever tasted. Tops peanut butter, nutella, chocolate. EVERYTHING. It was so good. I could eat the whole jar. Anyway... So we got the waffle with everything atop. It was heavy might I add. We devoured it within minutes. It was so good. The waffle isn't like any waffle. It is a belgian waffle. It was sweet, warm and crunchy. It was so good. I never tasted anything like it. The only reason why this review doesn't get a 5 star rating it is because I'm not a great fan of the price. It's a truck... I mean, at least charge a few dollars less because we have no where to sit and eat... I mean if you open a restaurant, then sure charge 7 dollars. But come on... I would go broke if I got this once a week. I can't imagine how the NYU students who live in the dorm they park in front of resist getting this every wednesday... Well at least try it ONCE. Then you will come back for more if you like, depending if you're rich enough. Oh I also try their mini waffles on a skewer. They put a mini waffle on a skewer and add strawberries and bananas at the end. Me and boyfriend chose to get spekuloos spread instead of fudge on ours. It was an extra 50 cents, but it was worth it. Might I add it was a second time eating waffle and dinges at the cart in front of central park. To feel less guilty, it was the next day, didn't get it twice in one day.. heh. I would be tempted to though.",Wafels & Dinges,4.5 star rating,$,"Belgian,, Waffles,, Food, Trucks"
539,tLtCa1LZj-FvALOSvHTYxg,Nancy A.,4.0 star rating,What a great way to start the day! The waffle with the Spekuloos was delicious. I enjoyed every bite of the waffle. They had a variety of waffles to choose from. From savory to sweet. I can't wait to try one of their savory waffles!,Wafels & Dinges,4.5 star rating,$,"Belgian,, Waffles,, Food, Trucks"
540,lhU8cx_-CseQB3cRn_8sNw,Carmen L.,4.0 star rating,"De bom is the bomb. Price at 7.00, you get a scoop of vanilla ice cream on top of a freshly made waffle drizzled with fudge and powder. It was like a taste of heaven. I can't wait to try more. :)",Wafels & Dinges,4.5 star rating,$,"Belgian,, Waffles,, Food, Trucks"
541,vw2ibzSFc7n3SRonm5iOoA,Leslie O.,5.0 star rating,Holy God ...little piece of heaven... this thing is amazing!  So glad I took a little detour and stumbled upon this delicousness.  I had a mini wafle with nutella and walnuts and I'm going back for a couple full-sized ones tonight (some are for gifts ok)... so worth the chase if it comes down to that.And I can't believe how incredibily late I am on finding this considering my dear Joolie was the first to spot it.,Wafels & Dinges,4.5 star rating,$,"Belgian,, Waffles,, Food, Trucks"
542,ahro5QW4HNZUmVL63BPTBA,Tae K.,5.0 star rating,"""THE BEST"" waffle I've ever had. I will go back here for waffles all the time. We were already full from dinner but saw this infamous truck and couldn't throw our chances away. So for the first time, we tried wafel & dinges and got liege wafel with Nutella. So chewy and sweet. Just so wonderful. And it melts in your mouth. It's usually hard to find food tasty, even though it's good, when you're full to the max. But we forgot how full we were and finished the waffle. So satisfying and I'm definitely gonna go back and recommend this place to all my friends.",Wafels & Dinges,4.5 star rating,$,"Belgian,, Waffles,, Food, Trucks"
543,x-PbS6EYenefEA3HjQDvwQ,Samantha K.,4.0 star rating,Must get the spekuloos spread on the wafels! It was so good that I bought a container of the spread to use at home. I normally get the the special dessert wafel since it's unique. I had something with pumpkin once and it was delicious! I've also bought the mini wafelinis to go so I can share with friends too.,Wafels & Dinges,4.5 star rating,$,"Belgian,, Waffles,, Food, Trucks"
544,aqIJuovzuAmbrs8SoD0Heg,Kristy F.,2.0 star rating,Had a scoop of the speakuloos ice cream (served only at this specific station- was by columbus circle) over a waffle...it was okay but I've certainly had better for cheaper. The workers were nice enough but the coffee wasn't all that either. I'd pass next time and recommend trying a different spot if you'd like to indulge that pesky sweet tooth.,Wafels & Dinges,4.5 star rating,$,"Belgian,, Waffles,, Food, Trucks"
