,user_id,user_name,user_rating,user_text,restaurant_name,restaurant_rating,restaurant_price,restaurant_type
713,5UUVP0wib3xoE9gFbdfCMA,Hilary P.,5.0 star rating,"Easily my favorite NYC food truck in terms of offerings and friendliness; one of the guys once offered to let me stand by the truck and tell customers what to get because of how passionately I extolled the virtues of certain menu items to my friends. My all-time highlight reel includes the BBQ pulled pork waffle and either the Brussels or Liege waffles with spekuloos ice cream on top. In lieu of ice cream, I recommend a combo of bananas, strawberries and spekuloos. They also make a mean iced coffee.I've lost count of the times I've been to either their truck or carts, in part fueled by a livingsocial deal where I got some of their premade waffles and then a savory & sweet combo. If they ever offer up another such deal, jump on it.",Wafels & Dinges,4.5 star rating,$,"Belgian,, Waffles,, Food, Trucks"
714,3P9xKhMiLiItFFoqZzIzdg,Tia T.,5.0 star rating,"Oh, Wafels and Dinges, how you've changed my life!! I was lured in by the thought of waffles and nutella...yum!! But, just as we neared the cart, we see waffles and spekuloos. ""I wonder what spekuloos is"" I say to the bf. We went for it and we'll never turn back! One taste of the cookie spread and I was a changed woman. Its like a heavenly version of spreadable teddy grahams. Before long, we've returned to the cart to buy a jar for at home...$7 is an expensive habit, but it's cheaper than crack (or at least I think so)!The waffles are tasty and have a great consistency, but, really the draw here are the dinges...nutella, whipped cream, spekuloos, fudge, dulce de leche. I would definitely recommend this stand to everyone.",Wafels & Dinges,4.5 star rating,$,"Belgian,, Waffles,, Food, Trucks"
715,6fM5RKYzlVjA9nduyV8mjA,Nan H.,3.0 star rating,"I just saw this on food network's ""best thing I ever ate"" and realized I had this at riverside park a while back.I was walking my dog and saw this truck sitting all by itself by the pier.  I got the waffles with icecream and it was delicious.  What a good combo of cold icecream and warm fresh waffles. But the more I ate it, the more I stopped wanting to eat it.  The waffle was very dense.  I was expecting a more airy waffle.  Now looking back I should've gotten the spekuloos on my waffle, maybe that would've made it taste better, but I wasn't as well versed in dutch as I am now.The guys running the truck  are super nice",Wafels & Dinges,4.5 star rating,$,"Belgian,, Waffles,, Food, Trucks"
716,HbHIS1fTS7dUpU5n7BaeUg,Joanne B.,5.0 star rating,"I have always been a good girl sticking with just the plain wafel, which I totally find very delicious.  On a daring weekend I took a trip to the dark side and had a WMD.  Wafel of Massive Deliciousness - which was basically a wafel with chocolate fudge, walnuts, bananas, strawberries and a dab of whipped cream.So ridiculously good.  The flavors go together so well that it's amazing yet not overpowering.  Excellent to share.",Wafels & Dinges,4.5 star rating,$,"Belgian,, Waffles,, Food, Trucks"
717,GTedgTfq8vRC4EaHpBSV_Q,Joe H.,4.0 star rating,"So this place is a food truck that drives around.  I actually went to see them at the holiday market at union square, but I also saw them at 4th and columbus st.  These guys are awesome.  I loved street waffles in belgium and this is not much different.  They make their waffles fresh and top them however you like them. Personally I got a waffle with just whipped cream on it (i'm pretty basic) but there was also this gingerbread butter that they had they let us try; not really my cup of tea.After getting my waffle, I ran off with it like a squirrel to a tree and ate the whole thing trying not to let anyone see me.  It was amazing.  Soft, fresh and the whipped cream was actually ""whipped cream"" (not out of a can).I totally am going to find this truck again to get another waffle.  Beware, you will not want to share.  Go get your own waffle... this one is mine.",Wafels & Dinges,4.5 star rating,$,"Belgian,, Waffles,, Food, Trucks"
718,jWhJoYyxhK87683qVbYldw,Angela K.,4.0 star rating,"Really good! especially from a truck.whoaa second waffles n dinges coming soon in central park!? i walk the dog through there everyday.. I don't know if I'm going to appreciate the extra couple lbs this will surely add to my waistline becoming part of my daily commute. eek. hahaI liked the dinges more than the waffles.. but I do like that they have multiple waffle styles because it seems everyone likes them a little different.. Relative to the other dessert spots & trucks this one is further down on the list.. waffles are a pretty standard food for me so its hard to get crazy excited about them.. but definitely good :) & I like that despite who you are with I think there's something for everyone: chocolately, fruity, sweet, savory, light, rich, etc.. crowd pleaser!",Wafels & Dinges,4.5 star rating,$,"Belgian,, Waffles,, Food, Trucks"
719,LxdsB6tItOuoX4ZOxyOPsg,Krutika D.,5.0 star rating,"I came here after a date at the MoMa once and this place is ah-mazing! The wafel was warm and crunchy and lightly sweetened. This is necessary, given all the toppings you have the option of adding! We went for ice-cream, strawberries and chocolate sauce. I have a sweet tooth and I think this hit the spot after a long afternoon at the museum. If you're on the go, tired from walking the concrete jungle, or just need an excuse for a snack, I highly recommend finding one of the trucks in the city and satisfying your sweet tooth!",Wafels & Dinges,4.5 star rating,$,"Belgian,, Waffles,, Food, Trucks"
720,IJY-gPEzl8ZSMOpXWFfrSg,Tara H.,4.0 star rating,"Prices are a bit steep, BUT the liege waffles are to die for, the hot chocolate is also decent! I just hate that there is no exact location for when i get a craving!",Wafels & Dinges,4.5 star rating,$,"Belgian,, Waffles,, Food, Trucks"
721,Yrpml3UGQ7NGXg-ADSOI2w,Tiffany K.,4.0 star rating,"Funny thing - each time I visit NYC, I usually accidently happen upon some popular food truck. Last summer it was the Big Gay Ice Cream Truck, last month it was Wafels & Dinges. My cousin kept talking about wanting to try Wafels & Dinges and one night while leaving St. Marks, we saw the Wafels & Dinges cart right in front of the NY FIlm Cafe. We were already stuffed from dinner, but we figured the truck was right there in front of us, so we couldn't hold out.When we first got up the truck and waited, I kept thinking to myself, WTF IS A DINGE?! I kept wondering if I was in for a weird treat. But after reading the description, I realized I was safe and that dinges just meant toppings.After much deliberation, we decided on waffle + nutella + strawberries. Oh man, these delectable wafels + dinges are dangerous! So good, and you know while you're eating it that it's possibly so bad at the same time. Fun food cart, glad to have accidently found it and can say I've tried!",Wafels & Dinges,4.5 star rating,$,"Belgian,, Waffles,, Food, Trucks"
722,QnXVrF1n_WB_Xe1j9cD28Q,Trish A.,4.0 star rating,"Can't say anything that hasn't already been said.I liked the Brussels waffle more than the liege. I think a light, crispy, brightly flavored waffle pairs rather nicely with rich toppings :) The Liege was good too, but too heavy/dense for a breakfast or snack IMO",Wafels & Dinges,4.5 star rating,$,"Belgian,, Waffles,, Food, Trucks"
723,366-Mk-WmxJcyHsSpkFR7g,Gina C.,5.0 star rating,"These waffles are like being back in the netherlands, best ever, and we love that there are carts all over that you can look up. Spekuloos is my favorite but there's so many things you can put on top",Wafels & Dinges,4.5 star rating,$,"Belgian,, Waffles,, Food, Trucks"
724,sOm_RmefC6JJqBevRl0jJw,Tom C.,3.0 star rating,"Wafels and Dinges (W&D) is a Belgian waffle purveyor that also has a line of packaged waffles sold in organic grocery stores such as Fairway, Food Emporium, and Garden of Eden. They operate out of a truck and can be found in various locations throughout Manhattan, depending on the time of day. See their truck schedule here or follow them on Twitter and Facebook to stay up-to-date on their whereabouts.W&D has some god dam good waffles. I like their liege waffle ($5), it's nice and crisp on the outside and soft and chewy in the inside. They also have a good selection of dinges (toppings) to choose from; the first one is free, the second is +$1 and +$2 get you unlimited dinges or a WMD (Waffle of massive deliciousness).In addition to traditional Belgian Waffles, they are also experimenting with nontraditional favors. These are items not on the menu and it's a bit of a secret, but if you ask for it they will serve it. The two that I know of and have tried are their BBQ Pull Pork Waffle and Bacon & Syrup Waffle. Both are decent, but not spectacular. There may be other items on this off-menu that I am not aware of, please contact me if you know of others.Overall, I would recommend sticking with their regular offerings for that good wholesome Belgium Waffle taste and trying their off-menu items if your feeling adventurous; either way you can't go wrong at Wafels & Dinges.",Wafels & Dinges,4.5 star rating,$,"Belgian,, Waffles,, Food, Trucks"
725,R2RZGpQF0na47vZsqt9GHg,Stephanie A.,5.0 star rating,Amazing/life changing. it is currently a solution when ever i feel even slightly down : ),Wafels & Dinges,4.5 star rating,$,"Belgian,, Waffles,, Food, Trucks"
726,19-wFvMo20WNiQSzfP_P9A,Catherine R.,5.0 star rating,"A smattering of spekuloos (creamy, sticky gingerbread spread) on a spongy hot wafel, dotted with powdered sugar and handed with hands attached to dudes who deliver sass with each wafel (and sometimes a few free chocolate chips!)... dropping by the wafel cart always adds 8 points to my day.",Wafels & Dinges,4.5 star rating,$,"Belgian,, Waffles,, Food, Trucks"
727,FksjG1DZ9AOQyOaAZuTCWA,Dan L.,5.0 star rating,Are you in NYC and have not yet tried Wafels & Dinges?  Stop reading this review now and find the nearest Wafels & Dinges food cart or truck!!  They have several aorund central park  including one daily in front of the Time Warner Center.  Words cannot describe how wonderful these are so instead of wasting more of your time keeping your from these I will end my review so you can get your ass to the nearest one!!!!  Get going!!!!!,Wafels & Dinges,4.5 star rating,$,"Belgian,, Waffles,, Food, Trucks"
728,xmuCPiDaHXthxUVvqnTaEA,Tekwar T.,1.0 star rating,"After always seeing long lines at their truck and hearing the good buzz I finally decided to try W&D. I know I'm in the minority here but talk about overrated! Their waffles are light and airy...and devoid of flavor! No wonder you have to pile on the toppings or else there's nothing to taste. I got a waffle with strawberries, sprinkled with powdered sugar (they are quite stingy with tiny portions for toppings). Overrated, overpriced, and over it!",Wafels & Dinges,4.5 star rating,$,"Belgian,, Waffles,, Food, Trucks"
729,yOtGUWgHMiXuEmjHIjJFhg,Dez A.,1.0 star rating,"I'd recently received the following message from Thomas...""DesireeI saw your post at Yelp. Great work man...Hope you're proud of your writing skills.As far as I am concerned...give me zero stars. I don't need stars from people who don't give second chances to others.Let me know if you ever start your own business and we'll talk.Keep up the good work. Thomas""He feels that because I declined his certificate, I do not give 2nd chances. Nothing could be further from the truth!! I ain't mad at Thomas cos I know he ain't mad at ME, but at his employee who chose to give me wafels that were fit for the trash bin. Anywho, he goes on to say that he'd rather have ""zero stars"" from me. Unfortunately, the least can give is one star. As I'd said in my response to his e-mail, ""sorry you feel that way, but I'm happy to oblige.""And please note, as of this writing, The Street Treats truck is no longer on 55th & 6th. Don't know where they are now. :(",Wafels & Dinges,4.5 star rating,$,"Belgian,, Waffles,, Food, Trucks"
730,eGZIVdRlyrLa67KRjCVJ8g,Meredith R.,5.0 star rating,SLURP............................!Insane. Sinful. Delicious. This li'l truck impressed the taste buds out of this San Franciscan dessert snob. Just what my sweet tooth needed before bedy-bye. If the order-taker-guy suggests something different than what you *think* you want to order... TRUST him.,Wafels & Dinges,4.5 star rating,$,"Belgian,, Waffles,, Food, Trucks"
731,B6NzZ2R9RRtwTJYKltxauw,Denise Michelle S.,5.0 star rating,"Wafles & Dinges, stop following me!!!!! My theory is that, while most people need to track this little yellow truck down, it tracks me down. It seems as though everywhere I turn, I see the little yellow truck. The first time it happened was last spring at fulton fish market.  It was there our (at the time) 5 year old dropped her dinge, and the sweet guy in the window happily offered her another, without us even asking. Now that's customer service!! Unfortunately, it was also there where the little yellow truck decided to become MY biggest fan.  I try to ignore it, but every time I see the little yellow truck (and realize it's once again tracked me down) I acquiesce and end up stuffing my face with one of the many epicurean delights offered.  Only to spend the next two hours in a spin class or running down the west side highway in effort to undo the damage to my ass the spekuloos has done.  What I love?    - liege (the other belgian wafle)  - de throwdown wafle - just thinking about it makes me shake  - wafle ice cream sandwich - perfect balance of sweet, creamy chewiness  - mini wafelini (great for taking home and saving for later!!!)  - My favorite toppings are bananas, strawberries, nutella and of course spekuloos. Wafles & Dinges is highly addictive...proceed with caution!",Wafels & Dinges,4.5 star rating,$,"Belgian,, Waffles,, Food, Trucks"
732,og3ItQKKLqUGGhXdsDjU0w,Ravi J.,3.0 star rating,"Wafels & Dinges is more of a gourmet snack truck than a food truck.Scratching my head after gorging on an $8.50 Belgian waffel with pulled pork and slaw, I wondered: who on earth came up with this combo? Whew knew rich swine meat bathed in tangy BBQ sauce could pair so well with a buttery crisp Belgian waffel? And finally: how on earth did I agree to pay $8.50 for such a small portion?You see, Wafels & Dinges is a mixed bag. It's a gourmet foodtruck; and with gourmet comes a hefty price tag. For a Midtown lunch treat, it's a hard sell. I was still hungry after my artisan portion of pulled pork-on-a-wafel. Particularly since $8.50 can buy a lot more food in this culinary wasteland. Wafels & Dinges as an afterdinner treat? Now that's a different story. I would gladly fork over $4-5 for a tasty Belgian treat that I can eat outside on a warm summer night.Terrific truck and novel idea, just be careful with the lunchtime crowd and stick to the evenings.",Wafels & Dinges,4.5 star rating,$,"Belgian,, Waffles,, Food, Trucks"
733,B79V9a9-BpgYrYWFkaepnA,Angelica K.,5.0 star rating,"Wafels & Dinges waffles and toppings are hands down amazing.  I don't have to say much more than that since it's pretty much common knowledge.What I DO want to say is that we hired them to come out to Princeton, NJ (you do pay a rate per mile) for our wedding and they were one of the best vendors of the day.  From the very start of the process we worked with Ellen from their events department and she was responsive, helpful, answered all of our questions, and laid out all of the details right up front.  A month before the wedding we had to make a few minor adjustments to the location and they were perfectly accommodating and understanding.The day of, they were fantastic.  They served our guests with gusto and even stayed past their contracted time to make sure everybody in line got their order.  EVERYBODY loved the waffles and thought they were beyond delicious.  They even wrote a little message for us on the chalkboard.  Having them as a part of our wedding day was extremely memorable and while it wasn't cheap, it was worth every cent and ultimately, a really good deal considering the per head rate.If you are looking for a fun and creative treat for an event, definitely consider Wafels & Dinges.  They are professional, fun, and a high caliber quality business.  I wish I could have them at every party I will throw for the rest of my life.",Wafels & Dinges,4.5 star rating,$,"Belgian,, Waffles,, Food, Trucks"
734,oDvvk30VQ6IR0ZzACU7HTQ,Dillon S.,4.0 star rating,"Pretty dang good! First time I came I tried the Throwdown waffle but found it wayy to sweet. Next time I just got butter and strawberries and was much more satisfied. The batter is so dense and sweet by itself, I feel like the last thing it needs is thick sauce piled on top. My sister wasn't very hungry, but I wanted her to try something so I bought her the cute little waffle kabob thing. She loved it! Next time I'll probably stick to that myself. They're so filling that a little one will do!The perfect-waffle quest continues....",Wafels & Dinges,4.5 star rating,$,"Belgian,, Waffles,, Food, Trucks"
735,6n-azLgUKzkdZ7o_HH0hpA,Adam R.,5.0 star rating,"I had no idea that Wafels & Dinges appeared on Food Network until about halfway through my waffle, when I finally made the connection between the ""Throwdown"" waffle and, well, Bobby Flay's ""Throwdown.""  Apparently they won their throwdown, which doesn't surprise me a bit.  I won't say much, since many others have, but it suffices to say that their product is a little bit of heaven.  Mmm mm.Oh, and the guys who work in the truck are super friendly and laid-back.  This is a bonus!",Wafels & Dinges,4.5 star rating,$,"Belgian,, Waffles,, Food, Trucks"
736,CX1DQGcKZ-1DzxXKlLShKw,Megan A.,1.0 star rating,Followed the Twitter post to the truck location and they weren't there... Then went directly to the main shop and they wouldn't serve us even though it wasn't closing time. Spent an hour chasing these waffles for nothing,Wafels & Dinges,4.5 star rating,$,"Belgian,, Waffles,, Food, Trucks"
737,oMaC0XRrMs5EMZIzXT6N0Q,Samuel C.,5.0 star rating,"I love this spot. I have officially dragged my co-workers down to the truck and they are all hooked on it.It's so convient when it's outside your office. My only gripe is and this is against NYPD who forces the truck to move after being parked there all day. Damn it NYPD, can't you let Wafels & Dinges just conduct their business on the street? You guys are great but I want my Wafel & Dinges!!!",Wafels & Dinges,4.5 star rating,$,"Belgian,, Waffles,, Food, Trucks"
738,TtAg5cNrzHHv-BtfRo81vg,Katherine P.,5.0 star rating,"The smell of the waffles cooking is intoxicating.  I love their pulled pork on the waffle.  It must be eaten right away or the waffle gets soggy.  Who knew that a pickle in Kool-aid would be tasty (coolickle).  Note, their mini stands don't serve savory waffles.",Wafels & Dinges,4.5 star rating,$,"Belgian,, Waffles,, Food, Trucks"
739,eSGVqIcKzDS4-chqnPGyOg,Jenny O.,5.0 star rating,"NOM!It should be noted that I ordered a second waffle immediately after my first bite of my first waffle. NOM. All I should say is that I am so glad I sought after the Wafels & Dinges truck even though I wanted nothing more than to sit in front of a heater in my apartment. Oh, but after trying W&D... 18 DEGREES OUT? NO BIG DEAL--I was consumed by W&D's waffles. But I NEED to explain further how much I love W&D:First of all, their Spekuloos spread is amazing.  Although the guys making your waffles won't tell you what it's exactly made out of, the spread is a bit spicy, a bit creamy, and tastes like gingerbread cinnamon. Eating the crispy and doughy waffles with spread reminiscent of gingerbread cookies brought me back to a state of nostalgia and holiday cheer... think Antono Ego from ""Ratatouille"" when he had that bowl of ratatouille.  Love at first bite? Definitely.Okay, W&D is where you go for liege waffles. HOLY MOLY. These wonderful creations are on point--they're crispy, doughy, slightly sweet, and, in general, perfect. W&D uses Belgian pearl sugar, a refined sugar, to sweeten the liege waffles, which gives it its crunchy outer layer.Their ""Dinges"" are toppings. You can choose from toppings like strawberries, bananas, Nutella, whipped cream, maple syrup, Spekuloos spread, etc. I opted for the liege wafel + strawberries + banana + maple syrup for the first waffle and then liege wafel + strawberries + Spekuloos + maple syrup for my second serving. Both A-MA-ZING.I did try their Bacon Syrup Wafel but wasn't really a fan. I was  overwhelmed by the syrup.If you're in New York, you need to get on this W&D craze! Waffles that taste a bit like sweet heaven? It's worth the wait, the cold, and your money.**Accepts credit cards!",Wafels & Dinges,4.5 star rating,$,"Belgian,, Waffles,, Food, Trucks"
740,OWTabF8cS-FwtTSWy8msdA,Tom L.,5.0 star rating,Best damn food truck in NyCNo idea what's in the speckaloos but you must try some now!!!,Wafels & Dinges,4.5 star rating,$,"Belgian,, Waffles,, Food, Trucks"
741,CtdYAUhzA8f7BSBz6J-HhQ,Jimmy C.,4.0 star rating,"Food Truck Gem! WOW can I dare say possibly the best waffle I have had ever? Close! If you ever see a big yellow Food truck, Run for it and get one of these.FOOD:We got a nutella covered belgian waffle and it was too die for. They made it fresh obviously but it tasted a little different from your regular waffle. Not over crunchy, yet moist and not too chewy either. It's probably some blend in their waffle mix. However, they executed perfectly and the nutella on top melted perfectly with it and had powdered sugar, a tiny bit of syrup among other things.SERVICE:Friendly, nice and when the person serving you has a great attitude, the food just tastes that much better if you know what I mean. However I was shocked when he asked for my name for the order and said shimmy instead of jimmy. And i said I know how to shimmy, and the crowd around me almost made me shimmy for my food but I talked them out of it. WHEW! LOL I need a beer or two before I do something like that in public haha.  ATMOSPHERE: Relaxed, Fun, on the streets. Great in person experience. Love the window in the back so you can see the cleanliness of the inside and what they are doing. Great touch to presentation in my opinion.  SUMMARY:Great dessert for night/late night or after any meal to be honest. Price can be a little too much for some but it's worth it. You won't be disappointed. I will come back whenever I'm not too full and spot it again!",Wafels & Dinges,4.5 star rating,$,"Belgian,, Waffles,, Food, Trucks"
742,GVMyCqy7v-kxpy4AWXVglw,Jen G.,4.0 star rating,"I have hunted down the waffel truck 4 times over the past year and it was worth every trip!  If you are lucky enough to have them stop nearby, be sure to give it a try; if you are like me and will travel for all things sweet, why wait for them to come to you?My personal favorite is a WMD brussels wafel with bananas, nutella, spekuloos, belgian chocolate fudge and whipped cream to top it off.  The brussels waffel is light and fluffy on the inside and crispy on the outside, perfect to hold lots of dinges without being overwhelmingly heavy.  If you have never tried spekuloos, it is a must try on your first visit (and I promise, you will go back).  Spekuloos tastes like gingerbread and cinnamon but in a spreadable-form!Over my visits I have tried to switch it up, but have found myself back at my favorites.  The liege wafel was a bit too heavy for all of the dinges, but with simple butter and syrup I'm sure it would taste delicious.  The wafel is much more chewy and has large sugar crystals inside.  I have also tried the bbq pulled pork wafel, and I am on the fence.  While I love the concept of sweet and savory, it did not live up to expectations.  The pulled pork needed to be tossed with the sauce, instead of drizzeled with it; the coolickle (Kool-Aid pickle) needed a little vinegar bite with all of the sweetness from the waffle and bbq sauce.  Will I get it again? Probably not.  Do I regret trying it? No way, it was worth the experience.  Overall, the Wafels & Dinges truck is a wonderful food truck with delicious treats and amazing service.  The guys from the truck are always very friendly and helpful.  I also highly suggest following them on twitter as they tweet a chance to get a free dinges every day.  I may have had to order like a valley girl, but I saved $1 so it was worth it!  So give it a try, you won't regret it.",Wafels & Dinges,4.5 star rating,$,"Belgian,, Waffles,, Food, Trucks"
743,VTgVWuXeDcJw3PDc6U67Xg,Joey R.,5.0 star rating,This was AMAZING!!!!! I had the pulled pork waffle. The waffle is served in the perfect way. You can watch them cook your waffle and the waffles and topping were to die for. This was definitely one of the best food trucks i have ever had.,Wafels & Dinges,4.5 star rating,$,"Belgian,, Waffles,, Food, Trucks"
744,PCHM2YY944GyG8IbYosOlw,Jeong K.,4.0 star rating,"Saw this on MvF and had to try it.  Verdict?  Loved it and recommend all of you foodies and non foodies to find this truck and get some.FYI, you will need to call to find the truck but well worth the find!",Wafels & Dinges,4.5 star rating,$,"Belgian,, Waffles,, Food, Trucks"
745,4MP0RMLiUNxPvAjOAXfiTA,Alison V.,4.0 star rating,Review for the mini truck at the south end of Central Park.  They only have one type of waffle.  I had one with the Spekuloos spread.  Delicious.  Wish I would have brought some back home with me.,Wafels & Dinges,4.5 star rating,$,"Belgian,, Waffles,, Food, Trucks"
