,user_id,user_name,user_rating,user_text,restaurant_name,restaurant_rating,restaurant_price,restaurant_type
258,DRg69V72CVrAiohRtOUGsA,Cindy L.,3.0 star rating,Worth the experience but I don't think I will be getting anything else from them soon. Happened to see their stand stationed outside the ice skating rink at Bryant Park and I decided to give them a try. Ordered the Turtle Wafle and the lady making it just sprinkled on about four layers of powdered sugar and chocolate syrup. The waffle were satisfying but I needed a huge bottle of water to wash down all the sugary sweetness later.,Wafels & Dinges,4.5 star rating,$,"Belgian,, Waffles,, Food, Trucks"
259,yQyQMgd5z3or1sZb1StFPw,GarGuPi L.,4.0 star rating,"Being a city slicker is all about multitasking and efficiency.  As someone who works in the food industry here, it's all about speed, speed, but without compensating quality. Yes, we are tough on ourselves, hence the proliferating healthcare. Juggling between two jobs is the norm.  The lack of full-time employment opportunity (companies skimping on benefits) and low salary, a city dweller can't function and survive on one employment anymore. Hence, eating on the run has become an art. What's that? Well, mainly handheld food items! While Wafels & Dinges isn't exactly an economical meal, one waffle plus topping is definitely fulfilling enough to consider one.  Aside from the calorie count, the wafel is conveniently plated on a folded container, much like a pizza, but more elegant and a sturdier hold.  While you can still go the proper method and eat with a fork and knife, one wouldn't be judged if you like slip the slice into your mouth.  No judgement when it comes to 'street' food.  The Belgium wafel isn't your typical frozen section kind.  Of course, it's freshly made on an iron waffle maker, under the expert hand of baristas.  As batter is poured, you could hear the exciting sizzle as the sugar, butter, dairy, and flour join in true matrimony.  Two more pass, out comes a perfectly formed wafel, ready to be dressed with your choice of toppings.  Speculoos (cookie butter) is their signature spread, so I went with that along with walnuts (as I saw that as an expensive condiment, rather than banana and strawberries).  Sure, it's brown, on brown, on well, more brown, with just a sprinkle of powdered sugar, the appearance isn't a colourful looker, but as we should never judge a book by its cover, eating it was just pure bliss.  While you could, of course, go with other routes, such as a la mode, nutella, or even savory versions, being a traditionalist has its own reward and that is guaranteed goodness.And oh, I ate that free because I drew an amateurish picture for their Wafel Day celebration. Once a year. I can justify that indulgence.Just one small complaint is that Wafel Day is only valid noon-6 and not the entire day. So that was my brunch/early dinner.",Wafels & Dinges,4.5 star rating,$,"Belgian,, Waffles,, Food, Trucks"
260,9LHoo2Sa0JSipL5A99ghBg,Tyler L.,3.0 star rating,"The waffles on this truck are good, but not $5 good.I opted for the liege wafel with spekuloos and whip cream. I originally wanted ice cream instead of whip cream, but they were out of that. I had never had spekuloos before, but it was a peanut butter like spread that was quite good. Apparently, it is supposed to be gingerbread and cinnamon.They give the wafel to you on a box holder and you eat it with a fork.I liked this, but for the price (for what is basically a snack), this will just be a one time thing for me.",Wafels & Dinges,4.5 star rating,$,"Belgian,, Waffles,, Food, Trucks"
261,GwAxWfgsf_GxxzwQjhBclA,Jasmine C.,4.0 star rating,"I was walking through SoHo, not expecting to find a Wafels & Dinges cart, and then I saw one! I always wanted to try and when I finally got the chance to, I hopped on it!I purchased a WMD (your own creation): strawberries, bananas, nutella, and ice cream. The total came out to $9. Be careful though, it can get really messy especially when the ice cream melts because the plate is paper. It was really good, expect that my waffle was little hard so it didn't taste that great.",Wafels & Dinges,4.5 star rating,$,"Belgian,, Waffles,, Food, Trucks"
262,Dr0XV4Yei_-a_cvZpiH-_g,Michelle M.,5.0 star rating,"Can't get enough! They always make my waffle to perfection. Love the dulce de leche, banana and Nutella . Oh so good!!",Wafels & Dinges,4.5 star rating,$,"Belgian,, Waffles,, Food, Trucks"
263,9-iOAvL2jy0qnif1_PtpEg,Heather M.,5.0 star rating,"Heaven in a food truck! Stumbled upon Wafles & Dinges on 44th & Park Ave. The man who seems like the owner, was extremely friendly, helpful and convincing. I got talked into a ""WMD"", with as many toppings as I wanted - Nutella, Bananas, Strawberries and of course the ""Speculoos"" cookie-batter type sauce. INCREDIBLE! :)A bit messy to eat on the street, but well worth it.",Wafels & Dinges,4.5 star rating,$,"Belgian,, Waffles,, Food, Trucks"
264,WkS0jbyqQpuuAWATktatpw,Saira G.,5.0 star rating,"Love love love this place, if nothing else because they introduced me to speculoos/cookie butter/biscoff. We ordered this even though we were on our way to a different bakery and had just eaten somewhere else because I had seen them on Bobbly Flay and had to try it. And I'm so glad I did because it has changed my life for the better. Note: I ate here like 5 years ago and still remember it and want to go back.",Wafels & Dinges,4.5 star rating,$,"Belgian,, Waffles,, Food, Trucks"
265,OVA3JP8_iM58Il3P3a7Kuw,Stephanie Q.,5.0 star rating,"One more thing checked off my list of things to before I die: A WAFELS & DINGES TOUR!!! I went there with some friends and was promptly greeted by our guide. I don't want to reveal too much because you should all seriously go there for yourselves and do the tour. But I will tell you that I was very excited to enter the kitchen and learn how the wafels are made. We got to eat freshly made wafels with spekuloos and powdered sugar. I was amazed by how heavy those wafel pans were- we got to lift them and it felt as if I was lifting at least 30 lbs. You certainly don't want to drop one of those on your feet. As a souvenir, you can also buy bottles of spekuloos, spekuloos cookies, and wafels  & dinges logo clothes (Halloween costume anyone?)My only advice to you is to sign up for the tour pronto!",Wafels & Dinges,4.5 star rating,$,"Belgian,, Waffles,, Food, Trucks"
266,FQh44MrbHRUUQm92MenTRQ,Matt E.,5.0 star rating,"4.5 stars...Wafles& Dinges is the shit. So much so that you just can't not cuss when it comes to describing their goodies. Currently they have two full sized trucks and a few of the smaller carts serving up a smaller version of the full menu. They have two different types of waffles ($5), each comes with one free topping (dinge), a second is $1 and unlimited is only $2. The first kind is the brussels which is the normal light and crispy type of belgium waffle you're familiar with. The second is my personal favorite that I get every time, the liege. It's a more dense soft and chewy waffle. They have 10 different toppings, all of which are pretty standard, but the one that stands out is the spekuloos spread. This spread has the consistency of nutella, looks like peanut butter, and tastes like teddy grahams. Luckily they also sell jars of this crack spread which is now my ultimate favorite. The waffles are always served hot and fresh and from someone friendly. If you're going to one of the full sized trucks they also offer a few savory options including a pulled pork topped wafel and a wafel with baked in bacon. I've tried the pulled pork which is topped with slaw and a cool-ickle (a pickle made with coolaid). It was pretty good for a waffle truck but I would be very disappointed if I got that pulled pork at a BBQ restaurant. Stick to the sweet stuff here, it's one of the best snacks in the city.",Wafels & Dinges,4.5 star rating,$,"Belgian,, Waffles,, Food, Trucks"
267,emvo1HeCL2oetDOf52xPkg,Alex C.,4.0 star rating,"This was pretty delicious. I was skeptical at first because, lets be honest, it's just a wafel right? Well, not so much. The texture is more bread like than regular airy wafels. It still has a great crunchy texture, but it's more dense, in the best ways possible.I had the throwdown this time and I don't know how I feel about the spekuloos, if I could re do it, I think I'd go caramel and chocolate with whipped cream.",Wafels & Dinges,4.5 star rating,$,"Belgian,, Waffles,, Food, Trucks"
268,2NLhdtYok2jUK8nbwocQWQ,Cassie P.,5.0 star rating,"Mom always said eat your vegetables. So I did. Then Mama said you have to go to Wafel and Dinges because it won best food truck in America. So I did. Running on 2 hours of sleep after working an overnight shift all I wanted to do was nap. But hey, I put in a full days work, it was 9am and from what I can remember that's breakfast time! Waffles are breakfast food. Let's find this truck!Liege waffle with spekuloos was served nice and warm. I ran from the truck to look for the closest place to perch myself to enjoy my treat. Oh my goodness I did not want this meal to end. From the first to last bite I was in heaven. Then I headed home and crashed for a few hours. You can bet I had sweet dreams.",Wafels & Dinges,4.5 star rating,$,"Belgian,, Waffles,, Food, Trucks"
269,GcN63fWDmgJgNg-noYkgkA,Annie P.,5.0 star rating,"The last time we visited NYC in May, my boyfriend and I were shopping in SoHo and decided to stop by a random waffle dessert truck in between stores. (unfortunately I forgot the name!)  This past weekend, we went back to NYC, and my boyfriend would not stop talking about getting waffles again because they were THAT good. After an eventful few hours of shopping, Wafles & Dinges was parked outside in SoHo and we decided to try it out.The menu had an assortment of dessert waffles, (spelled ""wafels"" -- I'm assuming that's the Belgian way of spelling it) savory waffles, and drinks. The first topping (called ""dinges"") was free, and a second topping was $1, but you could get unlimited toppings for $2. We chose ""de bom"" waffle with strawberries, bananas, and ice cream.As I was getting my utensils, the waffles were ready in about 3 minutes.  The whole thing was DIVINE. It was just the right amount of sweet and crispy, and the toppings added the perfect amount of sweetness. We killed it in a mere 3.5 minutes.This is definitely a truck that you NEED to follow if you have a sweet tooth like me!",Wafels & Dinges,4.5 star rating,$,"Belgian,, Waffles,, Food, Trucks"
270,BX7XTSDQZIduAkocEuo7CQ,Nhi D.,5.0 star rating,"Cue salivation glands -Anyone who visits New York City MUST try this place. I really wish we had stuff like this back on the west coast. The waffle I tried had Spekuloos, strawberries, a scoop of raspberry ice cream, and powdered sugar. Eat it while the waffle's still warm while you're strolling through Central Park. It's probably the closest you'll get to heaven while still alive and you'd be straight stupid to overlook this stand.Now excuse me while I pick up my drool.",Wafels & Dinges,4.5 star rating,$,"Belgian,, Waffles,, Food, Trucks"
271,Ne88GxQQZAEi9SYmC8DNvw,Dania S.,5.0 star rating,"Oh spekuloos, where have you been all my life?! This stuff is like crack I swear! I had seen Wafels & Dinges featured on an episode of Bobby Flay's Throwdown and they beat him so when I saw the truck while in East Village one day, I had to see what the hype was about... best.decision.ever. I of course ordered the throwdown wafel which consisted of the liege wafel, spekuloos, and whipped cream- that's it! Very simple in comparison to some of the other combos, but man oh man this is all you need! I was so confused by the spekuloos since I had never had it before. Is it peanut butter, is it caramel spread? What are you, you beautiful mouthgasming creature?! I eventually found out it was gingerbread spread and my world was forever changed. I will never go back to nutella again! They sell jars of spekuloos at the trucks and you can also buy them at their brick and mortar cafe. If you can't get it there, the Biscoff brand of spekuloos is in almost all grocery stores now, but for some reason I think the Wafels & Dinges brand is better even though no one else I know can taste a difference.Word on the street is they have spekuloos ice cream now too... I'm coming for you, my sweet!",Wafels & Dinges,4.5 star rating,$,"Belgian,, Waffles,, Food, Trucks"
272,FF7cssXdhJ-coePm1Bfc2w,Michael C.,4.0 star rating,Leige waffles in a food truck. Not the best one's I've ever had but pretty darn good. Reminded me of a few I've had in Holland. Wide variety of toppings and they also make mini ones if you only want a couple bites.,Wafels & Dinges,4.5 star rating,$,"Belgian,, Waffles,, Food, Trucks"
273,9zSBIZCll78ietKkQc-L4g,Jaison S.,5.0 star rating,"Best sweet-treat food cart in the city and the only one that I'll cross town to showoff to visitors.  Here's all you need to know (1) they call them ""wafles"" (only one f), (2) you need to find out their location from their website, (3) ""dinges"" is just a fun word for topping - get Spekuloos (ask to try it first if you don't think you'll like gingerbread-flavored food of the gods).",Wafels & Dinges,4.5 star rating,$,"Belgian,, Waffles,, Food, Trucks"
274,WeqJ2M7y26zblzpm1C8w4Q,Letie W.,5.0 star rating,"I love you my little liege waffle!!! Since I've come back home, I've purchased a waffle maker, searched the internet for the ""perfect"" liege recipe, collected all my ingredients on Amazon.com, and STILL...it's nothing compared to what you make!!!GO HERE!! YOU WILL NOT REGRET! It's absolutely delicious...and don't forget the spekuloos!",Wafels & Dinges,4.5 star rating,$,"Belgian,, Waffles,, Food, Trucks"
275,o-rEw654yzM-VZHXQAVt1w,Todd N.,4.0 star rating,"Belgian waffles out of a cart? GETTING IT!This little cart is absolutely great!  They have a lot of different choices from a large waffle to a belgian hot chocolate.  I decided to get the smallest waffle with strawberries and nutella.  YUM!  I'm a big fan of ""fancy"" desserts and such, and a big fan of crepes, so this waffle was pretty spot on.If you're ever in the soho area come here!  Just get a quick bite to eat and enjoy something delicious!",Wafels & Dinges,4.5 star rating,$,"Belgian,, Waffles,, Food, Trucks"
276,i_FaI0_oTUAvyyH2OszVSQ,Christina G.,4.0 star rating,"This review is a long time coming! I have been wanting to try this truck for a few years now and today I finally found them as I got off the train on my way to work. Surely it was fate. I swung over on my lunch break to try de throwdown since they beat Bobby Flay with that glorious sounding concoction. It's a traditional liege with spekuloos cookie spread and whipped cream. It was pretty darn delicious, and very sweet. I demolished the entire thing by myself so I felt a little weighed down afterwards. That one might be best for sharing! I'm looking forward to going back at some point the next time I need to nix a mid-day craving. Those will certainly do the trick. Next  time I'd like to give the brussels waffle a try with some lighter toppings (dinges).",Wafels & Dinges,4.5 star rating,$,"Belgian,, Waffles,, Food, Trucks"
277,oZ4iTR4Yc2ZCdohN2P3ytw,Jennifer M.,5.0 star rating,"Wafel & Dinges is just down right ridiculous and delicious! I'm pretty sure anything from this truck is just good and bad for my butt, chin and thighs at the same time but it's just so worth it! I must say, even if their wafel is not freshly cooked and sitting on that rack, it's still just as good. There's just something about that batter...Their MINI WAFEL with strawberries and bananas on each end is the most perfect sized treat there is!",Wafels & Dinges,4.5 star rating,$,"Belgian,, Waffles,, Food, Trucks"
278,cOLnihh8h-ZE60ga8FJrRw,Thom H.,5.0 star rating,"Belgian waffles the way they're SUPPOSED to be made, not the crap you get in diners. Do yourself a favor and get the ""throwdown"" waffle of speculoos and whipped cream, on the ""chewy"" waffle. Amazing.Get Nutella if you really want it, but IMO, Nutella has jumped the shark. It's great in many applications, but in this specific case, don't mess with the aforementioned winning combo. You won't be sorry.",Wafels & Dinges,4.5 star rating,$,"Belgian,, Waffles,, Food, Trucks"
279,_mG15eWlNawLH-e9rAiiTg,Chris T.,4.0 star rating,"Not gonna lie, these waffles are THE TITS!I got the liege waffle with nutella and dolce de leche and mmMMMmmmMMmmmMMmmmm!!If you see a truck or see this place, one word, GO!",Wafels & Dinges,4.5 star rating,$,"Belgian,, Waffles,, Food, Trucks"
280,7S41xF5w0JbdesNmwZZ4NQ,Jordan B.,5.0 star rating,"My boyfriend and I stopped by Wafles and Dings and got De WMD with Nutella, chocolate syrup, strawberries, and added a scoop of ice cream. I am not the biggest fan of waffles unless it's your traditional chicken and waffle meal. However, this dessert is very good. I thoroughly enjoyed the waffle which was cooked pretty well and all the toppings just make it that much better. It is a decent size so if you aren't really hungry or a big dessert person I would recommend sharing it with someone if you can. The staff was very helpful being that it was our first time there and service was pretty quick as well.",Wafels & Dinges,4.5 star rating,$,"Belgian,, Waffles,, Food, Trucks"
281,SAxw8udr_GM9BbEdTBNXVg,Sai T.,4.0 star rating,Very good waffles. The waffle icecream sandwich with the wierdly spelt icecream flavor was very good. Tastes like graham crackers. Took off a star for the little rude service. Otherwise its very good,Wafels & Dinges,4.5 star rating,$,"Belgian,, Waffles,, Food, Trucks"
282,PVGzqXdzKpyo685mqoCNYA,Colleen Y.,5.0 star rating,"saw an episode of best food trucks and I totally understand why it was rated the number #1 food truck.I got the WMD, I don't want to know how many calories are in it. But that gingerbread spread with the crispy buttery sweet waffle.. drool.. it just melts in your mouth. I would definitely take recommend taking visiting friends to try the WMD... they don't know what they are missing out on.",Wafels & Dinges,4.5 star rating,$,"Belgian,, Waffles,, Food, Trucks"
283,g7vB7Y0r8QIrmG6CY2oNVQ,Adam P.,2.0 star rating,"Usually these waffles are delicious. Tonight I bought one with water for 8$ and it was dry and tough as hell. One bite and thrown out. Please don't sell old waffles. As a long time customer that's just dissappinting. (By the Brooklyn bridge). P.s. usually, 5 stars and had a couple of great experiences but this was a really awful one.",Wafels & Dinges,4.5 star rating,$,"Belgian,, Waffles,, Food, Trucks"
284,DmpQyncP31AuyMcWw7oc6A,Paola A.,4.0 star rating,"Every time I see the Wafels and Dinges truck, I freak out. I LOVE this place. I usually go with the small Belgian wafel with little sugar crystals snuggled into the doughy inside of the crispy warm wafel. Obviously go with the Nutella... Never say no to that chocolatey goodness. Strawberries and whip are great on it too!Also, the hot cocoa is pretty great, just make sure they mix it well.*would be a 5 if the Wafels were always fresh poured- almost always they have them premade and then they hear them up.. Still good but I like them better fresh duh",Wafels & Dinges,4.5 star rating,$,"Belgian,, Waffles,, Food, Trucks"
285,awGu0wERH4T23-3WYppOKA,Asmita J.,4.0 star rating,"FINALLY got to try this, and boy was I glad i did!my friends and i bought 3 WMD (all you want toppings for $7) - we tried both types of waffles (which the guy described as chewy/dense vs light/fluffy). toppings included the fugde/fruit/nuts, nutella/fruit/spekuloos (gingerbread spread), and fudge/strawberries/whipped cream .... all of them come with confectioner's sugar on tophere are my thoughts:-the waffles were REALLY filling and in retrospect, we shoul've shared.-the lighter one wasnt any fluffier than the other one. i probably would go with the chewier one next time because the flavor was better-the spekuloos spread was really interesting in a good way, and i might just keep it simple and have this alone next time.-fudge is better than nutellawould i come back? - um, duh.",Wafels & Dinges,4.5 star rating,$,"Belgian,, Waffles,, Food, Trucks"
286,cIhV01MS4o0m5jHanohT2w,Crystal Z.,5.0 star rating,Delicious. Two bucks for all you can add toppings. The foodie in me is sold on this :],Wafels & Dinges,4.5 star rating,$,"Belgian,, Waffles,, Food, Trucks"
287,_FubKqv3j5m3xL3dbnQdSQ,Raj S.,5.0 star rating,"$6 for a deliciously chewy waffle! We got it with speculoos topping. Big enough to share with friends, it's a perfect snack before walking over Brooklyn bridge.",Wafels & Dinges,4.5 star rating,$,"Belgian,, Waffles,, Food, Trucks"
288,S4Vei9oQ7dZDGtnrXyOPJQ,Morgen B.,5.0 star rating,"Decadence and delicious perfection in my mouth! Get the Liege waffle with vanilla ice cream, whipped cream and Spekuloos sauce! AMAZING.I actually almost cried while eating it, because my body and mind were like...whaaaaattttt is this!?!Pricey, but worth it. Wafels and Dinges!",Wafels & Dinges,4.5 star rating,$,"Belgian,, Waffles,, Food, Trucks"
289,wf50aJWlmCjRtr1IOErGzw,Chrissy W.,4.0 star rating,Food is good but the staff is a bunch of adolescents who are more interested in playing in the restaurant than providing good service.  Still would come dine. just low expectations.,Wafels & Dinges,4.5 star rating,$,"Belgian,, Waffles,, Food, Trucks"
290,u7VgUamyykRdhK3-oAS0Rw,V L.,4.0 star rating,"It's a nice snack.  Definitely not a meal or anything of the sort.  I got it with speculoos and while I am a big sugar fan, this was really super duper full of sugar and killed the taste of the waffle.Maybe if I got it with more/other toppings it might have been a bit better, but definitely worth a try at least once.",Wafels & Dinges,4.5 star rating,$,"Belgian,, Waffles,, Food, Trucks"
291,FNfDKu2y-HK5arvYYKesOw,Quana C.,5.0 star rating,"One dreary morning, I received a food alert on my cellphone from my girl Ava E. ( at this point in my Yelplife, you all should know by now conversations about food for me, start and end with Ava E.) that she spotted a Waffles and Dinges cart on the corner of Fulton across from Shake Shack. The poor man wasn't even ready for business, but my homie knew how badly I wanted to give it a try that she accosted him and got all the scoop on his hours of operation. SCORE!One day after a particularly stressful overnight shift I say to myself, ""Self, you deserve a waffle go get it!"" Now any of you who have been in the area are well aware of how non car friendly it is, but I would not denied!After some circling, I decide to employ what I call The Old Radio City Trick* jump out and get my waffle with spekuloos , Belgian chocolate and whipped cream. Wow! Wow and double wow!These waffles were worth the wait, and I even caught up with them in the city and bought a jar of the crack like spekuloos (which is awesome on Pepridge Farm cinnamon bread).I highly recommend you give it a try if you haven't already...I'm kinda late in the game, but I'm here now dammit!* One day I needed concert tickets and refused to pay the redonkulous parking garage rate so I parked right in front of Radio City Music Hall, popped my hood and pretended to run inside to use a phone for help. Worked like a charm!",Wafels & Dinges,4.5 star rating,$,"Belgian,, Waffles,, Food, Trucks"
292,VjAu15Foa-HHMK3_vO7ECw,Maxiel G.,1.0 star rating,"What happened to the Brussels waffle? Apparently, the best waffle has been discontinued? I used to love this truck, but today was my last day paying $8 for a cold, hard/sticky waffle. no bueno. Please bring the Brussels waffle back!",Wafels & Dinges,4.5 star rating,$,"Belgian,, Waffles,, Food, Trucks"
293,WSxFtFjp0StGv-NGtdfbaw,Walter C.,1.0 star rating,Do not purchase the Groupon deal for the Herald square location they refused to honor my groupon purchase eventhough it says right on the Groupon voucher that it's valid at the Herald square location.,Wafels & Dinges,4.5 star rating,$,"Belgian,, Waffles,, Food, Trucks"
294,D5OHGTQHpgHWeN6ROZnqCQ,Sally C.,5.0 star rating,"BEST food truck in the city. Hands down. (Or up near my mouth shoving waffles into my face.)I think there was once a Livingsocial for Wafels and Dinges. I immediately shrieked out loud in excitement and asked my coworkers whether I should spend $40 or $80 on pre-purchasing waffles. The only response I received was looks of horror.But I was completely serious! I will walk miles for these waffles. I would give up eating real food just to eat this all the time. I even have the hotline saved as a contact in my phone.For $7 you can get a delicious liege waffle with UNLIMITED toppings! So I always pile up with my favorites - their signature spekuloos spread (you must try this! tastes like gingerbread),  nutella, strawberries, bananas, whipped cream. Their spekuloos ice cream is also delicious. This is a MUST try!",Wafels & Dinges,4.5 star rating,$,"Belgian,, Waffles,, Food, Trucks"
295,wAGh2TNTrqXB_456gBWPNw,M K.,3.0 star rating,I feel like I'm the only person in this world who finds waffle in Wafels & Dinges just A-Ok. I like my waffles fluffy in the middle and crunchy on the side but Wafels & Dinges offers doughy & dry waffles. Neh...But most people I know LOVE it and they are earning amazing review in general here so if you haven't tried it I think it's worth a try,Wafels & Dinges,4.5 star rating,$,"Belgian,, Waffles,, Food, Trucks"
296,BXl_Kla8SF7T7MNsSH3SZQ,Liz T.,5.0 star rating,"As Shakespeare's Othello said, ""If it were now to die, 'Twere now to be most happy.""That is all.",Wafels & Dinges,4.5 star rating,$,"Belgian,, Waffles,, Food, Trucks"
